{
  "anumber": "A10139321",
  "id": "A10139321_0000",
  "page_index": 0,
  "resources": {
    "full_jpg": "https://dctn4zjpwgdwdiiy5odjv7o2se0bqgjb.lambda-url.us-east-1.on.aws/iiif/3/og-2023-kc-nara_A10139321_0000/full/max/0/default.jpg"
  },
  "fields": {
    "sex": {
      "ms_sex_llm_v1": "female"
    },
    "doctype": {
      "ms_doctype_v1": "letter"
    },
    "form_title": {
      "ms_form_title_llm_v1": "Certificate of Citizenship, Form N-560 ( (REV. 5-25-55)"
    },
    "countries": {
      "ms_countries_nlp_v1": [
        "United States",
        "Lithuania"
      ]
    },
    "years": {
      "ms_years_nlp_v1": [
        1904
      ]
    },
    "certificate_naturalization": {
      "complexion": {
        "complexion_llm_v1": "dark"
      },
      "marital_status": {
        "marital_status_llm_v1": "Married"
      },
      "year_naturalization": {
        "year_naturalization_llm_v1": 1915
      },
      "residence_naturlization": {
        "residence_naturlization_llm_v1": "Newark, New Jersey"
      }
    }
  },
  "is_g325a": false,
  "is_cert_naturalization": true,
  "full_text": "Form N-560 (REV. 5-25-55) CA No. A-356417 application no. A10 139 321 DUPLICATE Personaldesoviption of holderas, of date cofissuanceof his, certificate; Sex female date of birth October 17,1904 country of birth Lithuania ; complexion dark coloroleyes brown colorofhair gray-brown, height 5 feel 2 . inches; weight 150 pounds; visibledistinclivearks pock mark on right side of chin Maritalstatus married I certify that the description, above given is brue and that hereto, is a likeness of me Gune Sreener Freedlander ( Complete and true signature of holder) Peinknown, that ANNE WIENER FRIEDLANDER , now residingial 35 Eckert Avenue, Newark, New Jersey having applied.loshe Commissioner of Immigration,and Section 341 ofthe Immigration, and nationality Achhavingproved.lo Commissioner,Health helmited States of America.,became July 7, 1915 andismowinthel United States: nom Therefore Section 341,of the Immigration and nationality Act, this certificate 8th Seal day/of March in the year) of our . and fifty-seven ,and of our Independence,the onehundrechand eighty-first , and/shesealopshe Department IT IS A VIOLATION OF THE U. S. CODE (AND PUNISHABLE AS SUCH) TO COPY. PRINT. PHOTOGRAPH. OR OTHERWISE ILLEGALLY USE THIS CERTIFICATE. COMMISSIONER OF IMMIGRATION AND NATURALIZATION DEPA BUREAU OF ENCRAYING AND PRINTING,LITHO."
}