{
  "anumber": "A10294862",
  "id": "A10294862_0106",
  "page_index": 106,
  "resources": {
    "full_jpg": "https://dctn4zjpwgdwdiiy5odjv7o2se0bqgjb.lambda-url.us-east-1.on.aws/iiif/3/og-2023-kc-nara_A10294862_0106/full/max/0/default.jpg"
  },
  "fields": {
    "sex": {
      "ms_sex_llm_v1": "male"
    },
    "doctype": {
      "ms_doctype_v1": "form"
    },
    "form_title": {
      "ms_form_title_llm_v1": "INFORMATION FOR TRAVEL DOCUMENT OR PASSPORT"
    },
    "countries": {
      "ms_countries_nlp_v1": [
        "Canada",
        "China",
        "United States"
      ]
    },
    "years": {
      "ms_years_nlp_v1": [
        2023,
        1950,
        1908,
        1955
      ]
    }
  },
  "is_g325a": false,
  "is_cert_naturalization": false,
  "full_text": "Screened by NARA, 9/18/2023 INFORMATION FOR TRAVEL DOCUMENT OR PASSPORT Office 060 848323 1. Sex: Male X Female 2. Occupation Laborer on wan Toywhar, Kwangtung, China TOLK encemper. sea Jape 3. Nearest large city to place of birth Distance and direction from place of birth 4. Father's name, place of birth, and on address Gwoon Goon - born China - deceased eng GOLLOGE Lecolog of eye usqe present at AOAL 0.6633 exbsurgi V. 1089 5 Mother's maiden name, place of birth, and present address Woong, Shaeso born China - deceased TO V20 Aoff IFOM OL psae Aon CASE pesu 8 INSIDPOL CUTURES ONTON 6. Names, addresses, and relationship of relatives abroad \"ife and children in Loyshan, China Aon sug aggiese Lebolf 7. Names, locations, and dates (years) of attendance of foreign schools 7 yrs school Toyshan, China 8. Names, locations, and dates (years) of attendance of foreign churches V None GLO Aon SAGE fo OL gebozesq que no* MPS: beyona None 9. Was a record made of any religious ceremony? IS 6 HBAG Aom peen specify FLOW spe Quiject 200000 BJUCG HLBC SELLASIS v no 80 MJGLG sug 10. Last address in native country Toyshan, China 11. Date left native country 1950 Aon Last foreign address Nong Kong treep enplas 13. Date last foreign address 1955 appl #7020q If naturalized citizen of any country, how was pnp I citizenship acquired? 704 barbore g Aoe eupex sug TOUR Aoa month to Y Tufengeg (Show date and place of naturalization and number of certificate, if known) VA CUTROSE Lonaborf allg Taugjuk DOBBERRIOIS or polqei GLOBBINE curq' OL LO-GUFLS beliving (abecita): 15. If citizenship is different from country of birth, explain 30 JOSE 08 GLGM 22 BBOMXAITIE pome gaye) 919 kon Tree Boston MUTO IJ402 ID 16vs Easy entry into the United States was grouper J8 POLIFF (Give name of last foreign port and country) eng 17. In possession of travel document Cpassport timeOof gitty JYes No CON 2.10 IS ALE! NO BTOK 28TW ST ALE: Aoa CAST Xee\" Chinese Passport sug sqq1632 or bleeouf abones Describe nature of document (s) It 80' TI fire nutfeg sug greg JN CHITTOLUTE I MS SII THISHI® 18. State whether subject has passport, birth certificate, baptismal certificate, certificate of military service, or any document IIAQ to GIVECT GAGI I OL OI AUST COMUSTA SIG host to CICISON establish nationality and/or identity. List each: CUTUS None Mpen sug Apele MGLG Aon POLU °2° 2V-J-J2 (1908) rate DOUB JOA SPEND Aont 19. If subject did not have travel document or passport at time of entry, or does not have such a document now, did he ever DOO patobiam one? Yes No VState how, when, and where it was obtained; what kind of document it was; and what be- of it: son ROJGNNUJA BMGWT cust pps Aom pe CJG CUG MJOJE suq came by [LOGJA suq muger DG suq WSA pe mag ph CUG 98 GAJQGUGS ID 8UA OI blogeequut VIG to WSKS 20. deportable to Canada, give date and port of arrival in Canada and name vessel: you Lon make moaf I-8 SIN 911 or spe nugeo Street sug SELAICS sug Q681L6 fo Aon psepo 21. Personal description: Height Weight 140# Eyes Brown Black (L 206q &YAG Hair Face Nose Mouth RIGHT EYEBROW . S2 Taze Distinctive marks 22. Remarks: DIRELICE mm TOLED OK VB If the other side has not been executed, the information should be inserted for use in securing a travel document or passport. QUILED SIVIER gnq8es Bmsen no OLIU yobioaeq"
}