{
  "anumber": "A10430675",
  "id": "A10430675_0000",
  "page_index": 0,
  "resources": {
    "full_jpg": "https://dctn4zjpwgdwdiiy5odjv7o2se0bqgjb.lambda-url.us-east-1.on.aws/iiif/3/og-2023-kc-nara_A10430675_0000/full/max/0/default.jpg"
  },
  "fields": {
    "sex": {
      "ms_sex_llm_v1": "male"
    },
    "doctype": {
      "ms_doctype_v1": "letter"
    },
    "form_title": {
      "ms_form_title_llm_v1": "Naturalization Certificate,, 11283"
    },
    "countries": {
      "ms_countries_nlp_v1": [
        "China",
        "United States"
      ]
    },
    "years": {
      "ms_years_nlp_v1": [
        1904,
        1959
      ]
    },
    "certificate_naturalization": {
      "complexion": {
        "complexion_llm_v1": "dark"
      },
      "marital_status": {
        "marital_status_llm_v1": "Married"
      },
      "year_naturalization": {
        "year_naturalization_llm_v1": 1959
      },
      "residence_naturlization": {
        "residence_naturlization_llm_v1": "322 Sunset Drive, Pullman, Washington"
      }
    }
  },
  "is_g325a": false,
  "is_cert_naturalization": true,
  "full_text": "CA DUPLICATE TO BE FORWARDED TO No. 7683675 IMMIGRATION AND NATURALIZATION SERVICE ONE Petition No. 11283 Personal description, of holders of date cofnaturalization: Date of birth April 13, 1904 sex male ; complexion dark coloroleyes brown color of hair gray-black height 5 feel 8 inches; weight 142 pounds; visible distinctive marks none Maritalstatus married formernationality China I certify that the description, above given is have, and that thepholograph, afficed hereto is a likeness of me. have sign mailing Complete and true of Line holder) signature United States of America SS. Eastern District of Washington Beitknown, that at a term of the District the United States, Eastern District of Washington Court of held pursuantle lawal Spokane on April 3, 1959 the Court havingfoundshal MAOLING LIU then residing at 322 Sunset Drive, Pullman, Washington intends loreside permanently in the United. States when so required by the Naturalization. Laws of the United. States), had in allother respects, complied with the applicable provisions of such naturalization laws, and was entitled to be Seal admitted docilizenship thereupon ordered that such person be and(s)hewas admitted as a citizen of the United States of America. Intestimony whereof thesealof the courtis hereunto afficed this third day of April fifty-nine in the year of our Lord nineteen hundred and and of our Independence the one hundred and eighty-third. Dorotly Moulton Hisaviolation of the u L. Code land Acting Clerk of the U. s/o District Court. punishable as such) to copy. print, photograph. or otherwise illegally use this certificate. By Deputy Clerk."
}