{
	"anumber": "A10706964",
	"id": "A10706964_0010",
	"page_index": 10,
	"resources": {
		"full_jpg": "https://dctn4zjpwgdwdiiy5odjv7o2se0bqgjb.lambda-url.us-east-1.on.aws/iiif/3/og-2023-kc-nara_A10706964_0010/full/max/0/default.jpg"
	},
	"fields": {
		"sex": {
			"ms_sex_llm_v1": "female"
		},
		"doctype": {
			"ms_doctype_v1": "form"
		},
		"form_title": {
			"ms_form_title_llm_v1": "U.S. Department of Justice"
		},
		"countries": {
			"ms_countries_nlp_v1": ["Mexico", "United States"]
		},
		"years": {
			"ms_years_nlp_v1": [1987]
		},
		"g325a": {
			"occupation": {
				"occupation_llm_v1": "['n.a']"
			},
			"reason": {
				"reason_llm_v1": "NATURALIZATION"
			},
			"nationality": {
				"nationality_llm_v1": "Mexican"
			}
		}
	},
	"is_g325a": true,
	"is_cert_naturalization": false,
	"full_text": "U.S. Department of Justice OMB No. 1115-0066 Immigration and Naturalization Service BIOGRAPHIC INFORMATION (Family name) (First name) (Middle name) MALE BIRTHDATE(Mo.-Day-Yr.) NATIONALITY FILE NUMBER SOTO MARIA Filemon FEMALE 12-02-10 Mexican A 10 706 964 ALL OTHER NAMES USED (Including names by previous marriages) CITY AND COUNTRY OF BIRTH SOCIAL SECURITY NO. MOTA MARIA F. San Jose, Guerrero (If any) 452-66-9888 FAMILY NAME FIRST NAME DATE, CITY AND COUNTRY OF BIRTH(If known) CITY AND COUNTRY OF RESIDENCE. FATHER MOTHER (Maiden name) SOTO, MARIANA NOT KNOW - DIED WHEN I WAS BABY HUSBAND( (If none, so state) FAMILY NAME FIRST NAME BIRTHDATE CITY & COUNTRY OF BIRTH DATE OF MARRIAGE PLACE OF MARRIAGE OR WIFE (For wife. give maiden name) Don't NOT ANAPRA MOTA ALBINO REMBER KNOW 3/12/56 NEW MEXICO FORMER HUSBANDS OR WIVES(if none, so state) FAMILY NAME (For wife, give maiden name) FIRST NAME BIRTHDATE DATE & PLACE OF MARRIAGE DATE AND PLACE OF TERMINATION OF MARRIAGE APPLICANT'S RESIDENCE LAST FIVE YEARS. LIST PRESENT ADDRESS FIRST. FROM TO STREET AND NUMBER CITY PROVINCE OR STATE COUNTRY MONTH YEAR MONTH YEAR 201 CORTez DR. El PASO Texas 3 86 PRESENT TIME 1840 Cypress It 1125 El PASO Teras 9 74 3 86 APPLICANT'S LAST ADDRESS OUTSIDE THE UNITED STATES OF MORE THAN ONE YEAR FROM TO STREET AND NUMBER CITY PROVINCE OR STATE COUNTRY MONTH YEAR MONTH YEAR APPLICANT'S EMPLOYMENT LAST FIVE YEARS. (IF NONE, so STATE) LIST PRESENT EMPLOYMENT FIRST FROM TO FULL NAME AND ADDRESS OF EMPLOYER OCCUPATION (SPECIFY) MONTH YEAR MONTH YEAR PRESENT TIME None Show below last occupation abroad if not shown above. (Include all information requested above.) THIS FORM IS SUBMITTED IN CONNECTION WITH APPLICATION FOR: SIGNATURE OF APPLICANT DATE NATURALIZATION OTHER (SPECIFY): STATUS AS PERMANENT RESIDENT maris-Fmots 1-5-87 IF YOUR NATIVE ALPHABET IS IN OTHER THAN ROMAN LETTERS. WRITE YOUR NAME IN YOUR NATIVE ALPHABET IN THIS SPACE: Are all copies legible? Yes PENALTIES: SEVERE PENALTIES ARE PROVIDED BY LAW FOR KNOWINGLY AND WILLFULLY FALSIFYING OR CONCEALING A MATERIAL FACT. APPLICANT: BE SURE TO PUT YOUR NAME AND ALIEN REGISTRATION NUMBER IN THE BOX OUTLINED BY HEAVY BORDER BELOW. COMPLETE THIS BOX (Family name) (Given name) (Middle name) (Alien registration number) JAN 29 1987 Texas Citizenship Section Form G-325 (Rev. 10-1-82) Y (1) Ident."
}
