{
  "anumber": "A11138471",
  "id": "A11138471_0000",
  "page_index": 0,
  "resources": {
    "full_jpg": "https://dctn4zjpwgdwdiiy5odjv7o2se0bqgjb.lambda-url.us-east-1.on.aws/iiif/3/og-2023-kc-nara_A11138471_0000/full/max/0/default.jpg"
  },
  "fields": {
    "sex": {
      "ms_sex_llm_v1": "female"
    },
    "doctype": {
      "ms_doctype_v1": "letter"
    },
    "form_title": {
      "ms_form_title_llm_v1": "U.S. Naturalization Certificate, TR-64"
    },
    "countries": {
      "ms_countries_nlp_v1": [
        "Canada",
        "United States"
      ]
    },
    "years": {
      "ms_years_nlp_v1": [
        1905,
        1963
      ]
    },
    "certificate_naturalization": {
      "complexion": {
        "complexion_llm_v1": "fair"
      },
      "marital_status": {
        "marital_status_llm_v1": "Widow"
      },
      "year_naturalization": {
        "year_naturalization_llm_v1": 1963
      },
      "residence_naturlization": {
        "residence_naturlization_llm_v1": "417 North 32nd Place, Phoenix, Arizona"
      }
    }
  },
  "is_g325a": false,
  "is_cert_naturalization": true,
  "full_text": "TO BE FORWARDED TO No. 8510791 IMMIGRATION AND NATURALIZATION SERVICE CERTE Petition no. TR=64 DUPLICATE Personal description, of holderas of datesfnaturalization. Date of birth November 30, 1905 sex female ; complexion fair colorsheres blue-gray colorof hair blond height 5 feel 1} inches; weight 150 pounds; visible none Maritalstates widow Country of formernationality Canada I certify that the description, above givenis, have hereto, is a likeness of me. Flower Creaton Complete and true signature of holder) UNITED STATES OF AMERICA | SS: DISTRICT OF ARIZONA Beit known, that ad a termofthe United States District Court of District of Arizona held pursuant to lawal Phoenix, Arizona on January 21, 1963 the FLORENCE GRESTON then residing at 417 North 32nd Place, Phoenix, Arizona inlends Moreside permanentlyin, the United States when somequired by the naturalization Laws of the United. States), had in allother respects complied with the applicable provisions of such naturaliseation laws, and was entitled lobe Seal admitted socilixenship thereuponordered that such person be and(s)hewas admilled as acilizena the United States of America. Intestimony whereofshersealofthe courtis hereunto, affixced this 21st day of January in the year of our Lord nineteen hundred and sixty-three WM. H. LOV ELESS Hisaviolation of punishable as such) to copy print, photograph. Clerk of the U. S. District Court. or otherwise illegally use this certificate. By Jenna Libby Libboy Deputy Clerk. Jenner BUREAU"
}