{
  "anumber": "A11638538",
  "id": "A11638538_0020",
  "page_index": 20,
  "resources": {
    "full_jpg": "https://dctn4zjpwgdwdiiy5odjv7o2se0bqgjb.lambda-url.us-east-1.on.aws/iiif/3/og-2023-kc-nara_A11638538_0020/full/max/0/default.jpg"
  },
  "fields": {
    "sex": {
      "ms_sex_llm_v1": "male"
    },
    "doctype": {
      "ms_doctype_v1": "form"
    },
    "form_title": {
      "ms_form_title_llm_v1": "BIOGRAPHIC INFORMATION, G-325 ( (Rev. 10-1-82) Y"
    },
    "countries": {
      "ms_countries_nlp_v1": [
        "Honduras",
        "Belize",
        "United States"
      ]
    },
    "years": {
      "ms_years_nlp_v1": [
        1971,
        1970,
        1956,
        1960,
        1945,
        1987,
        2023,
        1944,
        1978
      ]
    },
    "g325a": {
      "occupation": {
        "occupation_llm_v1": "[' retired', 'mechanical eng']"
      },
      "reason": {
        "reason_llm_v1": "NATURALIZATION"
      },
      "nationality": {
        "nationality_llm_v1": "Honduras"
      }
    }
  },
  "is_g325a": true,
  "is_cert_naturalization": false,
  "full_text": "Screened by NARA, 5/31/2023 U.S. Department of Justice OMB No. 1115-0066 Immigration and Naturalization Service BIOGRAPHIC INFORMATION (Family name) (First name) (Middle name) MALE BIRTHDATE(Mo.-Day-Yr.) NATIONALITY FILE NUMBER CAIN WHITFIELD HUGH EVAN FEMALE 08-11-15 Honduras A11 638 538 ALL OTHER NAMES USED (Including names by previous marriages) CITY AND COUNTRY OF BIRTH SOCIAL SECURITY NO. NONE La Ceiba, Honduras (If any) 103-34- 1807 FAMILY NAME FIRST NAME DATE, CITY AND COUNTRY OF BIRTH(If known) CITY AND COUNTRY OF RESIDENCE. FATHER CAIN William La Ceiba Honduras DECEASED 1945 MOTHER(Maiden name) MUNNINGS, Ethel Belize City , Belize DECEASED 1970 HUSBAND (If none, so state) FAMILY NAME FIRST NAME BIRTHDATE CITY & COUNTRY OF BIRTH DATE OF MARRIAGE PLACE OF MARRIAGE OR (For wife, give maiden name) WIFE NONE FORMER HUSBANDS OR WIVES(if none, so state) FAMILY NAME (For wife, give maiden name) FIRST NAME BIRTHDATE DATE & PLACE OF MARRIAGE DATE AND PLACE OF TERMINATION OF MARRIAGE ARNOLD Gladys 10-26-24 1944 Belize City 01-15-75 New York, NY APPLICANT'S RESIDENCE LAST FIVE YEARS. LIST PRESENT ADDRESS FIRST. FROM TO STREET AND NUMBER CITY PROVINCE OR STATE COUNTRY MONTH YEAR MONTH YEAR 1586 West 51st Street L. A. CA USA 1971 PRESENT TIME APPLICANT'S LAST ADDRESS OUTSIDE THE UNITED STATES OF MORE THAN ONE YEAR FROM TO STREET AND NUMBER CITY PROVINCE OR STATE COUNTRY MONTH YEAR MONTH YEAR Krkood Attey Belize City Belize 1956 April 1960 APPLICANT'S EMPLOYMENT LAST FIVE YEARS. (IF NONE, so STATE) LIST PRESENT EMPLOYMENT FIRST FROM TO FULL NAME AND ADDRESS OF EMPLOYER OCCUPATION SPECIFY) MONTH YEAR MONTH YEAR Retired Retired 1978 PRESENT TIME Show below last occupation abroad if not shown above. (Include all information requested above.) Mechanical Eng 1937 April 1960 THIS FORM IS SUBMITTED IN CONNECTION WITH APPLICATION FOR: SIGNATURE OF APPLICANT DATE NATURALIZATION OTHER (SPECIFY): STATUS AS PERMANENT RESIDENT XWhitfield Cam 10-14-86 IF VOUR NATIVE ALPHABET IS ON OTHER THAN ROMAN LETTERS. WRITE YOUR NAME IN YOUR NATIVE ALPHABET IN THIS SPACE: Are all copies legible? Yes PENALTIES: SEVERE PENALTIES ARE PROVIDED BY LAW FOR KNOWINGLY AND WILLFULLY FALSIFYING OR CONCEALING A MATERIAL FACT. APPLICANT: BE SURE TO PUT YOUR NAME AND ALIEN REGISTRATION NUMBER IN THE BOX OUTLINED BY HEAVY BORDER BELOW. COMPLETE THIS BOX (Family name) (Given name) (Middle name) (Alien registration number) CAIN WHITFIELD HUGH EVAN All 638 538 LOS CIT . 400 0 6 APR 1987 (date) Form G-325 (Rev. 10-1-82) Y (1) Ident."
}