{
  "anumber": "A11799647",
  "id": "A11799647_0010",
  "page_index": 10,
  "resources": {
    "full_jpg": "https://dctn4zjpwgdwdiiy5odjv7o2se0bqgjb.lambda-url.us-east-1.on.aws/iiif/3/og-2023-kc-nara_A11799647_0010/full/max/0/default.jpg"
  },
  "fields": {
    "sex": {
      "ms_sex_llm_v1": "female"
    },
    "doctype": {
      "ms_doctype_v1": "letter"
    },
    "form_title": {
      "ms_form_title_llm_v1": "Naturalization Certificate, N-550"
    },
    "countries": {
      "ms_countries_nlp_v1": [
        "Mexico",
        "United States"
      ]
    },
    "years": {
      "ms_years_nlp_v1": [
        1914,
        1988,
        2023
      ]
    },
    "certificate_naturalization": {
      "complexion": {
        "complexion_llm_v1": "fair"
      },
      "marital_status": {
        "marital_status_llm_v1": "MARRIED"
      },
      "year_naturalization": {
        "year_naturalization_llm_v1": 1988
      },
      "residence_naturlization": {
        "residence_naturlization_llm_v1": "827 S. MARIPOSA"
      }
    }
  },
  "is_g325a": false,
  "is_cert_naturalization": true,
  "full_text": "Screened by NARA, 5/9/2023 FORM N-550 U. S. DEPARTMENT OF JUSTICE No. 13520608 IMMIGRATION AND NATURALIZATION SERVICE (REV. 5-1-84)Y Name ARANDA, SOCORRO FORMERLY ARANDA, MARIA DEL SOCORRO residing at 827 S. MARIPOSA SIGNATURE OF HOLDER Date of birthos ANGELES, Date CA of order 90005 of admission IS NOT REQUIRED ON THIS 10/22/14 5/24/88 DUPLICATE STUB Date certificate issued MAY 24TH, 1988 by the U.S. District Court at Los Angeles, California DUPLICATE DO NOT DETACH Petition No. 00708845 INS No. A11/799 647 THE D TO BE FORWARDED TO No. 13520608 IMMIGRATION AND NATURALIZATION SERVICE CANE Petition No. 00708845 INP. Registration No. All 799 647 DUPLICATE Personal description of holder as of date of naturalization: Date of birth OCTOBER 22, 1914 sex FEMALE complexion FAIR coloropeyes BROWN color of hair GRAY height 5 feet 0 inches; weight 118 pounds; visible distinctive marks NONE Marital, status MARRIED Country of formerantionality MEXICO I certify that the description above given is have, and that the photograph affixed hereto is a likeness of me. Soerns arinda Complete and true signature of holder) UNITED STATES OF AMERICA } SS: CENTRAL DIST. OF CALIFORNIA Beit known, that al a termofthe District Court of The United States held pursuant to law all Los Angeles on MAY 24TH, 1988 the Gourthaving foundshab SOCORRO ARANDA intends then residing loreside all permanentlyin 827 S MARIPOSA the United. LOS Plates ANGELES, when'sorequired, CA by the Naturalization. Laws of the United. States), had in all other respects, complied with the applicable provisions of such naturalization laws, and was entitled be Seal admitted socilixenship thereupon ordered that such person be and (s)hewas admilled as a citizen of the United States of America. In testimony whereoft thesealop the courtis hereunto affixed this day of nineteen hundred and 24TH MAY EIGHTY-EIGHT LEONARD A. BROSNAN Clerk of the U.S: District Court. IT IS PUNISHABLE BY U. S. LAW TO COPY, PRINT OR PHOTOGRAPH THIS CERTIFICATE. By Martha Soled Deputy Clerk."
}