{
  "anumber": "A12250430",
  "id": "A12250430_0028",
  "page_index": 28,
  "resources": {
    "full_jpg": "https://dctn4zjpwgdwdiiy5odjv7o2se0bqgjb.lambda-url.us-east-1.on.aws/iiif/3/og-2023-kc-nara_A12250430_0028/full/max/0/default.jpg"
  },
  "fields": {
    "sex": {
      "ms_sex_llm_v1": "female"
    },
    "doctype": {
      "ms_doctype_v1": "form"
    },
    "form_title": {
      "ms_form_title_llm_v1": "Biographic Information, FORM G-325 A REV. 4-1-67"
    },
    "countries": {
      "ms_countries_nlp_v1": [
        "Canada",
        "China",
        "United States"
      ]
    },
    "years": {
      "ms_years_nlp_v1": [
        2023
      ]
    },
    "g325a": {
      "occupation": {
        "occupation_llm_v1": "['laundry', ' self-employed']"
      },
      "reason": {
        "reason_llm_v1": "ADJUSTMENT OF STATUS"
      },
      "nationality": {
        "nationality_llm_v1": "CHINESE"
      }
    }
  },
  "is_g325a": true,
  "is_cert_naturalization": false,
  "full_text": "FORM G-325 A REV. 4-1-67 Screened by NARA, 9/18/2023 FORM APPROVED BUDGET BUREAU NO. 43-R436 BIOGRAPHIC UNITED STATES DEPARTMENT OF JUSTICE LOS INFORMATION Immigration and Naturalization Service T/C to: 249 1/10/69 (FAMILY NAME) (FIRST NAME) (MIDDLE NAME) MALE BIRTHDATE (MO-DAY-YR.) NATIONALITY ALIEN REGISTRATION NO. WONG, BEN DONG FEMALE 1/22/11 CHINESE (IF ANY) A12 250 430 ALL OTHER NAMES USED CITY AND COUNTRY OF BIRTH (DATE) SOCIAL SECURITY NO. (IF ANY) WONG, GUCK ON CANTON , CHINA 553-36-2519 FAMILY NAME FIRST NAME DATE, CITY AND COUNTRY OF BIRTH (IF KNOWN) CITY AND COUNTRY OF RESIDENCE FATHER WONG WEE DON - DIED MOTHER (MAIDEN NAME) TOM GIM YEP - CANADA (RESIDENCE) SPOUSE (IF NONE, so STATE) FAMILY NAME FIRST NAME BIRTHDATE CITY & COUNTRY OF BIRTH DATE OF MARRIAGE PLACE OF MARRIAGE (FOR WIFE, GIVE MAIDEN NAME) FONG SUEY 7/28/15 GIN CANTON, CHINA CHINA FORMER SPOUSES (IF NONE, so STATE) FAMILY NAME (FOR WIFE. GIVE MAIDEN NAME) FIRST NAME BIRTHDATE DATE & PLACE OF MARRIAGE DATE AND PLACE OF TERMINATION OF MARRIAGE NONE APPLICANT'S RESIDENCE LAST FIVE YEARS. LIST PRESENT ADDRESS FIRST. FROM TO STREET AND NUMBER CITY PROVINCE OR STATE COUNTRY MONTH YEAR MONTH YEAR 1416 3rd AVENUE Los ANGELES CALIF. U.S.A. SEPT. 52 PRESENT TIME LAST FOREIGN RESIDENCE OF MORE THAN ONE YEAR IF NOT SHOWN ABOVE. (INCLUDE ALL INFORMATION REQUESTED ABOVE.) APPLICANT'S EMPLOYMENT LAST FIVE YEARS. (IF NONE, so STATE) LIST PRESENT EMPLOYMENT FIRST. FROM TO FULL NAME AND ADDRESS OF EMPLOYER OCCUPATION MONTH YEAR MONTH YEAR EMPLOYED 1800 W-8 ST. LAUNDRY JULY 41 PRESENT TIME LAST OCCUPATION ABROAD IF NOT SHOWN ABOVE. (INCLUDE ALL INFORMATION REQUESTED ABOVE.) THIS FORM IS SUBMITTED IN CONNECTION WITH APPLICATION FOR: IF YOUR NATIVE ALPHABET IS IN OTHER THAN ROMAN LETTERS. WRITE YOUR NAME IN NATURALIZATION ADJUSTMENT OF STATUS YOUR NATIVE ALPHABET IN THIS SPACE: OTHER (SPECIFY): PENALTIES: SEVERE PENALTIES ARE PROVIDED BY LAW FOR KNOWINGLY AND WILLFULLY FALSIFYING 11/6/68 OR CONCEALING A MATERIAL FACT. DATE Wing (SIGNATURE Ben OF APPLICANT OR Dong PETITIONER"
}