{
  "anumber": "A12250430",
  "id": "A12250430_0027",
  "page_index": 27,
  "resources": {
    "full_jpg": "https://dctn4zjpwgdwdiiy5odjv7o2se0bqgjb.lambda-url.us-east-1.on.aws/iiif/3/og-2023-kc-nara_A12250430_0027/full/max/0/default.jpg"
  },
  "fields": {
    "sex": {
      "ms_sex_llm_v1": "male"
    },
    "doctype": {
      "ms_doctype_v1": "form"
    },
    "form_title": {
      "ms_form_title_llm_v1": "Biographic Information, G-325A"
    },
    "countries": {
      "ms_countries_nlp_v1": [
        "Canada",
        "China",
        "United States"
      ]
    },
    "years": {
      "ms_years_nlp_v1": [
        1969,
        2023,
        1814
      ]
    },
    "g325a": {
      "occupation": {
        "occupation_llm_v1": "['laundry', ' retired']"
      },
      "reason": {
        "reason_llm_v1": "ADJUSTMENT OF STATUS"
      },
      "nationality": {
        "nationality_llm_v1": "CHINESE"
      }
    }
  },
  "is_g325a": true,
  "is_cert_naturalization": false,
  "full_text": "FORM G-325 A REV. 4-1-67 Screened by 9/18/2023 FORM APPROVED T/C 24QUDGET BUREAU NO. 43-R436 BIOGRAPHIC UNITED STATES DEPARTMENT OF JUSTICE JAN 15 1969 INFORMATION Immigration and Naturalization Service (FAMILY NAME) (FIRST NAME) (MIDDLE NAME) MALE BIRTHDATE(MO-DAY-YR.) NATIONALITY DATE ALIEN REGISTRATION NO. WONG, BEN DONG FEMALE 1/22/1814 CHINESE (IF ANY A12 250 430 ALL OTHER NAMES USED CITY AND COUNTRY OF BIRTH SOCIAL SECURITY NO. (IF ANY) WONG, GUCK ON CANTON , CHINA 553-36-2579 FAMILY NAME FIRST NAME DATE, CITY AND COUNTRY OF BIRTH (IF KNOWN) CITY AND COUNTRY OF RESIDENCE FATHER WONG WEE DON DIED MOTHER (MAIDEN NAME) TOM GIM YEP - CANADA (RESIDENCE) was SPOUSE (IF NONE, so STATE) FAMILY NAME FIRST NAME BIRTHDATE CITY & COUNTRY OF BIRTH DATE OF MARRIAGE PLACE OF MARRIAGE (FOR WIFE, GIVE MAIDEN NAME) FONG SUEY GiN 7/28/15 CANTON, CHINA, CHINA FORMER SPOUSES (IF NONE, so STATE) FAMILY NAME (FOR WIFE. GIVE MAIDEN NAME) FIRST NAME BIRTHDATE DATE & PLACE OF MARRIAGE DATE AND PLACE OF TERMINATION OF MARRIAGE NONE APPLICANT'S RESIDENCE LAST FIVE YEARS. LIST PRESENT ADDRESS FIRST. FROM TO STREET AND NUMBER CITY PROVINCE OR STATE COUNTRY MONTH YEAR MONTH YEAR 1416 310 AVENUE LOS ANGELES CALIF. U.S.A. SEPT. 52 PRESENT TIME LAST FOREIGN RESIDENCE OF MORE THAN ONE YEAR IF NOT SHOWN ABOVE. (INCLUDE ALL INFORMATION REQUESTED ABOVE.) APPLICANT'S EMPLOYMENT LAST FIVE YEARS. (IF NONE, so STATE) LIST PRESENT EMPLOYMENT FIRST. FROM TO FULL NAME AND ADDRESS OF EMPLOYER OCCUPATION MONTH YEAR MONTH YEAR SELF-EMPLOYED 1800 W-8 ST. LAUNDRY JULY 41 PRESENT TIME LAST OCCUPATION ABROAD IF NOT SHOWN ABOVE. (INCLUDE ALL INFORMATION REQUESTED ABOVE.) THIS FORM IS SUBMITTED IN CONNECTION WITH APPLICATION FOR: IF YOUR NATIVE ALPHABET IS IN OTHER THAN ROMAN LETTERS. WRITE YOUR NAME IN NATURALIZATION ADJUSTMENT OF STATUS YOUR NATIVE ALPHABET IN THIS SPACE: OTHER (SPECIFY): PENALTIES: SEVERE PENALTIES ARE PROVIDED BY LAW FOR KNOWINGLY AND WILLFULLY FALSIFYING 11/6/68 OR CONCEALING A MATERIAL FACT. DATE Wing (SIGNATURE Ben OF APPLICANT OR Dong PETITIONER) COMPLETE THIS BOX (FAMILY NAME) (GIVEN NAME) (MIDDLE NAME) (ALIEN REGISTRATION NUMBER) WONG Ben Dong A12 250 430 (OTHER AGENCY USE) (INS USE) (daughter REFER no DATA in KE HUANG law (nee CH'EN) GEN-hsia LOS WHICH WAS SENT THE Los angeles (All-94-27a) etc. T/C - 249 11/10/69 (DATE) OFFICE OF INS ON local basis investigative fi : To check FB1 this reply is result of check of FILL records, request arrest to Identification Divident Dre submitted Water are necessary for positive Finger dis, 2) Rec. Br. FORM G-325A"
}