{
  "anumber": "A12491240",
  "id": "A12491240_0066",
  "page_index": 66,
  "resources": {
    "full_jpg": "https://dctn4zjpwgdwdiiy5odjv7o2se0bqgjb.lambda-url.us-east-1.on.aws/iiif/3/og-2023-kc-nara_A12491240_0066/full/max/0/default.jpg"
  },
  "fields": {
    "sex": {
      "ms_sex_llm_v1": "female"
    },
    "doctype": {
      "ms_doctype_v1": "form"
    },
    "form_title": {
      "ms_form_title_llm_v1": "Title: United States Department of Justice Immigration and Naturalization Service, Form Number: G-325A REV. 4-1-67, United States Department of Justice Immigration and Naturalization Service, G-325A REV.  at-1-67"
    },
    "countries": {
      "ms_countries_nlp_v1": [
        "Cuba",
        "United States"
      ]
    },
    "years": {
      "ms_years_nlp_v1": [
        1908,
        1958,
        1968,
        1940,
        1869,
        1879,
        1936
      ]
    },
    "g325a": {
      "occupation": {
        "occupation_llm_v1": "['attorney', ' retired']"
      },
      "nationality": {
        "nationality_llm_v1": "Cuban"
      }
    }
  },
  "is_g325a": true,
  "is_cert_naturalization": false,
  "full_text": "FORM G-325 A REV. 4-1-67 A12491240 office code 0300 RM APPROVED BUDGE BUREAU No. 43-R436 BIOGRAPHIC UNITED STATES DEPARTMENT OF JUSTICE INFORMATION Immigration and Naturalization Service type. ease Sec. 12-2-88 (FAMILY NAME) (FIRST NAME) (MIDDLE NAME) MALE BIRTHDATE (MO-DAY-YR.) NATIONALITY ALIEN REGISTRATION NO. date (IF ANY) RANGEL Desiderio Angel FEMALE 09-26-'05 Cuban 1-12-491-240 ALL OTHER NAMES USED CITY AND COUNTRY OF BIRTH SOCIAL SECURITY NO. (IF ANY) Desiderio Angel RANGEL (Mendez) Guanajay, Pinar del Rio Cube 265-74-4659 FAMILY NAME FIRST NAME DATE, CITY AND COUNTRY OF BIRTH (IF KNOWN) CITY AND COUNTRY OF RESIDENCE FATHER RANGEL, Desiderio dob 1869 born in Las Villas, Cuba and decsd 10 ('33) MOTHER (MAIDEN NAME) MENDEZ. Maria Rita dob 1879 born in Guanajay P-Rio Cuba dec 1940 SPOUSE (IF NONE, so STATE) FAMILY NAME FIRST NAME BIRTHDATE CITY & COUNTRY OF BIRTH DATE OF MARRIAGE PLACE OF MARRIAGE (FOR WIFE, GIVE MAIDEN NAME) Married 6-26-1958 married in La Habana, Cuba GARCIA, Carmen Gertudis (Ramirez) dob 11-22-16 born in Ila Habana, Cuba FORMER SPOUSES (IF NONE, so STATE) FAMILY NAME (FOR WIFE, GIVE MAIDEN NAME) FIRST NAME BIRTHDATE DATE & PLACE OF MARRIAGE DATE AND PLACE OF TERMINATION OF MARRIAGE OCHAMBARENA, Esther dob 04-1-1908 born in Artemise P Rio Cubs born on (married June 26. June 1936 married in Is Habana Cuba dévorced 3-41-53 APPLICANT'S RESIDENCE LAST FIVE YEARS. LIST PRESENT ADDRESS FIRST. FROM TO STREET AND NUMBER CITY PROVINCE OR STATE COUNTRY MONTH YEAR MONTH YEAR 2736 32 Street Astoria LI NY USA Feb '66 PRESENT TIME 600 West 136 Street NYC NY USA Oct $64 Feb '66 1506 16th Street Miamia Florida USA Sept 161 Oct '64 - LAST FOREIGN RESIDENCE OF MORE THAN ONE YEAR IF NOT SHOWN ABOVE. (INCLUDE ALL INFORMATION REQUESTED ABOVE.) 19 No 8205 Marianso La Hobana Hebna Cuba Sept 158 Sont 161 APPLICANT'S EMPLOYMENT LAST FIVE YEARS. (IF NONE, so STATE) LIST PRESENT EMPLOYMENT FIRST. FROM TO FULL NAME AND ADDRESS OF EMPLOYER OCCUPATION MONTH YEAR MONTH YEAR PRESENT TIME Merrill Lynch, Pierce and Penner 70 Pine St NYC Clk June 165 . . LAST OCCUPATION ABROAD IF NOT SHOWN ABOVE. (INCLUDE ALL INFORMATION REQUESTED ABOVE.) Attorney (self emr loyed) Ettorney 06 1930Sept 161 THIS FORM IS SUBMITTED IN CONNECTION WITH APPLICATION FOR: IF YOUR NATIVE ALPHABET IS IN OTHER THAN ROMAN LETTERS. WRITE YOUR NAME IN NATURALIZATION ADJUSTMENT OF STATUS YOUR NATIVE ALPHABET IN THIS SPACE: OTHER (SPECIFY): PENALTIES: SEVERE PENALTIES ARE PROVIDED BY LAW FOR KNOWINGLY AND WILLFULLY FALSIFYING 7 1968 OR CONCEALING A MATERIAL FACT. DATE (SIGNATURE OF APPLICANT OR PETITIONER) COMPLETE THIS BOX (FAMILY NAME) (GIVEN NAME) (MIDDLE NAME) (ALIEN REGISTRATION NUMBER) Rangél Desiderio Angel 2 1-12 491 240 (OTHER AGENCY USE) 3 U.S. (INS USE) records CONSUL: check form with with reply to: and return this HAVANA FILES District Director, Now ization Service, Immigration and Natural not York No Y. 10007 SIGNED NR MP NA ENTERED WITHOUT VISA \"HAVANA (4) Consul CUBA- FORM G-325A"
}