{
  "anumber": "A12495368",
  "id": "A12495368_0037",
  "page_index": 37,
  "resources": {
    "full_jpg": "https://dctn4zjpwgdwdiiy5odjv7o2se0bqgjb.lambda-url.us-east-1.on.aws/iiif/3/og-2023-kc-nara_A12495368_0037/full/max/0/default.jpg"
  },
  "fields": {
    "sex": {
      "ms_sex_llm_v1": "male"
    },
    "doctype": {
      "ms_doctype_v1": "form"
    },
    "form_title": {
      "ms_form_title_llm_v1": "Biographic Information, FORM G-325A ( (REV. 5-1-68)"
    },
    "countries": {
      "ms_countries_nlp_v1": [
        "Cuba",
        "United States"
      ]
    },
    "years": {
      "ms_years_nlp_v1": [
        1966,
        1968,
        1969,
        1963,
        1967,
        1965
      ]
    },
    "g325a": {
      "occupation": {
        "occupation_llm_v1": "[' retired', 'miss doris']"
      },
      "reason": {
        "reason_llm_v1": "NATURALIZATION"
      },
      "nationality": {
        "nationality_llm_v1": "Cuba"
      }
    }
  },
  "is_g325a": true,
  "is_cert_naturalization": false,
  "full_text": "FORM G-325 A (REV. 5-1-68) Form Approved Budget Bureau No. 43-R436 BIOGRAPHIC UNITED STATES DEPARTMENT OF JUSTICE INFORMATION Immigration and Naturalization Service 482-P- (Family name) (First name) (Middle name) MALE BIRTHDATE (Mo.-Day-Yr.) NATIONALITY ALIEN REGISTRATION NO. CUNILL MAKIA HNH of CUBA (If any) FEMALE 12-16-190 1-12-495-312 ALL OTHER NAMES USED CITY AND COUNTRY OF BIRTH SOCIAL SECURITY NO. MARIA ANA DIAZ BARCENAS PINAR DEL Rio - CUBA 281-42-4455 (If any) FAMILY NAME FIRST NAME DATE, CITY AND COUNTRY OF BIRTH (If known) CITY AND COUNTRY OF RESIDENCE DIA2 - CESAR. GUANE CORA - DEAD FATHER MOTHER (Maiden name) BARCENAS. DOLORES. HABAHA CUBA DEAD SPOUSE (If none, so state) FAMILY NAME FIRST NAME BIRTHDATE CITY & COUNTRY OF BIRTH DATE OF MARRIAGE PLACE OF MARRIAGE (For wife, give maiden name) CONILL BUEHAVENTURA 11.26.1902 - BESUCAL 6-12-1934 CUBA HABANK CUITA FORMER SPOUSES (If none, so state) FAMILY NAME (For wife, give maiden name) FIRST NAME BIRTHDATE DATE & PLACE OF MARRIAGE DATE AND PLACE OF TERMINATION OF MARRIAGE ALFONSO- JUAN DE 0105 3-8-184 12-23-1923 7-24-1933 HARAAN MARANA CUBA APPLICANT'S RESIDENCE LAST FIVE YEARS. LIST PRESENT ADDRESS FIRST. FROM TO STREET AND NUMBER CITY PROVINCE OR STATE MONTH YEAR MONTH 2510. N.W 231/C7 COUNTRY/L/ YEAR MIAMI FLORIDA 5 1968 PRESENT TIME 275-5. NEW HAMPSHIRE listAnce ES- CALIF EE. 21U 9 1967. 3-1968 1132.N. 3 - STREET MYRATI FLORIDA EE.UU I 1965 8. 196% 736 N.W. 23 AVE MIAMI PLERIOR EE.UU. g 1963 - 9-1965 - LAST FOREIGN RESIDENCE OF MORE THAN ONE YEAR IF NOT SHOWN ABOVE. (INCLUDE ALL INFORMATION REQUESTED ABOVE.) APPLICANT'S EMPLOYMENT LAST FIVE YEARS. (IF NONE, SO STATE.) LIST PRESENT EMPLOYMENT FIRST. FROM TO FULL NAME AND ADDRESS OF EMPLOYER OCCUPATION MONTH YEAR MONTH YEAR MUSH MISS DO.RISSR - 390-N W. 21st, NONE AT THIS TIME PRESENT TIME OPERATOR 1969 4 1969 Mc KAY of MIAMI. 328. N.W 29st. st.Catl 10 1968 12 1968 CHARM CALIF TORFALER-CO 1860.5.10 Awedes I 1967 3 1968 FONTAINE DELOY I N C . premium 2 1967 8 1968 LAST OCCURATION ABROAD IPNOT SHOWN ABOVE (INCLU ALL INFORMATION REQUESTED ABOVE) 10 1963 7 1966. THIS FORM IS SUBMITTED IN CONNECTION WITH APPLICATION FOR: SIGNATURE OF APPLICANT OR PETITIONER DATE NATURALIZATION ADJUSTMENT OF STATUS OTHER (SPECIFY): Maria Ann Cumll PENALTIES: SEVERE PENALTIES ARE PROVIDED BY LAW IF YOUR NATIVE ALPHABET IS IN OTHER THAN ROMAN LETTERS, WRITE YOUR NAME IN YOUR FOR KNOWINGLY AND WILLFULLY FALSIFYING NATIVE ALPHABET IN THIS SPACE: OR CONCEALING A MATERIAL FACT. 3 482-P- COMPLETE THIS BOX (Family name) (Given name) (Middle name) (Alien registration number) CUNILL MARIA ANA A-12 495 368 (OTHER AGENCY USE) (INS USE) MIA-CITZ OCT 141969 (4) Consul FORM G-325A"
}