{
  "anumber": "A12495368",
  "id": "A12495368_0038",
  "page_index": 38,
  "resources": {
    "full_jpg": "https://dctn4zjpwgdwdiiy5odjv7o2se0bqgjb.lambda-url.us-east-1.on.aws/iiif/3/og-2023-kc-nara_A12495368_0038/full/max/0/default.jpg"
  },
  "fields": {
    "sex": {
      "ms_sex_llm_v1": "female"
    },
    "doctype": {
      "ms_doctype_v1": "form"
    },
    "form_title": {
      "ms_form_title_llm_v1": "United States Department of Justice Immigration and Naturalization Service, FORM G-325 A ( (REV. 5-1-68)"
    },
    "countries": {
      "ms_countries_nlp_v1": [
        "Cuba",
        "United States"
      ]
    },
    "years": {
      "ms_years_nlp_v1": [
        1966,
        1923,
        1968,
        1934,
        1969,
        1963,
        1902,
        1933,
        1967,
        1965
      ]
    },
    "g325a": {
      "occupation": {
        "occupation_llm_v1": "['machine operator-1', ' charm of miami', ' 860 s. la aurora st.', ' cali.', ' sorfalea co']"
      },
      "reason": {
        "reason_llm_v1": "Naturalization"
      },
      "nationality": {
        "nationality_llm_v1": "Cuba"
      }
    }
  },
  "is_g325a": true,
  "is_cert_naturalization": false,
  "full_text": "FORM G-325 A (REV. 5-1-68) MIA-CITZ Form Approved Budget Bureau No. 43-R436 BIOGRAPHIC UNITED STATES DEPARTMENT OF JUSTICE INFORMATION Immigration and Naturalization Service OCT 141969 482-P- (Family name) (First name) (Middle name) MALE BIRTHDATE (Mo.-Day-Yr.) NATIONALITY ALIEN REGISTRATION NO. CUNILL ANA - CUBA (If any) MARIA FEMALE 12-26-1903 4-12-495-368 ALL OTHER NAMES USED CITY AND COUNTRY OF BIRTH SOCIAL SECURITY NO. MARIA ANA DIAZ BARCENAS PINAR DEL Rio - CUBA - 261-42-4455 (If any) FAMILY NAME FIRST NAME DATE, CITY AND COUNTRY OF BIRTH (If known) CITY AND COUNTRY OF RESIDENCE DIA2 - CESAR- - GUANE - CUBA - DEAD FATHER MOTHER (Maiden name) BARCENAS as DOLORES HABANA. CUBA DEAD SPOUSE (If none, so state) FAMILY NAME FIRST NAME BIRTHDATE CITY & COUNTRY OF BIRTH DATE OF MARRIAGE PLACE OF MARRIAGE (For wife, give maiden name) CUNILL BUENAVENTURA. 11-26-1902 - BESUCAL 6-12-1934 HABANA CUBA CUBA FORMER SPOUSES (If none, so state) FAMILY NAME (For wife, give maiden name) FIRST NAME BIRTHDATE DATE & PLACE OF MARRIAGE DATE AND PLACE OF TERMINATION OF MARRIAGE ALFONSO- JUAN DE Dios 3-8-1893 3-12-23-1923 7-24-1933 HABANA-CUBA HARANA-CUBA. APPLICANT'S RESIDENCE LAST FIVE YEARS. LIST PRESENT ADDRESS FIRST. FROM TO 2510-N.W. STREET - AND NUMBER 23rd ct CITY PROVINCE OR STATE TR UU MONTH YEAR MONTH YEAR MIAMI FLORIDA. 5 1968 PRESENT TIME 275-5 NEW HAMPSHIRE - los ANGELES. CALIF. EE. 4U 9 1967-3-1968 1132- 3 STREET MIAMI FLORIDA EE.UU. 9 1965 1-8-1967 7.36 N.W. 23 AVE MIAMI FLORIDA EE. 44. 9 1963 9- 1965 LAST FOREIGN RESIDENCE OF MORE THAN ONE YEAR IF NOT SHOWN ABOVE. (INCLUDE ALL INFORMATION REQUESTED ABOVE.) APPLICANT'S EMPLOYMENT LAST FIVE YEARS. (IF NONE, SO STATE.) LIST PRESENT EMPLOYMENT FIRST. FROM TO FULL NAME AND ADDRESS OF EMPLOYER OCCUPATION MONTH YEAR MONTH YEAR Miss DORISSA - 390-N.W. 27 st NONE. AT THIS TIME - - PRESENT TIME machine OPERATOR. / 1969 4 1969 MC KAY of - st.Colf 10 1968 12 1968 CHARM CALIF. S.ORFALEA. angeles 9 1967 3 1968 FONTAINE MEDIESON INC ABROAD IF AQID ABOVE. many HIALEAH RMA NON DELOY INC. 716 Levelon Road- OPERATOR 2 1967 8 1968 tNF WESTED ABOVE) 10 1963 7 1966 THIS FORM IS SUBMITTED IN CONNECTION WITH APPLICATION FOR: SIGNATURE OF APPLICANT OR PETITIONER DATE NATURALIZATION ADJUSTMENT OF STATUS OTHER (SPECIFY): Maria Ana Cunill PENALTIES: SEVERE PENALTIES ARE PROVIDED BY LAW IF YOUR NATIVE ALPHABET IS IN OTHER THAN ROMAN LETTERS, WRITE YOUR NAME IN YOUR FOR KNOWINGLY AND WILLFULLY FALSIFYING NATIVE ALPHABET IN THIS SPACE: OR CONCEALING A MATERIAL FACT."
}