{
  "anumber": "A12491240",
  "id": "A12491240_0000",
  "page_index": 0,
  "resources": {
    "full_jpg": "https://dctn4zjpwgdwdiiy5odjv7o2se0bqgjb.lambda-url.us-east-1.on.aws/iiif/3/og-2023-kc-nara_A12491240_0000/full/max/0/default.jpg"
  },
  "fields": {
    "sex": {
      "ms_sex_llm_v1": "male"
    },
    "doctype": {
      "ms_doctype_v1": "letter"
    },
    "form_title": {
      "ms_form_title_llm_v1": "The Naturalization Certificate, 10657327"
    },
    "countries": {
      "ms_countries_nlp_v1": [
        "Cuba",
        "United States"
      ]
    },
    "years": {
      "ms_years_nlp_v1": [
        1977,
        1905
      ]
    },
    "certificate_naturalization": {
      "complexion": {
        "complexion_llm_v1": "medium"
      },
      "marital_status": {
        "marital_status_llm_v1": "Married"
      },
      "year_naturalization": {
        "year_naturalization_llm_v1": 1977
      },
      "residence_naturlization": {
        "residence_naturlization_llm_v1": "Sweetwater, Florida"
      }
    }
  },
  "is_g325a": false,
  "is_cert_naturalization": true,
  "full_text": "THE TO BE FORWARDED TO No. 10657327 IMMIGRATION AND NATURALIZATION SERVICE 0 Delilion No. 128174 DUPLICATE Alien Registration no. A12 491 240 Personal description of holderas of date of naturalization: Date of birth September 26, 1905 sex male ; complexion medium colorobeyes green color of hair gray height 5 feet 6 inches; weight 50 pounds; visible distinctive marks none Maritalstatus married Country of formernationality Cuba I certify that the description, above given is brue, hereto, is a likeness of me. Desiderio Bangel ( Complete and true signature of holder) UNITED STATES OF AMERICA SS: SOUTHERN DISTRICT OF FLORIDA Beitknown that at a termofthe District Court of The United States held pursuant, to lawal Miami, Florida on May 24, 1977 the Court havingfoundshai DESIDERIO RANGEL then residing at Sweetwater, Florida inlends loreside permanently in the United States when sorequired by the Naturalization Laws of the United States), had in all other respects complied with the applicable provisions of such naturalization laws, and was entitled to be Seal admitted to acitizenship thereupon ordered that such person be and (s)hewas admilled as a citizen of the United States of America. In destimony whereofthesealofthe courtis hereunto,afficed, this 24th day of May in the year four Lord nineleen hundred and seventy-seven JOSEPH .I. BOGART IT IS PUNISHABLE BY U. S. LAW TO COPY, Clerk of the U. S. District Court. PRINT OR PHOTOGRAPH THIS CERTIFICATE. By Pilor Tee Deputy Clerk."
}