{
  "anumber": "A12994632",
  "id": "A12994632_0054",
  "page_index": 54,
  "resources": {
    "full_jpg": "https://dctn4zjpwgdwdiiy5odjv7o2se0bqgjb.lambda-url.us-east-1.on.aws/iiif/3/og-2023-kc-nara_A12994632_0054/full/max/0/default.jpg"
  },
  "fields": {
    "sex": {
      "ms_sex_llm_v1": "female"
    },
    "doctype": {
      "ms_doctype_v1": "form"
    },
    "form_title": {
      "ms_form_title_llm_v1": "Biographic Information, FORM G-325A ( (REV. 10-1-74) Y"
    },
    "countries": {
      "ms_countries_nlp_v1": [
        "China",
        "United States"
      ]
    },
    "years": {
      "ms_years_nlp_v1": [
        1918,
        2023,
        1979
      ]
    },
    "g325a": {
      "occupation": {
        "occupation_llm_v1": "[' owner', 'own business man wah book store']"
      },
      "reason": {
        "reason_llm_v1": "NATURALIZATION"
      },
      "nationality": {
        "nationality_llm_v1": "China"
      }
    }
  },
  "is_g325a": true,
  "is_cert_naturalization": false,
  "full_text": "FORM G-325A (REV. 10-1-74) Y Screened by NARA, 9/18/2023 form Proceved UNITED STATES DEPARTMENT OF JUSTICE LOS OMB No. 43-R436 Immigration and Naturalization Service CIT - 400 BIOGRAPHIC INFORMATION 11 SEP 1979 (Family name) (First name) (Middle name) MALE BIRTHDA E(Mo. Day-Yr.) NATIONALITY REGISTRATION NO. CHU ) WAI MAN FEMALE 5-27-14 China A12-994-632 ALL OTHER NAMES USED (Including names by previous marriages) CITY AND COUNTRY OF BIRTH SOCIAL SECURITY NO None Canton- china 564-68-6626 FAMILY NAME FIRST NAME DATE, CITY AND COUNTRY OF BIRTH(If known) CITY AND COUNTRY OF RESIDENCE. GEE WY N/A China Deceased FATHER MOTHER (Maiden name) CHUNG PAT N/A china Deceased HUSBAND (If none, so state) FAMILY NAME FIRST NAME BIRTHDATE CITY & COUNTRY OF BIRTH DATE OF MARRIAGE PLACE OF MARRIAGE OR (For wife, give maiden name) WIFE PING 5-2-27 12-26- Reno so Hong Kong 64 Nevada FORMER HUSBANDS OR WIVES(if none, so state) FAMILY NAME (For wife, give maiden name) FIRST NAME BIRTHDATE DATE & PLACE OF MARRIAGE DATE AND PLACE OF TERMINATION OF MARRIAGE Hing Yeung 1918 2-8-39 Deceased - Hong Kong China APPLICANT'S RESIDENCE LAST FIVE YEARS. LIST PRESENT ADDRESS FIRST. FROM TO STREET AND NUMBER CITY PROVINCE OR STATE COUNTRY MONTH YEAR MONTH YEAR 933 1/4 Chung King Rd Los angeles CA USA 4 66 PRESENT TIME APPLICANT'S LAST ADDRESS OUTSIDE THE UNITED STATES OF MORE THAN ONE YEAR FROM TO YEAR MONTH YEAR STREET AND NUMBER CITY PROVINCE OR STATE COUNTRY MONTH APPLICANT'S EMPLOYMENT LAST FIVE YEARS. (IF NONE, so STATE.) LIST PRESENT EMPLOYMENT FIRST FROM TO FULL NAME AND ADDRESS OF EMPLOYER OCCUPATION (SPECIFY) MONTH YEAR MONTH YEAR own Business MAN WAH Book store owner / 70 PRESENT TIME 933 14 Chung King Rd. L.A, ca Show below last occupation abroad if not shown above. (Include all information requested above.) THIS FORM IS SUBMITTED IN CONNECTION WITH APPLICATION FOR: SIGNATURE OF APPLICANT OR PETITIONER DATE NATURALIZATION ADJUSTMENT OF STATUS XWa /Uan chm 8/16/79 OTHER (SPECIFY): IF YOUR NATIVE ALPHABET Ps IN OTHER THAN ROMAN LETTERS. WRITE YOUR NAME IN YOUR NATIVE ALPHABET IN THIS SPACE: Are all copies legible? Yes PENALTIES: SEVERE PENALTIES ARE PROVIDED BY LAW FOR KNOWINGLY AND WILLFULLY FALSIFYING OR CONCEALING A MATERIAL FACT."
}