{
  "anumber": "A12994632",
  "id": "A12994632_0036",
  "page_index": 36,
  "resources": {
    "full_jpg": "https://dctn4zjpwgdwdiiy5odjv7o2se0bqgjb.lambda-url.us-east-1.on.aws/iiif/3/og-2023-kc-nara_A12994632_0036/full/max/0/default.jpg"
  },
  "fields": {
    "doctype": {
      "ms_doctype_v1": "form"
    },
    "form_title": {
      "ms_form_title_llm_v1": "APPLICATION FOR STATUS AS PERMANENT RESIDENT"
    },
    "countries": {
      "ms_countries_nlp_v1": [
        "China",
        "United States"
      ]
    },
    "years": {
      "ms_years_nlp_v1": [
        1966,
        1942,
        1960,
        1945,
        1948,
        1914,
        2023,
        1963,
        1964,
        1944,
        1924,
        1927,
        1939
      ]
    }
  },
  "is_g325a": false,
  "is_cert_naturalization": false,
  "full_text": "Screened by NARA, 9/18/2023 HONGKONG - PAROLEE H-41 Form Approved Budget Bureau No. 43-R400.2 APPLICATION FOR STATUS AS PERMANENT RESIDENT FEB 3 1966 (For use under Section 245, 249 or the proviso to Section 203(a)(7) of the Immigration and Nationality Act or Section 13 of the Act of September 11, 1957) FEE STAMP FILE NO. CHECKED APPLICANT FOR BENEFITS OF SECTION LAW Immigrant Nonimmigrant (Type) visa issued at on (DO NOT WRITE ABOVE THIS LINE) (SEE INSTRUCTIONS BEFORE FILLING IN APPLICATION. IF YOU NEED MORE SPACE TO ANSWER FULLY ANY QUESTION ON THIS FORM, USE A SEPARATE SHEET AND IDENTIFY EACH ANSWER WITH THE NUMBER OF THE CORRESPONDING QUESTION. FILL IN WITH TYPEWRITER OR PRINT IN BLOCK LETTERS IN INK.) 1. I hereby apply for the status of a lawful permanent resident alien on the following basis: (Check appropriate box) An immigrant visa is immediately available to me: A. other than as a refugee B. as a refugee I have resided in the United States continuously since C. prior to June 30, 1948 D. prior to July 1, 1924. 2. My name is (First) (Middle) (Last) My alien registration number is WAI-MAN CHU A12994632 I have also used the following names (Married women must show maiden name and names by prior marriages, if any) Nil 3. I reside in the United States at: (Apt. No.) (No. and Street) (City) (State) 1564 Jackson Street, San Francisco, California, 4. Date of Birth Place of Birth (City or Town) (County, Province, or State) (Country) I am now a citizen of (Country) May 27 1914 Toysan, Kwangtung, China Hong Kong china 5. Height Weight Eyes Hair Complexion Marks or Scars 6. Parents' Names 5 ft. 5 in. 140 lbs. Brown Black Yellow None Shou-Wy Gee (Mr. & Mrs) 7. I last arrived in the United States at the port of (City and State) on (Month) (Day) (Year) Alaska on May 6 1963 by (Name of vessel or other means of travel) as a (Visitor, student, U.S. citizen, stowaway, immigrant, etc.) North West Airline immigrant 8. I have resided at the following places: (Applicants who check Block A or B of Item 1 must furnish all places of residence from date five years prior to entry into the United States, up to and including the present time, listing present address first. Applicants who check Block C or D of Item 1 must show all places of residence during the last five years, listing present address first.) State From To Street and No. City Province Country Month Year Month Year 15642 Jackson St San Francisco, Calif U.S.A. July 1964 Present time 1137 Stockton St San Francis Calif U.S.A. Nov 1963 July 1964 ROAD 3030 Ross Street PALOALION Calif U.S.A. May L963 Nov 1963 22 Pok Man Street hong Kong China March 1960 May 1963 16 Yiu Wah Dai St Canton Kwangtu China 1945 March 1960 9. I have been employed at the following places during the past five years (include all United States and foreign employment) Type of work From To Full name and address of employer I did Month Year Month Year Foodland Super Market, 1300, Eddy Street Vegetable Nov 1964 Present time San Franc isco, Calif Depar tment 10. I do do not intend to seek gainful employment in the United States. 11. I am am not married. (If you are married give the following:) a. Date of marriage b. Date and place of birth of spouse Oct 26 1964 Hong Kong May 2 1927 C. Name of spouse and last address at which you and your spouse resided together Name Address (Apt. No.) (Number and Street) (Town or City) (State) From (Month and Year) To (Month and Year) Yuen-Ping So 15642 Jackon Street, San Francisco, California, U.S.A. d. Number of times I have been married, including this marriage e. Number of times my spouse has been married f. Number of children Twice Once Four g. The following members of my family are also applying for status as permanent residents: Samuel Chu, Felix Yiu-Chung Chu, Diane Yin-Mey Chu, Liz Hoi-Wan Chu. h. Name, date and place of birth and present address of each child: Samuel Chu 28/11/1939 Toysen, China Diane Yin Moy Chu 12/1/1944 Felix Yiu Chung Chu 4/5/1942 Toysen, China Liz Hoi Wan Chu 5/9/1945 Form I-485 (Rev. 12-1-65) UNITED STATES DEPARTMENT OF JUSTICE Immigration and Naturalization Service"
}