{
  "anumber": "A13073806",
  "id": "A13073806_0010",
  "page_index": 10,
  "resources": {
    "full_jpg": "https://dctn4zjpwgdwdiiy5odjv7o2se0bqgjb.lambda-url.us-east-1.on.aws/iiif/3/og-2023-kc-nara_A13073806_0010/full/max/0/default.jpg"
  },
  "fields": {
    "sex": {
      "ms_sex_llm_v1": "male"
    },
    "doctype": {
      "ms_doctype_v1": "form"
    },
    "form_title": {
      "ms_form_title_llm_v1": "U.S. Department of Justice Immigration and Naturalization Service, G-325 ( (Rev. 10-1-82) Y"
    },
    "countries": {
      "ms_countries_nlp_v1": [
        "Mexico"
      ]
    },
    "years": {
      "ms_years_nlp_v1": [
        1966,
        1968,
        1914,
        2023,
        1997
      ]
    },
    "g325a": {
      "occupation": {
        "occupation_llm_v1": "['n.a']"
      },
      "reason": {
        "reason_llm_v1": "NATURALIZATION"
      },
      "nationality": {
        "nationality_llm_v1": "MEXICAN"
      }
    }
  },
  "is_g325a": true,
  "is_cert_naturalization": false,
  "full_text": "UNICOR FEDERAL PRISON INDUSTRIES INC. LEAVENWORTH KANSAS Screened by NARA, 6/29/2023 INSTRUCTIONS: USE TYPEWRITER. BE SURE ALL COPIES ARE LEGIBLE. Failure to answer fully all questions delays action. Do Not Remove Carbons: If typewriter is not available, print heavily in block letters with ball-point pen. U.S. Department of Justice OMB No. 1115-0066 Immigration and Naturalization Service BIOGRAPHIC INFORMATION (Family name) (First name) (Middle name) MALE BIRTHDATE (Mo.-Day-Yr.) NATIONALITY FILE NUMBER SANCHEZ-VEGA, RAFAEL FEMALE 05-26-1914 MEXICAN A 13 073 806 ALL OTHER NAMES USED (Including names by previous marriages) CITY AND COUNTRY OF BIRTH SOCIAL SECURITY NO. NONE YURIRIA GUANAJUATO MEXICO (If any) 547-66-0067 FAMILY NAME FIRST NAME DATE, CITY AND COUNTRY OF BIRTH (If known) CITY AND COUNTRY OF RESIDENCE. SANCHEZ ESTEBAN. FATHER GUANAJUATO, MEXICO. DECEASED 1966 MOTHER (Maiden name) VEGA PRUDENCIA. GUANAJUATO, MEXICO. DECEASED 1968 HUSBAND (If none, so state) FAMILY NAME FIRST NAME BIRTHDATE CITY & COUNTRY OF BIRTH DATE OF MARRIAGE PLACE OF MARRIAGE OR (For wife, give maiden name) WIFE GUANAJUATO, GUANAJUATO, MARTINEZ-ALCANTAR, ROSA 9-6-12 MEXICO 01-10-39 MEXICO. FORMER HUSBANDS OR WIVES (if none, so state) FAMILY NAME (For wife, give maiden name) FIRST NAME BIRTHDATE DATE & PLACE OF MARRIAGE DATE AND PLACE OF TERMINATION OF MARRIAGE NONE APPLICANT'S RESIDENCE LAST FIVE YEARS. LIST PRESENT ADDRESS FIRST. FROM TO STREET AND NUMBER CITY PROVINCE OR STATE COUNTRY MONTH YEAR MONTH YEAR 3549 S. \"B\" ST. OXNARD CALIFORNIA USA 01 97 PRESENT TIME 612 JOYCE DRIVE PORT HUE CALIFORNIA USA 01 91 01 97 APPLICANT'S LAST ADDRESS OUTSIDE THE UNITED STATES OF MORE THAN ONE YEAR FROM TO STREET AND NUMBER CITY PROVINCE OR STATE COUNTRY MONTH YEAR MONTH YEAR NONE APPLICANT'S EMPLOYMENT LAST FIVE YEARS. (IF NONE, so STATE) LIST PRESENT EMPLOYMENT FIRST FROM TO FULL NAME AND ADDRESS OF EMPLOYER OCCUPATION (SPECIFY) MONTH YEAR MONTH YEAR NONE RETIRED 05 68 PRESENT TIME Show below last occupation abroad if not shown above. (Include all information requested above.) NONE THIS FORM IS SUBMITTED IN CONNECTION WITH APPLICATION FOR: SIGNATURE OF APPLICANT DATE NATURALIZATION OTHER (SPECIFY): STATUS AS PERMANENT RESIDENT Katali Sancher 10-26-1997 IF YOUR NATIVE ALPHABET IS IN OTHER THAN ROMAN LETTERS WRITE YOUR NAME IN YOUR NATIVE ALPHABET IN THIS SPACE Are all copies legible? Yes NONE PENALTIES: SEVERE PENALTIES ARE PROVIDED BY LAW FOR KNOWINGLY AND WILLFULLY FALSIFYING OR CONCEALING A MATERIAL FACT. APPLICANT: BE SURE TO PUT YOUR NAME AND ALIEN REGISTRATION NUMBER IN THE BOX OUTLINED BY HEAVY BORDER BELOW. COMPLETE THIS BOX (Family name) (Given name) (Middle name) (Allen registration number) SANCHEZ-VEGA, RAFAEL A13 073 806 Form G-325 (Rev. 10-1-82) Y (1) Ident."
}