{
  "anumber": "A13573268",
  "id": "A13573268_0016",
  "page_index": 16,
  "resources": {
    "full_jpg": "https://dctn4zjpwgdwdiiy5odjv7o2se0bqgjb.lambda-url.us-east-1.on.aws/iiif/3/og-2023-kc-nara_A13573268_0016/full/max/0/default.jpg"
  },
  "fields": {
    "sex": {
      "ms_sex_llm_v1": "female"
    },
    "doctype": {
      "ms_doctype_v1": "form"
    },
    "form_title": {
      "ms_form_title_llm_v1": "United States Department of Justice Immigration and Naturalization Service, G-325 ( (11-1-66)"
    },
    "countries": {
      "ms_countries_nlp_v1": [
        "China",
        "United States"
      ]
    },
    "years": {
      "ms_years_nlp_v1": [
        1962,
        1968,
        1929,
        1952,
        1913,
        1967,
        1965
      ]
    },
    "g325a": {
      "occupation": {
        "occupation_llm_v1": "['none']"
      },
      "reason": {
        "reason_llm_v1": "NATURALIZATION"
      },
      "nationality": {
        "nationality_llm_v1": "Chinese"
      }
    }
  },
  "is_g325a": true,
  "is_cert_naturalization": false,
  "full_text": "FORM G-325 (11-1-66) NR1226 5700 APPROVED BUDGET BUREAU No. 43-RA36 BIOGRAPHIC UNITED STATES DEPARTMENT OF JUSTICE INFORMATION Immigration and Not ralization Service DEC 2 1 1967 274 * U.S. GOVERNMENT PRINTING OFFICE 1968 OF 239-685 (Family 'ngme) (First name) (Middl name) MALE BIRTHDATE (Mo.-Day-Yr.) NATIONALITY ALIEN REGISTRATION NO. TSE King Chun FEMALE July,15,1913 Chinese (If any A-13573268. ALL OTHER NAMES USED CITY AND COUNTRY OF BIRTH SOCIAL SECURITY NO. Hoi Ping, Canton, China. (If any) FAMILY NAME FIRST NAME DATE, CITY AND COUNTRY OF BIRTH (If known) CITY AND COUNTRY OF RESIDENCE Tse Dang Hoiping, Canton, hina Deceased FATHER Shiu Lan. Canton, China Kowloon, Hong Kong MOTHER (Maiden name) SPOUSE (If none, so state) FAMILY NAME FIRST NAME BIRTHDATE CITY & COUNTRY OF BIRTH DATE OF MARRIAGE PLACE OF MARRIAGE (For wife, give maiden name) Hoi Ping April 11, Yee Hing Jew Frank 12/1/12 Canton, China 1929 Canton, China. FORMER SPOUSES (If none, so state) None FAMILY NAME (For wife, give maiden name) FIRST NAME BIRTHDATE DATE AND PLACE OF MARRIAGE DATE AND PLACE OF TERMINATION OF MARRIAGE 23RB-K APPLICANT'S RESIDENCE LAST FIVE YEARS. LIST PRESENT ADDRESS FIRST. STREET AND NUMBER CITY PROVINCE OR STATE COUNTRY FROM: MONTH YEAR TO: MONTH YEAR 1323-K Street, Bakersfield Calif. U. S. A. Nov. 1965 PRESENT TIME 515 4th Street Taft Calif. U. S. A. Nov. 1962 Nov. L965 APPLICANT'S EMPLOYMENT LAST FIVE YEARS. (If none, so state.) LIST PRESENT EMPLOYMENT FIRST. FROM TO FULL NAME AND ADDRESS OF EMPLOYER OCCUPATION MONTH YEAR MONTH YEAR PRESENT TIME None. LAST FOREIGN RESIDENCE OF MORE THAN ONE YEAR (If not shown above): LAST OCCUPATION ABROAD (If not shown above): FROM TO CITY COUNTRY FROM TO (Month) (Year) (Month) (Year) (Month) (Year) (Month) (Year) City Country Kowloon Hong Kong 10, 1952. 11, 62 None. THIS FORM IS SUBMITTED IN CONNECTION WITH APPLICATION FOR: NATURALIZATION ADJUSTMENT OF STATUS OTHER (Specify): PENALTIES: SEVERE PENALTIES ARE PROVIDED BY LAW FOR Ise King chun KNOWINGLY AND WILLFULLY FALSIFYING OR CON- CEALING A MATERIAL FACT. Date (Signature of applicant or petitioner) COMPLETE THIS BOX (Family name) (Given name) (Middle name) Alien registration number) TSE KING CHUN filed inquiry. A-13573268 Sheex (INS USE) LOS Check upon data of (OTHER AGENCY laered requestriates. as a to clears must no be check. bed CIT - 400 DEC 12 1967 date be for positive FORM G-325 FBI (2) Rec. Br. of"
}