{
  "anumber": "A13573268",
  "id": "A13573268_0015",
  "page_index": 15,
  "resources": {
    "full_jpg": "https://dctn4zjpwgdwdiiy5odjv7o2se0bqgjb.lambda-url.us-east-1.on.aws/iiif/3/og-2023-kc-nara_A13573268_0015/full/max/0/default.jpg"
  },
  "fields": {
    "sex": {
      "ms_sex_llm_v1": "female"
    },
    "doctype": {
      "ms_doctype_v1": "form"
    },
    "form_title": {
      "ms_form_title_llm_v1": "Biographic Information, G-325 ( (11-1-66)"
    },
    "countries": {
      "ms_countries_nlp_v1": [
        "China",
        "United States"
      ]
    },
    "years": {
      "ms_years_nlp_v1": [
        1962,
        1968,
        1929,
        1952,
        1913,
        1967,
        1965
      ]
    },
    "g325a": {
      "occupation": {
        "occupation_llm_v1": "['n.a']"
      },
      "reason": {
        "reason_llm_v1": "NATURALIZATION"
      },
      "nationality": {
        "nationality_llm_v1": "Chinese"
      }
    }
  },
  "is_g325a": true,
  "is_cert_naturalization": false,
  "full_text": "FORM G-325 (11-1-66) WR1220 570RRAPPROVED BUDGET BUREAU No. 43-R436 BIOGRAPHIC UNITED STATES DEPARTMENT OF JUSTICE DEC 2 1962 274 INFORMATION Immigration and Nat ralization Service * U.S. GOVERNMENT PRINTING OFFICE 1968 OF 239-685 (Family name) (First name) (Middle name) MALE BIRTHDATE (Mo.-Day-Yr.) NATIONALITY ALIEN REGISTRATION NO. TSE King Chun FEMALE July, 15,1913 Chinese (If any A-13573268. ALL OTHER NAMES USED CITY AND COUNTRY OF BIRTH SOCIAL SECURITY NO. Hoi Ping, Canton, China. (If any) FAMILY NAME FIRST NAME DATE, CITY AND COUNTRY OF BIRTH (If known) CITY AND COUNTRY OF RESIDENCE Tse Dan, Hoiping, Canton, hina Deceased FATHER Shiu Lan. Canton, China Kowloon, Hong Kong MOTHER (Maiden name) SPOUSE (If none, so state) FAMILY NAME FIRST NAME BIRTHDATE CITY & COUNTRY OF BIRTH DATE OF MARRIAGE PLACE OF MARRIAGE (For wife, give maiden name) Hoi Ping April 11, Yee Hing Jew Frank 12/1/12 Canton, China 1929 Canton, China. FORMER SPOUSES (If none, so state) None FAMILY NAME (For wife, give maiden name) FIRST NAME BIRTHDATE DATE AND PLACE OF MARRIAGE DATE AND PLACE OF TERMINATION OF MARRIAGE 2326-K APPLICANT'S RESIDENCE LAST FIVE YEARS. LIST PRESENT ADDRESS FIRST. STREET AND NUMBER CITY PROVINCE OR STATE COUNTRY FROM: MONTH YEAR TO: MONTH YEAR 1323-K Street, Bakersfield Calif. U. S. A. Nov. 1965 PRESENT TIME 515 4th Street Taft Calif. U. S. A. Nov. 1962 Nov. L965 District 16 SIGNATURE SPECIMEN FORM File No: A-3573268 HSIEH Chiung chen (m) Chinese characters 6200 Form G-138 6200/8774/3191 Jse King hun (6-16-58) Anglicized form of signature: PRESENT TIME None. LAST FOREIGN RESIDENCE OF MORE THAN ONE YEAR (If not shown above): LAST OCCUPATION ABROAD (If not shown above): FROM TO CITY COUNTRY FROM TO (Month) (Year) (Month) (Year) (Month) (Year) (Month) (Year) City Country Kowloon Hong Kong 10, 1952.11,62 None. THIS FORM IS SUBMITTED IN CONNECTION WITH APPLICATION FOR: NATURALIZATION ADJUSTMENT OF STATUS OTHER (Specify): PENALTIES: SEVERE PENALTIES ARE PROVIDED BY LAW FOR Jse King than KNOWINGLY AND WILLFULLY FALSIFYING OR CON- CEALING A MATERIAL FACT. Date (Signature of applicant or petitioner) COMPLETE THIS BOX (Family name) (Given name) (Middle name) Alien registration number) TSE KING CHUN tiled A-13573268 (INS USE) Check upon Inf problems data be (OTHER of AGENCY aerea tted for as a to positive elegrance must no inquiry. check. sheek bed LOS CIT - 400 DEC 12 1967 date arrest FORM G-325 FBI (2) Rec. Br. gr"
}