{
  "anumber": "A13559853",
  "id": "A13559853_0045",
  "page_index": 45,
  "resources": {
    "full_jpg": "https://dctn4zjpwgdwdiiy5odjv7o2se0bqgjb.lambda-url.us-east-1.on.aws/iiif/3/og-2023-kc-nara_A13559853_0045/full/max/0/default.jpg"
  },
  "fields": {
    "sex": {
      "ms_sex_llm_v1": "male"
    },
    "doctype": {
      "ms_doctype_v1": "form"
    },
    "form_title": {
      "ms_form_title_llm_v1": "BIOGRAPHIC INFORMATION, FORM G-325 ( (REV. 1-8-06)"
    },
    "countries": {
      "ms_countries_nlp_v1": [
        "United States"
      ]
    },
    "years": {
      "ms_years_nlp_v1": [
        1914,
        1967,
        2023,
        1964
      ]
    },
    "g325a": {
      "occupation": {
        "occupation_llm_v1": "[' retired', 'dental tech']"
      },
      "reason": {
        "reason_llm_v1": "NATURALIZATION"
      },
      "nationality": {
        "nationality_llm_v1": "Chinese"
      }
    }
  },
  "is_g325a": true,
  "is_cert_naturalization": false,
  "full_text": "FORM G-325 A (REV. 5-1-68) Screened by NARA, 7/24/2023 LOS Form Approved CIT 4 400 Budget Bureau No. 43-R436 BIOGRAPHIC UNITED STATES DEPARTMENT OF JUSTICE INFORMATION Immigration and Naturalization Service SEP 9 1971 G 325(3) 12-2-71 (Family name) (First name) (Middle name) MALE BIRTHDATE (Mo.- Day-Yr.) NATION Adate) ALIEN REGISTRATION NO. Wong Man Get FEMALE August 22, 1914 Chinese (If any) A13 559 853 ALL OTHER NAMES USED CITY AND COUNTRY OF BIRTH SOCIAL SECURITY NO. None Kwang Tung China (If any) 547-68-8863 FAMILY NAME FIRST NAME DATE, CITY AND COUNTRY OF BIRTH (If known) CITY AND COUNTRY OF RESIDENCE Wong Chau Deceased FATHER MOTHER (Maiden name) Yu Chun Deceased SPOUSE (If none, so state) FAMILY NAME FIRST NAME BIRTHDATE CITY & COUNTRY OF BIRTH DATE OF MARRIAGE PLACE OF MARRIAGE (For wife, give maiden name) Yu Pui-fun 4-21-1920 Kwang Tung, China 4-10-43 Canton, China FORMER SPOUSES (If none, so state) FAMILY NAME (For wife, give moiden name) FIRST NAME BIRTHDATE DATE & PLACE OF MARRIAGE DATE AND PLACE OF TERMINATION OF MARRIAGE None APPLICANT'S RESIDENCE LAST FIVE YEARS. LIST PRESENT ADDRESS FIRST. FROM TO STREET AND NUMBER CITY PROVINCE OR STATE COUNTRY MONTH YEAR MONTH YEAR 854 N. Crescent Hgts Blvd. Los Angeles California U.S. March 1964 PRESENT TIME LAST FOREIGN RESIDENCE OF MORE THAN ONE YEARIF NOT SHOWN ABOVE. (INCLUDE ALL INFORMATION REQUESTED ABOVE.) APPLICANT'S EMPLOYMENT LAST FIVE YEARS. (IF NONE, so STATE.) LIST PRESENT EMPLOYMENT FIRST. FROM TO FULL NAME AND ADDRESS OF EMPLOYER OCCUPATION MONTH YEAR MONTH YEAR Cushman & Tamura Dental Laboratory 3612 W Pico L.A. Dental Tech May 1967 PRESENT TIME LAST OCCUPATION ABROAD IF NOT SHOWN ABOVE (INCLUDE ALL INFORMATION REQUESTED ABOVE) THIS FORM IS SUBMITTED IN CONNECTION WITH APPLICATION FOR: SIGNATURE OF APPLICANT OR PETITIONER DATE NATURALIZATION ADJUSTMENT OF STATUS OTHER (SPECIFY): Man Get Worg PENALTIES: SEVERE PENALTIES ARE PROVIDED BY LAW IF YOUR NATIVE ALPHABET IS IN OTHER THAN ROMAN LETTERS, WRITE YOUR NAME IN YOUR FOR KNOWINGLY AND WILLFULLY FALSIFYING NATIVE ALPHABET IN THIS SPACE: OR CONCEALING A MATERIAL FACT."
}