{
  "anumber": "A17190805",
  "id": "A17190805_0004",
  "page_index": 4,
  "resources": {
    "full_jpg": "https://dctn4zjpwgdwdiiy5odjv7o2se0bqgjb.lambda-url.us-east-1.on.aws/iiif/3/og-2023-kc-nara_A17190805_0004/full/max/0/default.jpg"
  },
  "fields": {
    "sex": {
      "ms_sex_llm_v1": "female"
    },
    "doctype": {
      "ms_doctype_v1": "form"
    },
    "form_title": {
      "ms_form_title_llm_v1": "Biographic Information, G-325 ( (REV. 8-1-74)"
    },
    "countries": {
      "ms_countries_nlp_v1": [
        "China",
        "United States"
      ]
    },
    "years": {
      "ms_years_nlp_v1": [
        1975,
        1884,
        1881,
        1969,
        2023,
        1957,
        1977,
        1978
      ]
    }
  },
  "is_g325a": false,
  "is_cert_naturalization": false,
  "full_text": "FORA G-325 (REV. 8-1-74)Y Screened by NARA. 6/30/2023 LOS UNITED ST PARTMENT OF JUSTICE BIOGRAPHIC CIT * 400 Form Approved INFORMATION Imm Naturalization Service OMB No. 43-R436 NATIONALITY LAUG 7 2 100m (Family name) (First name) (Middle name) MALE BIRTHDATE (Mo.-Day-Yr.) ALIEN REGISTRATION NO. CHAN So LAAN FEMALE 3-17-1915 Chinese (If ahy) A17190805 ALL-OTHER NAMES USED (Including names by previous marriages) CITY AND COUNTRY OF BIRTH SOCIAL SECURITY NO. N/A Canton, china (If any) 550-94-3661 FAMILY NAME FIRST NAME DATE, CITY AND COUNTRY OF BIRTH (If known) CITY AND COUNTRY OF RESIDENCE FATHER chan, Nai-Mar 10/1881 Canton, China (deceased) MOTHER (Maiden name) Ho, chung-Wah 11/1884 canton, china (deceased) HUSBAND (If none, 80 state) FAMILY NAME FIRST NAME BIRTHDATE CITY & COUNTRY OF BIRTH DATE OF MARRIAGE PLACE OF MARRIAGE OR (For wife. give maiden name) WIFE None FORMER HUSBANDS OR WIVES (If none, so state) None FAMILY NAME (For wife, give maiden name) FIRST NAME BIRTHDATE DATE AND PLACE OF MARRIAGE DATE AND PLACE OF TERMINATION OF MARRIAGE APPLICANT'S RESIDENCE LAST FIVE YEARS. LIST PRESENT ADDRESS FIRST. FROM TO STREET AND NUMBER CITY PROVINCE OR STATE COUNTRY MONTH YEAR MONTH YEAR 1013 1/2 W. Kensington Rd. Los Angeles California USA May 1977 PRESENT TIME 1948 Carmen Ave. sy \" w , July 1975 1633 Lucile Ave May 1977 11 id 11 \" May 1969 July 1975 APPLICANT'S LAST ADDRESS OUTSIDE THE UNITED STATES OF MORE THAN ONE YEAR. FROM TO STREET AND NUMBER CITY PROVINCE OR STATE COUNTRY MONTH YEAR MONTH YEAR 7 To Kwa Wan Road Kowloon Hong Kong China - 1957 May 1969 APPLICANT'S EMPLOYMENT LAST FIVE YEARS. (IF NONE, so STATE.) LIST PRESENT EMPLOYMENT FIRST. FROM TO FULL NAME AND ADDRESS OF EMPLOYER OCCUPATION (Specify) MONTH YEAR MONTH YEAR New Asia Restaurant, 2324 Colorado Blvd, Eagle Rock, Calif. Hostess April 1978 PRESENT TIME Show below last occupation abroad if not shown above. (Include all information requested above.) THIS FORM IS SUBMITTED IN CONNECTION WITH APPLICATION FOR: SIGNATURE OF APPLICANT OR PETITIONER DATE NATURALIZATION OTHER (SPECIFY) So Laan Chan 6-30-80 ADJUSTMENT OF STATUS IF YOUR NATIVE ALPHABET IS IN OTHER THAN ROMAN LETTERS, WRITE YOUR NAME IN YOUR NATIVE ALPHABET IN THIS SPACE: Are all copies legible? Yes BR PENALTIES: SEVERE PENALTIES ARE PROVIDED BY LAW FOR KNOWINGLY AND WILLFULLY FALSIFYING OR CONCEALING A MATERIAL FACT."
}