{
  "anumber": "A17182973",
  "id": "A17182973_0035",
  "page_index": 35,
  "resources": {
    "full_jpg": "https://dctn4zjpwgdwdiiy5odjv7o2se0bqgjb.lambda-url.us-east-1.on.aws/iiif/3/og-2023-kc-nara_A17182973_0035/full/max/0/default.jpg"
  },
  "fields": {
    "sex": {
      "ms_sex_llm_v1": "female"
    },
    "doctype": {
      "ms_doctype_v1": "form"
    },
    "form_title": {
      "ms_form_title_llm_v1": "Biographic Information Form, G-325A"
    },
    "countries": {
      "ms_countries_nlp_v1": [
        "China",
        "Brazil"
      ]
    },
    "years": {
      "ms_years_nlp_v1": [
        1966,
        1917,
        1960,
        1968,
        1969,
        2023,
        1963,
        1967,
        2012,
        1936
      ]
    },
    "g325a": {
      "occupation": {
        "occupation_llm_v1": "[' retired', 'adm.']"
      },
      "reason": {
        "reason_llm_v1": "OTHER"
      },
      "nationality": {
        "nationality_llm_v1": "China"
      }
    }
  },
  "is_g325a": true,
  "is_cert_naturalization": false,
  "full_text": "FORM G-325 A REV. 4-1-67 Screened by NARA, 8/18/2023 TC/245 FORM APPROVED BUDGET BUREAU NO. 43-R436 BIOGRAPHIC ITED STATES DEPARTMENT OF JUSTICE LOS INFORMATION Immigration and Naturalization Service 11-7-68 (FAMILY NAME) (FIRST NAME) (MIDDLE NAME) MALE BIRTHDATE (M.O-DAY-YR.) NATIONALITY ALIEN REGISTRATION NO. LEE Yoh Shanghai9 (IF ANY) Han FEMALE China Jan.914 China 417 182 973 ALL OTHER NAMES USED CITY AND COUNTRY OF BIRTH SOCIAL SECURITY NO. (IF ANY) Shanghai China FAMILY NAME FIRST NAME DATE, CITY AND COUNTRY OF BIRTH (IF KNOWN) CITY AND COUNTRY OF RESIDENCE FATHER LEE ZAO NIUH (Deceased) MOTHER (MAIDEN NAME) LOH TZE (Deceased) SPOUSE (IF NONE, so STATE) FAMILY NAME FIRST NAME BIRTHDATE CITY & COUNTRY OF BIRTH DATE OF MARRIAGE PLACE OF MARRIAGE (FOR WIFE, GIVE MAIDEN NAME) China Ming Lo Chin 5.5.1917 dangsi, China Dec. 2,1936 Shanghai FORMER SPOUSES (IF NONE, so STATE) FAMILY NAME (FOR WIFE, GIVE MAIDEN NAME) FIRST NAME BIRTHDATE DATE & PLACE OF MARRIAGE DATE AND PLACE OF TERMINATION OF MARRIAGE APPLICANT'S RESIDENCE LAST FIVE YEARS. LIST PRESENT ADDRESS FIRST. FROM TO STREET AND NUMBER CITY PROVINCE OR STATE COUNTRY MONTH YEAR MONTH YEAR 381 Rua das Palmeiras Son Paulo Brasil Mayli 1967 ApiRESENT 1968 414 Run Barao de Ladario Sao Paulo Brasil Jan 1963 Jan. 1966 Caixa Postal 8610 Soa Paulo Brasil Feb 1960 Jan. 1966 184 Run Rocha Sao Paulo Brasil Jan 1966 May 1967 1801 Pandora Aven e Los Angeles, California USA 4 68 Present LAST FOREIGN RESIDENCE OF MORE THAN ONE YEAR IF NOT SHOWN ABOVE. (INCLUDE ALL INFORMATION REQUESTED ABOVE.) APPLICANT'S EMPLOYMENT LAST FIVE YEARS. (IF NONE, so STATE) LIST PRESENT EMPLOYMENT FIRST. FROM TO FULL NAME AND ADDRESS OF EMPLOYER OCCUPATION MONTH YEAR MONTH YEAR Willys Overland do Brasil, Sao Paulo, Brasil Adm. June 1960 PRESENT TIN 1966 Diversay Wilmingotn S.A. Sao Paulo, Brasil Adm. June 1966 1967 LAST OCCUPATION ABROAD IF NOT SHOWN ABOVE. (INCLUDE ALL INFORMATION REQUESTED ABOVE.) THIS FORM IS SUBMITTED IN CONNECTION WITH APPLICATION FOR: IF YOUR NATIVE ALPHABET IS IN OTHER THAN ROMAN LETTERS, WRITE YOUR NAME IN NATURALIZATION ADJUSTMENT OF STATUS YOUR NATIVE ALPHABET IN THIS SPACE: OTHER (SPECIFY): PENALTIES: SEVERE PENALTIES ARE PROVIDED BY LAW 10/8/68 FOR KNOWINGLY AND WILLFULLY FALSIFYING OR CONCEALING A MATERIAL FACT. DATE (SIGNATURE OF APPLICANT QR PETITIONER) COMPLETE THIS BOX (FAMILY NAME) (GIVEN NAME) (MIDDLE NAME) (ALIEN REGISTRATION NUMBER) YOH Han A17 182 973 (OTHER AGENCY USE) (INS USE) American Embassy records and return this form Rio de Janeiro, Brazil to: U.S. Dept. of Justice, Dec. 13, 1968 American Consulate General Immigration & Notz. Servicer SÃ£o Paulo, Brazil 300 N. Los Angeles Street, No adverse record January 20, 1969 Los Assisted 2012 See ATTACHED MEMORANDU Rudolph F. Glasl hipge Raigl B2 American Vice Consul Visa Symbol ELEANOR Connu of Date Visa Issued 3/27/68 REC'D FC 1969 Consulate Rio de laneric (4) Consul FORM G-325A mbassy Blasie"
}