{
  "anumber": "A17180748",
  "id": "A17180748_0015",
  "page_index": 15,
  "resources": {
    "full_jpg": "https://dctn4zjpwgdwdiiy5odjv7o2se0bqgjb.lambda-url.us-east-1.on.aws/iiif/3/og-2023-kc-nara_A17180748_0015/full/max/0/default.jpg"
  },
  "fields": {
    "sex": {
      "ms_sex_llm_v1": "female"
    },
    "doctype": {
      "ms_doctype_v1": "form"
    },
    "form_title": {
      "ms_form_title_llm_v1": "BIOGRAPHIC INFORMATION, FORM G-325A ( (REV. 8-27-72N)"
    },
    "countries": {
      "ms_countries_nlp_v1": [
        "China",
        "United States"
      ]
    },
    "years": {
      "ms_years_nlp_v1": [
        1975,
        1971,
        1910,
        1970,
        1972,
        1968,
        1974,
        1973,
        2023,
        1961
      ]
    },
    "g325a": {
      "occupation": {
        "occupation_llm_v1": "['cook']"
      },
      "reason": {
        "reason_llm_v1": "NATURALIZATION"
      },
      "nationality": {
        "nationality_llm_v1": "Chinese"
      }
    }
  },
  "is_g325a": true,
  "is_cert_naturalization": false,
  "full_text": "FORM G-325A (REV. 8-27-72)N Screened by NARA, 9/21/2023 Form Approved UNITED STATES DEPARTMENT OF JUSTICE LOS OMB No. 43-R436 BIT 405 Immigration and Naturalization Service CIT - 400 BIOGRAPHIC INFORMATION #3 sent 0.5 5/23/75 AUG 1972 MAY 23 1975 (Family name) (First name) (Middle name) MALE BIRTHDATE(Mo.-Day-Yr.) NATIONALITY ALIEN REGISTRATION NO. (date) LO, YUNG SING FEMALE 12/25/1910 Chinese any 17 180 748 ALL OTHER NAMES USED (Including names by previous marriages) CITY AND COUNTRY OF BIRTH SOCIAL SECURITY NO. None Kiang Sic. Kiukiang, China 558-88-6826 (If any) FAMILY NAME FIRST NAME DATE, CITY AND COUNTRY OF BIRTH(If known) CITY AND COUNTRY OF RESIDENCE LO Bing Unk. China Deceased. FATHER MOTHER (Maiden name) WANG Ah \" II 11 none, so state) FAMILY NAME FIRST NAME BIRTHDATE CITY & COUNTRY OF BIRTH DATE OF MARRIAGE PLACE OF MARRIAGE OR (For wife, give maiden name) WIFE CHUN Yuk 12-2-23 China 6/12/1961 Hong Kong FORMER HUSBANDS OR WIVES(if none,so state) FAMILY NAME (For wife, give maiden name) FIRST NAME BIRTHDATE DATE & PLACE OF MARRIAGE DATE AND PLACE OF TERMINATION OF MARRIAGE CHUN Nan Unkn. 10-10-30 China 3-24-1960 - China APPLICANT'S RESIDENCE LAST FIVE YEARS. LIST PRESENT ADDRESS FIRST. FROM TO STREET AND NUMBER CITY PROVINCE OR STATE COUNTRY MONTH YEAR MONTH YEAR 601 South Detroit St. Apt. 401 Los Angeles, Calif. USA. March 1971 PRESENT TIME 1312 Ridgecrest Drive Beverly Hills, Calif. USA. Febr. 1968 March 1971 APPLICANT'S LAST ADDRESS OUTSIDE THE UNITED STATES OF MORE THAN ONE YEAR FROM TO STREET AND NUMBER CITY PROVINCE OR STATE COUNTRY MONTH YEAR MONTH YEAR 371 King's Road - 2nd Flr. Hong Kong Hong Kong May 1961 Feb. 1968 APPLICANT'S EMPLOYMENTLAST FIVE YEARS. (IF NONE, so STATE.) LIST PRESENT EMPLOYMENT FIRST. FROM TO FULL NAME AND ADDRESS OF EMPLOYER OCCUPATION (SPECIFY) MONTH YEAR MONTH YEAR Dr. Ross & R. Platt - Employers 1877 Rising Glen Rd. LA.CA. -COOK March-1974 PRESENT TIME Blaine O. Leventhal - 320 St. Pierre Rd. Bel Air, CA. - Cook Febr. 1972 Jan. 1973 Laurence Harvey - 1000 N. Crescent Dr. Beverly Hills,CA. Cook May 1970 July 1971 D. Ludwig - 1312 Ridgecrest Dr., Beverly Hills, CA. - Cook Feb. 1968 Dec. 1970 Show below last occupation abroad if not shown above. (Include all information requested above.) THIS FORM IS SUBMITTED IN CONNECTION WITH APPLICATION FOR: SIGNATURE OF APPLICANT OR PETITIONER DATE INATURALIZATION ADJUSTMENT OF STATUS OTHER (SPECIFY): IF NAME IN YOUR NATIVE ALPHABET IN THIS SPACE: YOUR Ke youghing NATIVE ALPHABET IS IN OTHER THAN ROMAN LETTERS, WRI/TE YOUR November 22, 1974 Are all copies legible? Yes young sing PENALTIES: SEVERE PENALTIES ARE PROVIDED BY LAW FOR KNOWINGLY AND WILLFULLY FALSIFYING OR CONCEALING A MATERIAL FACT."
}