{
  "anumber": "A17195429",
  "id": "A17195429_0075",
  "page_index": 75,
  "resources": {
    "full_jpg": "https://dctn4zjpwgdwdiiy5odjv7o2se0bqgjb.lambda-url.us-east-1.on.aws/iiif/3/og-2023-kc-nara_A17195429_0075/full/max/0/default.jpg"
  },
  "fields": {
    "sex": {
      "ms_sex_llm_v1": "female"
    },
    "doctype": {
      "ms_doctype_v1": "form"
    },
    "form_title": {
      "ms_form_title_llm_v1": "Biographic Information, G-325 ( (REV. 8-1-74)"
    },
    "countries": {
      "ms_countries_nlp_v1": [
        "China",
        "United States"
      ]
    },
    "years": {
      "ms_years_nlp_v1": [
        1885,
        2023,
        1983,
        1883,
        1939
      ]
    },
    "g325a": {
      "occupation": {
        "occupation_llm_v1": "['house keeper', ' retired']"
      },
      "nationality": {
        "nationality_llm_v1": "CHINESE"
      }
    }
  },
  "is_g325a": true,
  "is_cert_naturalization": false,
  "full_text": "Screened by NARA, 9/21/2023 FORM G-325 (REV. 8-1-74)Y UNITED STATES DEPARTMENT OF JUSTICE BIOGRAPHIC CIT 400 Approved INFORMATION Immigration and Naturalization Service OMB NO. 43-R436 01 JUL 1983 (Family name) (First name) (Middle name) MALE BIRTHDATE (Mo.-Day-Yr.) NATIONALITY ALIEN REGISTRATION NO. LAU NUI ChAN FEMALE 3-6-15 CHINESE (Ifany) A-17-14542.91 ALL OTHER NAMES USED (Including names by previous marriages) CITY AND COUNTRY OF BIRTH SOCIAL SECURITY NO. CANTON ChINA (If any) 551-94-5538 FAMILY NAME FIRST NAME DATE, CITY AND COUNTRY OF BIRTH (If known) CITY AND COUNTRY OF RESIDENCE CHAN you FATHER DIED 1883 CANTON ChiNA MOTHER (Maiden name) ChEVNG HA NUI DIED 1885 HUSBAND (If none, so state) FAMILY NAME FIRST NAME BIRTHDATE CITY & COUNTRY OF BIRTH DATE OF MARRIAGE PLACE OF MARRIAGE OR (For wife, give maiden name) WIFE HUSBAND. LAU ChuEN 11-10-17 CANTON-ChiNA 9-1939 ChiHA FORMER HUSBANDS OR WIVES (If none, so state) FAMILY NAME (For wife, give maiden name) FIRST NAME BIRTHDATE DATE AND PLACE OF MARRIAGE DATE AND PLACE OF TERMINATION OF MARRIAGE NONE APPLICANT'S RESIDENCE LAST FIVE YEARS. LIST PRESENT ADDRESS FIRST. FROM TO STREET AND NUMBER CITY PROVINCE OR STATE COUNTRY MONTH YEAR MONTH YEAR 790. FAIRFIELD CIRCLE PASADENA C. A. 91106 U.S. MAY 69 PRESENT TIME APPLICANT'S LAST ADDRESS OUTSIDE THE UNITED STATES OF MORE THAN ONE YEAR. FROM TO STREET AND NUMBER CITY PROVINCE OR STATE COUNTRY MONTH YEAR MONTH YEAR FLAT A. BLOCK 6. NAM Funct SUN ChuEN QUARRY BAY HONG KONB L 1978 81 APPLICANT'S EMPLOYMENT LAST FIVE YEARS. (IF NONE, so STATE.) LIST PRESENT EMPLOYMENT FIRST. FROM TO FULL NAME AND ADDRESS OF EMPLOYER OCCUPATION (Specify) MONTH YEAR MONTH YEAR PRESENT TIME MRS. N. PASChALL 790,FAIRFIELD CIRCLE PASADENA. C. A. 91106 HOUSE KEEPER MAY 69 Show below last occupation abroad if not shown above. (Include all information requested above.) NOISE THIS FORM IS SUBMITTED IN CONNECTION WITH APPLICATION FOR: SIGNATURE OF APPLICANT OR PETITIONER DATE NATURALIZATION OTHER (SPECIFY) ADJUSTMENT OF STATUS New Chom gove 10-1-81 IF YOUR NATIVE ALPHABET IS IN OTHER THAN ROMAN LETTERS, WRITE YOUR NAME IN YOUR NATIVE ALPHABET IN THIS SPACE: Are all copies legible? Yes PENALTIES: SEVERE PENALTIES ARE PROVIDED BY LAW FOR KNOWINGLY AND WILLFULLY FALSIFYING OR CONCEALING A MATERIAL FACT. APPLICANT: BE SURE TO PUT YOUR NAME AND ALIEN REGISTRATION NUMBER IN THE BOX OUTLINED BY HEAVY BORDER BELOW. COMPLETE THIS BOX (Family name) (Given name) (Middle name) (Alien registration number) NUI ChAN LALL A-17-195429 (OTHER AGENCY USE) INS USE (Office of Origin) OFFICE CODE: TYPE OF CASE: DATE: Los CIT 400 01 IIII 1983 FORM G-325 (1) Ident."
}