{
  "anumber": "A17181791",
  "id": "A17181791_0136",
  "page_index": 136,
  "resources": {
    "full_jpg": "https://dctn4zjpwgdwdiiy5odjv7o2se0bqgjb.lambda-url.us-east-1.on.aws/iiif/3/og-2023-kc-nara_A17181791_0136/full/max/0/default.jpg"
  },
  "fields": {
    "doctype": {
      "ms_doctype_v1": "form"
    },
    "countries": {
      "ms_countries_nlp_v1": [
        "United States"
      ]
    },
    "years": {
      "ms_years_nlp_v1": [
        2023
      ]
    }
  },
  "is_g325a": false,
  "is_cert_naturalization": false,
  "full_text": "Screened by NARA, 9/21/2023 LONG DISTANCE TELEPHONE CALL REPORT DATE ACTIVITY FACILITY: AMOUNT (DO NOT FILL IN THIS BLOCK WHEN CALL IS FILE NO. FTS A HANDLED THROUGH A SERVICE SWITCH BOARD OR WHEN 5/26/70 FTS IS USED.) 200 A17181791 COMMERCIAL FROM: T.O. Paulson, (NAME) ADD-DED (OFFICE) TELEPHONE NUMBER CHARGED LOS 688-2777 TO: (NAME) (OFFICE) TELEPHONE NUMBER CALLED Mr. BARON, Aost. COMMISSIONER DEPORTATIONS, C.O. (8)202-626-136x CERTIFICATION: 1 CERTIFY THAT THIS OFFICIAL TELEPHONE CALL APPROVAL: WAS NECESSARY IN THE INTEREST OF THE GOVERNMENT. Theumon O Poulea Summer D Paulon SIGNATURE OF EMPLOYEE MAKING THE CALL. SIGNATURE OF APPROVING OFFICER. (REQUIRED ON COPY ONLY.) JUSTIFICATION: WAS THIS CALL MADE AT THE REQUEST OF THE CENTRAL OFFICE OR REGIONAL OFFICE? YES NO IF \"NO\" IS CHECKED. ENTER JUSTIFICATION. 1 B. Betty INE MAO, Pei- A17181791 SUBJECT MATTER: Budground of case jurniched Mr. Boron date at his request including rest hearing of June 1, 19 70 ORIGINAL TO CASE FILE. SUBJECT FILE OR WORK FOLDER: COPY TO FINANCE FORM G-40 (REV. 3-1-66) UNITED STATES DEPARTMENT OF JUSTICE Immigration and Naturalization Service"
}