{
  "anumber": "A17181791",
  "id": "A17181791_0004",
  "page_index": 4,
  "resources": {
    "full_jpg": "https://dctn4zjpwgdwdiiy5odjv7o2se0bqgjb.lambda-url.us-east-1.on.aws/iiif/3/og-2023-kc-nara_A17181791_0004/full/max/0/default.jpg"
  },
  "fields": {
    "sex": {
      "ms_sex_llm_v1": "female"
    },
    "doctype": {
      "ms_doctype_v1": "letter"
    },
    "form_title": {
      "ms_form_title_llm_v1": "Naturalization Certificate, Form N-550"
    },
    "countries": {
      "ms_countries_nlp_v1": [
        "China",
        "United States"
      ]
    },
    "years": {
      "ms_years_nlp_v1": [
        1914,
        1976
      ]
    },
    "certificate_naturalization": {
      "complexion": {
        "complexion_llm_v1": "medium"
      },
      "marital_status": {
        "marital_status_llm_v1": "Divorced"
      },
      "year_naturalization": {
        "year_naturalization_llm_v1": 1976
      },
      "residence_naturlization": {
        "residence_naturlization_llm_v1": "720 South San Rafael Avenue, Pasadena, California"
      }
    }
  },
  "is_g325a": false,
  "is_cert_naturalization": true,
  "full_text": "SIGNATURE OF HOLDER IS NOT REQUIRED ON THIS DUPLICATE STUB DUPLICATE DO NOT DETACH TO BE FORWARDED TO No. 10533276 IMMIGRATION AND NATURALIZATION SERVICE CERTIFIED CATE 0 Pelition No! 374025 Alien Registration Ro A17 181 791 DUPLICATE Personal description of holderas, of datesfnaturalization. Date of birth October 27, 1914 sex Female ; complexion Medium colorobeyes Brown colorofhair Gray height 5 feel 0 inches; weight 139 pounds; visible distinctive marks None Maritalstatus Divorced Country of formernationality China certify that the description, above given is true, andMhadthephotographaffived hereto is a likeness ofm Betty Peting Mae Complete and true signature of holder) UNITED STATES OF AMERICA } SS: CENTRAL DIST. OF CALIFORNIA Beit known, that at a termolthe District Court,of The United States heldpursuants to law al Los Angeles on September 17, 1976 the Court havingfoundshal *** BETTY PEI-ING MAO then residing at 720 South San Rafael Avenue, Pasadena, California inlends loreside permanently in the United. States when sorequired by the Naturalization Laws of the United. States), had in all other respects, complied with the applicable provisions of ruch naturalization laws, and was entilled to be Seal admitted socilixenship. thereupon ordered that such person be and shewas admilled as a citizen of the United States of America, Intestimony whereof thesealof the courtis hereunto, affixed this 17th day of September in the year of our Lord nineleen hundred and Seventy-six EDWARD M. KRITZMAN Clerk of the U.S. District Court. IT IS PUNISHABLE BY U. S. LAW TO COPY, PRINT OR PHOTOGRAPH THIS CERTIFICATE. By S. Clay Deputy Clerk."
}