{
  "anumber": "A17211293",
  "id": "A17211293_0006",
  "page_index": 6,
  "resources": {
    "full_jpg": "https://dctn4zjpwgdwdiiy5odjv7o2se0bqgjb.lambda-url.us-east-1.on.aws/iiif/3/og-2023-kc-nara_A17211293_0006/full/max/0/default.jpg"
  },
  "fields": {
    "sex": {
      "ms_sex_llm_v1": "female"
    },
    "doctype": {
      "ms_doctype_v1": "form"
    },
    "form_title": {
      "ms_form_title_llm_v1": "Biographic Information, FORM G-325A REV. 4-1-67"
    },
    "countries": {
      "ms_countries_nlp_v1": [
        "United States",
        "India"
      ]
    },
    "years": {
      "ms_years_nlp_v1": [
        2023,
        2001,
        1968
      ]
    },
    "g325a": {
      "occupation": {
        "occupation_llm_v1": "['n.a']"
      },
      "reason": {
        "reason_llm_v1": "NATURALIZATION"
      },
      "nationality": {
        "nationality_llm_v1": "INDIA"
      }
    }
  },
  "is_g325a": true,
  "is_cert_naturalization": false,
  "full_text": "FORM G-325 A REV. 4-1-67 Screened by NARA, 7/10/2023 TC/245 FORM APPROVED LOS 3-6-66 BUDGET BUREAU No. 43-R436 BIOGRAPHIC UNITED STATES DEPARTMENT OF JUSTICE INFORMATION Immigration and Naturalization Service A17 211 (FAMILY NAME) PANCHAL ALL OTHER NAMES USED KAMLAGEN (FIRST NAME) (MIDDLE NAME) MALE BIRTHDATE (MO-DAY-YR.) NATIONALITY ALIEN REGISTRATION NO. (IF ANY) D FEMALE 1/25/13 CITY AND COUNTRY OF BIRTH INDIA pp I-465086 SOCIAL SECURITY NO. (IF ANY) NONE 1968 BULSAR , INDIA FAMILY NAME FIRST NAME DATE, CITY AND COUNTRY OF BIRTH (IF KNOWN) CITY AND COUNTRY OF RESIDENCE FATHER MISTRI INDIA - DECEASED MOTHER (MAIDEN NAME) MISTRI GUNGA BULSAR INDIA , INDIA SPOUSE (IF NONE, so STATE) FAMILY NAME FIRST NAME BIRTHDATE CITY & COUNTRY OF BIRTH DATE OF MARRIAGE PLACE OF MARRIAGE (FOR WIFE, GIVE MAIDEN NAME) PANCHAL QAYARAM 1/16/09 BULSAR, INDIA 2/10/24 BULSAR FORMER SPOUSES (IF NONE, so STATE) NONE FAMILY NAME(FOR WIFE, GIVE MAIDEN NAME) FIRST NAME BIRTHDATE DATE & PLACE OF MARRIAGE DATE AND PLACE OF TERMINATION OF MARRIAGE APPLICANT'S RESIDENCE LAST FIVE YEARS. LIST PRESENT ADDRESS FIRST. FROM TO STREET AND NUMBER CITY PROVINCE OR STATE COUNTRY MONTH YEAR MONTH YEAR 2001 N. LINWOOD AVE SANTA ANA CALIF USA 6/26 67 PRESENT TIME 33 MAHALAKMI SOCIETY ELLIS-BRIOGE AHEMEDABAD GWARAT INDIA JUNE 55 6/26 67 LAST FOREIGN RESIDENCE OF MORE THAN ONE YEAR IF NOT SHOWN ABOVE. (INCLUDE ALL INFORMATION REQUESTED ABOVE.) APPLICANT'S EMPLOYMENT LAST FIVE YEARS. (1F NONE, so STATE) LIST PRESENT EMPLOYMENT FIRST. FROM TO FULL NAME AND ADDRESS OF EMPLOYER OCCUPATION MONTH YEAR MONTH YEAR NONE PRESENT TIME LAST OCCUPATION ABROAD IF NOT SHOWN ABOVE. (INCLUDE ALL INFORMATION REQUESTED ABOVE.) THIS FORM IS SUBMITTED IN CONNECTION WITH APPLICATION FOR: IF YOUR NATIVE ALPHABET IS IN OTHER THAN ROMAN LETTERS, WRITE YOUR NAME IN NATURALIZATION ADJUSTMENT OF STATUS YOUR NATIVE ALPHABET IN THIS SPACE: OTHER (SPECIFY): PENALTIES: SEVERE PENALTIES ARE PROVIDED BY LAW FOR KNOWINGLY AND WILLFULLY FALSIFYING 2/21/68 E4121H 4414 OR CONCEALING A MATERIAL FACT. DATE (SIGNATURE OF APPLICANT OR PETITIONER) COMPLETE THIS BOX (FAMILY NAME) (GIVEN NAME) (MIDDLE NAME) (ALIEN REGISTRATION NUMBER) PANCHAL KAMLABEN DAYARAM A17 211 295 AMERICAN CONSULATE GENE(OTHER AGENCY USE) MAR 29 1968 U.S. Consul: (INS USE)check BOMBAY 26. INDIA records and return this form to: U.S. Dept. of Justice, Immigration & Natz. Service, NO DEROGATORY INFORMATION 300 N. Los Angeles Street, A--- C 00012 APPLICANT NOT REGISTERED AT THIS OFFICE FOR IMMIGRATION B2Vimat Boutay 6/15/67 FREDERIC OHEINGCO R ppt 2465086 India Vice Consul of the United States of merica (4) Consul FORM 325A"
}