{
  "anumber": "A17200810",
  "id": "A17200810_0007",
  "page_index": 7,
  "resources": {
    "full_jpg": "https://dctn4zjpwgdwdiiy5odjv7o2se0bqgjb.lambda-url.us-east-1.on.aws/iiif/3/og-2023-kc-nara_A17200810_0007/full/max/0/default.jpg"
  },
  "fields": {
    "sex": {
      "ms_sex_llm_v1": "male"
    },
    "doctype": {
      "ms_doctype_v1": "form"
    },
    "form_title": {
      "ms_form_title_llm_v1": "APPLICATION FOR IMMIGRANT VISA AND ALIEN REGISTRATION"
    },
    "countries": {
      "ms_countries_nlp_v1": [
        "United States",
        "India"
      ]
    },
    "years": {
      "ms_years_nlp_v1": [
        1900
      ]
    }
  },
  "is_g325a": false,
  "is_cert_naturalization": false,
  "full_text": "Form Approved. (English) Budget Bureau No. 47-R150.2. (4-63) DEPARTMENT OF STATE FOREIGN SERVICE OF THE UNITED STATES OF AMERICA APPLICATION FOR IMMIGRANT VISA AND ALIEN REGISTRATION INSTRUCTIONS: This form must be filled out in DUPLICATE by typewriter, or if by hand in legible block letters. ALL questions must be answered, if applicable. Questions which are not applicable should be so marked. If there is insufficient room on the form, answer on separate sheets, in duplicate using the same numbers as appear on the form. Attach the sheets to the forms. DO NOT SIGN this form until instructed to do so by the consular officer. The fee for filing this application for an immigrant visa if $5.00. The fee should be paid in United States dollars or local currency equivalent or by bank draft, when you appear before the consular officer. WARNING: Any false statement or concealment of a material fact may result in your permanent exclusion from the United States. Even though you should be admitted to the United States, a fraudulent entry could be ground for your prosecution and/or deportation. CONSULATE GENERAL I hereby apply for an immigrant visa and alien registration at the United States at BOMBAY, INDIA and state the following facts: 1. My family name is My first name is My middle name is PATEL DAHI PARBHUBHAI 2. My full name in native alphabet (If other than Roman letters are used) is 51.2 Yaojoid YEM 3. Other names I have used or by which I have been known are (If married woman, give maiden name) aka Laxmiben PATEL DAHI NARANBHAI 4. The date of my birth is 5. My place of birth is (Day) (Month)V (Year) (City or town) (Province) (Country) 29 JUNE 1900 VAGHECH, DIST. SURAT, GUJARAT INDIA. 7. My present calling or occupation is 2 6. My age is 67 YEARS Housewife 8. My present address is PATEL STREET, VIRAVAL, TAL. NAVSARI, DIST BULSAR, GUJARAT, INDIA. 9. My sex is 10. My marital status is Single (never married) Married Widowed Divorced Separated Male Female Including my present marriage, I have been married one times. 11. My nationality is INDIAN. 12. My personal description is 13. I have the following visible marks of identification (a) Color of hair (c) Height GREY 5' 119 None feet inches (b) Color of eyes BLACK (d) Complexion FAIR 14. My purpose in going to the United States is To join son, AS AN IMMIGRANT. 15. I intend to remain in the United States permanently or (Give length of 16. I intend to enter the United States at the port of time) PERMANENTLY. LOS ANGELES. 17. I (Do) have a ticket to my final destination 18. (a) I am going to the United States to join the following person (Give name 18. (b) I am sponsored by the following person and/or organization (Give and address and relationship, if any) address if different from (a)) MR. SURENDRAKUMAR PARBHUBHAI PATEL, AS IN COLUMN 18 (A) 17302 ELSINORE CIRCLE, HUNTINGTON BEACH, CALIFORNIA, J.S.A. 19. My final address in the United States is 17302 ELSINORE CIRCLE, HUNTINGTON BEACH, CALIFORNIA, 20. My personal financial resources are NIL (a) Cash (c) Real estate (value) (b) Bank deposits (d) Other THIS FORM MAY BE OBTAINED GRATIS AT CONSULAR OFFICES OF THE UNITED STATES OF AMERICA"
}