{
  "anumber": "A17211295",
  "id": "A17211295_0016",
  "page_index": 16,
  "resources": {
    "full_jpg": "https://dctn4zjpwgdwdiiy5odjv7o2se0bqgjb.lambda-url.us-east-1.on.aws/iiif/3/og-2023-kc-nara_A17211295_0016/full/max/0/default.jpg"
  },
  "fields": {
    "sex": {
      "ms_sex_llm_v1": "male"
    },
    "doctype": {
      "ms_doctype_v1": "form"
    },
    "form_title": {
      "ms_form_title_llm_v1": "Title: UNITED STATES DEPARTMENT OF JUSTICE Immigration and Naturalization Service\\nForm Number: G-325A REV. 4-1-67"
    },
    "countries": {
      "ms_countries_nlp_v1": [
        "United States",
        "India"
      ]
    },
    "years": {
      "ms_years_nlp_v1": [
        1968,
        2023,
        1909,
        2001
      ]
    },
    "g325a": {
      "occupation": {
        "occupation_llm_v1": "['n.a']"
      },
      "reason": {
        "reason_llm_v1": "NATURALIZATION"
      },
      "nationality": {
        "nationality_llm_v1": "INDIA"
      }
    }
  },
  "is_g325a": true,
  "is_cert_naturalization": false,
  "full_text": "Screened by NARA, 7/10/2023 FORM G-325 A REV. 4-1-67 TC/245 FORM APPROVED LOS BUDGET BUREAU No. 43-R436 BIOGRAPHIC UNITED STATES DEPARTMENT OF JUSTICE 3-6-68 INFORMATION Immigration and Naturalization Service A17 211 295 (FAMILY NAME) (FIRST NAME) (MIDDLE NAME) MALE BIRTHDATE (MO-DAY-YR.) NATIONALITY ALIEN REGISTRATION NO. PANCHAL DAYARAM RANCHHODJi FEMALE MAY 16, 1909 INDIA PP (IF ANY) I 465088 ALL OTHER NAMES USED CITY AND COUNTRY OF BIRTH SOCIAL SECURITY NO. (IF ANY) COMPANONE BULSAR, INDIA MBAY, FAMILY NAME FIRST NAME DATE, CITY AND COUNTRY OF BIRTH (IF KNOWN) CITY AND COUNTRY OF RESIDENCE FAN FATHER 1968PANCHAL RANCHHODI BULSAR ,INDIA DECEASED MOTHER (MAIDEN NAME) MISTRI REVABAI BULSAR 1401A DECEASED SPOUSE (IF NONE, so STATE) FAMILY NAME FIRST NAME BIRTHDATE CITY & COUNTRY OF BIRTH DATE OF MARRIAGE PLACE OF MARRIAGE (FOR WIFE, GIVE MAIDEN NAME) 1/25/13 BULSAR, MISTRI KAMLABEN INDIA 2/10/24 BULSAR FORMER SPOUSES (IF NONE, so STATE) NONE FAMILY NAME (FOR WIFE, GIVE MAIDEN NAME) FIRST NAME BIRTHDATE DATE & PLACE OF MARRIAGE DATE AND PLACE OF TERMINATION OF MARRIAGE APPLICANT'S RESIDENCE LAST FIVE YEARS. LIST PRESENT ADDRESS FIRST. FROM TO STREET AND NUMBER CITY PROVINCE OR STATE COUNTRY MONTH YEAR MONTH YEAR 2001 N. LINWOOD AVE SANTA ANA CALIF U.S.A 6/26 67 PRESENT TIME 33 MAHALAXMI SOCIETY ELLIS BRIDGE AHEMEDAGAD GUSARAT INDIA JUNE 55 6/26 67 LAST FOREIGN RESIDENCE OF MORE THAN ONE YEAR IF NOT SHOWN ABOVE. (INCLUDE ALL INFORMATION REQUESTED ABOVE.) APPLICANT'S EMPLOYMENT LAST FIVE YEARS. (IF NONE, so STATE) LIST PRESENT EMPLOYMENT FIRST. FROM TO FULL NAME AND ADDRESS OF EMPLOYER OCCUPATION MONTH YEAR MONTH YEAR NONE PRESENT TIME LAST OCCUPATION ABROAD IF NOT SHOWN ABOVE. (INCLUDE ALL INFORMATION REQUESTED ABOVE.) THIS FORM IS SUBMITTED IN CONNECTION WITH APPLICATION FOR: IF YOUR NATIVE ALPHABET IS IN OTHER THAN ROMAN LETTERS, WRITE YOUR NAME IN NATURALIZATION ADJUSTMENT OF STATUS YOUR NATIVE ALPHABET IN THIS SPACE: OTHER (SPECIFY): PENALTIES: SEVERE PENALTIES ARE PROVIDED BY LAW FOR KNOWINGLY AND WILLFULLY FALSIFYING 2/21/68 OR CONCEALING A MATERIAL FACT. DATE / Dayaram Ranchhody (SIGNATURE OF APPLICANT OR PETITIONER) Panchel COMPLETE THIS BOX (FAMILY NAME) (GIVEN NAME) (MIDDLE NAME) (ALIEN REGISTRATION NUMBER) PANCHAL DAYARAM RANCHHODJI A17 211 295 (OTHER AGENCY USE) MAR 29 1968 AMERICAN CONSULATE GENERAL U.S. Consul: (INS Please USE). check BOMBAY 26, INDIA records and return this form to: U.S. Dept. of Justice, Immigration & Natz. Service, NO DEROGATORY INFORMATION 300, N. Los Angeles Street APPLICANT NOT REGISTER Los Angeles. C>lif annon THIS OFFICERLOR INM Vice Consul of the \\ fillery FREDERIC Rassyn R OHMINGER ppt21465888 India Baunaat Bombay 6/15/57 merica. (4) Consul FORM G-325A"
}