{
  "anumber": "A17224552",
  "id": "A17224552_0017",
  "page_index": 17,
  "resources": {
    "full_jpg": "https://dctn4zjpwgdwdiiy5odjv7o2se0bqgjb.lambda-url.us-east-1.on.aws/iiif/3/og-2023-kc-nara_A17224552_0017/full/max/0/default.jpg"
  },
  "fields": {
    "sex": {
      "ms_sex_llm_v1": "female"
    },
    "doctype": {
      "ms_doctype_v1": "form"
    },
    "form_title": {
      "ms_form_title_llm_v1": "Biographic Information, Form G-325A"
    },
    "countries": {
      "ms_countries_nlp_v1": [
        "Pakistan",
        "United States"
      ]
    },
    "years": {
      "ms_years_nlp_v1": [
        1897,
        1968,
        1929,
        2023,
        1890,
        1915
      ]
    },
    "g325a": {
      "occupation": {
        "occupation_llm_v1": "['n.a']"
      },
      "reason": {
        "reason_llm_v1": "NATURALIZATION"
      },
      "nationality": {
        "nationality_llm_v1": "PAKISTAN"
      }
    }
  },
  "is_g325a": true,
  "is_cert_naturalization": false,
  "full_text": "FORM G-325 A REV. 4-1-67 Screened by NARA, 7/10/2023 FORM APPROVED BUDGET BUREAU No. 43-R436 BIOGRAPHIC UNITED STATES DEPARTMENT OF JUSTICE LOS INFORMATION Immigration and Naturalization Service T/C 2458 (FAMILY NAME) (FIRST NAME) (MIDDLE NAME) BIRTHDATE (MO-DAY-YR.) NATIONALITY ALIEN REGISTRATION NO. MALE EXEX CHOUDHRY BIBI FEMALE 1-1-1915 PAKISTAN E17224552 (IF ANY) ALL OTHER NAMES USED CITY AND COUNTRY OF BIRTH SOCIAL SECURITY NO. (IF ANY) NONE JULLUNDUR, PAKISTAN FAMILY NAME FIRST NAME DATE, CITY AND COUNTRY OF BIRTH (IF KNOWN) CITY AND COUNTRY OF RESIDENCE FATHER CHOUDHRY ABDULLA CA 1890 JULLUNDUR, PAKISTAN MOTHER (MAIDEN NAME CHOUDHRY HAFISA CA 1897 JULLUNDUR, PAKISTAN 1070 MAR SPOUSE (IF NONE, so STATE) FAMILY NAME FIRST NAME BIRTHDATE CITY & COUNTRY OF BIRTH DATE OF MARRIAGE PLACE OF MARRIAGE (FOR WIFE, GIVE MAIDEN NAME) 7-8-07 JULLUNDUR BAHNWALPUR CHOUDHRY ASMATULLAH PAKISTAN CMAY 1929 PAKISTAN UNITED MEACHAL OF THE FORMER SPOUSES (IF NONE, so STATE) LAHORE PAKISTAN STATES OF AMERICA FAMILY NAME (FOR WIFE, GIVE MAIDEN NAME) FIRST NAME BIRTHDATE DATE & PLACE OF MARRIAGE DATE AND PLACE OF TERMINATIONALE MARRIAGE NONE APPLICANT'S RESIDENCE LAST FIVE YEARS. LIST PRESENT ADDRESS FIRST. FROM TO STREET AND NUMBER CITY PROVINCE OR STATE COUNTRY MONTH YEAR MONTH YEAR 160 Mohallah Choudhrian Bahawalpur Bahawalpur Pakistan - 54 PRESENT TIME 5376 Angeles, Cal Present LAST FOREIGN RESIDENCE OF MORE THAN ONE YEAR IF NOT SHOWN ABOVE. (INCLUDE ALL INFORMATION REQUESTED ABOVE.) APPLICANT'S EMPLOYMENT LAST FIVE YEARS. (IF NONE, so STATE) LIST PRESENT EMPLOYMENT FIRST. FROM TO FULL NAME AND ADDRESS OF EMPLOYER OCCUPATION MONTH YEAR MONTH YEAR NONE PRESENT TIME LAST OCCUPATION ABROAD IF NOT SHOWN ABOVE. (INCLUDE ALL INFORMATION REQUESTED ABOVE.) HOUSEWIFE THIS FORM IS SUBMITTED IN CONNECTION WITH APPLICATION FOR: IF YOUR NATIVE ALPHABET IS IN OTHER THAN ROMAN LETTERS, WRITE YOUR NAME IN NATURALIZATION ADJUSTMENT OF STATUS YOUR NATIVE ALPHABET IN THIS SPACE: OTHER (SPECIFY): PENALTIES: SEVERE PENALTIES ARE PROVIDED BY LAW bb FOR KNOWINGLY AND WILLFULLY FALSIFYING Feb 26.68 OR CONCEALING A MATERIAL FACT. DATE (SIGNATURE OF APPLICANT OR PETITIONER) COMPLETE THIS BOX (FAMILY NAME) (GIVEN NAME) (MIDDLE NAME) (ALIEN REGISTRATION NUMBER) CHOUDHRY BIBI a17224552 (OTHER AGENCY USE) Pl U.S. Consul: (INS USE) check records and return this form Lahore, Pakistan to: U.S. D of Justice, March 18, 1968 Immigratio the Service, 800 N. Los A gales Street, NOTHING DEROGATORY Los Angeles, Calif. 90012 NOT REGISTERED B-2 STANLEY T. ESCUDERO fahore Patienton 5-4-66 Vice Congui of the United States of America (4) Consul fakeston PPAC 168839 FORM G-325A"
}