{
  "anumber": "A17212360",
  "id": "A17212360_0022",
  "page_index": 22,
  "resources": {
    "full_jpg": "https://dctn4zjpwgdwdiiy5odjv7o2se0bqgjb.lambda-url.us-east-1.on.aws/iiif/3/og-2023-kc-nara_A17212360_0022/full/max/0/default.jpg"
  },
  "fields": {
    "sex": {
      "ms_sex_llm_v1": "female"
    },
    "doctype": {
      "ms_doctype_v1": "form"
    },
    "form_title": {
      "ms_form_title_llm_v1": "United States Department of Justice Immigration and Naturalization Service Form G-325A (, Form G-325A"
    },
    "countries": {
      "ms_countries_nlp_v1": [
        "United States"
      ]
    },
    "years": {
      "ms_years_nlp_v1": [
        1406,
        1968,
        1918,
        1952,
        1967
      ]
    },
    "g325a": {
      "occupation": {
        "occupation_llm_v1": "['n.a']"
      },
      "nationality": {
        "nationality_llm_v1": "chinese"
      }
    }
  },
  "is_g325a": true,
  "is_cert_naturalization": false,
  "full_text": "FORM G-325A (REV. 4-1-71) Form Approved UNITED STATES DEPARTMENT OF JUSTICE Budget Bureau No. 43-R436 BIOGRAPHIC Immigration and Naturalization Service INFORMATION (Family name) (First name) (Middle name) MALE BIRTHDATE (Mo.-Day-Yr.) NATIONALITY ALIEN REGISTRATION NO. WONG yuk 6-9-15 since (If any) FEMALE A17212360 ALL OTHER NAMES USED CITY AND COUNTRY OF BIRTH SOCIAL SECURITY NO. FUKINCHIMA (If any) 558-86-UN FAMILY NAME FIRST NAME DATE, CITY AND COUNTRY OF BIRTH (If known) CITY AND COUNTRY OF RESIDENCE WONG PING FU FOKINCHANA diseased FATHER MOTHER (Maiden name) so 1CHAN HUSBAND (If none, so state) FAMILY NAME FIRST NAME BIRTHDATE CITY & COUNTRY OF BIRTH DATE OF MARRIAGE PLACE OF MARRIAGE OR (For wife, give maiden name) WIFE nuw FORMER HUSBANDS OR WIVES (if none, so state) FAMILY NAME (For wife, give maiden name) FIRST NAME BIRTHDATE DATE & PLACE OF MARRIAGE DATE AND PLACE OF TERMINATION OF MARRIAGE APPLICANT'S RESIDENCE LAST FIVE YEARS. LIST PRESENT ADDRESS FIRST. FROM TO YEAR STREET AND NUMBER CITY PROVINCE OR STATE COUNTRY MONTH YEAR MONTH 1021 MURAGADRIVE hosAngeres Cahis u A. A may 1918 PRESENT TIME Show below last foreign residence of more than one year if not shown above. (Include all information requested above.) 18 hak SHAN Rd 1/F BLOCK 17 KOW LOON HONG KONG CHINE May 1952 Dec 1967 APPLICANT'S EMPLOYMENT LAST FIVE YEARS. (IF NONE, SO STATE.) LIST PRESENT EMPLOYMENT FIRST. FROM TO OCCUPATION (SPECIFY) MONTH YEAR MONTH YEAR FULL NAME AND ADDRESS OF EMPLOYER h. W. STUNSTON, POLIMORAGH DK, LOSH nigeles COOK may 1968 PRESENT TIME Show below last occupation abroad if not shown above. (Include all information requested above.) HaRRy Wic KiNG LG, 116UNION HOUSE HONGKING cook -ariah sept 1406 NOV 1967 THIS FORM IS SUBMITTED IN CONNECTION WITH APPLICATION FOR: SIGNATURE OF APPLICANT OR PETITIONER DATE NATURALIZATION ADJUSTMENT OF STATUS OTHER (SPECIFY): Waig Muk IF YOUR NATIVE ALPHABET IS IN OTHER THAN ROMAN LETTERS, WRITE YOUR NAME IN YOUR NATIVE ALPHABET IN THIS SPACE: Are all copies legible? Yes PENALTIES: SEVERE PENALTIES ARE PROVIDED BY LAW FOR KNOWINGLY AND WILLFULLY FALSIFYING OR CONCEALING A MATERIAL FACT. COMPLETE THIS BOX (Family name) (Given name) (Middle name) (Alien registration number) WONG YOK A17212360 (OTHER AGENCY USE) INS USE (Office of Origin) (3) C. FORM G-325A"
}