{
  "anumber": "A17212360",
  "id": "A17212360_0015",
  "page_index": 15,
  "resources": {
    "full_jpg": "https://dctn4zjpwgdwdiiy5odjv7o2se0bqgjb.lambda-url.us-east-1.on.aws/iiif/3/og-2023-kc-nara_A17212360_0015/full/max/0/default.jpg"
  },
  "fields": {
    "sex": {
      "ms_sex_llm_v1": "female"
    },
    "doctype": {
      "ms_doctype_v1": "letter"
    },
    "form_title": {
      "ms_form_title_llm_v1": "Certificate of Naturalization, 9564496"
    },
    "countries": {
      "ms_countries_nlp_v1": [
        "China",
        "United States"
      ]
    },
    "years": {
      "ms_years_nlp_v1": [
        1973,
        1915
      ]
    },
    "certificate_naturalization": {
      "complexion": {
        "complexion_llm_v1": "medium"
      },
      "marital_status": {
        "marital_status_llm_v1": "Single"
      },
      "year_naturalization": {
        "year_naturalization_llm_v1": 1973
      },
      "residence_naturlization": {
        "residence_naturlization_llm_v1": "1027 Moraga Dr., Los Angeles, Ca."
      }
    }
  },
  "is_g325a": false,
  "is_cert_naturalization": true,
  "full_text": "TO BE FORWARDED TO No. 9564496 IMMIGRATION AND NATURALIZATION SERVICE ORROR 0 Petition No. 343688 DUPLICATE AlienRegistration no A17 212 360 Personal,description of holder as Date of birth June 9, 1915 sex Female ; complexion Medium colorsferies Brown ;color of hair Black height 5 feel 2 inches; weight.40 pounds; None Maritalstatus Single Country of formernationality China I certify that the description, above givenis, herelois, a likeness of me yuk and wing ( Complete true signature of holder) UNITED STATES OF AMERICA } SS: CENTRAL DIST. OF CALIFORNIA Beit known, that ala termof the District Court,of The United States held pursuant, to law al Los Angeles on Occober 26, 1973 the ***YUK WONG*** them residing at 1027 Moraga Dr., Los Angeles, Ca. inlondstoresidepermanentlyin the United States when sosequired bythe naturalizeation Laws of the United. States), complied with the applicable, provisions, of such nahiralization laws, and was entitled tobe Seal admilled docilizenship thereupon ordered that such pe sombe and(s)hewas admilled as acilizen the United States of America, 26th day of October in the year of our Lord mineteen hundred and Seventy three . EDWARD M. KRITZMAN IT IS PUNISHABLE BY U.S. LAW TO COPY, Clerk of the U. S. District Court. PRINT OR PHOTOGRAPH THIS CERTIFICATE. By S.C. Tm Deputy Clerk."
}