{
  "anumber": "A17212360",
  "id": "A17212360_0021",
  "page_index": 21,
  "resources": {
    "full_jpg": "https://dctn4zjpwgdwdiiy5odjv7o2se0bqgjb.lambda-url.us-east-1.on.aws/iiif/3/og-2023-kc-nara_A17212360_0021/full/max/0/default.jpg"
  },
  "fields": {
    "sex": {
      "ms_sex_llm_v1": "female"
    },
    "doctype": {
      "ms_doctype_v1": "form"
    },
    "form_title": {
      "ms_form_title_llm_v1": "BIOGRAPHIC INFORMATION, FORM G-325A ( (REV. 4-1-71)"
    },
    "countries": {
      "ms_countries_nlp_v1": [
        "United States"
      ]
    },
    "years": {
      "ms_years_nlp_v1": [
        1966,
        1968,
        1973,
        1952,
        1967
      ]
    },
    "g325a": {
      "occupation": {
        "occupation_llm_v1": "['cook']"
      },
      "reason": {
        "reason_llm_v1": "THIS FORM IS SUBMITTED IN CONNECTION WITH APPLICATION FOR"
      },
      "nationality": {
        "nationality_llm_v1": "Chinese"
      }
    }
  },
  "is_g325a": true,
  "is_cert_naturalization": false,
  "full_text": "FORM G-325A (REV. 4-1-71) CIT - 400 Form Approved UNITED STATES DEPARTMENT OF JUSTICE MAR 14 1973 Budeet Bureau No. 43-R436 BIOGRAPHIC Immigration and Naturalization Service IFORMATION Atc sent 6-20-13 prints (date) (Family name) (First name) (Middle name) MALE BIRTHDATE (Mo.-Day-Yr.) NATIONALITY ALIEN REGISTRATION NO. IVONG YUR FEMALE 6-9-15 Chinese (If any) A17212360 ALL OTHER NAMES USED CITY AND COUNTRY OF BIRTH SOCIAL SECURITY NO. FUKIN, CHINA (If 558-83-6678 FAMILY NAME FIRST NAME DATE, CITY AND COUNTRY OF BIRTH (If known) CITY AND COUNTRY OF RESIDENCE WONG PING FU FUKIN, CHINA deceased FATHER MOTHER (Maiden name) SU CHaN \" 11 HUSBAND (If none, so state) FAMILY NAME FIRST NAME BIRTHDATE CITY & COUNTRY OF BIRTH DATE OF MARRIAGE PLACE OF MARRIAGE OR (For wife, give maiden name) WIFE none FORMER HUSBANDS OR WIVES (if none, so state) FAMILY NAME (For wife, give maiden name) FIRST NAME BIRTHDATE DATE & PLACE OF MARRIAGE DATE AND PLACE OF TERMINATION OF MARRIAGE none APPLICANT'S RESIDENCE LAST FIVE YEARS. LIST PRESENT ADDRESS FIRST. FROM TO STREET AND NUMBER CITY PROVINCE OR STATE COUNTRY MONTH YEAR MONTH YEAR 1021 MORAGADRIVE KosAngehes Cahif U.S.A. May 1968 PRESENT TIME Show below last foreign residence of more than one year if not shown above. (Include all information requested above.) 78 hak SHaN Rd , 1/F BLOCK 17, KOWLOON, HONG KONG, CHING May 1952 Dec 1967 APPLICANT'S EMPLOYMENT LAST FIVE YEARS. (IF NONE, SO STATE.) LIST PRESENT EMPLOYMENT FIRST. FROM TO FULL NAME AND ADDRESS OF EMPLOYER OCCUPATION (SPECIFY) MONTH YEAR MONTH YEAR L. W,STUNSTON, 1027 MORAGA DR, LOSAngeLes COOK may 1968 PRESENT TIME Show below last occupation abroad if not shown above. (Include all information requested above.) HaRRy WICKING & Co., 716UNION HOUSE, HONG-KONG cook-amah Sept 1966 NOV 1967 THIS FORM IS /SUBMITTED IN CONNECTION WITH APPLICATION FOR: SIGNATURE OF APPLICANT OR PETITIONER DATE NATURALIZATION ADJUSTMENT OF STATUS OTHER (SPECIFY): Wong IS IN OTHER ROMAN LETTERS, yeek WRITE YOUR NAME IF YOUR NATIVE ALPHABET THAN IN YOUR NATIVE ALPHABET IN THIS SPACE: Are all copies legible? Yes PENALTIES: SEVERE PENALTIES ARE PROVIDED BY LAW FOR KNOWINGLY AND WILLFULLY FALSIFYING OR CONCEALING A MATERIAL FACT."
}