{
  "anumber": "A18029489",
  "id": "A18029489_0050",
  "page_index": 50,
  "resources": {
    "full_jpg": "https://dctn4zjpwgdwdiiy5odjv7o2se0bqgjb.lambda-url.us-east-1.on.aws/iiif/3/og-2023-kc-nara_A18029489_0050/full/max/0/default.jpg"
  },
  "fields": {
    "sex": {
      "ms_sex_llm_v1": "male"
    },
    "doctype": {
      "ms_doctype_v1": "form"
    },
    "form_title": {
      "ms_form_title_llm_v1": "United States Department of Justice Immigration and Naturalization Service, FORM G-325 A REV. 4-1-67"
    },
    "countries": {
      "ms_countries_nlp_v1": [
        "Pakistan",
        "United States",
        "India"
      ]
    },
    "years": {
      "ms_years_nlp_v1": [
        1912,
        1908,
        1968,
        1934,
        1941,
        1969,
        1963,
        1967,
        1964,
        1939,
        1965
      ]
    },
    "g325a": {
      "occupation": {
        "occupation_llm_v1": "['engineer']"
      },
      "nationality": {
        "nationality_llm_v1": "Indian"
      }
    }
  },
  "is_g325a": true,
  "is_cert_naturalization": false,
  "full_text": "FORM G-325 A REV. 4-1-67 FORM APPROVED BUDGET BUREAU NA. 43-R436 BIOGRAPHIC UNITED STATES DEPARTMENT OF JUSTICE INFORMATION Immigration and Naturalization Service 418-059-489 (FAMILY NAME) (FIRST NAME) (MIDDLE NAME) MALE BIRTHDATE (MO-DAY-YR.) NATIONALITY ALIEN REGISTRATION NO. PAHWA VIDYA SAGAR MARCH 7,1908 (IF ANY) FEMALE INDIAN NONE ALL OTHER NAMES USED CITY AND COUNTRY OF BIRTH SOCIAL SECURITY NO. V. S. PAHWA D.G.Khan, Pakistan (IF ANY) 015-44-1049 FAMILY NAME FIRST NAME DATE, CITY AND COUNTRY OF BIRTH (IF KNOWN) CITY AND COUNTRY OF RESIDENCE FATHER Pahwa Ladharam Date not known. Shorkot, Pakistan. Not alive MOTHER (MAIDEN NAME) Pahwa Ratan Devi. Date not known. Chitorgarh India. Not alive SPOUSE ( IF NONE, so STATE) FAMILY NAME FIRST NAME BIRTHDATE CITY & COUNTRY OF BIRTH DATE OF MARRIAGE PLACE OF MARRIAGE (FOR WIFE, GIVE MAIDEN NAME) 1912 Multan Hira Hira Aug 8, Mianwali Pak May 15, 1934 Pak, FORMER SPOUSES ( IF NONE, so STATE) None FAMILY NAME (FOR WIFE, GIVE MAIDEN NAME) FIRST NAME BIRTHDATE DATE & PLACE OF MARRIAGE DATE AND PLACE OF TERMINATION OF MARRIAGE APPLICANT'S RESIDENCE LAST FIVE YEARS. LIST PRESENT ADDRESS FIRST. FROM TO STREET AND NUMBER CITY PROVINCE OR STATE COUNTRY MONTH YEAR MONTH YEAR 6, Conant Street West Concord Mass Delhi U.S.A. June 1968 PRESENT TIME 4/53 ROOpnagar Delhi India. March 1967 May 1968 Bungalow Type A Fertilizer Colony Gorakhpur U.P. India Sept 1965 Mar 1967 Shahi Building Ist Floor Cinema Street Gorakhpur U.P. India July 1964 Aug 1965 Fertilizer Colony Chembur Bombay Maharashtra India Dec 1963 June 1964 LAST FOREIGN RESIDENCE OF MORE THAN ONE YEAR IF NOT SHOWN ABOVE. (INCLUDE ALL INFORMATION REQUESTED ABOVE.) Steamer Pt Aden Aden ARABIA Aden Aden Apl 1939 Mar 1941 APPLICANT'S EMPLOYMENT LAST FIVE YEARS. (IF NONE, so STATE) LIST PRESENT EMPLOYMENT FIRST. FROM TO FULL NAME AND ADDRESS OF EMPLOYER OCCUPATION MONTH YEAR MONTH YEAR Anderson Nichols & Co Inc 150 Causeway St Boston Engineer Sept 68 PRESENT TIME Mass U,S.A. Greenleaf Associates 31 Parkway Cambridge Engineer Jul 68 Mass U.S.A. Sept 68 Fertilizer Cor of India Gorakhpur U. P India Dy Chief Eng Jul 64 Mar 67 LAST OCCUPATION ABROAD IF NOT SHOWN ABOVE. (INCLUDE ALL INFORMATION REQUESTED ABOVE.) Fertilizer Cor of India Bombay Onle Engr Pee 63 Jun 64 Air Ministry Aden C. E. Ani30 Mar THIS FORM IS SUBMITTED IN CONNECTION WITH APPLICATION FOR: IF YOUR NATIVE ALPHABET IS IN OTHER THAN ROMAN LETTERS, WRITE YOUR NAME IN INATURALIZATION ADJUSTMENT OF STATUS YOUR NATIVE ALPHABET IN THIS OTHER (SPECIFY): PENALTIES: SEVERE PENALTIES ARE PROVIDED BY LAW FOR KNOWINGLY AND WILLFULLY FALSIFYING Jan 20, 1969 OR CONCEALING A MATERIAL FACT. DATE Kudya SPACE: (SIGNATURE OF APPLICANT OR PETITIONER)"
}