{
  "anumber": "A19581639",
  "id": "A19581639_0078",
  "page_index": 78,
  "resources": {
    "full_jpg": "https://dctn4zjpwgdwdiiy5odjv7o2se0bqgjb.lambda-url.us-east-1.on.aws/iiif/3/og-2023-kc-nara_A19581639_0078/full/max/0/default.jpg"
  },
  "fields": {
    "sex": {
      "ms_sex_llm_v1": "male"
    },
    "doctype": {
      "ms_doctype_v1": "form"
    },
    "form_title": {
      "ms_form_title_llm_v1": "BIOGRAPHIC INFORMATION, A 19581-639"
    },
    "countries": {
      "ms_countries_nlp_v1": [
        "Singapore",
        "United States",
        "India"
      ]
    },
    "years": {
      "ms_years_nlp_v1": [
        1966,
        1897,
        1971,
        1970,
        1968,
        2023,
        1967
      ]
    },
    "g325a": {
      "occupation": {
        "occupation_llm_v1": "['n.a']"
      },
      "reason": {
        "reason_llm_v1": "ADJUSTMENT OF STATUS"
      },
      "nationality": {
        "nationality_llm_v1": "Indian"
      }
    }
  },
  "is_g325a": true,
  "is_cert_naturalization": false,
  "full_text": "Screened by NARA, 7/13/2023 FORM G-325 A (REV. 4-1-70) Form Approved Budget Bureau No. 43-R436 BIOGRAPHIC UNITED STATES DEPARTMENT OF JUSTICE INFORMATION Immigration and Naturalization Service A19581639 (Family name) (First name) (Middle name) MALE BIRTHDATE (Mo.-Day-Yr.) NATIONALITY ALIEN REGISTRATION NO. FEMALE 1897. INDIAN (If any) GATHA DHANKUNVAR MOHANLAL G 300 ALL OTHER NAMES USED CITY AND COUNTRY OF BIRTH SOCIAL SECURITY NO. AJAB, SAURASHTRA, INDIA. (If any) KOTAK DHANKUNVAR VANMALIDAS NIL. FAMILY NAME FIRST NAME DATE, CITY AND COUNTRY OF BIRTH (If known) CITY AND COUNTRY OF RESIDENCE FATHER KOTAK VANMALIDHS Not-known. VADAL, SAURASHTRA, INDIA MOTHER (Maiden name) KOTAK GOMATI Not- known, VADAL SAURASHTRA, INDIA SPOUSE (If none, so state) FAMILY NAME FIRST NAME BIRTHDATE CITY & COUNTRY OF BIRTH DATE OF MARRIAGE PLACE OF MARRIAGE Widow . (For wife, give maiden name) FORMER SPOUSES (If none, so state) FAMILY NAME (For wife, give maiden name) FIRST NAME BIRTHDATE DATE & PLACE OF MARRIAGE DATE AND PLACE OF TERMINATION OF MARRIAGE APPLICANT'S RESIDENCE LAST FIVE YEARS. LIST PRESENT ADDRESS FIRST. FROM TO STREET AND NUMBER CITY PROVINCE OR STATE COUNTRY MONTH YEAR MONTH YEAR 1053, REVERDY ROAD, BALTIMORE MARYLAND U.S.A. MARCH 1970 PRESENT TIME 4, FIR AVENUE, SINGAPORE SINGAPORE 1966 SEPTEMBER 1967 24, PSHPA MILAN BOMBAY-26 BOMBAY, September 1967 INDIA. JANUary 1968 4, FIR AVENUE. SINGAPORE-10 SINGAPORE January 1968 MARCH -1970 Show below last foreign residence of more than one year if not shown above. (Include all information requested above.) APPLICANT'S EMPLOYMENT LAST FIVE YEARS. (IF NONE, so STATE.) LIST PRESENT EMPLOYMENT FIRST. FROM TO FULL NAME AND ADDRESS OF EMPLOYER OCCUPATION (SPECIFY) MONTH YEAR MONTH YEAR PRESENT TIME -NIL- Show below last occupation abroad if not shown above. (Include all information requested above.) THIS FORM IS SUBMITTED IN CONNECTION WITH APPLICATION FOR: SIGNATURE OF-APPLICANT OR PETITIONER DATE NATURALIZATION ADJUSTMENT OF STATUS skyatha october 12-1971. OTHER (SPECIFY): IF YOUR NATIVE ALPHABET IS IN OTHER THAN ROMAN LETTERS, WRITE YOUR NAME IN YOUR NATIVE ALPHABET IN THIS SPACE: ARE ALL COPIES LEGIBLE? Yes 21141 2yen PENALTIES: SEVERE PENALTIES ARE PROVIDED BY LAW FOR KNOWINGLY AND WILLFULLY FALSIFYING OR CONCEALING A MATERIAL FACT."
}