{
  "anumber": "A19509771",
  "id": "A19509771_0052",
  "page_index": 52,
  "resources": {
    "full_jpg": "https://dctn4zjpwgdwdiiy5odjv7o2se0bqgjb.lambda-url.us-east-1.on.aws/iiif/3/og-2023-kc-nara_A19509771_0052/full/max/0/default.jpg"
  },
  "fields": {
    "sex": {
      "ms_sex_llm_v1": "male"
    },
    "doctype": {
      "ms_doctype_v1": "form"
    },
    "form_title": {
      "ms_form_title_llm_v1": "Title: BIOGRAPHIC INFORMATION\\nForm Number: FORM G-325A ( (REV. 4-71)"
    },
    "countries": {
      "ms_countries_nlp_v1": [
        "United States",
        "Sudan",
        "India"
      ]
    },
    "years": {
      "ms_years_nlp_v1": [
        1971,
        2023
      ]
    },
    "g325a": {
      "occupation": {
        "occupation_llm_v1": "['head master']"
      },
      "reason": {
        "reason_llm_v1": "NATURALIZATION"
      },
      "nationality": {
        "nationality_llm_v1": "Indian"
      }
    }
  },
  "is_g325a": true,
  "is_cert_naturalization": false,
  "full_text": "FORM G-325A (REV. 4-1-71) Screened by NARA, 7/13/2023 office code 0300 - NYC Form Approved UNITED STATES DEPARTMENT OF JUSTICE Budget Bureau No. 43-R436 BIOGRAPHIC Immigration and Naturalization Service ype case Sec. 245 INFORMATION 3-21-72 date (Family name) (First name) (Middle name) MALE BIRTHDATE (Mo.-Day-Yr., NATIONALITY ALIEN REGISTRATION NO. TRIVEDI Mohanlal FEMALE 11/17/06 Indian A19509771 (If\\any) ALL OTHER NAMES USED CITY AND COUNTRY OF BIRTH SOCIAL SECURITY NO. (If any) Kolithad India FAMILY NAME FIRST NAME DATE, CITY AND COUNTRY OF BIRTH (If known) CITY AND COUNTRY OF RESIDENCE FATHER TRIVEDI Prabhaji Kolithad, India Deceased MOTHER (Maiden name) BHATT Zaveer Khambhalia, India Deceased HUSBAND (If none, so state) FAMILY NAME FIRST NAME BIRTHDATE CITY & COUNTRY OF BIRTH DATE OF MARRIAGE PLACE OF MARRIAGE OR WIFE (For wife, give maiden name) Deceased FORMER HUSBANDS OR WIVES (if none, SO state) None FAMILY NAME (For wife, give maiden name) FIRST NAME BIRTHDATE DATE & PLACE OF MARRIAGE DATE AND PLACE OF TERMINATION OF MARRIAGE APPLICANT'S RESIDENCE LAST FIVE YEARS. LIST PRESENT ADDRESS FIRST. FROM TO STREET AND NUMBER CITY PROVINCE OR STATE COUNTRY MONTH YEAR MONTH YEAR 132-65 Pople Avenue Queens New York USA 12 71 PRESENT TIME 24 Dwight Street Boston Mass. USA 10 71 12 71 132-65 Pople Avenue Queens New York USA 12 70 10 71 P.O. Box 361 Omdurman Sudan 48 12 70 Show below last foreign residence of more than one year if not shown above. (Include all information requested above.) APPLICANT'S EMPLOYMENT LAST FIVE YEARS. (IF NONE, so STATE.) LIST PRESENT EMPLOYMENT FIRST. FROM TO FULL NAME AND ADDRESS OF EMPLOYER OCCUPATION (SPECIFY) MONTH YEAR MONTH YEAR Omdurman Indian School Head master 48 70 Show below last occupation abroad if not shown above. (Include all information requested above.) THIS FORM IS SUBMITTED IN CONNECTION WITH APPLICATION FOR: SIGNATURE OF APPLICANT OR PETITIONER DATE NATURALIZATION ADJUSTMENT OF STATUS 'M.P. Irinedi December 20, 1971 OTHER (SPECIFY): IF YOUR NATIVE ALPHABET IS IN OTHER THAN ROMAN LETTERS. WRITE YOUR NAME IN YOUR NATIVE ALPHABET IN THIS SPACE: Are all copies legible? Yes Highwar PENALTIES: SEVERE PENALTIES ARE PROVIDED BY LAW FOR KNOWINGLY AND WILLFULLY FALSIFYING OR CONCEALING A MATERIAL FACT:"
}