{
  "anumber": "A19509771",
  "id": "A19509771_0026",
  "page_index": 26,
  "resources": {
    "full_jpg": "https://dctn4zjpwgdwdiiy5odjv7o2se0bqgjb.lambda-url.us-east-1.on.aws/iiif/3/og-2023-kc-nara_A19509771_0026/full/max/0/default.jpg"
  },
  "fields": {
    "sex": {
      "ms_sex_llm_v1": "male"
    },
    "doctype": {
      "ms_doctype_v1": "form"
    },
    "form_title": {
      "ms_form_title_llm_v1": "MEMORANDUM OF CREATION OF RECORD OF LAWFUL PERMANENT RESIDENCE"
    },
    "countries": {
      "ms_countries_nlp_v1": [
        "United States",
        "India"
      ]
    },
    "years": {
      "ms_years_nlp_v1": [
        1972
      ]
    }
  },
  "is_g325a": false,
  "is_cert_naturalization": false,
  "full_text": "ERS UNITED JUSTICE Immigration and Naturalization Service MEMORANDUM OF CREATION OF RECORD OF LAWFUL PERMANENT RESIDENCE Place N Y c (245) File No. A19 509 771 Status as a lawful permanent resident of the United States is accorded: SEX DATE OF BIRTH Name MILLI IUS Mohanlal Trivedi Male 11/17/06 Street we PLACE OF BIRTH Address 132-65 Pople Avenue Queens New York India of 21046 City, State, Zip NATIONALITY COUNTRY TO WHICH CHARGEABLE (If any) PREFERENCE (If any) India A120 505(p) PRIORITY DATE India Z-2 (NP-1) Non Pref. 2/9/72 REMARKS CERTIFICATION the plock ou ING foll NONPREFERENCE: Section 212(a)(14) certification not required because: waver oflabor set granted by DD M100 ue Individual section 212 (a) (14) certification issued Blanket section 212(a)(14) certification issued under the following provision of law: Sec 203(h) of the I & N Act Sec 249 of the I & N Act Sec 13 of the Act of 9/11/57 Sec 214(d) I & N Act Sec 244 ( ) ) of the I & N Act Sec 1 of the Act of 11/2/66 Private Law no. of the of Congress session Sec 245 of the I & N Act Sec 2 of the Act of 11/2/66 MAY 20 1972 (Other law Specify) As of JUN 08 1972 at (Month) (Day) 1 Year) Nyc PORT OF ENTRY FOR PERMANENT RESIDENCE OUbLOIGLEUCE (5) the qate Class of admission (Insert symbol) 2-2(NP-1) (Applicable in all cases) MCE DATE OF U.1 S. APPROVED INS RECOMMENDED BY: (Immigration Officer) From (Date) ACTION ou MAY 26 1972 DD the JUN 08 1972 JUN 08 1972 DISTRICT Street marks FOR USE BY VISA CONTROL OFFICE 12 Lednile 1-181 APR 17 1972 CONTLO Date cases pe issued India OLUEL MUGLE 26LAICE Foreign State 6/9/12 Preference Category nonpreference STATISTICS DILGCTOL POLU Number 17.784 spall pe MAY ancy casea the subjicate Month of Issuance a the lapp COULLO MUSU aLout Signed (Visa Office, Dept. of State) Form L-357 delivered Form I-151 delivered Form I-151 mailed Form G-153 delivered MAR 0 w CC: Visa Control Office, Visa Office, Department of State, Washington, D.C. 20520 for allocation of Immigrant visa number. State Director, Selective Service FORM I-181 (REV. 10-1-71) N (Page 1)"
}