{
  "anumber": "A19581639",
  "id": "A19581639_0025",
  "page_index": 25,
  "resources": {
    "full_jpg": "https://dctn4zjpwgdwdiiy5odjv7o2se0bqgjb.lambda-url.us-east-1.on.aws/iiif/3/og-2023-kc-nara_A19581639_0025/full/max/0/default.jpg"
  },
  "fields": {
    "sex": {
      "ms_sex_llm_v1": "female"
    },
    "doctype": {
      "ms_doctype_v1": "form"
    },
    "form_title": {
      "ms_form_title_llm_v1": "APPLICATION FOR STATUS AS PERMANENT RESIDENT"
    },
    "countries": {
      "ms_countries_nlp_v1": [
        "United States",
        "India"
      ]
    },
    "years": {
      "ms_years_nlp_v1": [
        1897,
        1970,
        1948,
        2023,
        1924
      ]
    }
  },
  "is_g325a": false,
  "is_cert_naturalization": false,
  "full_text": "Screened by NARA, 7/13/2023 Form Approved Budget Bureau No. 43-R0400 APPLICATION FOR STATUS AS PERMANENT RESIDENT $25.00 FEE STAMP File No. 71-12 APPLICATION FORTHE BENEFITS OF SECTION: Immigrat 203(a)(7) and Sec. 245, I&N Act 245 tion Service 249 I&N Act Date 10.12.71 Is Sec. 214(d), I&N Act Sec. 13, Act of 9/11/57 by (DO NOT WRITE ABOVE THIS LINE.) (SEE INSTRUCT IONS BEFORE FILLING IN APPLICATION. IF YOU NEED MORE SPACE TO ANSWER FULLY ANY QUESTION ON THIS FORM, USE A SEPARATE SHEET AND IDENTIFY EACH ANSWER WITH THE NUMBER OF THE CORRESPONDING QUESTION. FILL IN WITH TYPEWRITER OR PRINT IN BLOCK LETTERS IN INK.) 1. I hereby apply for the status of a lawful permanent resident alien on the following basis: (Check box A, B, C, D, E or F) An immigrant visa is immediately available to me: A. As a refugee (Section 203(a)(7) and Section 245, I&N Act). B. As a former fiancee or fiance of a U.S. citizen whom I married within 90 days after my arrival in the United States, or as a child of such fiancee or fiance (Section 214(d), I&N Act). C. As a former government official, or as a member of the immediate family of such official (Section 13, Act of September 11, 1957). D. As a person to whom an immigrant visa is immediately available, other than one described above, (Section 245, I&N Act). E. As a person who has resided in the United States continuously since prior to July 1, 1924 (Section 249, I&N Act). F. As a person who has resided in the United States continuously since a date on or after July 1, 1924, but before June 30, 1948 (Section 249, I&N Act). A19 581 639 2. My name is (Last in capital letters) (First Name) (Middle Name) My alien registration number is Sex GATHA G.300 Male DHANKUNVAR MOMANLAL Female 3. I reside in the United States at: (Apt. No.) (No. and Street) (City) (State) (ZIP Code) 1053, REVERDY ROAD, BALTIMORE, MARYLAND 21212 4. Date of Birth Place of Birth (City or Town) (County, Province, or State) (Country) I am now a citizen of (Country) year 1897 AJAB SAURASHTRA, INDIA INDIA 5. I last arrived in the United States at the port of (City and State) on (Month) (Day) (Year) Kennedy Air-port,New-york March 28,1970 by (Name of vessel or other means of travel) as a (visitor, student, exchange visitor, temporary worker, fiancee, fiance, crewman, Aig-India AI-III parolee, etc.) Visitor. B-V was My nonimmigt visa was issued by the United States Consul at (City) (State) on (Month) (Day) (Year) I inspected. was not United State consul at Bombay INDIA. March 16, 1970.Â¥ 6. I am single married divorced widowed a. I have been married times, including my present marriage, if now married. (If you are now married give the following:) b. Number of times my spouse has been married C. Name of spouse d. My spouse resides with me apart from me at Address (Apt. No.) (No. & Street) (Town or City) (Province or State) (Country) 7. a. I haye NO children, as follows: (complete all columns as to each child. If child lives with you, state \"with me\" in last column; otherwise give city and state or country of child's residence. Name Sex Place of Birth Date of Birth of Now Living at RECEIVED and Net Service b. The following members of my family are also applying for permanent resident status: Baltimore GATHA SUDHA KANTICAL FOIA (b)(6) 8. I have have not heretofore filed an application for the status of a permanent resident. (If you have ever filed such application, give the date and place of filing and final disposition.) Form I-485 (Rev. 7-1-70)N UNITED STATES DEPARTMENT OF JUSTICE Immigration and Naturalization Service For Statistics (Forms G-22.2a, (Page G-23.2) Received Tr. Out Completed 10-28-71"
}