{
  "anumber": "A20181518",
  "id": "A20181518_0036",
  "page_index": 36,
  "resources": {
    "full_jpg": "https://dctn4zjpwgdwdiiy5odjv7o2se0bqgjb.lambda-url.us-east-1.on.aws/iiif/3/og-2023-kc-nara_A20181518_0036/full/max/0/default.jpg"
  },
  "fields": {
    "sex": {
      "ms_sex_llm_v1": "male"
    },
    "doctype": {
      "ms_doctype_v1": "form"
    },
    "form_title": {
      "ms_form_title_llm_v1": "MEMORANDUM OF CREATION OF RECORD OF LAWFUL PERMANENT RESIDENCE"
    },
    "countries": {
      "ms_countries_nlp_v1": [
        "Russia",
        "United States",
        "Ukraine"
      ]
    },
    "years": {
      "ms_years_nlp_v1": [
        1901,
        1905,
        1974
      ]
    }
  },
  "is_g325a": false,
  "is_cert_naturalization": false,
  "full_text": "IMPORTANT: PLEASE'READ INSTRUCTIONS ON BACK OF PAGE ONE BEFORE FILLING OUT MEMORANDUM U.S. GOVERNMENT PRINTING OFFICE: 1972-478-549 UNITED STATES DEPARTMENT OF JUSTICE Immigration and Naturalization Service MEMORANDUM OF CREATION OF RECORD OF LAWFUL PERMANENT RESIDENCE Place Miami, Florida File No. A20 181 518 Status as a lawful permanent resident of the United States is accorded: Name SEX DATE OF BIRTH Joseph Young (Yosevitz) Male Street July 4, 1901 1759 Planters Road Address PLACE OF BIRTH Jacksonville, \"1a. 33207 City, State, Zip Ukraine, Russia NATIONALITY COUNTRY TO WHICH CHARGEABLE (If any) PREFERENCE (If any) Russian PRIORITY DATE NA - NA REMARKS See exhibits Nos. 1, 3, 4, & 6 in the file NONPREFERENCE: Section 212(a)(14) certification not required because: Individual section 212(a)(14) certification issued Blanket section 212(a)(14) certification issued under the following provision of law: Sec 203(h) of the I & N Act Sec 249 of the I & N Act Sec 214(d) I & N Act Private Law no. of the Sec 244( )( ) of the I & N Act Sec 1 of the Act of 11/2/66 Congress session Sec 245 of the I & N Act Sec 13 of the Act of 9/11/57 8 C.F.R. 101. ((a) (Other law Specify) As of June 15, 1905 at Baltimore, Maryland (Month) (Day) (Year) PORT OF ENTRY FOR PERMANENT RESIDENCE Class of admission (Insert symbol) permanent resident (Applicable in all cases) DATE OF RECOMMENDED BY (Immigration Officer) Generalattorney(Nationality) fullites (Date) ACTION May 24, 1974 5/24/74 DD Robert L. Woytych DISTRICT FOR USE BY VISA CONTROL OFFICE Miami, Florida 06 Date Foreign State Preference Category Number Month of Issuance Signed No ARC to be issued-N600 adjudi cated (Visa Office, Dept. of State) him As USC. Form I-357 delivered Form I-151 delivered Form I-151 mailed Form G-153 delivered CC: Visa Control Office, Visa Office, Department of State, Washington, D.C. 20520 for allocation of Immigrant visa number. State Director, Selective Service FORM I-181 (REV. 12-1-72) Y (Page 1)"
}