{
  "anumber": "A20181518",
  "id": "A20181518_0005",
  "page_index": 5,
  "resources": {
    "full_jpg": "https://dctn4zjpwgdwdiiy5odjv7o2se0bqgjb.lambda-url.us-east-1.on.aws/iiif/3/og-2023-kc-nara_A20181518_0005/full/max/0/default.jpg"
  },
  "fields": {
    "sex": {
      "ms_sex_llm_v1": "male"
    },
    "doctype": {
      "ms_doctype_v1": "form"
    },
    "form_title": {
      "ms_form_title_llm_v1": "Application for Certificate of Citizenship, Form N-600 ( (Rev. 9–1–69)"
    },
    "countries": {
      "ms_countries_nlp_v1": [
        "Russia",
        "Germany",
        "United States",
        "Ukraine"
      ]
    },
    "years": {
      "ms_years_nlp_v1": [
        1973,
        1901,
        1905,
        1924
      ]
    }
  },
  "is_g325a": false,
  "is_cert_naturalization": false,
  "full_text": "Form approved. FEE STAMP Budget Bureau No. 43-R0105. UNITED STATES DEPARTMENT OF JUSTICE IMMIGRATION AND NATURALIZATION SERVICE IMMIGRATION & APPLICATION FOR CERTIFICATE NATURALIZATION SERVICE OF CITIZENSHIP Take or mail this application to: IMMIGRATION AND NATURALIZATION SERVICE MAK 23 9 41 AM 73 51 S. W. 1st AVE. (ROOM 1402) (Print or type) NC Date March 19, 1973 MIAMI, FLORIDA 33130 JOSEPH YOUNG nee MIAMI DISTRICT OFFICE (Name) (Maiden name, if any) 1759 PLANTERS ROAD (Apartment number, Street address, and, if appropriate, \"in care of\") ALIEN REGISTRATION JACKSONVILLE, DUVAL FLORIDA 32207 (City) (County) (State) (ZIP Code) No. A20181518 AREA CODE 904 396-0326 (Telephone Number) See Instructions on Pages 5 and 6 I hereby apply to the Commissioner of Immigration and Naturalization for a certificate showing that I am citizen of the myn United States of America. (1) I was born in UNKNOWN UKRAINE RUSSIA (State or whenE. country on JULY 4. 1901 (City) (Month) (Day) (Year) (2) My personal description is: Sex MALE ; complexion WHITE ; color of eyes BLUE ; color of hair BLACK 5 feet 9 center height Rt Cheek inches; weight 165 pounds; visible distinctive marks NONE mole Marital status: Single; Married Divorced Widow (er) (3) I arrived in the United States at ABOUT XXX%X 1905 tax UNKNOWN 1905 unc (City and State) BALTimbRE, Month (Day) (Year) under the name JOSEPH YOSEVITZ Guddmarch by means of SHIP - NAME UNKNOWN LAND (Name of ship or other means of arrival) on U.S. Passport No. unknown issued to me at OR April on 19.06 ; (Month) (Day) (Year) on an Immigrant Visa. (4) FILL IN THIS BLOCK ONLY IF YOU ARRIVED IN THE UNITED STATES BEFORE JULY 1, 1924. N (a) My last permanent foreign residence was unknown RUSSIA (City) (Country) (b) I took the ship or other conveyance to the United States at Bremen, Germany (City) (Country) (c) I was during FATHER ISADORE at CINCINNATI OHIO (Name of person in the United States) (City and State where thi3 person was living) (d) I traveled to the United States with MY MOTHER -ESTHER RIVA (Names of passengers or relatives with whom you traveled, and their relationship to you, if any) (5) Have you been out of the United States since you first arrived? Yes X No. If \"Yes\" fill in the following information for every absence. NAME OF SHIP, OR OF AIRLINE, RAILROAD COMPANY, BUS DATE DEPARTED DATE RETURNED COMPANY, OR OTHER MEANS USED To RETURN TO THE PLACE OR PORT OF ENTRY THROUGH WHICH You RETURNED TO THE UNITED STATES UNITED STATES (Not applicable 1 (6) I have not filed a declaration of intention to become a citizen of the United States or a petition for naturalization. (have) (have not) (If \"have\" give full details on a separate sheet of paper this size and attach it, showing question number.) TO THE APPLICANT.-Do not write between the double lines below. Continue on next page. ARRIVAL RECORDS EXAMINED ARRIVAL RECORD FOUND Card index Place Date Index books Name Manifests Manner Marital status Age (Signature of person making search) Form N-600 (Rev. 9-1-69) (1)"
}