{
  "anumber": "A20258691",
  "id": "A20258691_0049",
  "page_index": 49,
  "resources": {
    "full_jpg": "https://dctn4zjpwgdwdiiy5odjv7o2se0bqgjb.lambda-url.us-east-1.on.aws/iiif/3/og-2023-kc-nara_A20258691_0049/full/max/0/default.jpg"
  },
  "fields": {
    "sex": {
      "ms_sex_llm_v1": "male"
    },
    "doctype": {
      "ms_doctype_v1": "form"
    },
    "form_title": {
      "ms_form_title_llm_v1": "Biographic Information, G-325A ( (REV. 8-27-72N)"
    },
    "countries": {
      "ms_countries_nlp_v1": [
        "Taiwan",
        "China",
        "United States"
      ]
    },
    "years": {
      "ms_years_nlp_v1": [
        1910,
        1968,
        1935,
        1973,
        2023
      ]
    },
    "g325a": {
      "occupation": {
        "occupation_llm_v1": "['n.a']"
      },
      "reason": {
        "reason_llm_v1": "NATURALIZATION"
      },
      "nationality": {
        "nationality_llm_v1": "China"
      }
    }
  },
  "is_g325a": true,
  "is_cert_naturalization": false,
  "full_text": "FORM G-325A (REV. 8-27-72)N Screened by NARA, 9/21/2023 Form Approved UNITED STATES DEPARTMENT OF JUSTICE OMB No. 43-R436 Immigration and Naturalization Service BIOGRAPHIC INFORMATION (Family name) (First name) (Middle name) MALE BIRTHDATE(Mo.-Day-Yr.) NATIONALITY ALIEN REGISTRATION NO. LEANG YUE TSI FEMALE APRIL 4, 1910 CHINA ALL OTHER NAMES USED (Including names by previous marriages) CITY AND COUNTRY OF BIRTH SOCIAL SECURITY NO. KWANG TUNG, CHINA (If any) FAMILY NAME FIRST NAME DATE, CITY AND COUNTRY OF BIRTH(If known) CITY AND COUNTRY OF RESIDENCE LEANG DEAD FATHER MOTHER (Maiden name) LIANG Ho TCHEN DEAD HUSBAND (If none, so state) FAMILY NAME FIRST NAME BIRTHDATE CITY & COUNTRY OF BIRTH DATE OF MARRIAGE PLACE OF MARRIAGE OR (For wife, give maiden name) WIFE LEANG PEI KING MOK NOV. 12,1910 KWANG TUNG JUNE, 1935 SHANG HAI FORMER HUSBANDS OR WIVES(if none, so state) NONE FAMILY NAME (For wife, give maiden name) FIRST NAME BIRTHDATE DATE & PLACE OF MARRIAGE DATE AND PLACE OF TERMINATION OF MARRIAGE APPLICANT'S RESIDENCE LAST FIVE YEARS. LIST PRESENT ADDRESS FIRST. FROM TO STREET AND NUMBER CITY PROVINCE OR STATE COUNTRY MONTH YEAR MONTH YEAR 2210, GREENFIELD , WICHITA KANSAS U.S.A. 3 1973 PRESENT TIME NO2-3 ALLEY 6, LANE 123, SECTION TAIPE TAIWAN CHINA 6 1968 3 1973 5, NANKING E. RD. APPLICANT'S LAST ADDRESS OUTSIDE THE UNITED STATES OF MORE THAN ONE YEAR FROM TO STREET AND NUMBER CITY PROVINCE OR STATE COUNTRY MONTH YEAR MONTH YEAR N023 ALLEY6, LANE-123, NANKING RD TAIPEI TAIWAN CHINA 6 1968 3 1973 APPLICANT'S EMPLOYMENT LAST FIVE YEARS. (IF NONE, so STATE.) LIST PRESENT EMPLOYMENT FIRST. FROM TO FULL NAME AND ADDRESS OF EMPLOYER OCCUPATION (SPECIFY) MONTH YEAR MONTH YEAR PRESENT TIME Show below last occupation abroad if not shown above. (Include all information requested above.) THIS FORM IS SUBMITTED IN CONNECTION WITH APPLICATION FOR: SIGNATURE OF APPLICANT OR PETITIONER DATE NATURALIZATION ADJUSTMENT OF STATUS APPLICATION FOR STATUS OTHER (SPECIFY): AS R. IF THAN ROMAN YOUR NAME IN YOUR YOUR Yue NATIVE ALPHABET IS Zosi IN OTHER Leang LETTERS. WRITE 2, NATIVE AUG, ALPHABET IN 1973 THIS SPACE: Are all copies legible? Yes Step PENALTIES : SEVERE PENALTIES ARE PROVIDED BY LAW FOR KNOWINGLY AND WILLFULLY FALSIFYING OR CONCEALING A MATERIAL FACT."
}