{
  "anumber": "A20211280",
  "id": "A20211280_0061",
  "page_index": 61,
  "resources": {
    "full_jpg": "https://dctn4zjpwgdwdiiy5odjv7o2se0bqgjb.lambda-url.us-east-1.on.aws/iiif/3/og-2023-kc-nara_A20211280_0061/full/max/0/default.jpg"
  },
  "fields": {
    "sex": {
      "ms_sex_llm_v1": "female"
    },
    "doctype": {
      "ms_doctype_v1": "form"
    },
    "form_title": {
      "ms_form_title_llm_v1": "Biographic Information"
    },
    "countries": {
      "ms_countries_nlp_v1": [
        "Taiwan",
        "China",
        "United States"
      ]
    },
    "years": {
      "ms_years_nlp_v1": [
        1919,
        1984,
        1982,
        1972,
        1938,
        1974,
        2023,
        1913,
        1976,
        1978
      ]
    },
    "g325a": {
      "occupation": {
        "occupation_llm_v1": "['n.a']"
      },
      "reason": {
        "reason_llm_v1": "NATURALIZATION"
      },
      "nationality": {
        "nationality_llm_v1": "China"
      }
    }
  },
  "is_g325a": true,
  "is_cert_naturalization": false,
  "full_text": "FORM G-325 (REV. 5-1-79)Y Screened by NARA, 7/24/2023 BIOGRAPHIC UNITED STATES DEPARTMENT OF JUSTICE Form Approved INFORMATION OMB No. 43-R436 Immigration and Naturalization Service (Family name) (First name) (Middle name) MALE BIRTHDATE (Mo.-Day-Yr.) NATIONALITY FILE NUMBER Cheng, Ching-Hsing FEMALE Mar. 12 1913 China A-20211280 ALL OTHER NAMES USED (Including names by previous marriages) CITY AND COUNTRY OF BIRTH SOCIAL SECURITY NO. (If any) China 556-33-5013 FAMILY NAME FIRST NAME DATE, CITY AND COUNTRY OF BIRTH (If known) CITY AND COUNTRY OF RESIDENCE FATHER Cheng, Ching-I MOTHER (Maiden name) Cheng-Chung , I HUSBAND (If none, SO state) FAMILY NAME FIRST NAME BIRTHDATE CITY & COUNTRY OF BIRTH DATE OF MARRIAGE PLACE OF MARRIAGE OR (For wife. give maiden name) WIFE Cheng, Hsu Tsui-Ling Hsu 12-20-1919 China 9-3-1938 China FORMER HUSBANDS OR WIVES (If none. so state) FAMILY NAME (For wife. give maiden name) FIRST NAME BIRTHDATE DATE AND PLACE OF MARRIAGE DATE AND PLACE OF TERMINATION OF MARRIAGE Msn 12-20-1919 9-3-1938chin APPLICANT'S RESIDENCE LAST FIVE YEARS. LIST PRESENT ADDRESS FIRST. FROM TO STREET AND NUMBER CITY PROVINCE OR STATE COUNTRY MONTH YEAR MONTH YEAR 27230 La Prada Way Sun City va. U.S.A. 8 1978 PRESENT TIME 9139 Admity ave. Riverside Ca. U.S.A. 7 1976 8 1978 APPLICANT'S LAST ADDRESS OUTSIDE THE UNITED STATES OF MORE THAN ONE YEAR. FROM TO STREET AND NUMBER CITY PROVINCE OR STATE COUNTRY MONTH YEAR MONTH YEAR NO, 129 5th Floor wendioust. Taipli Taiwan China 7 1972 8 1974 APPLICANT'S EMPLOYMENT LAST FIVE YEARS. (IF NONE, SO STATE.) LIST PRESENT EMPLOYMENT FIRST. FROM TO FULL NAME AND ADDRESS OF EMPLOYER OCCUPATION (Specify) MONTH YEAR MONTH YEAR PRESENT TIME Show below last occupation abroad if not shown above. (Include all information requested above.) THIS FORM IS SUBMITTED IN CONNECTION WITH APPLICATION FOR: SIGNATURE OF APPLICANT DATE NATURALIZATION OTHER (SPECIFY) STATUS AS PERMANENT RESIDENT Cheug Ching Asing 6-29-1982 IF YOUR NATIVE ALPHABET IS IN OTHER THAN ROMAN LETTERS, WRITE YOUR NAME IN YOUR NATIVE ALPHABET IN THIS SPACE: Are all copies legible? Yes PENALTIES: SEVERE PENALTIES ARE PROVIDED BY LAW FOR KNOWINGLY AND WILLFULLY FALSIFYING OR CONCEALING MATERIAL FACT. APPLICANT: BE SURE TO PUT YOUR NAME AND ALIEN REGISTRATION NUMBER IN THE BOX OUTLINED BY HEAVY BORDER BELOW. COMPLETE THIS BOX (Family name) (Given name) (Middle name) (Alien registration number) Cheng, Ching-Hsing A 20 211 280 (OTHER AGENCY USE) INS USE (Office of Origin) OFFICE CODE: TYPE OF CASE: DATE: LOS CIT 10 400 JAN 09 1984 (date) FORM G-325 [1] Ident."
}