{
  "anumber": "A20216306",
  "id": "A20216306_0032",
  "page_index": 32,
  "resources": {
    "full_jpg": "https://dctn4zjpwgdwdiiy5odjv7o2se0bqgjb.lambda-url.us-east-1.on.aws/iiif/3/og-2023-kc-nara_A20216306_0032/full/max/0/default.jpg"
  },
  "fields": {
    "sex": {
      "ms_sex_llm_v1": "male"
    },
    "doctype": {
      "ms_doctype_v1": "form"
    },
    "form_title": {
      "ms_form_title_llm_v1": "BIOGRAPHIC INFORMATION, G-325A ( (REV.10-1-74) Y"
    },
    "countries": {
      "ms_countries_nlp_v1": [
        "Pakistan",
        "United States"
      ]
    },
    "years": {
      "ms_years_nlp_v1": [
        1969,
        2023,
        1906,
        1958
      ]
    },
    "g325a": {
      "occupation": {
        "occupation_llm_v1": "['missionary']"
      },
      "reason": {
        "reason_llm_v1": "NATURALIZATION"
      },
      "nationality": {
        "nationality_llm_v1": "Pakistan"
      }
    }
  },
  "is_g325a": true,
  "is_cert_naturalization": false,
  "full_text": "Screened by NARA, 7/18/2023 FORM G-325A (REV. 10-1-74) Y Form Approved UNITED STATES DEPARTMENT OF JUSTICE OMB No. 43-R436 Immigration and Naturalization Service BIOGRAPHIC INFORMATION (Family name) (First name) (Middle name) MALE BIRTHDATE(Mo.-Day-Yr.) NATIONALITY ALIEN REGISTRATION NO. SHAH HAJI ISLAM FEMALE 5-26-1906 PAKISTAN 1220216306 ALL OTHER NAMES USED (Including names by previous marriages) CITY AND COUNTRY OF BIRTH SOCIAL SECURITY NO. MARDAN PAKISTAN (If any) NONE FAMILY NAME FIRST NAME DATE, CITY AND COUNTRY OF BIRTH(If known) CITY AND COUNTRY OF RESIDENCE FATHER SHAH ABDUL MOHD, HAJI ISLAM 6-26-1880 MARDAN PAKISTAN MOTHER (Maiden name) ZULAIKHA BIBI SHAH 6-4-1881 MARDAN PAKISTAN HUSBAND (If none, so state) FAMILY NAME FIRST NAME BIRTHDATE CITY & COUNTRY OF BIRTH DATE OF MARRIAGE PLACE OF MARRIAGE OR (For wife, give maiden name) WIFE FORMER HUSBANDS OR WIVES(if none, so state) FAMILY NAME (For wife, give maiden name) FIRST NAME BIRTHDATE DATE & PLACE OF MARRIAGE DATE AND PLACE OF TERMINATION OF MARRIAGE HUSSEINA BEGUM SHAH HUSSEINA 4-21-9909 MARDAN PAK. APPLICANT'S RESIDENCE LAST FIVE YEARS. LIST PRESENT ADDRESS FIRST. FROM TO STREET AND NUMBER CITY PROVINCE OR STATE COUNTRY MONTH YEAR MONTH YEAR 1655 W. 44 PI, Apt. 336 HIALEAH F/A. USA PRESENT TIME 91-ALY ABAD Ki KARACHi38 SIND PAKISTAN oct 1969 - E-111 KARIM ABAD 1/ \" 11 NOV. 1958 oct 1969 GARI KAPOORA MARDAN NWFP 11 MAY 1906 NOV 1958 APPLICANT'S LAST ADDRESS OUTSIDE THE UNITED STATES OF MORE THAN ONE YEAR FROM TO STREET AND NUMBER CITY PROVINCE OR STATE COUNTRY MONTH YEAR MONTH YEAR 91-ALYABAD Karach 38 Karach SIND PAKISTAN OCT. 1969 - - APPLICANT'S EM PLOYMENT LAST FIVE YEARS. (IF NONE, so STATE.) LIST PRESENT EMPLOYMENT FIRST. FROM TO FULL NAME AND ADDRESS OF EMPLOYER OCCUPATION (SPECIFY) MONTH YEAR MONTH YEAR NONE PRESENT TIME Show below last occupation abroad if not shown above. (Include all information requested above.) MISSIONARY THIS FORM IS SUBMITTED IN CONNECTION WITH APPLICATION FOR: SIGNATURE OF APPLICANT OR PETITIONER DATE NATURALIZATION ADJUSTMENT OF STATUS A.Shah 10-7-75 OTHER (SPECIFY): IF YOUR NATIVE ALPHABET IS IN OTHER THAN ROMAN LETTERS. WRITE YOUR NAME IN YOUR NATIVE ALPHABET IN THIS SPACE: Are all copies legible? Yes Oli out feel PENALTIES: SEVERE PENALTIES ARE PROVIDED BY LAW FOR KNOWINGLY AND WILLFULLY PALSIFYING OR CONCEALING A MATERIAL FACT."
}