{
  "anumber": "A20211280",
  "id": "A20211280_0032",
  "page_index": 32,
  "resources": {
    "full_jpg": "https://dctn4zjpwgdwdiiy5odjv7o2se0bqgjb.lambda-url.us-east-1.on.aws/iiif/3/og-2023-kc-nara_A20211280_0032/full/max/0/default.jpg"
  },
  "fields": {
    "sex": {
      "ms_sex_llm_v1": "male"
    },
    "doctype": {
      "ms_doctype_v1": "form"
    },
    "form_title": {
      "ms_form_title_llm_v1": "BIOGRAPHIC INFORMATION, G-325A ( (REV. 8-27-72N)"
    },
    "countries": {
      "ms_countries_nlp_v1": [
        "Taiwan",
        "China",
        "United States"
      ]
    },
    "years": {
      "ms_years_nlp_v1": [
        1919,
        2023,
        1938
      ]
    },
    "g325a": {
      "occupation": {
        "occupation_llm_v1": "['maintenance officer']"
      },
      "reason": {
        "reason_llm_v1": "NATURALIZATION"
      },
      "nationality": {
        "nationality_llm_v1": "Chinese"
      }
    }
  },
  "is_g325a": true,
  "is_cert_naturalization": false,
  "full_text": "Screened by NARA, 7/24/2023 Form Approved FORM G-325A (REV. 8-27-72)N UNITED STATES DEPARTMENT OF JUSTICE Los OMB No. 43-R436 Immigration and Naturalization Service DIEXM24 BIOGRAPHIC INFORMATION 12/15/76 (Family name) (First name) (Middle name) MALE BIRTHDATE (Mo.-Day-Yr.) NATIONALITY ALIEN REGISTRATION NO. Chinese (If CHENG, Ching-Hsing FEMALEMar. 12,1913 A20,211,280 CITY AND COUNTRY OF BIRTH SOCIAL SECURITY NO. ALL OTHER NAMES USED (Including names by previous marriages) \"Jonathan\" CHIN-HSING CHENG Peiping City, China (If any) FAMILY NAME FIRST NAME DATE, CITY AND COUNTRY OF BIRTH(I known) CITY AND COUNTRY OF RESIDENCE FATHER CHENG, Ching-i Peiping, China Deceased MOTHER (Maiden name) CHENG-CHUNG, I Peiping, China Deceased HUSBAND (If none, so state) FAMILY NAME FIRST NAME BIRTHDATE CITY & COUNTRY OF BIRTH DATE OF MARRIAGE PLACE OF MARRIAGE OR (For wife, give maiden name) WIFE Dec. 20, Peiping, CHENG, Tsui-Ling (nee) HSU 1919 China Sept. 3, 1938 China FORMER HUSBANDS OR WIVES(if none,so state) FAMILY NAME (For wife, give maiden name) FIRST NAME BIRTHDATE DATE & PLACE OF MARRIAGE DATE AND PLACE OF TERMINATION OF MARRIAGE None APPLICANT'S RESIDENCE LAST FIVE YEARS LIST PRESENT ADDRESS FIRST. FROM TO CITY PROVINCE OR STATE COUNTRY MONTH YEAR MONTH YEAR STREET AND NUMBER 9855 Fox St. Riverside California USA Dec. 74 PRESENT TIME 3940 Dawes St. #6 Riverside, California USA Aug. 74 Dec. 74 129-5 Wenchow St. Taipei, Taiwan R.O.C. Nov. 73 Aug. 74 4-3, A8, L133, Nanking E. Rd., 4th Section Taipei Taiwan R.O.C. Jan. 72 Nov. 73 127-6 Wenchow St. Taipei Taiwan R.O.C. 53 Dec. 71 APPLICANT'S LAST ADDRESS OUTSIDE THE UNITED STATES OF MORE THAN ONE YEAR FROM TO CITY PROVINCE OR STATE COUNTRY MONTH YEAR MONTH YEAR STREET AND NUMBER #4-3, Alley 8, Lane 133, Nanking E. Rd. Sec. 4, Taipei, Taiwan Jan. 72 July 74 APPLICANT'S EMPLOYMENT LAST FIVE YEARS (IF NONE, so STATE.) LIST PRESENT EMPLOYMENT FIRST FROM TO OCCUPATION (SPECIFY) MONTH YEAR MONTH YEAR FULL NAME AND ADDRESS OF EMPLOYER United States Army Technical Group, Taiwan (Transpo Div) PRESENT TIME Maintenance Officer July 65 July 74 Show below last occupation abroad if not shown above. (Include all information requested above.) THIS FORM IS SUBMITTED IN CONNECTION WITH APPLICATION FOR: SIGNATURE OF APPLICANT OR PETITIONER DATE 3/14/75 INATURALIZATION ADJUSTMENT OF STATUS OTHER (SPECIFY): Chaug Chinghing IF YOUR NATIVE ALPHABET is IN OTHER THAN ROMAN LETTERS. WRITE YOUR NAME IN YOUR NATIVE ALPHABET IN THIS SPACE: Are all copies legible? Yes the of th N/A PENALTIES SEVERE PENALTIES ARE PROVIDED BY LAW FOR KNOWINGLY AND WILLFULLY FALSIFYING OR CONCEALING A MATERIAL FACT"
}