{
  "anumber": "A20337856",
  "id": "A20337856_0018",
  "page_index": 18,
  "resources": {
    "full_jpg": "https://dctn4zjpwgdwdiiy5odjv7o2se0bqgjb.lambda-url.us-east-1.on.aws/iiif/3/og-2023-kc-nara_A20337856_0018/full/max/0/default.jpg"
  },
  "fields": {
    "sex": {
      "ms_sex_llm_v1": "female"
    },
    "doctype": {
      "ms_doctype_v1": "form"
    },
    "form_title": {
      "ms_form_title_llm_v1": "BIOGRAPHIC INFORMATION, G-325A ( (REV. 10-1-74) Y"
    },
    "countries": {
      "ms_countries_nlp_v1": [
        "Pakistan",
        "United States",
        "India"
      ]
    },
    "years": {
      "ms_years_nlp_v1": [
        1907,
        1901,
        2023
      ]
    },
    "g325a": {
      "occupation": {
        "occupation_llm_v1": "['n/a']"
      },
      "nationality": {
        "nationality_llm_v1": "Indian"
      }
    }
  },
  "is_g325a": true,
  "is_cert_naturalization": false,
  "full_text": "Screened by NARA, 7/18/2023 FORM G-325A (REV. 10-1-74) Y Form Approved UNITED STATES DEPARTMENT OF JUSTICE OMB No. 43-R436 Immigration and Naturalization Service BIOGRAPHIC INFORMATION (Family name) (First name) (Middle name) MALE BIRTHDATE(Mo.-Day-Yr.) NATIONALITY ALIEN REGISTRATION NO. ADVANI RUKMANI DEVI FEMALE 1-15-1907 INDIAN (If any) ALL OTHER NAMES USED (Including names by previous marriages) CITY AND COUNTRY OF BIRTH now in SOCIAL SECURITY NO. N/A HYDERABAD (SIND) PAKISTAN (If any) None FAMILY NAME FIRST NAME DATE, CITY AND COUNTRY OF BIRTH(If known) CITY AND COUNTRY OF RESIDENCE FATHER MIRCHANDAN : KHANCHAND unknown HYDERABAD (SIND) nowdeceased MOTHER (Maiden name) HATHIRAMANI : BULL BAI unknown HYDERABAN (SIND) now deceased HUSBAND (If none, so state) FAMILY NAME FIRST NAME BIRTHDATE CITY & COUNTRY OF BIRTH DATE OF MARRIAGE PLACE OF OR (For wife, give maiden name) WIFE ADVANI TECKCHAND 9-12-1901 L HYDERABAD (SIND) HYDE RABAO(SIND) FORMER HUSBANDS OR WIVES(if none, so state) FAMILY NAME (For wife, give maiden name) FIRST NAME BIRTHDATE DATE & PLACE OF MARRIAGE DATE AND PLACE OF TERMINATION OF MARRIAGE None APPLICANT'S RESIDENCE LAST FIVE YEARS. LIST PRESENT ADDRESS FIRST. FROM TO 1218 SSTREET AND NUMBER HEW WAY Los CITOS PROVINCE OR STATE COUNTRY 9-9.16 MONTH YEAR MONTH YEAR U.S A PRESENT 870 ELMIRA DRIVE SUNNYVALE CALIFORNIA U.S.A 5 75 PRESENT TIME 16, SUNDER NAGAR MARKET NEW DELHI # INDIA 12 72 5 75 870 ELMIRA DRIVE SUNNYVALE CALIFORNIA U-S-A 6 71 12 72 43, HANUMAN ROAD NEW DELHI INDIA 11 41 6 71 APPLICANT'S LAST ADDRESS OUTSIDE THE UNITED STATES OF MORE THAN ONE YEAR FROM TO STREET AND NUMBER CITY PROVINCE OR STATE COUNTRY MONTH YEAR MONTH YEAR 6, SUNDER NAGAR MARKET NEW DELHI INDIA 12 72 5 75 APPLICANT'S EMPLOYMENT LAST FIVE YEARS. (IF NONE, so STATE.) LIST PRESENT EMPLOYMENT FIRST. FROM TO FULL NAME AND ADDRESS OF EMPLOYER OCCUPATION (SPECIFY) MONTH YEAR MONTH YEAR NONE PRESENT TIME Show below last occupation abroad if not shown above. (Include all information requested above.) THIS FORM IS SUBMITTED IN CONNECTION WITH APPLICATION FOR: SIGNATURE OF APPLICANT OR PETITIONER DATE INATURALIZATION ADJUSTMENT OF STATUS (59.2505 OTHER (SPECIFY): 10.5.76 IF YOUR NATIVE ALPHABET IS IN OTHER THAN ROMAN LETTERS. WRITE YOUR NAME IN YOUR NATIVE ALPHABET IN THIS SPACE: Are all copies legible? Yes (593) PENALTIES: SEVERE PENALTIES ARE PROVIDED BY LAW FOR KNOWINGLY AND WILLFULLY FALSIFYING OR CONCEALING A MATERIAL FACT."
}