{
  "anumber": "A20337856",
  "id": "A20337856_0015",
  "page_index": 15,
  "resources": {
    "full_jpg": "https://dctn4zjpwgdwdiiy5odjv7o2se0bqgjb.lambda-url.us-east-1.on.aws/iiif/3/og-2023-kc-nara_A20337856_0015/full/max/0/default.jpg"
  },
  "fields": {
    "sex": {
      "ms_sex_llm_v1": "female"
    },
    "doctype": {
      "ms_doctype_v1": "form"
    },
    "form_title": {
      "ms_form_title_llm_v1": "APPLICATION FOR STATUS AS PERMANENT RESIDENT"
    },
    "countries": {
      "ms_countries_nlp_v1": [
        "Pakistan",
        "United States",
        "India"
      ]
    },
    "years": {
      "ms_years_nlp_v1": [
        1975,
        2620,
        1948,
        2023,
        1924
      ]
    }
  },
  "is_g325a": false,
  "is_cert_naturalization": false,
  "full_text": "Screened by NARA, 7/18/2023 UNITED STATES DEPARTMENT OF JUSTICE : 1974-561-638 Immigration and Naturalization Service compat APPLICATION FOR STATUS AS PERMANENT RESIDENT Form Approved O.M.B. No. 43-R0400 FEE STAMP File No. in APPLICATION FOR THE BENEFITS OF SECTION: Sec. 203(a)(7) and Sec. 245, I&N Act Sec. 245, I&N Act Sec. 214(d), I&N Act Sec. 249, I&N Act Sec. 13, Act of 9/11/57 5 (DO NOT WRITE ABOVE THIS LINE.) (SEE INSTRUCTIONS BEFORE FILLING IN APPLICATION. IF YOU NEED MORE SPACE TO ANSWER FULLY ANY QUESTION ON THIS FORM, USE A SEPARATE SHEET AND IDENTIFY EACH ANSWER WITH THE NUMBER OF THE CORRESPONDING QUESTION. FILL IN WITH TYPEWRITER OR PRINT IN BLOCK LETTERS IN INK.) 1. I hereby apply for the status of a lawful permanent resident alien on the following basis: (Check box A. B. C. D. E. or F) A. As a refugee to whom an immigrant visa is immediately available (Section 203(a)(7) and Section 245, I&N Act). B. As a person who entered the U.S. with a visa issued to me as the fiancee or fiance of a U.S. citizen whom I married within 90 days after my entry, or as a child of such fiancee or fiance (Sec. 214(d), I&N Act). C. As a former government official, or as a member of the immediate family of such official (Section 13, Act of September 11, 1957) D. As a person to whom an immigrant visa is immediately available, other than one described above (Section 245, I&N Act). E. As a person who has resided in the United States continuously since prior to July 1, 1924 (Section 249, I&N Act). F. As a person who has resided in the United States continuously since a date on or after July 1, 1924, but before June 30, 1948 (Section 249, I&N Act). 2. My name is (Last in capital letters) (First Name) (Middle Name) sexi A1 sid 10/29/2620 ADVANI RUKMANI DEVI Male Female 4. I reside in the United States at: (c/o) (No. and Street) (Apt. No.) (City) (State) (ZIP Code) 5. Have you ever applied before for permanent resident 218 ST MATT WAY, 94022 870. ELMIRA DRIVE SUNNYVALE CA 94087 status in the U.S.? Yes No 6. My alien registration number 7. I am a citizen of (Country) 8 Date of Birth (If \"Yes\", give the date and place of filing and FA20337856 INDIA final disposition.) 1-15-1907 9. Place of Birth (City or Town) (County, Province, or State) (Country) HYDERABAD (SIND) Now in PAKISTAN 10. Name as appears on nonimmigrant document (Form I-94) 3 RUKMA ADUANI DEVIA I last arrived in the United States at the port of (City and State) on (Month) (Day) (Year) by (Name of vessel or other means of travel) NEW YORK NY 15-18-75 LH-494 as a (visitor, student, crewman, parolee, etc.) my I-94 permit number is VISITOR 370 60 I was was not inspected. 00 11. My nonimmigrant visa, number 002627 was issued by the on (Month) (Day) (Year) 12. I am GMAY14,1975 single married United States Consul at (City)(Country) NEW DELHI - INDIA divorced widowed 13. I have been married times, including my present marriage, if now married. (If you are now married give the following:) a. Number of times my husband or wife has been married b. Name of husband or wife (Wife give maiden name) N/A N/A DECEASED c. My husband or wife resides with me apart from me at Address (Apt. o.)(No. & Street)(Town or City)(Province or State)(Country) N/A 14. a. I have 5 sons or daughters as follows: (Complete all columns as to each son or daughter: if living with you state \"with me\" in last column; otherwise give city and state or country of son's or daughter's residence). aelmarried Omanicita T. Name ADVANI Sex Place of Birth Date of Birth Now living at m HYDERABAD (SIND) 5-29-25 6. Sunder Nagar Mkr. New Decin-India MOHAN T. ADVANI M HYDERABAD (SIND) 5-3-34 5,ORCHARD WAY N. ROCKVILLE, Md. GULU T. ADUAN M HYDERABAD (SIND) 2-22-36 810 ELMIRA DR. SUNNYUALE CA PREMU G. ADVANI F LAHORE now Pakisran) in 7-12-38 6221 W.ESTER Pc. BROWN DEER his MEENAKSHI T. ADVANI F NEW DELHI_ (NIDA 8-28-44 870, ELMIRA DR. SUNNYOALE CA b. The following members of my family are also applying for permanent resident status: Q N/A none 15. Flist below all organizations, societies, clubs, and associations, past or present, in which I have held membership in the United States or a foreign country, and the periods and places of such membership. (If you have never been a member of any organization, state \"None\".) None UNITED STATES DEPARTMENT OF JUSTICE RECEIVED TRANS. IN RET'D-TRANS. Immigration and Naturalization Service OUT COMPLETED Form I-485 (Rev. 5-1-74) Y (Page 1)"
}