{
  "anumber": "A20550522",
  "id": "A20550522_0161",
  "page_index": 161,
  "resources": {
    "full_jpg": "https://dctn4zjpwgdwdiiy5odjv7o2se0bqgjb.lambda-url.us-east-1.on.aws/iiif/3/og-2023-kc-nara_A20550522_0161/full/max/0/default.jpg"
  },
  "fields": {
    "sex": {
      "ms_sex_llm_v1": "female"
    },
    "doctype": {
      "ms_doctype_v1": "form"
    },
    "form_title": {
      "ms_form_title_llm_v1": "Biographic Information Form G-325 ( 'Screened by NARA, 7/18/2023'"
    },
    "countries": {
      "ms_countries_nlp_v1": [
        "Pakistan",
        "United States",
        "India"
      ]
    },
    "years": {
      "ms_years_nlp_v1": [
        2023,
        1975,
        1982,
        1976
      ]
    },
    "g325a": {
      "occupation": {
        "occupation_llm_v1": "['business']"
      },
      "reason": {
        "reason_llm_v1": "NATURALIZATION"
      },
      "nationality": {
        "nationality_llm_v1": "Indian"
      }
    }
  },
  "is_g325a": true,
  "is_cert_naturalization": false,
  "full_text": "FORM G-325 (REV. 8-1-74)Y Screened by NARA, 7/18/2023 UNITED STATES DEPARTMENT OF JUSTICE BIOGRAPHIC Form Approved INFORMATION Immigration and Naturalization Service OMB Nc.43-R436 (Family name) (First name) (Middle name) MALE BIRTHDATE (Mo.-Day-Yr.) NATIONALITY ALIEN REGISTRATION NO. (If any) Gulrajani Hiranand Tolarm FEMALE July13, 13 Indian A20-550-522 ALL OTHER NAMES USED (Including names by previous marriages) CITY AND COUNTRY OF BIRTH SOCIAL SECURITY NO. (If any) None Hyderabadsind, Pakistan 557-08-2124 FAMILY NAME FIRST NAME DATE, CITY AND COUNTRY OF BIRTH (If known) CITY AND COUNTRY OF RESIDENCE FATHER Gulrajani Tolaram Hyderabadsind, Pakistan MOTHER (Maiden name) Late Radhibai Not Known HUSBAND (If none, SO state) FAMILY NAME FIRST NAME BIRTHDATE CITY & COUNTRY OF BIRTH DATE OF MARRIAGE PLACE OF MARRIAGE OR (For wife, give maiden name) WIFE Gulrajani Pushpa Pushpa 12/12/25 Pakistan 2/28/40 FORMER HUSBANDS OR WIVES (If none, SO state) Pakistan FAMILY NAME (For wife, give maiden name) FIRST NAME BIRTHDATE DATE AND PLACE OF MARRIAGE DATE AND PLACE OF TERMINATION OF MARRIAGE None 12-12-25 2-28-40 Pakistan None APPLICANT'S RESIDENCE LAST FIVE YEARS. LIST PRESENT ADDRESS FIRST. FROM TO STREET AND NUMBER CITY PROVINCE OR STATE COUNTRY MONTH YEAR MONTH YEAR 19500 Victory Blvd. Reseda Calif. U.S.A PRESENT TIME 81650. Westlake Ave. L.A. Calif. U.S.A APPLICANT'S LAST ADDRESS OUTSIDE THE UNITED STATES OF MORE THAN ONE YEAR. FROM TO STREET AND NUMBER CITY PROVINCE OR STATE COUNTRY MONTH YEAR MONTH YEAR 2381E. Street Poona Maharashtra India Dec. '77 July '78 APPLICANT'S EMPLOYMENT LAST FIVE YEARS. (IF NONE, so STATE.) LIST PRESENT EMPLOYMENT FIRST. FROM TO FULL NAME AND ADDRESS OF EMPLOYER OCCUPATION (Specify) MONTH YEAR MONTH YEAR Retired, Business Jau 1976 PRESENT TIME Was self-employed, Thirft Cleaners at '73 '75 Trazana and Maharajh Restaurant at 7th '71 '75 Street & 1st. & Main Street 1975 Show below last occupation abroad if not shown above. (Include all information requested above.) THIS FORM IS SUBMITTED IN CONNECTION WITH APPLICATION FOR: SIGNATURE OF APPLICANT OR PETITIONER DATE NATURALIZATION OTHER (SPECIFY) ADJUSTMENT OF STATUS Huauand. T. Gulvajain April 10th 81 IF YOUR NATIVE ALPHABET IS IN OTHER THAN ROMAN LETTERS, WRITE YOUR NAME IN YOUR NATIVE ALPHABET IN THIS SPACE: Are all copies legible? Yes is PENALTIES: SEVERE PENALTIES ARE PROVIDED BY LAW FOR KNOWINGLY AND WILLFULLY FALSIFYING OR CONCEALING A MATERIAL FACT. APPLICANT: BE SURE TO PUT YOUR NAME AND ALIEN REGISTRATION NUMBER IN THE BOX OUTLINED BY HEAVY BORDER BELOW. COMPLETE THIS BOX (Family name) (Given name) (Middle name) (Alien registration number) GULRAJANI HIRANAND TOLARAM A20-550-522 (OTHER AGENCY USE) INS USE (Office of Origin) OFFICE CODE: TYPE OF CASE: DATE: LOS CIT - 400 OCT 2 1982 date FORM G-325 (1) Ident."
}