{
  "anumber": "A20550522",
  "id": "A20550522_0020",
  "page_index": 20,
  "resources": {
    "full_jpg": "https://dctn4zjpwgdwdiiy5odjv7o2se0bqgjb.lambda-url.us-east-1.on.aws/iiif/3/og-2023-kc-nara_A20550522_0020/full/max/0/default.jpg"
  },
  "fields": {
    "sex": {
      "ms_sex_llm_v1": "male"
    },
    "doctype": {
      "ms_doctype_v1": "form"
    },
    "form_title": {
      "ms_form_title_llm_v1": "APPLICATION FOR STATUS AS PERMANENT RESIDENT, I-458 ( (Rev. 11-1-73)"
    },
    "countries": {
      "ms_countries_nlp_v1": [
        "Pakistan",
        "United States",
        "India"
      ]
    },
    "years": {
      "ms_years_nlp_v1": [
        1924,
        2023,
        1975,
        1948
      ]
    }
  },
  "is_g325a": false,
  "is_cert_naturalization": false,
  "full_text": "Screened by NARA, 7/18/2023 NITED STATES DEPARTMENT OF JUSTICE GPO: 1973-521-939 Immigration and Naturalization Service APPLICATION FOR STATUS AS PERMANENT RESIDENT Form Approved O.M.B. No. 43-R0400 FEE STAMP File No. 20 530 522 LOS APPLICATION FOR THE BENEFITS OF SECTION: T/C4 Sec. 203 (7) and Sec. 245, REC'D T/C JUL 171974 T/C Act Sec. 245 19 SEP 1975 214(d), I&N Act Sec. 249 I&N Act 21 APR DATE Sec. 13, Act of 9/11/57 (DO NOT WRITE ABOVE THIS LINE.) (SEE INSTRUCTIONS BEFORE FILLING IN APPLICATION. IF YOU NEED MORE SPACE TO ANSWER FULLY ANY QUESTION ON THIS FORM. USE A SEPARATE SHEET AND IDENTIFY EACH ANSWER WITH THE NUMBER OF THE CORRESPONDING QUESTION. FILL IN WITH TYPEWRITER OR PRINT IN BLOCK LETTERS IN INK.) 1. I hereby apply for the status of a lawful permanent resident alien on the following basis: (Check box A, B, C, D, E, or F) A. As a refugee to whom an immigrant visa is immediately available (Section 203(a)(7) and Section 245, I&N Act). B. As a person who entered the U.S. with a visa issued to me as the fiancee or fiance of a U.S. citizen whom I married within 90 days after my entry, or as a child of such fiancee or fiance (Sec. 214(d), I&N Act). C. As a former government official, or as a member of the immediate family of such official (Section 13, Act of September 11, 1957). D. As a person to whom an immigrant visa is immediately available, other than one described above (Section 245, I&N Act). E. As a person who has resided in the United States continuously since prior to July 1, 1924 (Section 249, I&N Act). F. As a person who has resided in the United States continuously since a date on or after July 1. 1924, but before June 30. 1948 (Section 249, I&N Act). 2. My name is (Last in capital letters) (First Name) (Middle Name) 3. Sex GULRAJANI, Hiranand Tolaram Male Female 4. I resid in the Unite 500 TH (No and EST State) 5. Have you ever applied before for permanent resident 738 So. Beacon Ave., L. A., California status in the U.S.? Yes No 6. My alien registration number 7. I am a citizen of (Country) 8. Date of Birth (If \"Yes\", give the date and place of filing and A20550522 India 7-13-13 final disposition.) 9. Place of Birth (City or Town) (County, Province, or State) (Country) Hydrebad Sindh, Sindh, Pakistan 10. Name as appears on nonimmigrant document (Form I-94) HIRANANI GULRAJANI I last arrived in the United States at the port of (City and State) on (Month) (Day) (Year) by (Name of vessel or other means of travel) NEW YORK 10-3-73 PAN AM as a (visitor. student. crewman, parolee. etc.) my I-94 permit number is B-1 I was was not inspected. 11. My nonimmigrant visa, number 001237 . was issued by the on (Month) (Day) (Year) 12. I am single married United States Consul at (Country) MADRAS INDIA 9-5-73 divorced widowed 13. I have been married I times, including my present marriage. if now married. (If you are now married give the following:) a. Number of times my husband or wife has been married b. Name of husband or wife (Wife give maiden name) one Tikan R. Chatalani; PUSHPA CHATLANI c. My husband or wife resides with me apart from me at Address (Apt. No.)(No. & Street)(Town or City) (Province or State) (Country) 14. a. I have B7 sons or daughters as follows: (Complete all columns as to each son or daughter; if living with you state \"with me\" in last column; otherwise give city and state or country of son's or daughter's residence). Name Sex Place of Birth Date of Birth Now living at FOIA (b)(6) J 2 (see ATTACHED PAGE) b. The following members of my family are also applying for permanent resident status: 1.0 Chatlani, Tikan (Gulrajani, Pushpa) (wife) 3. 2.0 FOIA (b)(6) (son) 4. FOIA (b)(6) 15. I list below all organizations, societies, ciuus, and associations, past or present, in which I have held membership in the United States or a foreign country, and the periods and places of such membership. (If you have never been a member of any organization, state \"None\".) NONE UNITED STATES DEPARTMENT OF JUSTICE RECEIVED TRANS. IN RET'D-TRANS. Immigration and Naturalization Service OUT COMPLETE Form I-485 (Rev. 11-1-73) (Pas"
}