{
  "anumber": "A20550522",
  "id": "A20550522_0047",
  "page_index": 47,
  "resources": {
    "full_jpg": "https://dctn4zjpwgdwdiiy5odjv7o2se0bqgjb.lambda-url.us-east-1.on.aws/iiif/3/og-2023-kc-nara_A20550522_0047/full/max/0/default.jpg"
  },
  "fields": {
    "sex": {
      "ms_sex_llm_v1": "female"
    },
    "doctype": {
      "ms_doctype_v1": "form"
    },
    "form_title": {
      "ms_form_title_llm_v1": "Biographic Information, Form G-325A ( (REV. 8-27-72N)"
    },
    "countries": {
      "ms_countries_nlp_v1": [
        "Pakistan",
        "United States",
        "India"
      ]
    },
    "years": {
      "ms_years_nlp_v1": [
        1949,
        1971,
        1999,
        1972,
        2023
      ]
    },
    "g325a": {
      "occupation": {
        "occupation_llm_v1": "[' usa', ' hong kong', ' bombay', 'self-employed entire life; chandum-prakash & bros.']"
      },
      "nationality": {
        "nationality_llm_v1": "Indian"
      }
    }
  },
  "is_g325a": true,
  "is_cert_naturalization": false,
  "full_text": "FORM G-325A (REV. 8-27-72)N Screened by NARA, 7/18/2023 Form Approved UNITED STATES DEPARTMENT OF JUSTICE OMB No. 43-R436 Immigration and Naturalization Service BIOGRAPHIC INFORMATION (Family name) (First name) (Middle name) MALE BIRTHDATE(Mo.-Day-Yr.) NATIONALITY ALIEN REGISTRATION NO. GULRAJANI Hiranand Tolaram FEMALE 7/13/13 Indian (If any) ALL OTHER NAMES USED (Including names by previous marriages) CITY AND COUNTRY OF BIRTH Hydrebad SOCIAL SECURITY NO. None (If any) Sindh. Sindh, Pakistan 557-08-2124 FAMILY NAME FIRST NAME DATE, CITY AND COUNTRY OF BIRTH(If known) CITY AND COUNTRY OF RESIDENCE FATHER Gulrajani, Tolaram Hydrebad, Pakistan Deceased MOTHER (Maiden name) Sadhragani, Radhibhai Hydrebad, Pakistan Deceased HUSBAND (If none, so state) FAMILY NAME FIRST NAME BIRTHDATE CITY & COUNTRY OF BIRTH DATE OF MARRIAGE PLACE OF MARRIAGE OR (For wife, give maiden name) WIFE Hydrebad, Hydrebad, Chatalani Tikan R. 12/12/25 Pakistan 2/28/40 Sindh FORMER HUSBANDS OR WIVES(if none,so state) FAMILY NAME (For wife, give maiden name) FIRST NAME BIRTHDATE DATE & PLACE OF MARRIAGE DATE AND PLACE OF TERMINATION OF MARRIAGE None APPLICANT'S RESIDENCE LAST FIVE YEARS. LIST PRESENT ADDRESS FIRST. FROM TO STREET AND NUMBER CITY PROVINCE OR STATE COUNTRY MONTH YEAR MONTH YEAR 816 S. Westlake Ave. L.A. Calif. USA Dec. 74 DONORATE PRESENT TIME 738 So. Beacon L.A. Calif. USA May 74 Dec. 74 722 So. Alvarado L.A. Calif. USA Oct. 73 May 74 2391 East Street Poona Maharastra India June 73 Oct. 73 722 So. Alvarado L.A. Calif. USA Oct. 72 June 73 2391 East Street Poona Maharastra India Dec. 71 Oct. 72 262 So. Rampart L.A. Calif USA Oct 71 Dec 71 APPLICANT'S LAST ADDRESS OUTSIDE THE UNITED STATES OF MORE THAN ONE YEAR FROM CONT D. TO STREET AND NUMBER CITY PROVINCE OR STATE COUNTRY MONTH YEAR MONTH YEAR 2391 East 1949 APPLICANT'S EMPLOYMENT LAST FIVE YEARS. (IF NONE, so STATE.) LIST PRESENT EMPLOYMENT FIRST. FROM 1971 TO FULL NAME AND ADDRESS OF EMPLOYER OCCUPATION (SPECIFY) MONTH YEAR MONTH YEAR PRESENT TIME employed entire life: 1999 / Chandun-Prakash & Bros. Bombay Hongkong, USA Also, Maharajah Snack Bar, IA, Calif. 1972 PRESENT Show below last occupation abroad if not shown above. (Include all information requested above.) THIS FORM IS SUBMITTED IN CONNECTION WITH APPLICATION FOR: SIGNATURE OF APPLICANT OR PETITIONER DATE NATURALIZATION ADJUSTMENT OF STATUS OTHER (SPECIFY): Humane Subraya mm 5/13/76 IF YOUR NATIVE ALPHABET IS IN OTHER THAN ROMAN LETTERS. WRITE YOUR NAME IN YOUR NATIVE ALPHABET IN THIS SPACE: Are all copies legible? Yes PENALTIES SEVERE PENALTIES ARE PROVIDED BY LAW FOR KNOWINGLY AND WILLFULLY FALSIFYING OR CONCEALING A MATERIAL FACT. APPLICANT: BE SURE TO PUT YOUR NAME AND ALIEN REGISTRATION NUMBER IN THE BOX OUTLINED BY HEAVY BORDER BELOW. COMPLETE THIS BOX (Family name) (Given name) (Middle name) (Alien registration number) GULRAJANI HIRANAND TOLARAM A20530 522 (OTHER AGENCY USE) INS USE (Office of Origin) (4) Consul FORM G-325A"
}