{
  "anumber": "A20535147",
  "id": "A20535147_0050",
  "page_index": 50,
  "resources": {
    "full_jpg": "https://dctn4zjpwgdwdiiy5odjv7o2se0bqgjb.lambda-url.us-east-1.on.aws/iiif/3/og-2023-kc-nara_A20535147_0050/full/max/0/default.jpg"
  },
  "fields": {
    "sex": {
      "ms_sex_llm_v1": "female"
    },
    "doctype": {
      "ms_doctype_v1": "form"
    },
    "form_title": {
      "ms_form_title_llm_v1": "Biographic Information, G-325A ( (REV. 8-27-72)"
    },
    "countries": {
      "ms_countries_nlp_v1": [
        "Japan",
        "China",
        "United States"
      ]
    },
    "years": {
      "ms_years_nlp_v1": [
        1973,
        1965
      ]
    },
    "g325a": {
      "occupation": {
        "occupation_llm_v1": "[' tokyo office', ' china union lines', 'manager', ' japan']"
      },
      "reason": {
        "reason_llm_v1": "NATURALIZATION"
      },
      "nationality": {
        "nationality_llm_v1": "China"
      }
    }
  },
  "is_g325a": true,
  "is_cert_naturalization": false,
  "full_text": "FORM G-325A (REV. 8-27-72)N TC/245 Form Approved UNITED STATES DEPARTMENT OF JUSTICE OMB No. 43-R436 LOS Immigration and Naturalization Service BIOGRAPHIC . 1/24/74 INFORMATION A20 535 147 (Family name) (First name) (Middle name) [XIMALE BIRTHDATE(Mo.-Day-Yr.) NATIONALITY ALIEN REGISTRATION NO. YING Kuo-Han FEMALE 12/25/14 China (If Abldel any) ALL OTHER NAMES USED (Including nomes by previous marriages) CITY AND COUNTRY OF BIRTH SOCIAL SECURITY NO. None Shanghai, China (If any) None FAMILY NAME FIRST NAME DATE, CITY AND COUNTRY OF BIRTH(If known) CITY AND COUNTRY OF RESIDENCE FATHER YING Chen-Dah Unknown, Shanghai, China deceased MOTHER (Maiden name) LEE Shu Cheng Unknown, Shanghai, China deceased HUSBAND (If none, so state) FAMILY NAME FIRST NAME BIRTHDATE CITY & COUNTRY OF BIRTH DATE OF MARRIAGE PLACE OF MARRIAGE OR (For wife, give maiden name) WIFE CHANG Kwei Yen Kwei Yen Shanghai, China 8/6/47 Shanghai, FORMER HUSBANDS OR WIVES(if none.so state) China FAMILY NAME (For wife, give moiden nome) FIRST NAME BIRTHDATE DATE & PLACE OF MARRIAGE DATE AND PLACE OF TERMINATION OF MARRIAGE None APPLICANT'S RESIDENCE LAST FIVE YEARS. LIST PRESENT ADDRESS FIRST. FROM TO STREET AND NUMBER CITY PROVINCE OR STATE COUNTRY MONTH YEAR MONTH YEAR 315 W. Grand Avenue Alhambra California July 1973 PRESENT TIME Rm, 156 Yamashita-Cho, Naka -Ku, Yokohama Japan Jan. 1973 July 1973 620-67 Nagata-Cho, Minami-Ku Yokohama Japan June 1965 Jan. 1973 APPLICANT'S LAST ADDRESS OUTSIDE THE UNITED STATES OF MORE THAN ONE YEAR FROM TO STREET AND NUMBER CITY PROVINCE OR STATE COUNTRY MONTH YEAR MONTH YEAR APPLICANT'S EMPLOYMENT LAST FIVE YEARS. (IF NONE, so STATE.) LIST PRESENT EMPLOYMENT FIRST FROM TO FULL NAME AND ADDRESS OF EMPLOYER OCCUPATION (SPECIFY) MONTH YEAR MONTH YEAR None July 1973 PRESENT TIME China Union Lines, Tokyo Office, Japan Manager Jan. 1965 July 1973 Show below last occupation abroad if not shown above. (Include all information requested above.) THIS FORM IS SUBMITTED IN CONNECTION WITH APPLICATION FOR: SIGNATURE OF APPLICANT OR PETITIONER DATE NATURALIZATION ADJUSTMENT OF STATUS OTHER (SPECIFY): Twiting 11/12/73 IF YOUR NATIVE ALPHABET IS IN OTHER THAN ROMAN LETTERS WRITE YOUR NAME IN YOUR NATIVE ALPHABET IN THIS SPACE: Are all copies legible? Yes the IIIII PENALTIES SEVERE PENALTIES ARE PROVIDED BY LAW FOR KNOWINGLY AND WILLFULLY FALSIFYING OR CONCEALING A MATERIAL FACT."
}