{
  "anumber": "A20866872",
  "id": "A20866872_0027",
  "page_index": 27,
  "resources": {
    "full_jpg": "https://dctn4zjpwgdwdiiy5odjv7o2se0bqgjb.lambda-url.us-east-1.on.aws/iiif/3/og-2023-kc-nara_A20866872_0027/full/max/0/default.jpg"
  },
  "fields": {
    "sex": {
      "ms_sex_llm_v1": "male"
    },
    "doctype": {
      "ms_doctype_v1": "form"
    },
    "form_title": {
      "ms_form_title_llm_v1": "Biographic Information"
    },
    "countries": {
      "ms_countries_nlp_v1": [
        "United States",
        "Austria",
        "Italy"
      ]
    },
    "years": {
      "ms_years_nlp_v1": [
        1949,
        1907,
        1971,
        1970,
        1976,
        1935,
        1974,
        1972,
        1906,
        1866,
        1913,
        1964,
        1932,
        1977,
        1920,
        1965
      ]
    },
    "g325a": {
      "occupation": {
        "occupation_llm_v1": "[' retired', 'engineer']"
      },
      "nationality": {
        "nationality_llm_v1": "USSR"
      }
    }
  },
  "is_g325a": true,
  "is_cert_naturalization": false,
  "full_text": "FORM G-325C (9-1-74) Y Form Approved BIOGRAPHIC UNITED STATES DEPARTMENT OF JUSTICE OMB No. 43-R436 Immigration and Naturalization Service INFORMATION (Family name) (First name) (Middle name) MALE BIRTHDATE (Mo.-Day-Yr.) NATIONALITY LoiD FEMALE 1906 USSE ALL OTHER NAMES USED CITY AND COUNTRY OF BIRTH none USSR FAMILY NAME FIRST NAME DATE, CITY AND COUNTRY OF BIRTH (if known) CITY AND COUNTRY OF RESIDENCE FATHER TOUCHINE died 1935 Odess MOTHER (Maiden name) 1866,Vilno died 1932 Odonoa HUSBAND or WIFE FAMILY NAME FIRST NAME BIRTHDATE CITY & COUNTRY OF BIRTH DATE OF MARRIAGE PLACE OF MARRIAGE (If none, so state) (For wife, give maiden name) Banyn Juno 21 Organ USIA Aug. 20, 1974 Odossa 1913 FORMER HUSBANDS or WIVES (Fill in the blocks below. If none, state \"none\".) FAMILY NAME (For wife, give maiden name) FIRST NAME BIRTHDATE DATE & PLACE OF MARRIAGE DATE AND PLACE OF TERMINATION OF MARRIAGE Chawn 1907 1935,0 1970 Odenna the died APPLICANT'S RESIDENCE LAST FIVE YEARS. LIST PRESENT ADDRESS FIRST. FROM TO STREET AND NUMBER CITY PROVINCE OR STATE COUNTRY MONTH YEAR MONTH YEAR Langonare Dads dopli thrus- Ostin Ropa July 21 1972 PRESENT TIME al 50/5 Pens. Cipro Italy July13 127 July 21 1977 Pone, Base Vionna Austria July 7 1971 July 12 197 UI, Kivorostino 13/9 Odeans ISSR 1976 1977 01. Zaolayakovo 29/16 Odness USSR 1949 1976 APPLICANT'S EMPLOYMENT LAST FIVE YEARS. (if none, so state) LIST PRESENT EMPLOYMENT FIRST. FROM TO FULL NAME AND ADDRESS OF EMPLOYER OCCUPATION MONTH YEAR MONTH YEAR 1965 PRESENT TIME MISSAYA 1964 BUSTAWATER KUSTANAISK IF YOUR NATIVE ALPHABET IS IN OTHER THAN ROMAN LETTERS, WRITE YOUR NAME IN YOUR NATIVE ALPHABET BELOW: APPLICANT FOR CONDITIONAL ENTRY leus PENALTIES: SEVERE PENALTIES ARE PROVIDED BY LAW July29,1977 1920 FOR KNOWINGLY AND WILLFULLY FALSIFYING DATE (SIGNATURE OF APPLICANT OR PETITIONER) OR CONCEALING A MATERIAL FACT. COMPLETE THIS BOX (FAMILY NAME) (GIVEN NAME) (MIDDLE NAME) A20 866 872 Lais (OTHER AGENCY USE) (INS USE) CONDITIONAL ENTRY APPLICANT Return to: Home, Italy Immigration and Naturalization Service OFFICE CODE: TYPE OF CASE: SPECIAL HANDLING S.J. DATE: August 5, 1977 TELEGRAPHIC REPLY REQUESTED FORM G-325C (6) Consul"
}