{
  "anumber": "A20866872",
  "id": "A20866872_0004",
  "page_index": 4,
  "resources": {
    "full_jpg": "https://dctn4zjpwgdwdiiy5odjv7o2se0bqgjb.lambda-url.us-east-1.on.aws/iiif/3/og-2023-kc-nara_A20866872_0004/full/max/0/default.jpg"
  },
  "fields": {
    "sex": {
      "ms_sex_llm_v1": "male"
    },
    "doctype": {
      "ms_doctype_v1": "form"
    },
    "form_title": {
      "ms_form_title_llm_v1": "Biographic Information Form G-325A, G-325A"
    },
    "countries": {
      "ms_countries_nlp_v1": [
        "United States",
        "Italy"
      ]
    },
    "years": {
      "ms_years_nlp_v1": [
        1979,
        1982,
        1980,
        1906,
        1866,
        1976,
        1977,
        1915
      ]
    },
    "g325a": {
      "occupation": {
        "occupation_llm_v1": "['n.a']"
      },
      "nationality": {
        "nationality_llm_v1": "JEW"
      }
    }
  },
  "is_g325a": true,
  "is_cert_naturalization": false,
  "full_text": "TOTTE Approved OMB No. 43-R436 For sale by the Superintendent of Documents BIOGRAPHIC U.S. Government Printing Office INFORMATION Washington, D.C. 20402 (Per 100 copies) Stock No. 027-002-00170-2 (Family name) (First name) (Middle name) MALE BIRTHDATE(Mo.-Day-Yr.) NATIONALITY ALIEN REGISTRATION NO. TOMCHINSKY LEIB FEMALE 3/22/1906 JEW (If any) PA20866872 ALL OTHER NAMES USED (Including names by previous marriages) CITY AND COUNTRY OF BIRTH SOCIAL SECURITY NO. ODESSA USSR (If any) 117-60-4137 FAMILY NAME FIRST NAME DATE, CITY AND COUNTRY OF BIRTH(If known) CITY AND COUNTRY OF RESIDENCE OMCHINSRY ITZIK 4 151 1864 PINSK USSR FATHER MOTHER (Maiden name) TOMCHINSRY HE1B 3/22/1866 NEW YORK, USA. HUSBAND (If none, so state) FAMILY NAME FIRST NAME BIRTHDATE CITY & COUNTRY OF BIRTH DATE OF MARRIAGE PLACE OF MARRIAGE OR (For wife, give maiden name) WIFE OLSHANETS KAYA BASYA 3/22/06 ORGEEVISSR 8/20/76 USSR FORMER HUSBANDS OR WIVES(if none, so state) FAMILY NAME (For wife, give maiden name) FIRST NAME BIRTHDATE DATE & PLACE OF MARRIAGE DATE AND PLACE OF TERMINATION OF MARRIAGE SHTANE MICHAIL 3/5/1915 USSR USSR. APPLICANT'S RESIDENCE LAST FIVE YEARS. LIST PRESENT ADDRESS FIRST. FROM TO STREET AND NUMBER CITY PROVINCE OR STATE COUNTRY MONTH YEAR MONTH YEAR 3033 BRIGHTON 14 STR APAG BROORLYN NEW YORK USA 3 1980 PRESENT TIME 3033 BRIGHTON 14 STR APTAL BROORLYN NEW YORK USA 4 1979 3 1980 2785 OCEAN PARKWAY BROOKLYN NEW YORK USA 11 1977 4 1979 428 Pacarelli St R Rome Italy 8 77 11 77 APPLICANT'S LAST ADDRESS OUTSIDE THE UNITED STATES OF MORE THAN ONE YEAR FROM TO STREET AND NUMBER CITY PROVINCE OR STATE COUNTRY MONTH YEAR MONTH YEAR x 18 HVOROSTIN STR. ODESSA LIKRAINE USSR 8 1976 10 1977 APPLICANT'S EMPLOYMENT LAST FIVE YEARS. (IF NONE, SO STATE.) LIST PRESENT EMPLOYMENT FIRST FROM TO FULL NAME AND ADDRESS OF EMPLOYER NONE OCCUPATION (SPECIFY) MONTH YEAR MONTH YEAR PRESENT TIME no Show below last occupation abroad if not shown above. (Include all information requested above.) THIS FORM IS SUBMITTED IN CONNECTION WITH APPLICATION FOR: SIGNATURE OF APPLICANT OR PETITIONER DATE NATURALIZATION ADJUSTMENT OF STATUS Leis Tomekinsky OTHER (SPECIFY): 12/14/1982 IF YOUR NATIVE ALPHABET IS IN OTHER THAN ROMAN LETTERS, WRITE YOUR NAME IN YOUR NATIVE ALPHABET IN THIS SPACE: Are all copies legible? Yes TOMYUHCKUÃ‰ NubiROBHY PENALTIES: SEVERE PENALTIES ARE PROVIDED BY LAW FOR KNOWINGLY AND WILLFULLY FALSIFYING OR CONCEALING A MATERIAL FACT. APPLICANT: BE SURE TO PUT YOUR NAME AND ALIEN REGISTRATION NUMBER IN THE BOX OUTLINED BY HEAVY BORDER BELOW. COMPLETE THIS BOX (Family name) (Given name) (Middle name) (Alien registration number) TO MCHINSKY LEIB A20 866 872 (OTHER AGENCY USE) INS USE (Office of Origin) OFFICE CODE: There TYPE OF CASE: Parolee DATE: 12-14-82 FORM G-325A (1) Ident."
}