{
  "anumber": "A20968145",
  "id": "A20968145_0004",
  "page_index": 4,
  "resources": {
    "full_jpg": "https://dctn4zjpwgdwdiiy5odjv7o2se0bqgjb.lambda-url.us-east-1.on.aws/iiif/3/og-2023-kc-nara_A20968145_0004/full/max/0/default.jpg"
  },
  "fields": {
    "sex": {
      "ms_sex_llm_v1": "female"
    },
    "doctype": {
      "ms_doctype_v1": "form"
    },
    "form_title": {
      "ms_form_title_llm_v1": "APPLICATION FOR STATUS AS PERMANENT RESIDENT"
    },
    "countries": {
      "ms_countries_nlp_v1": [
        "United States",
        "India"
      ]
    },
    "years": {
      "ms_years_nlp_v1": [
        1924,
        1974,
        1908,
        1948
      ]
    }
  },
  "is_g325a": false,
  "is_cert_naturalization": false,
  "full_text": "Form Approved Budget Bureau No. 43-R0400 APPLICATION FOR STATUS AS PERMANENT RESIDENT FEE STAMP File No. A 20 968 145 APPLICATION FOR THE BENEFITS OF SECTION: 203(a)(7) and Sec. 245, I&N Act 245 249 I&N Act Sec. 214(d), I&N Act Sec. 13, Act of 9/11/57 DO NOT WRITE ABOV INSTRUCTIONS BEFORE FILLING IN APPLICATION. IF YOU NEED MORE SPACE TO NSWER FULLY ANY THIS ORM, USE A SEPARATE SHEET AND IDENTIFY EACH ANSWER WITH THE NUMBER OF THE ORRESPONDING QUESTION. FILL WITH TYPEWRITER OR PRINT IN BLOCK LETTERS IN INK.) 1. I hereby apply for the status of a lawful permanent resident alien on the following basis: (Check box A, B, C, D, E or F) An immigrant visa is immediately available to me: A. As a refugee (Section 203(a)(7) and Section 245, I&N Act). B. As a former fiancee or fiance of a U.S. citizen whom I married within 90 days after my arrival in the United States, or as a child of such fiancee or fiance (Section 214(d), I&N Act). C. As a former government official, or as a member of the immediate family of such official (Section 13, Act of September 11, 1957). D. As a person to whom an immigrant visa is immediately available, other than one described above, (Section 245, I&N Act). E. As a person who has resided in the United States continuously since prior to July 1, 1924 (Section 249, I&N Act). F. As a person who has resided in the United States continuously since a date on or after July 1, 1924, but before June 30, 1948 (Section 249, I&N Act). 2. My name is (Last in capital letters) (First Name) (Middle Name) My alien registration number is Sex NARANG LAL A 20968145 Male CHUNI Female 3. I reside in the United States at: (Apt. No.) (No. and Street) (City) (State) (ZIP Code) 501 FAIR VIEW AVE SIERRA MADRE CALIF 91024 4. Date of Birth Place of Birth (City or Town) (County, Province, or State) (Country) I am now a citizen of (Country) April 15, 1908 TALAGANG, PUNJAB INDIA INDIA 5. I last arrived in the United States at the port of (City and State) on (Month) (Day) (Year) PAN AM 01, NEW YORK 13 1974 by (Name of vessel or other means of travel) as a (visitor. student, exchange visitor, temporary worker, fiancee, fiance, crewman, parolee, etc.) PAN AM VISITOR B My nonimmigrant visa was issued by the United States Consul at (City) (State) on (Month) (Day) (Year) was I inspected. was not BOMBAY JUNE 17 1974 6. I am single married divorced widowed a. I have been married times, including my present marriage, if now married. (If you are now married give the following:) b. Number of times my spouse has been married C. Name of spouse once LAJYA VATI d. My spouse resides with me apart from me at Address (Apt. No.) (No. & Street) (Town or City) (Province or State) (Country) 48 JAI BHARAT BLDG, KHED GULLY, DADAR, BOMBAY INDIA 7. a. I have 7 children, as follows: (complete all columns as to each child. If child lives with you, state \"with me in last column; otherwise give city and state or country of child's residence. Name Sex Place of Birth Date of Birth Now Living at 1. SATISH KUMARI PAUL F LAHORE, INDIA R-496, NEW RAJINDER NAGAR 27.26.31 DELHI, INDIA 2. SUDARSHAN KUMARI PAUL F LAHORE, INDIA 16-16 40 Embassy of INDIA, 02.16.33 PRAGUE, CZECHO SLOVAKIA 3. CHANDER KUMAR NARANG M LAHORE INDIA JAN10,1935 501 FAIRVIEW AVE, SIERRA b. The following members of my family are also applying for permanent resident status: (SEE ATTACHMENT) MADRE, CALIF 91024 8. I have have not heretofore filed an application for the status of a permanent resident. (If you have ever filed such application, give the date and place of filing and final disposition.) Form I-485 (Rev. 7-1-70)N UNITED STATES DEPARTMENT OF JUSTICE Immigration and Naturalization Service (Page 1)"
}