{
  "anumber": "A20968145",
  "id": "A20968145_0035",
  "page_index": 35,
  "resources": {
    "full_jpg": "https://dctn4zjpwgdwdiiy5odjv7o2se0bqgjb.lambda-url.us-east-1.on.aws/iiif/3/og-2023-kc-nara_A20968145_0035/full/max/0/default.jpg"
  },
  "fields": {
    "sex": {
      "ms_sex_llm_v1": "female"
    },
    "doctype": {
      "ms_doctype_v1": "form"
    },
    "form_title": {
      "ms_form_title_llm_v1": "APPLICATION FOR IMMIGRANT VISA AND ALIEN REGISTRATION"
    },
    "countries": {
      "ms_countries_nlp_v1": [
        "Pakistan",
        "United States",
        "India"
      ]
    },
    "years": {
      "ms_years_nlp_v1": [
        1912,
        1931,
        1908
      ]
    }
  },
  "is_g325a": false,
  "is_cert_naturalization": false,
  "full_text": "FORM APPROVED O.M.B. No. 47-RO150 OPTION (English) (Rev. 7-79) DEPT. o A1 50230-104 APPLICATION FOR IMMIGRANT VISA AND ALIEN REGISTRATION INSTRUCTIONS: This form must be filled out in DUPLICATE by typewriter, or if by hand in legible block letters. All questions must be answered, if applicable. Questions which are not applicable should be so marked. If there is insufficient room on the form, answer on separate sheets, in duplicate using the same numbers as appear on the form. Attach the sheets to the forms. DO NOT SIGN this form until instructed to do so by the consular officer. The fee for filing this application for an immigrant visa is $5.00. The fee should be paid in United States dollars or local currency equivalent or by bank draft, when you appear before the consular officer. WARNING: Any false statement or concealment of a material fact may result in your permanent exclusion from the United States. Even though you should be admitted to the United States, a fraudulent entry could be grounds for your prosecution and/or deportation. 1. Family name First name Middle name NARANG CHUNILAL 2. Other names used or by which known (If married woman, give maiden name) NIL 3. Full name in native alphabet (If Roman letters not used) NOT APPLICABLE 4. Date of birth 5. Age 6. Place of birth (Day) (Month) (Year) (City or town) (Province) (Country) 15 APRIL 1908 74 Yrs TALAGANG WEST PUNJAB 9 INDIA (now Pakistan) 7. Nationality 8. Sex 9. Marital status INDIAN Male Female Single (never married) Married Widowed Divorced Separated Including my present marriage, I have been married times. 10. Occupation 11. Present address R-496 NEW RAJINDER NAGAR, NEW DELHI RETIRED 110060 12. Name, address, date and place of birth of wife/husband (Give maiden name of wife) LAJYAVATI MONGA, 10th JANUARY, 1912, DHARAMKOT, East Punjab, INDIA Date and place of marriage 10th FEBRUARY, 1931 at LAHORE, WEST PUNJAB, INDIA (now Pakistan) 13. Names, addresses, dates and places of birth of all children. Please see ANNEXURE I 14. Person(s) named in 12 and 13 who will accompany or follow 15. Final address in the United States me to the United States 4225 S. RIMVIEW DRIVE, WHITTIER, MRS. LAJYAVATI NARANG (Wife) CAL. 90601. (USA) 16. Person you intend to join (Give name, address and relationship, 17. Name and address of sponsoring person or organization (If if any) different from 16) CHANDER KUMAR NARANG 4225, S.RIMVIEW DR., NOT APPLICABLE WHITTIER, CAL. 90601. SON 18. Personal description 19. Marks of identification (a) Color of hair (c) Height MOLE ON RIGHT CHEEK BLACK & GREY 5 feet 7 inches (b) Color of eyes (d) Complexion 20. Purpose in going to the United States BROWN FAIR TO JOIN MY SONS 21. Length of intended stay (If permanently, so state) 22. Intended port of entry 23. Do you have a ticket to final destination? ABOUT TWO YEARS LOS ANGELES NOT YET PURCHASED THIS FORM MAY BE OBTAINED GRATIS AT CONSULAR OFFICES OF THE UNITED STATES OF AMERICA NSN 7540-00-149-0919 Previous edition not usable"
}