{
  "anumber": "A21198924",
  "id": "A21198924_0041",
  "page_index": 41,
  "resources": {
    "full_jpg": "https://dctn4zjpwgdwdiiy5odjv7o2se0bqgjb.lambda-url.us-east-1.on.aws/iiif/3/og-2023-kc-nara_A21198924_0041/full/max/0/default.jpg"
  },
  "fields": {
    "sex": {
      "ms_sex_llm_v1": "female"
    },
    "doctype": {
      "ms_doctype_v1": "form"
    },
    "form_title": {
      "ms_form_title_llm_v1": "BIOGRAPHIC INFORMATION, FORM G-325A ( (REV.10-1-74) Y"
    },
    "countries": {
      "ms_countries_nlp_v1": [
        "United States"
      ]
    },
    "years": {
      "ms_years_nlp_v1": [
        1895,
        1975,
        1970,
        1954,
        1945,
        2023
      ]
    },
    "g325a": {
      "occupation": {
        "occupation_llm_v1": "[' retired', 'police officer']"
      },
      "reason": {
        "reason_llm_v1": "NATURALIZATION"
      },
      "nationality": {
        "nationality_llm_v1": "Vietnamese"
      }
    }
  },
  "is_g325a": true,
  "is_cert_naturalization": false,
  "full_text": "FORM G-325A (REV. 10-1-74) Y Screened by NARA, 7/18/2023 Form Approved UNITED STATES DEPARTMENT OF JUSTICE OMB No. 43-R436 Immigration and Naturalization Service BIOGRAPHIC INFORMATION (Family name) (First name) (Middle name) PHAM VAN MALE BIRTHDATE(Mo.-Day-Yr.) NATIONALITY ALIEN REGISTRATION NO. THAO FEMALE 02-10-20 Vietnamese A21 198 924 (If any ALL OTHER NAMES USED (Including names by previous marriages) CITY AND COUNTRY OF BIRTH SOCIAL SECURITY NO. Bui CHU, V.N. (If any) FAMILY NAME FIRST NAME DATE, CITY AND COUNTRY OF BIRTH(If known) CITY AND COUNTRY OF RESIDENCE. FATHER Pham Thanh Van 1885 Bui Chu, V.N. DEC. MOTHER (Maiden name) Do Thuc Thi 1895 Bui Chu, V.N. DEC. HUSBAND (If none, so state) FAMILY NAME FIRST NAME BIRTHDATE CITY & COUNTRY OF BIRTH DATE OF MARRIAGE PLACE OF MARRIAGE OR (For wife, give maiden name) WIFE TRAN THI RIEN 1-1-22 Bui CHU, V.N 1945 Bui CHU FORMER HUSBANDS OR WIVES(if none,so state) FAMILY NAME (For wife, give maiden name) FIRST NAME BIRTHDATE DATE & PLACE OF MARRIAGE DATE AND PLACE OF TERMINATION OF MARRIAGE APPLICANT'S RESIDENCE LAST FIVE YEARS. LIST PRESENT ADDRESS FIRST. FROM TO STREET AND NUMBER CITY PROVINCE OR STATE COUNTRY MONTH YEAR MONTH YEAR 198 Pham Dinh Phung Pleiku V.N. 1970 PRESENT TIME APPLICANT'S LAST ADDRESS OUTSIDE THE UNITED STATES OF MORE THAN ONE YEAR FROM TO STREET AND NUMBER CITY PROVINCE OR STATE COUNTRY MONTH YEAR MONTH YEAR APPLICANT'S EMPLOYMENT LAST FIVE YEARS. (IF NONE, so STATE.) LIST PRESENT EMPLOYMENT FIRST. FROM TO FULL NAME AND ADDRESS OF EMPLOYER OCCUPATION (SPECIFY) MONTH YEAR MONTH YEAR Police Dept. Pleiku, V.N. Police Officer 1954 PRESENT TIME Ref in MAY 1975 Show below last occupation abroad if not shown above. (Include all information requested above.) THIS FORM IS SUBMITTED IN CONNECTION WITH APPLICATION FOR: SIGNATURE OF APPLICANT OR PETITIONER DATE NATURALIZATION ADJUSTMENT OF STATUS OTHER (SPECIFY) Parolee VICAM their 5/7/75 IF YOUR_NATIVE ALPHABET IS IN OTHER THAN ROMAN LETTERS. WRITE YOUR NAME IN YOUR NATIVE ALPHABET IN THIS SPACE: Are all copies legible? Yes PENALTIES: SEVERE PENALTIES ARE PROVIDED BY LAW FOR KNOWINGLY AND WILLFULLY FALSIFYING OR CONCEALING A MATERIAL FACT. APPLICANT: BE SURE TO PUT YOUR NAME AND ALIEN REGISTRATION NUMBER IN THE BOX OUTLINED BY HEAVY BORDER BELOW. COMPLETE THIS BOX (Family name) (Given name) (Middle name) (Alien registration number) PHAM THAO VAN A21 198 924 (OTHER AGENCY USE) INS USE (Office of Origin) OFFICE CODE: NDI TYPE OF CASE: 431 DATE: metnomese refuge SL. Wd 90 & 6 LVW special FORM G-325A (3) c."
}