{
  "anumber": "A21198924",
  "id": "A21198924_0022",
  "page_index": 22,
  "resources": {
    "full_jpg": "https://dctn4zjpwgdwdiiy5odjv7o2se0bqgjb.lambda-url.us-east-1.on.aws/iiif/3/og-2023-kc-nara_A21198924_0022/full/max/0/default.jpg"
  },
  "fields": {
    "sex": {
      "ms_sex_llm_v1": "female"
    },
    "doctype": {
      "ms_doctype_v1": "form"
    },
    "form_title": {
      "ms_form_title_llm_v1": "Information for Naturalization Application, Form G-325A"
    },
    "countries": {
      "ms_countries_nlp_v1": [
        "Vietnam",
        "United States"
      ]
    },
    "years": {
      "ms_years_nlp_v1": [
        1922,
        2023,
        1938,
        1915
      ]
    },
    "g325a": {
      "occupation": {
        "occupation_llm_v1": "['police non-commissioned officer', ' vietnam traffic control 09', ' pleiku']"
      },
      "nationality": {
        "nationality_llm_v1": "VIETNAMESE"
      }
    }
  },
  "is_g325a": true,
  "is_cert_naturalization": false,
  "full_text": "Screened by 7/18/2023 Form Approved UNITED STATES DEPARTMENT OF JUSTICE OMB No. 43-R436 Immigration and Naturalization Service INF ORMATION (Family name) (First name) (Middle name) MALE BIRTHDATE(Mo.-Day-Yr.) NATIONALITY ALIEN REGISTRATION NO. PHAM Thao Van FEMALE 2-10-1915 VIETNAMESE (If A21 198 924 ALL OTHER NAMES USED (Including names by previous marriages) CITY AND COUNTRY OF BIRTH SOCIAL SECURITY NO. NONE Ha-Linh, Vietnam 580) 40 5985 FAMILY NAME FIRST NAME DATE, CITY AND COUNTRY OF BIRTH(If known) CITY AND COUNTRY OF RESIDENCE PHAM Thanh FATHER Don't remember,Ha=Linh VN Deceased MOTHER(Maiden name) DO Thue Don't remember, Bui-Chu, VN Deceased HUSBAND (If none, so state) FAMILY NAME FIRST NAME BIRTHDATE CITY & COUNTRY OF BIRTH DATE OF MARRIAGE PLACE OF MARRIAGE OR (For wife, give maiden name) WIFE 1-1- Ha-Linh, 1938 Ha-Linh, TRAN Rien 1922 Vietnam Vietnam. FORMER HUSBANDS OR WIVES(i none,so state) FAMILY NAME (For wife, give maiden name) FIRST NAME BIRTHDATE DATE & PLACE OF MARRIAGE DATE AND PLACE OF TERMINATION OF MARRIAGE NONE APPLICANT'S RESIDENCE LAST FIVE YEARS. LIST PRESENT ADDRESS FIRST. FROM TO STREET AND NUMBER CITY PROVINCE OR STATE COUNTRY MONTH YEAR MONTH YEAR -1805 W. Adams street Santa Ana California U.S.A. 12 77 PRESENT TIME -1048 #C.Mission Drive Costa Mesa California U.S.A. 06 77 12 77 -3155 Canadian Drive Costa Mesa California U.S.A. 01 76 05 77 -1134 Crest Avenue Monterey California U.S.A. 10 75 12 75 -2264 Capitol La road Santa Cruz California U.S.A. 06 75 09 75 -Fort Chaffee Camp Arkansas U.S.A. 05 75 06 75 APPLICANT'S LAST ADDRESS OUTSIDE THE UNITED STATES OF MORE THAN ONE YEAR FROM TO STREET AND NUMBER CITY PROVINCE OR STATE COUNTRY MONTH YEAR MONTH YEAR -7, Yen Do street Pleiku Pleiku VIETNAM 02 65 03 75 APPLICANT'S EMPLOYMENT LAST FIVE YEARS. (IF NONE, so STATE.) LIST PRESENT EMPLOYMENT FIRST. FROM TO FULL NAME AND ADDRESS OF EMPLOYER OCCUPATION (SPECIFY) MONTH YEAR MONTH YEAR PRESENT TIME NONE Show below last occupation abroad if not shown above. (Include all information requested above.) Police Non-Commissioned Officer, Pleiku, Vietnam Traffic Control 09 54 03 75 THIS FORM IS SUBMITTED IN CONNECTION WITH APPLICATION FOR: SIGNATURE of APPLICANT OR PETITIONER DATE INATURALIZATION ADJUSTMENT OF STATUS OTHER (SPECIFY): Thao Van Pham 5-6-78 IF YOUR NATIVE ALPHABET IS IN OTHER THAN ROMAN LETTERS. WRITE YOUR NAME IN YOUR NATIVE ALPHABET IN THIS SPACE: Are all copies legible? Yes PENALTIES SEVERE PENALTIES ARE PROVIDED BY LAW FOR KNOWINGLY AND WILLFULLY FALSIFYING OR CONCEALING A MATERIAL FACT. APPLICANT: BE SURE TO PUT YOUR NAME AND ALIEN REGISTRATION NUMBER IN THE BOX OUTLINED BY HEAVY BORDER BELOW. COMPLETE THIS BOX (Family name) (Given name) (Middle name) (Alien registration number) PHAM Thao Van A 21 198 (OTHER AGENCY USE) INS USE (Office of Origin) OFFICE CODE: TYPE OF CASE: DATE: (3) C. FORM G-325A"
}