{
  "anumber": "A21198924",
  "id": "A21198924_0000",
  "page_index": 0,
  "resources": {
    "full_jpg": "https://dctn4zjpwgdwdiiy5odjv7o2se0bqgjb.lambda-url.us-east-1.on.aws/iiif/3/og-2023-kc-nara_A21198924_0000/full/max/0/default.jpg"
  },
  "fields": {
    "sex": {
      "ms_sex_llm_v1": "female"
    },
    "doctype": {
      "ms_doctype_v1": "form"
    },
    "form_title": {
      "ms_form_title_llm_v1": "Processing Sheet"
    },
    "countries": {
      "ms_countries_nlp_v1": [
        "Vietnam",
        "United States"
      ]
    },
    "years": {
      "ms_years_nlp_v1": [
        1994,
        2023,
        1995
      ]
    }
  },
  "is_g325a": false,
  "is_cert_naturalization": false,
  "full_text": "Screened by NARA, 7/18/2023 U.S. Department of Justice OF SOUTH Immigration & Naturalization Service RR K the PROCESSING SHEET File No: A 21-198-924 DESCRIPTION SECTION OF LAW Sex : MALE FEMALE ( ) 316(a) ( ) 325 Marital Status (S) (M) (D) (W) ( 319(a) ( ) 328 Height : Ft. 5 In. & 319(b) 329 Nationality : VieTNAM 322 ) 405 INITIAL : INTERVIEW DEC 15 1994 FINAL ACTION (Date) Englishs 55 55 ( ) Denial : Date & Initials Speaks Reads 15 Writes Understands 15 ( ) Withdrawal : Date & Initials Government : OK I.N.S. 12 E.T.S. ( ) CASAS ( ) ( ) Oath Taken Certificate Issued: REEXAM : ACTION or DOCUMENTS REQUIRED ( Date and Initials ( ) See Attached N-14b ( ) Reexamination DOCUMENTS PRESENTED ( ) Visa File ( ) Post Audit A.R.C. : I551 Sth ( ) Other : D.O.B. : 02-10-15 COMMENTS P.O.E. : 205 C.O.A. : IC6 D.O.E. : 06-04-75 CID / CDL : none Recommendation : GT DEC 15 & Interpreter Release in fil 55/15 Initials APPROVAL (STAMP) FINAL HEARING APPROVED INS DISTRICT DIRECTOR FEB 1 1995 DATE Recomme Hilla nded by 1200 LOS 4607 TIME ( ) Attorney Waiver Executed, If Attorney Present, List Name : 3. Months Residence OK ( Fingerprints NEG. 40 ( ) Nazi Negative Day-Time Phone : ( From 714) 75.1 8114 Ext OATH OF ALLEGIANCE Name Change : noin ( ) Modified Oath; Delete Part(s) : ( ) Promise to Bear Arms, ( ) Noncombat Duty OATH WITH U.S DISTRICT COURT : 246 I HEREBY DECLARE, on oath, That I absolutely and entirely renounce and abjure all allegiance and fidelity to any foreign prince, potentate, state, or sovereignty of whom or which I have heretofore been a subject or citizen; That I will support and defend the Constitution and the Laws of the United States of America against all enemies, foreign and domestic; That will bear true faith and allegiance to the same; That I will bear arms on behalf of the United States when required by Law; That I will perform noncombatant service in the Armed Forces of the United States when required by the Law; That I will perform work of national importance under civilian direction when required by the Law; and That I take this obligation freely without any mental reservation or purpose of evasion; so HELP ME GOD. In acknowledgement whereof I have hereunto affixed my signature. Signature : name Vour Phone"
}