{
  "anumber": "A21199209",
  "id": "A21199209_0014",
  "page_index": 14,
  "resources": {
    "full_jpg": "https://dctn4zjpwgdwdiiy5odjv7o2se0bqgjb.lambda-url.us-east-1.on.aws/iiif/3/og-2023-kc-nara_A21199209_0014/full/max/0/default.jpg"
  },
  "fields": {
    "sex": {
      "ms_sex_llm_v1": "female"
    },
    "doctype": {
      "ms_doctype_v1": "form"
    },
    "form_title": {
      "ms_form_title_llm_v1": "BIOGRAPHIC INFORMATION, FORM G-325A ( (REV. 10-1-74) Y"
    },
    "countries": {
      "ms_countries_nlp_v1": [
        "Vietnam",
        "United States"
      ]
    },
    "years": {
      "ms_years_nlp_v1": [
        1971,
        1955,
        2016,
        2023,
        1978
      ]
    },
    "g325a": {
      "occupation": {
        "occupation_llm_v1": "['assistant director of nha trang', ' hon cheng orphanage']"
      },
      "reason": {
        "reason_llm_v1": "NATURALIZATION"
      },
      "nationality": {
        "nationality_llm_v1": "Vietnamese"
      }
    }
  },
  "is_g325a": true,
  "is_cert_naturalization": false,
  "full_text": "FORM G-325A (REV. 10-1-74) Y Screened by NARA, 7/6/2023 Form Approved UNITED STATES DEPARTMENT OF JUSTICE LOS OMB No. 43-R436 Immigration and Naturalization Service BIOGRAPHIC T/C = 245 l INFORMATION MAR 1 8 1978 (Family name) (First name) (Middle name) MALE BIRTHDATE(Mo.-Day-Yr.) NATIONALITY (DATE) ALIEN REGISTRATION NO. LE SAO THI FEMALE 1/15/13 Vietnamese (If any) A21-199-209 ALL OTHER NAMES USED (Including names by previous marriages) CITY AND COUNTRY OF BIRTH SOCIAL SECURITY NO. none HAI CHAU VIET NAM (If any) 586-40-4818 FAMILY NAME FIRST NAME DATE, CITY AND COUNTRY OF BIRTH(If known) CITY AND COUNTRY OF RESIDENCE. FATHER LE DUOC UNKNOWN VIET NAM deceased MOTHER (Maiden name) TRAN SUU VIET NAM deceased HUSBAND (If none, so state) FAMILY NAME FIRST NAME BIRTHDATE CITY & COUNTRY OF BIRTH DATE OF MARRIAGE PLACE OF MARRIAGE OR WIFE (For wife, give maiden N/A name) DA NANG TRXAN Hai Chau, Viet Ham 5/19/32 FORMER HUSBANDS OR WIVES(if none, so state) more FAMILY NAME (For wife, give moiden name) FIRST NAME BIRTHDATE DATE & PLACE OF MARRIAGE DATE AND PLACE OF TERMINATION OF MARRIAGE TRAN DE 8/15/13 HAICHAU, U.N 1971 ViETNAM DELEASED APPLICANT'S RESIDENCE LAST FIVE YEARS. LIST PRESENT ADDRESS FIRST. FROM TO STREET AND NUMBER CITY PROVINCE OR STATE COUNTRY MONTH YEAR MONTH YEAR 10222 Lanett Ave Whittier CA U.S. 7 76 PRESENT TIME 2016 U.S. 31 North # 8 Niles MI U.S. 8 75 7 76 124 Hoang Dieu 20 Nha The Saigon Viet Nam / 70 4 Khanh Hoa 75 NhaTrang Viet Nam / 56 / 70 APPLICANT'S LAST ADDRESS OUTSIDE THE UNITED STATES OF MORE THAN ONE YEAR FROM TO STREET AND NUMBER CITY PROVINCE OR STATE COUNTRY MONTH YEAR MONTH YEAR 20 Nha The Who Trang Khanh hoa Viet Nam / 56 / 70 APPLICANT'S EMPLOYMENT LAST FIVE YEARS. (IF NONE. so STATE.) LIST PRESENT EMPLOYMENT FIRST. FROM TO FULL NAME AND ADDRESS OF EMPLOYER OCCUPATION (SPECIFY) MONTH YEAR MONTH YEAR none PRESENT TIME Show below last occupation abroad if not shown above. (Include all information requested above.) assistant director of Nha Trang, Hon Chong Orphanage 1955 71 THIS FORM IS SUBMITTED IN CONNECTION WITH APPLICATION FOR: SIGNATURE OF APPLICANT OR PETITIONER DATE INATURALIZATION ADJUSTMENT OF STATUS OTHER (SPECIFY): Sao Thi LE 2/22/78 IF YOUR NATIVE ALPHABET is IN OTHER THAN ROMAN LETTERS. WRITE YOUR NAME IN YOUR NATIVE ALPHABET IN THIS SPACE: Are all copies legible? Yes PENALTIES: SEVERE PENALTIES ARE PROVIDED BY LAW FOR KNOWINGLY AND WILLFULLY FALSIFYING OR CONCEALING A MATERIAL FACT."
}