{
  "anumber": "A21201155",
  "id": "A21201155_0036",
  "page_index": 36,
  "resources": {
    "full_jpg": "https://dctn4zjpwgdwdiiy5odjv7o2se0bqgjb.lambda-url.us-east-1.on.aws/iiif/3/og-2023-kc-nara_A21201155_0036/full/max/0/default.jpg"
  },
  "fields": {
    "sex": {
      "ms_sex_llm_v1": "female"
    },
    "doctype": {
      "ms_doctype_v1": "form"
    },
    "form_title": {
      "ms_form_title_llm_v1": "BIOGRAPHIC INFORMATION, FORM G-325A (REV. 10-1-74)Y"
    },
    "countries": {
      "ms_countries_nlp_v1": [
        "Vietnam",
        "United States"
      ]
    },
    "years": {
      "ms_years_nlp_v1": [
        2023,
        1946,
        1915
      ]
    },
    "g325a": {
      "occupation": {
        "occupation_llm_v1": "['self-employed', ' unemployed in u.s.']"
      },
      "reason": {
        "reason_llm_v1": "Yes"
      },
      "nationality": {
        "nationality_llm_v1": "VIETNAMESE"
      }
    }
  },
  "is_g325a": true,
  "is_cert_naturalization": false,
  "full_text": "FORM G-325A (REV. 10-1-74)-Y Screened by NARA, 9/21/2023 Form Approved UNITED STATES DEPARTMENT OF JUSTICE LOS OMB No 43-R436 Immigration and Naturalization Service T/C 245 BIOGRAPHIC INFORMATION 2-12-19 (DATE) (Family name) (First name) (Middle name) MALE BIRTHDATE(Mo.-Day-Yr.) NATIONALITY ALIEN REGISTRATION NO. LE Chi Thi FEMALE 1-3-1915 VIETNAMESE (If any) A21-201-155 ALL OTHER NAMES USED (Including names by previous marriages) CITY AND COUNTRY OF BIRTH SOCIAL SECURITY NO. LE Thi Chi (name as on I-94 Form) Thai Binh, VIETNAM (If 586-40-8672 FAMILY NAME FIRST NAME DATE, CITY AND COUNTRY OF BIRTH(If known) CITY AND COUNTRY OF RESIDENCE LE Du Unknown, Ha-Noi, V-Nam Deceased FATHER NGUYEN Tinh Unknown, Ha-Noi, V-Nam Deceased MOTHER (Maiden name) HUSBAND (If none, so state) FAMILY NAME FIRST NAME BIRTHDATE CITY & COUNTRY OF BIRTH DATE OF MARRIAGE PLACE OF MARRIAGE OR (For wife, give maiden name) WIFE 8-1- Thai Binh, 10-9- Thai Binh, PHAM Ke 1915 Viet Nam. 1946 Viet Nam. FORMER HUSBANDS OR WIVES( none,so state) FAMILY NAME (For wife, give maiden name) FIRST NAME BIRTHDATE DATE & PLACE OF MARRIAGE DATE AND PLACE OF TERMINATION OF MARRIAGE NONE APPLICANT'S RESIDENCE LAST FIVE YEARS. LIST PRESENT ADDRESS FIRST. FROM TO STREET AND NUMBER CITY PROVINCE OR STATE COUNTRY MONTH YEAR MONTH YEAR -6562 Farinella Drive. Huntington Beach California U.S.A. 08 78 PRESENT TIME -7401 Weal Circle Huntington Beach California U.S.A. 06 77 08 78 -412 Phyllis Drive Killen Texas U.S.A. 05 75 06 77 -Fort Chaffee Refugee Camp Arkansas U.S.A. 05 75 05 75 -Guam Island U.S.A. 04 75 05 75 -467/18 Phan Thanh Gian st Saigon VIETNAM 11 55 04 75 APPLICANT'S LAST ADDRESS OUTSIDE THE UNITED STATES OF MORE THAN ONE YEAR FROM TO STREET AND NUMBER CITY PROVINCE OR STATE COUNTRY MONTH YEAR MONTH YEAR -467/18 Phan Thanh Gian st Saigon VIETNAM 11 55 04 75 APPLICANT'S EMPLOYMENT LAST FIVE YEARS. (IF NONE, so STATE.) LIST PRESENT EMPLOYMENT FIRST. FROM TO FULL NAME AND ADDRESS OF EMPLOYER OCCUPATION (SPECIFY) MONTH YEAR MONTH YEAR -Groceries Merchant, Saigon, VIETNAM Self-employed ? 55 PRESENT NEA Unemployed in U.S. Show below last occupation abroad if not shown above. (Include all information requested above.) Groceries Merchant, Saigan, Viet Nam Self-employed ? 55 04 75 THIS FORM IS SUBMITTED IN CONNECTION WITH APPLICATION FOR: SIGNATURE OF APPLICANT OR PETITIONER DATE NATURALIZATION ADJUSTMENT OF STATUS OTHER (SPECIFY): clue 01-23-79 IF YOUR NATIVE ALPHABET IS IN OTHER THAN ROMAN LETTERS. WRITE YOUR NAME IN YOUR NATIVE ALPHABET IN THIS SPACE: Are all copies legible? Yes PENALTIES SEVERE PENALTIES ARE PROVIDED BY LAW FOR KNOWINGLY AND WILLFULLY FALSIFYING OR CONCEALING A MATERIAL FACT."
}