{
  "anumber": "A21202116",
  "id": "A21202116_0025",
  "page_index": 25,
  "resources": {
    "full_jpg": "https://dctn4zjpwgdwdiiy5odjv7o2se0bqgjb.lambda-url.us-east-1.on.aws/iiif/3/og-2023-kc-nara_A21202116_0025/full/max/0/default.jpg"
  },
  "fields": {
    "sex": {
      "ms_sex_llm_v1": "female"
    },
    "doctype": {
      "ms_doctype_v1": "form"
    },
    "form_title": {
      "ms_form_title_llm_v1": "BIOGRAPHIC INFORMATION, FORM G-325 ( (REV. 5-1-79)"
    },
    "countries": {
      "ms_countries_nlp_v1": [
        "Vietnam",
        "United States"
      ]
    },
    "years": {
      "ms_years_nlp_v1": [
        2023,
        1933,
        1913
      ]
    },
    "g325a": {
      "occupation": {
        "occupation_llm_v1": "['retired']"
      },
      "reason": {
        "reason_llm_v1": "NATURALIZATION"
      },
      "nationality": {
        "nationality_llm_v1": "Vietnam"
      }
    }
  },
  "is_g325a": true,
  "is_cert_naturalization": false,
  "full_text": "FORM G-325 (REV. 5-1-79)Y Screened by NARA, 7/28/2023 BIOGRAPHIC UNITED STATES DEPARTMENT OF JUSTICE Form Approved OMB No. 43-R436 INFORMATION Immigration and Naturalization Service (Family name) (First name) (Middle name) MALE BIRTHDATE (Mo.-Day-Yr.) NATIONALITY FILE NUMBER TRAN CHINH VAN FEMALE 7-14-1915 Vietnam A-21-202-116 ALL OTHER NAMES USED (Including names by previous marriages) CITY AND COUNTRY OF BIRTH SOCIAL SECURITY NO. none Nam Dinh - Vietnam (If any) 586-40-7829 FAMILY NAME FIRST NAME DATE. CITY AND COUNTRY OF BIRTH (If known) CITY AND COUNTRY OF RESIDENCE FATHER NGUYEN TRAN THUY LY N/A N/A } Vietnam Deceased in Vietnam MOTHER (Maiden name) HUSBAND (If none. SO state) FAMILY NAME FIRST NAME BIRTHDATE CITY & COUNTRY OF BIRTH DATE OF MARRIAGE PLACE OF MARRIAGE OR (For wife. give maiden name) WIFE LAM DOM 1913 Nam Dinh Nam Dinh vietnam 1933 VietNam FORMER HUSBANDS OR WIVES III none, SO state) FAMILY NAME (For wife, give maiden name) FIRST NAME BIRTHDATE DATE AND PLACE OF MARRIAGE DATE AND PLACE OF TERMINATION OF MARRIAGE none APPLICANT'S RESIDENCE LAST FIVE YEARS. LIST PRESENT ADDRESS FIRST. FROM TO STREET AND NUMBER CITY PROVINCE OR STATE COUNTRY MONTH YEAR MONTH YEAR 752 S. Mariposa #205 L.A CA USA / 80 PRESENT TIME 1106 FeRRY La Fayette Indiana USA 6 75 / 80 APPLICANT'S LAST ADDRESS OUTSIDE THE UNITED STATES OF MORE THAN ONE YEAR. FROM TO STREET AND NUMBER CITY PROVINCE OR STATE COUNTRY MONTH YEAR MONTH YEAR 209/23 Cuxa Kien Thiet SAIGON vietnam / 70 5 75 APPLICANT'S EMPLOYMENT LAST FIVE YEARS. (IF NONE, SO STATE.) LIST PRESENT EMPLOYMENT FIRST. FROM TO FULL NAME AND ADDRESS OF EMPLOYER OCCUPATION (Specify) MONTH YEAR MONTH YEAR RETIRED PRESENT TIME Show below last occupation abroad if not shown above. (Include all information requested above.) THIS FORM IS SUBMITTED IN CONNECTION WITH APPLICATION FOR: NATURALIZATION OTHER (SPECIFY) STATUS AS PERMANENT RESIDENT SIGNATURE fullive OF APPLICANT DATE 7-15-82 IF YOUR NATIVE ALPHABET IS IN OTHER THAN ROMAN LETTERS, WRITE YOUR NAME IN YOUR NATIVE ALPHABET IN THIS SPACE: Are all copies legible? Yes PENALTIES: SEVERE PENALTIES ARE PROVIDED BY LAW FOR KNOWINGLY AND WILLFULLY FALSIFYING OR CONCEALING A MATERIAL FACT. APPLICANT: BE SURE TO PUT YOUR NAME AND ALIEN REGISTRATION NUMBER IN THE BOX OUTLINED BY HEAVY BORDER BELOW. COMPLETE THIS BOX (Family name) (Given name) (Middle name) (Alien registration number) TRAN , CHiNH VAN A21-202-116 (OTHER AGENCY USE) INS USE (Office of Origin) OFFICE CODE: TYPE OF CASE: DATE: FORM G-325 [1] Ident."
}