{
  "anumber": "A21203763",
  "id": "A21203763_0034",
  "page_index": 34,
  "resources": {
    "full_jpg": "https://dctn4zjpwgdwdiiy5odjv7o2se0bqgjb.lambda-url.us-east-1.on.aws/iiif/3/og-2023-kc-nara_A21203763_0034/full/max/0/default.jpg"
  },
  "fields": {
    "sex": {
      "ms_sex_llm_v1": "female"
    },
    "doctype": {
      "ms_doctype_v1": "form"
    },
    "form_title": {
      "ms_form_title_llm_v1": "Biographic Information, G-325A"
    },
    "countries": {
      "ms_countries_nlp_v1": [
        "Vietnam",
        "China",
        "United States"
      ]
    },
    "years": {
      "ms_years_nlp_v1": [
        1975,
        1956,
        2023,
        1926,
        1976,
        1961,
        1950
      ]
    },
    "g325a": {
      "occupation": {
        "occupation_llm_v1": "[' retired', 'owner']"
      },
      "reason": {
        "reason_llm_v1": "Naturalization"
      },
      "nationality": {
        "nationality_llm_v1": "VIETNAM"
      }
    }
  },
  "is_g325a": true,
  "is_cert_naturalization": false,
  "full_text": "RM G-325A (REV. 10-1-74) Y Screened by NARA, 9/21/2023 LOS Form Approved UNITED STATES DEPARTMENT OF JUSTICE T/C R/P OMB No. 43-R436 Immigration and Naturalization Service BIOGRAPHIC 6-1-76 INFORMATION (DATE) (Family name) (First name) (Middle name) MALE BIRTHDATE(Mo.-Day-Yr.) NATIONALITY ALIEN REGISTRATION NO. THIEL BANH FEMALE 01-1-15 ViETNAM (If any) A 1 / 203 763 ALL OTHER NAMES USED (Including names by previous marriages) CITY AND COUNTRY OF BIRTH SOCIAL SECURITY NO. CANTON CHINA (If (P6-32-8966 FAMILY NAME FIRST NAME DATE, CITY AND COUNTRY OF BIRTH(If known) CITY AND COUNTRY OF RESIDENCE THIEU KY CANTON, CHINA CHINA FATHER LUN MOTHER (Maiden name) THI Not number HUSBAND (If none, so state) FAMILY NAME FIRST NAME BIRTHDATE CITY & COUNTRY OF BIRTH DATE OF MARRIAGE PLACE OF MARRIAGE OR (For wife, give maiden name) WIFE THiEL , NG LIYEN HAI 1926 SAIGON, ViETNAY 1956 ViETNAM FORMER HUSBANDS OR WIVES(if none,s state) FAMILY NAME (For wife, give maiden name) FIRST NAME BIRTHDATE DATE & PLACE OF MARRIAGE DATE AND PLACE OF TERMINATION OF MARRIAGE NONE APPLICANT'S RESIDENCE LAST FIVE YEARS. LIST PRESENT ADDRESS FIRST. FROM TO STREET AND NUMBER CITY PROVINCE OR STATE COUNTRY MONTH YEAR MONTH YEAR 1242 N. Westmoreland L.A. CACiF U.S.A AUG 1975 PRESENT TIME 636. ALPHINE ST #2 L.A. - Nov 75 Nov 1975 Now APPLICANT'S LAST ADDRESS OUTSIDE THE UNITED STATES OF MORE THAN ONE YEAR FROM TO STREET AND NUMBER CITY PROVINCE OR STATE COUNTRY MONTH YEAR MONTH YEAR 762, TRAN -HUNG- CHO-LON SAIGON VIETNAM Now 1961 Apr 1975 APPLICANT'S EMPLOYMENT LAST FIVE YEARS. (IF NONE, so STATE.) LIST PRESENT EMPLOYMENT FIRST. FROM TO FULL NAME AND ADDRESS OF EMPLOYER OCCUPATION (SPECIFY) MONTH YEAR MONTH YEAR HONG PHAT CONG TY ETS HONG THANH OWNER May 1950 PRESENT TIME 762, BD TRAN HUNG D40 SAIGON, ViETNAM APR 1975 THANH PHAT CONG TY Show below last occupation abroad if not shown above. (Include all information requested above.) THIS FORM IS SUBMITTED IN CONNECTION WITH APPLICATION FOR: SIGNATURE OF APPLICANT OR PETITIONER DATE NATURALIZATION ADJUSTMENT OF STATUS OTHER (SPECIFY): TF YOUR NATIVE ALPHABET IS LN OTHER THAN ROMAN LETTERS. WRITE TOUR-NAME IN YOUR NATIVE ALPHABET IN THIS May-26-1976 SPACE: Are all copies legible? Yes PENALTIES: SEVERE PENALTIES ARE PROVIDED BY LAW FOR KNOWINGLY AND WILLFULLY FALSIFYING OR CONCEALING A MATERIAL FACT. APPLICANT: BE SURE TO PUT YOUR NAME AND ALIEN REGISTRATION NUMBER IN THE BOX OUTLINED BY HEAVY BORDER BELOW. COMPLETE THIS BOX (Family name) (Given name) (Middle name) (Alien registration number) THIEV,-BANH -421-203-763 (OTHER AGENCY USE) INS USE (Office of Origin) OFFICE CODE: TYPE OF CASE: DATE: LOS T/C - R/P 6-1-76 (DATE) I-570 Special (1) Ident. FORM G-325A"
}