{
  "anumber": "A21202301",
  "id": "A21202301_0040",
  "page_index": 40,
  "resources": {
    "full_jpg": "https://dctn4zjpwgdwdiiy5odjv7o2se0bqgjb.lambda-url.us-east-1.on.aws/iiif/3/og-2023-kc-nara_A21202301_0040/full/max/0/default.jpg"
  },
  "fields": {
    "sex": {
      "ms_sex_llm_v1": "female"
    },
    "doctype": {
      "ms_doctype_v1": "form"
    },
    "form_title": {
      "ms_form_title_llm_v1": "Biographic Information, G-325 ( (REV. 5-1-79)"
    },
    "countries": {
      "ms_countries_nlp_v1": [
        "Vietnam",
        "United States"
      ]
    },
    "years": {
      "ms_years_nlp_v1": [
        1895,
        2023,
        1896,
        1983
      ]
    },
    "g325a": {
      "occupation": {
        "occupation_llm_v1": "['electronic technician', ' saigon', ' night man', ' nbc news']"
      },
      "reason": {
        "reason_llm_v1": "NATURALIZATION"
      },
      "nationality": {
        "nationality_llm_v1": "VIETNAM"
      }
    }
  },
  "is_g325a": true,
  "is_cert_naturalization": false,
  "full_text": "Screened by NARA, 8/22/2023 FORM G-325 (REV. 5-1-79)Y UNITED STATES DEPARTMENT OF JUSTICE Form Approved BIOGRAPHIC OMB No. 43-R436 Immigration and Naturalization Service INFORMATION (Family same) (First name) (Middle name) MALE BIRTHDATE (Mo.-Day-Yr.) NATIONALITY FILE NUMBER DO TOAI DINH FEMALE 06-22-15 VIET NAM A 21202301 ALL. OTHER NAMES USED (Including names by previous marriages) CITY AND COUNTRY OF BIRTH SOCIAL SECURITY NO. NONE HANOI, VIET NAM (If any) 586-40-7362 FAMILY NAME FIRST NAME DATE, CITY AND COUNTRY OF BIRTH (If known) CITY AND COUNTRY OF RESIDENCE FATHER DO RUAT 1895 HANOI VIET NAM (DECEASED) MOTHER (Maiden name) NGUYEN LINH 1896 HADONG VIET NAM HUSBAND (If none, so state) FAMILY NAME FIRST NAME BIRTHDATE CITY & COUNTRY OF BIRTH DATE OF MARRIAGE PLACE OF MARRIAGE OR (For wife, give maiden name) WIFE HA HOP 10-19-19 NAMDINH, 10-20-38 NAM DINH, VIET NAM VIET NAM FORMER HUSBANDS OR WIVES (If none, so state) FAMILY NAME (For wife, give maiden name) FIRST NAME BIRTHDATE DATE AND PLACE OF MARRIAGE DATE AND PLACE OF TERMINATION OF MARRIAGE NONE APPLICANT'S RESIDENCE LAST FIVE YEARS. LIST PRESENT ADDRESS FIRST. FROM TO STREET AND NUMBER CITY PROVINCE OR STATE COUNTRY MONTH YEAR MONTH YEAR 3820 W. CLARK AVE BURBANK CALIF. USA 10 75 PRESENT TIME APPLICANT'S LAST ADDRESS OUTSIDE THE UNITED STATES OF MORE THAN ONE YEAR. FROM TO STREET AND NUMBER CITY PROVINCE OR STATE COUNTRY MONTH YEAR MONTH YEAR NONE APPLICANT'S EMPLOYMENT LAST FIVE YEARS. (IF NONE, so STATE.) LIST PRESENT EMPLOYMENT FIRST. FROM TO FULL NAME AND ADDRESS OF EMPLOYER OCCUPATION (Specify) MONTH YEAR MONTH YEAR CERWIN VEGA 12250 MONTAGUE ST. ARLETA CA. RUDIO TECHNICIAN 06 16 PRESENT TIME Show below last occupation abroad if not shown above. (Include all information requested above.) ELECTRONIC TECHNICIAN, BC NEWS SAIGON NIGHT MAN 12 73 04 75 THIS FORM IS SUBMITTED IN CONNECTION WITH APPLICATION FOR: SIGNATURE OF APPLICANT DATE NATURALIZATION OTHER (SPECIFY) Zoai Dinh Do 11-04-81 STATUS AS PERMANENT RESIDENT IF YOUR NATIVE ALPHABET IS IN OTHER THAN ROMAN LETTERS. WRITE YOUR NAME IN YOUR NATIVE ALPHABET IN THIS SPACE: Are all copies legible? Yes PENALTIES: SEVERE PENALTIES ARE PROVIDED BY LAW FOR KNOWINGLY AND WILLFULLY FALSIFYING OR CONCEALING A MATERIAL FACT. APPLICANT: BE SURE TO PUT YOUR NAME AND ALIEN REGISTRATION NUMBER IN THE BOX OUTLINED BY HEAVY BORDER BELOW. COMPLETE THIS BOX (Family name) (Given name) (Middle name) (Allen registration number) DO TOAI DINH A21202301 (OTHER AGENCY USE) INS USE (Office of Origin) OFFICE CODE: TYPE OF CASE: DATE: LOS CIE B 400 Net 1983 [1] Ident. FORM G-325"
}