{
  "anumber": "A21203763",
  "id": "A21203763_0025",
  "page_index": 25,
  "resources": {
    "full_jpg": "https://dctn4zjpwgdwdiiy5odjv7o2se0bqgjb.lambda-url.us-east-1.on.aws/iiif/3/og-2023-kc-nara_A21203763_0025/full/max/0/default.jpg"
  },
  "fields": {
    "sex": {
      "ms_sex_llm_v1": "male"
    },
    "doctype": {
      "ms_doctype_v1": "form"
    },
    "form_title": {
      "ms_form_title_llm_v1": "BIOGRAPHIC INFORMATION, FORM G-325A ( (REV. 10-1-74) Y"
    },
    "countries": {
      "ms_countries_nlp_v1": [
        "Vietnam",
        "China",
        "United States"
      ]
    },
    "years": {
      "ms_years_nlp_v1": [
        1975,
        1948,
        2023,
        1978,
        1976,
        1977,
        1915
      ]
    },
    "g325a": {
      "occupation": {
        "occupation_llm_v1": "['self-employed']"
      },
      "reason": {
        "reason_llm_v1": "NATURALIZATION"
      },
      "nationality": {
        "nationality_llm_v1": "Vietnam"
      }
    }
  },
  "is_g325a": true,
  "is_cert_naturalization": false,
  "full_text": "FORM G-325A (REV. 10-1-74) Screened by NARA, 9/21/2023 Form Approved UNITED STATES DEPARTMENT OF JUSTICE LOS OMB No. 43-R436 BIOGRAPHIC Immigration and Naturalization Service. T/C = 245 INFORMATION JAN 28 1978 (DATE) (Family name) (First name) (Middle name) MALE BIRTHDATE(Mo.-Day-Yr.) NATIONALITY ALIEN REGISTRATION NO. THIEU, BANH FEMALE 01-01-1915 Vietnam (If any) As 21-203-763 ALL OTHER NAMES USED (Including names by previous marriages) CITY AND COUNTRY OF BIRTH SOCIAL SECURITY NO. NONE QUANG DONG CHINA (Santon) (If any) 586-32-8966 FAMILY NAME FIRST NAME DATE, CITY AND COUNTRY OF BIRTH(If known) CITY AND COUNTRY OF RESIDENCE. THIEU, CANTON CHINA FATHER MOTHER (Maiden name) LUU, THI CANTON CHINA HUSBAND (If none, so state) FAMILY NAME FIRST NAME BIRTHDATE CITY & COUNTRY OF BIRTH DATE OF MARRIAGE PLACE OF MARRIAGE OR (For wife, give maiden name) WIFE NGUYEN, HAI 01-01-26 Dietnam 1948 SAIGON FORMER HUSBANDS OR WIVES(if none, so state) FAMILY NAME (For wife, give maiden name) FIRST NAME BIRTHDATE DATE & PLACE OF MARRIAGE DATE AND PLACE OF TERMINATION OF MARRIAGE NONE APPLICANT'S RESIDENCE LAST FIVE YEARS. LIST PRESENT ADDRESS FIRST. FROM TO STREET AND NUMBER CITY PROVINCE OR STATE COUNTRY MONTH YEAR MONTH YEAR 719 N. BunkerfillarpH13 C,A. C, A. U.S.A. 6 1977 PRESENT TIME 636 Alsime street#5 L.A. C. A. U.S.A. 11 1975 6 1976 1242N Westmore and L.A. C. A. U.S.A. 8 1975 11 1975 393 TW,115ths THomother L.A. C. A. U.S.A. 7 1975 8 1975 762 TRAN-HUNG-DAO CHOLON VN 11 61 4 75 APPLICANT'S LAST ADDRESS OUTSIDE THE UNITED STATES OF MORE THAN ONE YEAR FROM TO STREET AND NUMBER CITY PROVINCE OR STATE COUNTRY MONTH YEAR MONTH YEAR 762 TRAN HUNG DAO CHOLON VN 11 61 4 75 APPLICANT'S EMPLOYMENT LAST FIVE YEARS. (IF NONE, so STATE.) LIST PRESENT EMPLOYMENT FIRST. FROM TO FULL NAME AND ADDRESS OF EMPLOYER OCCUPATION (SPECIFY) MONTH YEAR MONTH YEAR Unemployed 7 1975 PRESENT TIME TAPHACO bo(vietnom) self employed 5 61 7 75 Show below last occupation abroad if not shown above. (Include all information requested above.) THIS FORM IS SUBMITTED IN CONNECTION WITH APPLICATION FOR: SIGNATURE OF APPLICANT OR PETITIONER DATE 12-14-77 NATURALIZATION ADJUSTMENT OF STATUS OTHER (SPECIFY): IF YOUR NATIVE ALPHABET is OTHER WRITE YOUR NAME IN YOUR NATIVE ALPHABET IN THIS SPACE: Are all copies legible? Yes PENALTIES: SEVERE PENALTIES ARE PROVIDED BY LAW FOR KNOWINGLY AND WILLFULLY FALSIFYING OR CONCEALING A MATERIAL FACT."
}