{
  "anumber": "A21204721",
  "id": "A21204721_0030",
  "page_index": 30,
  "resources": {
    "full_jpg": "https://dctn4zjpwgdwdiiy5odjv7o2se0bqgjb.lambda-url.us-east-1.on.aws/iiif/3/og-2023-kc-nara_A21204721_0030/full/max/0/default.jpg"
  },
  "fields": {
    "sex": {
      "ms_sex_llm_v1": "female"
    },
    "doctype": {
      "ms_doctype_v1": "letter"
    },
    "countries": {
      "ms_countries_nlp_v1": [
        "Vietnam",
        "United States"
      ]
    },
    "years": {
      "ms_years_nlp_v1": [
        1996,
        2023,
        1915
      ]
    },
    "certificate_naturalization": {
      "complexion": {
        "complexion_llm_v1": "N.A"
      },
      "marital_status": {
        "marital_status_llm_v1": "WIDOWED"
      },
      "year_naturalization": {
        "year_naturalization_llm_v1": 1996
      },
      "residence_naturlization": {
        "residence_naturlization_llm_v1": "Buena Park, CA"
      }
    }
  },
  "is_g325a": false,
  "is_cert_naturalization": true,
  "full_text": "Screened by NARA, 8/25/2023 CA No. 23258873 0 VEN D Personal description of holder INS RegistrationNo. A21 204 721 as of date of naturalization: I certify that the description given is true, and that the photograph affixced Date of birth: JANUARY 1, 1915 hereto is a likeness of me. Sex: FEMALE Height: 5 feet 00 inches Complete and true signature of holder) Maritalstatus: WIDOWED Be it known that, pursuant to an application filed with the Attorney General Country of former nationality: at: LOS ANGELES, CA VIETNAM The Attorney General having found that: THAN THI DO then residing in the United States, intends to reside in the United States when so- required by the Naturalization Laws of the United States, and had in all other respects complied with the applicable provisions of such naturalization laws and was entitled to be admitted to citizenship, such person having taken the oath of all giance in a ceremony conducted by the U.S. DISTRICT COURT FOR THE CENTRAL DIST. OF CALIFORNIA at: BUENA PARK, CA on: OCTOBER 18, 1996 that such person is admitted as a citizen of the United States of America. IT IS PUNISHABLE BY U. S. LAW TO COPY. PRINT OR PHOTOGRAPH THIS CERTIFICATE Daris missuer WITHOUT LAWFUL AUTHORITY. Commissioner of Immigration and Naturalization USIVE FORM N 550 REV. 6.91"
}