{
  "anumber": "A21296599",
  "id": "A21296599_0040",
  "page_index": 40,
  "resources": {
    "full_jpg": "https://dctn4zjpwgdwdiiy5odjv7o2se0bqgjb.lambda-url.us-east-1.on.aws/iiif/3/og-2023-kc-nara_A21296599_0040/full/max/0/default.jpg"
  },
  "fields": {
    "sex": {
      "ms_sex_llm_v1": "female"
    },
    "doctype": {
      "ms_doctype_v1": "form"
    },
    "form_title": {
      "ms_form_title_llm_v1": "BIOGRAPHIC INFORMATION, G-325A ( (REV. 10-1-74) Y"
    },
    "countries": {
      "ms_countries_nlp_v1": [
        "Vietnam",
        "United States"
      ]
    },
    "years": {
      "ms_years_nlp_v1": [
        1916,
        1975,
        1943,
        1960,
        1886,
        1887,
        2023,
        1977,
        1915
      ]
    },
    "g325a": {
      "occupation": {
        "occupation_llm_v1": "['custom inspector']"
      },
      "reason": {
        "reason_llm_v1": "Naturalization"
      },
      "nationality": {
        "nationality_llm_v1": "VIETNAMESE"
      }
    }
  },
  "is_g325a": true,
  "is_cert_naturalization": false,
  "full_text": "FORM G-325A (REV. 10-1-74) Y Screened by NARA 8/18/2023 Form Approved UNITED STATES DEPAR AENT OF JUSTICE OMB No. 43-R436 Immigration and Naturalization Service BIOGRAPHIC INFORMATION (Family name) (First name) (Middle name) MALE BIRTHDATE(Mo.-Day-Yr.) NATIONALITY ALIEN REGISTRAT ON NO. HULYNH TRIEIS THUAN FEMALE 10/12/1915 VIETNAMESE (If any) A21-296-599 ALL OTHER NAMES USED (Including names by previous marriages) CITY AND COUNTRY OF BIRTH SOCIAL SECURITY NO. N/A HAIPHONG VIETNAM (If any) 586-36-1969 FAMILY NAME FIRST NAME DATE, CITY AND COUNTRY OF BIRTH(If known) CITY AND COUNTRY OF RESIDENCE HUYNH NAM 05/10/1886 HAi PHONG V.N. FATHER MOTHER (Maiden name) TANG THONG 07/15/1887 HAI PHONE V.N. HUSBAND (If none, so state) FAMILY NAME FIRST NAME BIRTHDATE CITY & COUNTRY OF BIRTH DATE OF MARRIAGE PLACE OF MARRIAGE OR (For wife, give maiden name) WIFE 10/05 HAI PHONG 08/19 HAI PHONG LIJONG ANH 1916 VIET NAM 1943 VIET NAM NONE - FORMER HUSBANDS OR WIVES(if none, so state) - - - FAMILY NAME (For wife, give maiden name) FIRST NAME BIRTHDATE DATE & PLACE OF MARRIAGE DATE AND PLACE OF TERMINATION OF MARRIAGE N/A N/A APPLICANT'S RESIDENCE LAST FIVE YEARS. LIST PRESENT ADDRESS FIRST. FROM TO STREET AND NUMBER CITY PROVINCE OR STATE COUNTRY MONTH YEAR MONTH YEAR 37 MOODY DRIVE SANDWICH MASS. U.S. A. JILLY 1977 PRESENT TIME 16 APPLEBY ROAD SALEM MASS. U.S. A. ALLGILST 1975 JULY 1977 12 POPE ST APT Azil SALEM MASS. U.S. A. JHNE 1975 ALLGIST 1975 CAMP PENDLETON CALIFORNIA H.S.A MAY 1975 JUNE 1975 12z TAN HUNG( CHOLON) SAIGON VIETNAM MAY 1960 APRIL 1975 APPLICANT'S LAST ADDRESS OUTSIDE THE UNITED STATES OF MORE THAN ONE YEAR FROM TO STREET AND NUMBER CITY PROVINCE OR STATE COUNTRY MONTH YEAR MONTH YEAR 122 TAN HHNG (CHOLON) SAIGON VIETNAM MAY 1960 APRIL 1975 APPLICANT'S EMPLOYMENT LAST FIVE YEARS. (IF NONE, so STATE.) LIST PRESENT EMPLOYMENT FIRST. FROM TO FULL NAME AND ADDRESS OF EMPLOYER OCCUPATION (SPECIFY) MONTH YEAR MONTH YEAR NONE - JANELARY 1975 PRESENT TIME SAIGON PORT CUSTOM SAIGON, VIETNAM CUSTOM MAY 1960 JANUARY 1975 INSPECTOR Show below last occupation abroad if not shown above. (Include all information requested above.) THIS FORM IS SUBMITTED IN CONNECTION WITH APPLICATION FOR: SIGNATURE OF APPLICANT OR PETITIONER DATE NATURALIZATION ADJUSTMENT OF STATUS OTHER (SPECIFY): Then T Huynh July 161978 IF YOUR NATIVE ALPHABET IS IN OTHER THAN ROMAN LETTERS. WRITE YOUR NAME IN YOUR NATIVE ALPHABET IN THIS SPACE: Are all copies legible? Yes PENALTIES: SEVERE PENALTIES ARE PROVIDED BY LAW FOR KNOWINGLY AND WILLFULLY FALSIFYING OR CONCEALING A MATERIAL FACT."
}