{
	"anumber": "A21206025",
	"id": "A21206025_0061",
	"page_index": 61,
	"resources": {
		"full_jpg": "https://dctn4zjpwgdwdiiy5odjv7o2se0bqgjb.lambda-url.us-east-1.on.aws/iiif/3/og-2023-kc-nara_A21206025_0061/full/max/0/default.jpg"
	},
	"fields": {
		"sex": {
			"ms_sex_llm_v1": "female"
		},
		"doctype": {
			"ms_doctype_v1": "form"
		},
		"form_title": {
			"ms_form_title_llm_v1": "APPLICATION BY INDOCHINESE REFUGEE FOR PERMANENT RESIDENCE"
		},
		"countries": {
			"ms_countries_nlp_v1": ["Cambodia", "Vietnam", "United States", "Laos"]
		},
		"years": {
			"ms_years_nlp_v1": [1977, 2023, 1975, 1979]
		}
	},
	"is_g325a": false,
	"is_cert_naturalization": false,
	"full_text": "IMPORTANT Please read ched instructions By NARAC 11/28/2023 lewriter or print in block letters with ball-point pen. Do not leave any question answered. When appropriate insert \"none\" or \"not applicable\". If you need more space to answer fully any question on this form use a separate sheet of paper this size, and identify each answer with the number of the corresponding question. APPLICATION BY INDOCHINESE REFUGEE FOR PERMANENT RESIDENCE Form Approved OMB No. 43-R0595 DATE RECEIVED File Number Applicant for benefits of SECTION 101 OF THE ACT OF Section 101 of the Act of October 28, 1977 OCTOBER 28, 1977 Section 103 of the Act of October 28, 1977 Section 104 of the Act of October 28, 1977 DO NOT WRITE ABOVE THIS LINE. SEE INSTRUCTIONS BEFORE FILLING IN APPLICATION. IF YOU NEED MORE SPACE TO ANSWER FULLY ANY QUESTION ON THIS FORM, USE A SEPARATE SHEET AND IDENTIFY EACH ANSWER WITH THE NUMBER OF THE CORRESPONDING QUESTION. PRINT IN BLOCK LETTERS COMPLETE ONLY ONE OF THE FOLLOWING (1A, 1B, OR 1C 1.A. I hereby apply to become a lawful permanent resident alien on the following basis: I am a native or citizen of Vietnam, Laos, or Cambodia and have been physically present in the United States for at least two years and: (1) was paroled into the United States as a refugee from those countries subsequent to March 31, 1975, but prior to January 1, 1979; or (2) was inspected and admitted or paroled into the United States on or before March 31, 1975, and was physically present in the United States on March 31, 1975. 1.B. I hereby apply to have my admission for permanent residence recorded as of March 31, 1975 or the date of my arrival in the United States, whichever date is later. I was lawfully admitted for permanent residence prior to October 28, 1977. I am a native or citizen of Vietnam, Laos, or Cambodia and I have been physically present in the United States for at least two years and I am the spouse minor unmarried child of a native or citizen of Vietnam, Laos, or Cambodia and such relationship existed on March 31, 1975 or the date upon which my spouse parent was inspected and admitted or paroled into the United States. 1.C. I hereby apply to become a lawful permanent resident alien on the following basis: I am not a native or citizen of Vietnam, Laos, or Cambodia but I have been physically present in the United States for at least two years and I am the spouse minor unmarried child of a native or citizen of Vietnam, Laos, or Cambodia and such relationship existed: (Check whichever date is later) on March 31, 1975, or the date on which my spouse or parent was paroled into the United States as a refugee. 2. My name is (Family Name) (First/Given Name) (Middle Name) SEX Male Female LE THIN THI 2A. Name which you were admitted to the United States (if different from above) N/A 4. Have you ever applied for permanent res- idence status in the United States? 3. I reside in the United States at: (No. & Street) (Apt. No.) (City & State) (Zip Code) Yes No (If \"Yes\", give date and 825 CALLE HAYA Thousand Oaks CA 91360 place of filing and final disposition.) 5. Alien registration No. 6. I am now a citizen of (Country) 7. Date of Birth A-21-206-025 VIET NAM 6-21-15 8. Place of Birth (City or Town) (County, Province, or State) (Country) HANOI VIET NAM 9. Name as appears on nonimmigrant document Form My I-94 permit number is: I-94 LE THIN THI 064 61 04 10. My last arrival in the United States occurred on: At the Port of (City, State) DATE: (Month, Day, Year) 6-13-75 SND(P) 11. I arrived by (Name of vessel or other means of travel) as a (Visitor, student, U.S. citizen, stowaway, immigrant, parolee, etc.) litary airlift Parolee 12. I was was not 13. My nonimmigrant visa, number inspected N/A was issued by the U.S. Consul on (Month, Day, Year) at (City, Country) 14. I have been married times, including my present marriage, if now married. (If you are now married give the following) A. Number of times my husband or wife has been married. B. Name of husband or wife (Wife's maiden name) C. My husband or wife resides with me apart from me at Address (Apt. No.) (No. & Street) (Town or City) (Province or State) (Country) deceased 15. I have have not been absent from the United States during the past two years. FORM I-485 C RECEIVED TRANS. IN RET'D TRANS. COMPLETED (Page 1) OUT (10-15-77)"
}
