{
  "anumber": "A21235980",
  "id": "A21235980_0019",
  "page_index": 19,
  "resources": {
    "full_jpg": "https://dctn4zjpwgdwdiiy5odjv7o2se0bqgjb.lambda-url.us-east-1.on.aws/iiif/3/og-2023-kc-nara_A21235980_0019/full/max/0/default.jpg"
  },
  "fields": {
    "sex": {
      "ms_sex_llm_v1": "female"
    },
    "doctype": {
      "ms_doctype_v1": "form"
    },
    "form_title": {
      "ms_form_title_llm_v1": "Biographic Information, G-325A ( (REV. 10-1-74)"
    },
    "countries": {
      "ms_countries_nlp_v1": [
        "Vietnam",
        "United States"
      ]
    },
    "years": {
      "ms_years_nlp_v1": [
        2023
      ]
    },
    "g325a": {
      "occupation": {
        "occupation_llm_v1": "['none']"
      },
      "reason": {
        "reason_llm_v1": "ADJUSTMENT OF STATUS"
      },
      "nationality": {
        "nationality_llm_v1": "VIETNAM"
      }
    }
  },
  "is_g325a": true,
  "is_cert_naturalization": false,
  "full_text": "Screened by NARA, 9/21/2023 INSTRUCTIONS: USE TYPEWRITER. BE SURE ALL COPIES ARE LEGIBLE. Failure to answer fully -Il questions delays action. Do Not Remove Carbons: If typewriter is not availa print heavily in block letters with ball-point pen. # U.S. GOVERNMENT PRINTING OFFICE 1975-574-025 FORM G-325A (REV. 10-1-74) Y Form Approved UNITED STATES DEPARTMENT OF JUSTICE OMB No. 43-R436 Immigration and Naturalization Service BIOGRAPHIC (DATE) INFORMATION LZ (Family name) (First name) (Middle name) MALE BIRTHDATE(Mo.-Day-Yr.) NATIONALITY ALIEN REGISTRATION NO. TRAN MAUNGOC TH FEMALE 01/01/15 ViETNAM (If any) A21235980 ALL OTHER NAMES USED (Including names by previous marriages) CITY AND COUNTRY OF BIRTH SOCIAL SECURITY NO. NONE NAM DiNH ViETNAM (If any) 586-32-6996 FAMILY NAME FIRST NAME DATE, CITY AND COUNTRY OF BIRTH(If known) COUNTRY OF RESIDENCE. TRAN VAN UNK V.N. FATHER DECEASED MOTHER (Maiden name) NGUYEN TUNG -4- DECEASED HUSBAND (If none, so state) FAMILY NAME FIRST NAME BIRTHDATE CITY & COUNTRY OF BIRTH DATE OF MARRIAGE PLACE OF MARRIAGE OR (For wife, give maiden name) WIFE N/A FORMER HUSBANDS OR WIVES(if none, so state) FAMILY NAME (For wife, give maiden name) FIRST NAME BIRTHDATE DATE & PLACE OF MARRIAGE DATE AND PLACE OF TERMINATION OF MARRIAGE PHAM 1902 1932 V.N CLONG 2/1/50 DECEASED V.N APPLICANT'S RESIDENCE LAST FIVE YEARS. LIST PRESENT ADDRESS FIRST. FROM TO STREET AND NUMBER #19 CITY PROVINCE OR STATE COUNTRY MONTH YEAR MONTH YEAR 18449 COLLiNS ST. TARZANA CA U SA 6 75 PRESENT TIME 10 2 TRAN QUANG D'EU SAiGON V.N. 19 55 4 75 APPLICANT'S LAST ADDRESS OUTSIDE THE UNITED STATES OF MORE THAN ONE YEAR FROM TO STREET AND NUMBER CITY PROVINCE OR STATE COUNTRY MONTH YEAR MONTH YEAR 102 TRAN QUANG DiEU SAIGON V.N. 19 55 4 75 APPLICANT'S EMPLOYMENT LAST FIVE YEARS. (IF NONE, so STATE.) LIST PRESENT EMPLOYMENT FIRST. FROM TO FULL NAME AND ADDRESS OF EMPLOYER OCCUPATION (SPECIFY) MONTH YEAR MONTH YEAR PRESENT TIME NONE Show below last occupation abroad if not shown above. (Include all information requested above.) NONE THIS FORM IS SUBMITTED IN CONNECTION WITH APPLICATION FOR: SIGNATURE OF APPLICANT OR PETITIONER DATE INATURALIZATION ADJUSTMENT OF STATUS receive YOUR NATIVE ALPHABET IS IN OTHER THAN the ROMAN team 2/29/78 OTHER (SPECIFY): IF LETTERS. WRITE YOUR NAME IN YOUR NATIVE ALPHABET IN THIS SPACE: Are all copies legible? Yes PENALTIES: SEVERE PENALTIES ARE PROVIDED BY LAW FOR KNOWINGLY AND WILLFULLY FALSIFYING OR CONCEALING A MATERIAL FACT. A PPLICANT: BE SURE TO PUT YOUR NAME AND ALIEN REGISTRATION NUMBER IN THE INED BY HEAVY BORDER"
}