{
  "anumber": "A21206025",
  "id": "A21206025_0065",
  "page_index": 65,
  "resources": {
    "full_jpg": "https://dctn4zjpwgdwdiiy5odjv7o2se0bqgjb.lambda-url.us-east-1.on.aws/iiif/3/og-2023-kc-nara_A21206025_0065/full/max/0/default.jpg"
  },
  "fields": {
    "sex": {
      "ms_sex_llm_v1": "female"
    },
    "doctype": {
      "ms_doctype_v1": "form"
    },
    "form_title": {
      "ms_form_title_llm_v1": "Biographic Information Form G-325A, G-325A"
    },
    "countries": {
      "ms_countries_nlp_v1": [
        "Vietnam",
        "United States"
      ]
    },
    "years": {
      "ms_years_nlp_v1": [
        2023,
        1975,
        1978
      ]
    },
    "g325a": {
      "occupation": {
        "occupation_llm_v1": "['n.a']"
      },
      "reason": {
        "reason_llm_v1": "ADJUSTMENT OF STATUS"
      },
      "nationality": {
        "nationality_llm_v1": "VIETNAM"
      }
    }
  },
  "is_g325a": true,
  "is_cert_naturalization": false,
  "full_text": "Screened by NARA, 7/28/2023 INSTRUCTIONS: USE TYPEWRITER.. BE SURE ALL COPIES LEGIBLE. Failure to answer fully all questions delays action. : Do Not Remove Carbons: If typewriter is not available, print heavily in block letters with ball-point pen. U. GOVERNMENT PRINTING OFFICE 1975 574-025 FORM G-325A (REV. 10-1-74) Y LOS Form Approved UNITED STATES DEPARTMENT OF JUSTICE TIC - 245 OMB No. 43-R436 Immigration and Naturalization Service AY 6 1978 BIOGRAPHIC INFORMATION (DATH) (Family name) (First name) (Middle name) MALE BIRTHDATE(Mo -Day-Yr.) NATIONALITY ALIEN REGISTRATION NO. LE THIN THI FEMALE 6-21-15 VIETNAM (If any) A21 206-025 ALL OTHER NAMES USED (Including nomes by previous marriages) CITY AND COUNTRY OF BIRTH SOCIAL SECURITY NO. N/A HANOI VIET NAM (If any 586 - 417 FAMILY NAME FIRST NAME DATE, CITY AND COUNTRY OF BIRTH(If known) CITY AND COUNTRY OF RESIDENCE. Deceased FATHER LE MAU Unknown MOTHER(Maiden name) NGUYEN LIEN unknown SAIGON VIETNAM HUSBAND(If none, so state) FAMILY NAME FIRST NAME BIRTHDATE CITY & COUNTRY OF BIRTH DATE OF MARRIAGE PLACE OF MARRIAGE OR (For wife, give moiden name) WIFE Bui Tuc Deceased FORMER HUSBANDS OR WIVES(if none,so state) FAMILY NAME (For wife, give maiden name) FIRST NAME BIRTHDATE DATE & PLACE OF MARRIAGE DATE AND PLACE OF TERMINATION OF MARRIAGE APPLICANT'S RESIDENCE LAST FIVE YEARS. LIST PRESENT ADDRESS FIRST. FROM TO STREET AND NUMBER CITY PROVINCE OR STATE COUNTRY MONTH YEAR MONTH YEAR 825 Calle Haya # 8 1000 oaks CA USA 2 76 PRESENT TIME 2217 Calle Camelia 1000 Oaks CA USA 10 75 2 76 8842 grimes Cyn Rd MoorDark CA VSA 8 75 10 75 Weiner Medical Carter Weilman CA USA 6 75 8 75 Camer Pendleton oceanside CA USA 5 II 6 75 6231/184LE van Duyet SAIGON V. 5 73 4 75 APPLICANT'S LAST ADDRESS OUTSIDE THE UNITED STATES OF MORE THAN ONE YEAR FROM TO STREET AND NUMBER CITY PROVINCE OR STATE COUNTRY MONTH YEAR MONTH YE AR 623 /18 LE VAN DUYET SAILON V.N 5 75 4 75 APPLICANT'S EMPLOYMENT LAST FIVE YEARS. (IF NONE, so STATE.) LIST PRESENT EMPLOYMENT FIRST. FROM TO FULL NAME AND ADDRESS OF EMPLOYER N/A OCCUPATION SPECIFY) MONTH YEAR MONTH YEAR PRESENT TIME Show below last occupation abroad if not shown above. (Include all information requested above.) NONE THIS FORM IS SUBMITTED IN CONNECTION WITH APPLICATION FOR: SIGNATURE OF APPLICANT OF ETITIONER DATE x NATURALIZATION ADJUSTMENT OF STATUS Mg OTHER (SPECIFY): 3/28/78 IF YOUR NATIVE ALPHABET IS IN OTHER THAN ROMAN LETTERS. WRITE YOUR NAME IN YOUR NATIVE ALPHABET IN THIS SPACE Are all copies legible? Yes PENALTIES SEVERE PENALTIES ARE PROVIDED BY LAW FOR KNOWINGLY AND WILLFULLY FALSIFYING OR CONCEALING A MATERIAL FACT. (OTHER AGENCY USE) INS USE (Office of Origin) OFFICE CODE: TYPE OF CASE: DATE: (3) C. FORM G-325A"
}