{
  "anumber": "A21203763",
  "id": "A21203763_0073",
  "page_index": 73,
  "resources": {
    "full_jpg": "https://dctn4zjpwgdwdiiy5odjv7o2se0bqgjb.lambda-url.us-east-1.on.aws/iiif/3/og-2023-kc-nara_A21203763_0073/full/max/0/default.jpg"
  },
  "fields": {
    "sex": {
      "ms_sex_llm_v1": "male"
    },
    "doctype": {
      "ms_doctype_v1": "form"
    },
    "form_title": {
      "ms_form_title_llm_v1": "Biographic Information, G-325A ( (REV.10-1-74)"
    },
    "countries": {
      "ms_countries_nlp_v1": [
        "Vietnam",
        "China",
        "United States"
      ]
    },
    "years": {
      "ms_years_nlp_v1": [
        1946,
        1975,
        1962,
        1956,
        1175,
        2023,
        1926,
        1950,
        1915
      ]
    },
    "g325a": {
      "occupation": {
        "occupation_llm_v1": "[' retired', 'business']"
      },
      "reason": {
        "reason_llm_v1": "NATURALIZATION"
      },
      "nationality": {
        "nationality_llm_v1": "VN"
      }
    }
  },
  "is_g325a": true,
  "is_cert_naturalization": false,
  "full_text": "FORM G-325A (REV. 10-1-74) Y Form Approved UNITED STATES DEPART ENT JUSTICE Screened 9/21/2023 NF OMB No. 43-R436 Immigration and Naturalization Service BIOGRAPHIC INFORMATION (Family name) N N A21 203 763 (First name) (Middle name) MALE BIRTHDATE (Mo.-Day-Yr.) NATIONALITY ALIEN REGISTRATION NO. THIEU BANH FEMALE VN (rigine (If any) 1915 ALL OTHER NAMES USED (Including names marriages) CITY AND COUNTRY OF BIRTH chinise) SOCIAL SECURITY NO. CHOLON - VN (If any) FAMILY NAME FIRST NAME DATE, CITY AND COUNTRY OF BIRTH(If known) CITY AND COUNTRY OF RESIDENCE FATHER THIEU (UNKNOWN) CHINA MOTHER (Maiden name) LUU THI (UNKNOWN) CHINA HUSBAND (If none, so state) FAMILY NAME FIRST NAME BIRTHDATE CITY & COUNTRY OF BIRTH DATE OF MARRIAGE PLACE OF MARRIAGE OR (For wife, give maiden name) WIFE NGUYEN THI HAI 1926 CAN THO- 24 Nov, 1956 GIA DINH- VN FORMER HUSBANDS OR WIVES( (if none,so state) FAMILY NAME (For wife, give maiden name) FIRST NAME BIRTHDATE DATE & PLACE OF MARRIAGE DATE AND PLACE OF TERMINATION OF MARRIAGE NPU Bs APPLICANT'S RESIDENCE LAST FIVE YEARS. LIST PRESENT ADDRESS FIRST. May FROM TO STREET AND NUMBER CITY PROVINCE OR STATE COUNTRY MONT YEAR MONTH YEAR 762 TRAN HUNG DAO st. CHOLUN VIETNAM 11 1962 PRESENT TIME 4 1975 APPLICANT'S LAST ADDRESS OUTSIDE THE UNITED STATES OF MORE THAN ONE YEAR FROM TO STREET AND NUMBER CITY PROVINCE OR STATE COUNTRY MONTH YEAR MONTH YEAR 819 TRAN HUNG DAO St CHOLON VN 1946 Ad 1962 APPLICANT'S EMPLOYMENT LAST FIVE YEARS. (IF NONE, so STATE.) LIST PRESENT EMPLOYMENT FIRST. FROM TO FULL NAME AND ADDRESS OF EMPLOYER OCCUPATION (SPECIFY) MONTH YEAR MONTH YEAR THIEV BANH - 762 TRAN HUNG DAO st. BUSINESS MAY 1950 PRESENT TIME APRIL 1975 Show below last occupation abroad if not shown above. (Include all information requested above.) THIS FORM IS SUBMITTED IN CONNECTION WITH APPLICATION FOR: NATURALIZATION ADJUSTMENT OF STATUS OTHER (SPECIFY): VIETNAM REFUGEE Chicken IF SIGNATURE YOUR NATIVE ALPHADES OF APPLICANT IS IN OTHER OR THAN PETITIONER NAME IN NATIVE DATE ALPHABET 7th MAY 1175 ROMAN LETTERS. WRITE YOUR YOUR IN THIS SPACE: Are all copies legible? Yes PENALTIES SEVERE PENALTIES ARE PROVIDED BY LAW FOR KNOWINGLY AND WILLFULLY FALSIFYING OR CONCEALING A MATERIAL FACT. APPLICANT: BE SURE TO PUT YOUR NAME AND ALIEN REGISTRATION NUMBER IN THE BOX OUTLINED BY HEAVY BORDER BELOW. COMPLETE THIS BOX (Family name) (Given name) (Middle name) (Alien registration number) THIEU, BANH A21 203 763 (OTHER AGENCY USE) INS USE (Office of Origin) OFFICE CODE: She HISE â‚¬ 8 AVW NR TYPE OF CASE: DATE: VIETNAM REFUGEE CP PENDLETON, CA 5-7-75 FORM G-325A (3) c."
}