{
  "anumber": "A21201155",
  "id": "A21201155_0000",
  "page_index": 0,
  "resources": {
    "full_jpg": "https://dctn4zjpwgdwdiiy5odjv7o2se0bqgjb.lambda-url.us-east-1.on.aws/iiif/3/og-2023-kc-nara_A21201155_0000/full/max/0/default.jpg"
  },
  "fields": {
    "sex": {
      "ms_sex_llm_v1": "female"
    },
    "doctype": {
      "ms_doctype_v1": "letter"
    },
    "form_title": {
      "ms_form_title_llm_v1": "Naturalization Certificate of Alien, 1157458"
    },
    "countries": {
      "ms_countries_nlp_v1": [
        "Vietnam",
        "United States"
      ]
    },
    "years": {
      "ms_years_nlp_v1": [
        1985,
        1915
      ]
    },
    "certificate_naturalization": {
      "complexion": {
        "complexion_llm_v1": "medium"
      },
      "marital_status": {
        "marital_status_llm_v1": "MARRIED"
      },
      "year_naturalization": {
        "year_naturalization_llm_v1": 1985
      },
      "residence_naturlization": {
        "residence_naturlization_llm_v1": "2433 W. Flora Street, Santa Ana, CA"
      }
    }
  },
  "is_g325a": false,
  "is_cert_naturalization": true,
  "full_text": "e by NARA, 0 THE CA TO BE FORWARDED TO No. 11574758 IMMIGRATION AND NATURALIZATION SERVICE 0 Pelilion No. 481639 DUPLICATE AlienRegistration Ro A21 201 155 Personal description of holder's of Date of birth JANUARY 3, 1915 sex FEMALE ; complexion MEDIUM coloroleyes BROWN color of hair BLACK height 5 feet 1 inches; weight 100 pounds; NONE Maritalstatus MARRIED Country of formernationality VIETNAM I certify that the description, above givenis, New and herelois a likeness of me. childrence / Complete and true signature of holder) UNITED STATES OF AMERICA CENTRAL DIST. OF CALIFORNIA } SS: of Beit known, that at a termof the District Court of The United States held/pursuant to lawal Los Angeles on JULY 31, 1985 the Gourhavingfoundshal CHI THI LE then residing, at 2433 W. FLORA STREET, SANTA ANA, CA inlends, loreside, hermanenMying the United States when sorequired bythe Naturalization Laws of the United. States), hadin all other respects, complied with the applicable provisions of such naturalization laws, and was entilled do be Seal admilled socilisenship. thereupon nordered that such person be and(s)hewas admilled as a cilixen of the United States of America, Investimony whereofthesealofthe courtis, hereunto, affixced this 31ST day of JULY in theyearsfour Lord EIGHTY-FIVE . LEONARD A. BROSNAN Glerk of the U.S S. District Court. IT IS PUNISHABLE BY U. S. LAW TO COPY, PRINT OR PHOTOGRAPH THIS CERTIFICATE. By Frank Galvan Deputy Clerk."
}