{
  "anumber": "A21293871",
  "id": "A21293871_0028",
  "page_index": 28,
  "resources": {
    "full_jpg": "https://dctn4zjpwgdwdiiy5odjv7o2se0bqgjb.lambda-url.us-east-1.on.aws/iiif/3/og-2023-kc-nara_A21293871_0028/full/max/0/default.jpg"
  },
  "fields": {
    "sex": {
      "ms_sex_llm_v1": "male"
    },
    "doctype": {
      "ms_doctype_v1": "form"
    },
    "form_title": {
      "ms_form_title_llm_v1": "United States Department of Justice Immigration and Naturalization Service, G-325A"
    },
    "countries": {
      "ms_countries_nlp_v1": [
        "Vietnam",
        "United States"
      ]
    },
    "years": {
      "ms_years_nlp_v1": [
        1975,
        2023,
        1909,
        1978,
        1940,
        1930,
        1915
      ]
    },
    "g325a": {
      "occupation": {
        "occupation_llm_v1": "['n.a']"
      },
      "reason": {
        "reason_llm_v1": "NATURALIZATION"
      },
      "nationality": {
        "nationality_llm_v1": "VIETNAM"
      }
    }
  },
  "is_g325a": true,
  "is_cert_naturalization": false,
  "full_text": "Screened by NARA 8/29/2023 INSTRUCTIONS: USE TYPEWRITER. BE SURE ALL COPIES ARE LEGIBLE Failure to answer fully all questions delays action. Do Not Remove Carbons: If typewriter is not available, print heavily in block letters with ball-point pen. oua GOVERNMENT PRINTING OFFICE 1975 -574-025 FORM G-325A (REV. 10-1-74) Y Form Approved UNITED STATES DEPARTMENT OF JUSTICE LOS OMB No. 43-R436 Immigration and Naturalization Service BIOGRAPHIC T/C of 245 I INFORMATION APR 29 1978 (DATE) (Family nome) (First nome) (Middle nome) MALE BIRTHDATE(Mo.DDY-Yr.) NATIONALITY ALIEN REGISTRATION NO. NGUYEN TRAN BicH FEMALE 10/10/1915 VIETNAM (If any) A21-293-871 ALL OTHER NAMES USED (Including nomes by previous marriages) CITY AND COUNTRY OF BIRTH SOCIAL SECURITY NO. CANTHO VIETNAM (If any 686-32-2610 FAMILY NAME FIRST NAME DATE, CITY AND COUNTRY OF BIRTH(If known) CITY AND COUNTRY OF RESIDENCE. FATHER N6UYEN BiELI unknown CAN Tho, ViETNAM Deceased MOTHER (Maiden name) PHAM KIEU HUSBAND (If none. so state) FAMILY NAME FIRST NAME BIRTHDATE CITY & COUNTRY OF BIRTH DATE OF MARRIAGE PLACE OF MARRIAGE OR (For wife, give moiden name) WIFE IRAN TE 2/15/1909 Hue Vietnam May 1940 Saigox, VIN FORMER HUSBANDS OR WIVES[N none, so state) FAMILY NAME (For wife, give maiden name) FIRST NAME BIRTHDATE DATE & PLACE OF MARRIAGE DATE AND PLACE OF TERMINATION OF MARRIAGE None APPLICANT'S RESIDENCE LAST FIVE YEARS. LIST PRESENT ADDRESS FIRST. FROM TO STREET AND NUMBER CITY PROVINCE OR STATE COUNTRY MONTH YEAR MONTH YEAR 1802 E. GLenoaKs #C Glendale 1930 Lantana ST 21204 Oxnard California California U.S.A 2 76 PRESENT TIME u A 6 75 2 76 139 Chi Lang Saigon Viet nam 4 46 4 75 APPLICANT'S LAST ADDRESS OUTSIDE THE UNITED STATES OF MORE THAN ONE YEAR FROM TO STREET AND NUMBER CITY PROVINCE OR STATE COUNTRY MONTH YEAR MONTH YEAR 139 Che EMPLOYMENT Lang Saigon ViETNAM VIETNAM 4 75 APPLICANT'S VAST FIVE YEARS. (IF NONE. so STATE.) LIST PRESENT EMPLOYMENT FIRST. FROM TO FULL NAME AND ADDRESS OF EMPLOYER OCCUPATION (SPECIFY) MONTH YEAR MONTH YEAR PRESENT TIME None Show below last occupation abroad if not shown above. (Include all information requested above.) THIS FORM IS SUBMITTED IN CONNECTION WITH APPLICATION FOR: SIGNATURE or APPLICANT OMPRTITIONEE DATE NATURALIZATION ADJUSTMENT OF STATUS IF Tran YOUR NATIVE ALPHABET Bich is OTHER THAN nguyan ALETTERS, white in 3-28-78 OTHER (SPECIFY): IN ROMAN YOUR NAME TOUR NATIVE ALPHABLY IR THIS SPACE Are all copies legible? Yes PENALTIES: $EVERE PENALTIES ARE PROVIDED BY LAW FOR AND WILLFULLY FALSIFYING OR CONCEALING A MATERIAL FACT. OFFICE CODE: TYPE OF CASE: DATE: (3) C. FORM G-125A"
}