{
  "anumber": "A21206632",
  "id": "A21206632_0055",
  "page_index": 55,
  "resources": {
    "full_jpg": "https://dctn4zjpwgdwdiiy5odjv7o2se0bqgjb.lambda-url.us-east-1.on.aws/iiif/3/og-2023-kc-nara_A21206632_0055/full/max/0/default.jpg"
  },
  "fields": {
    "sex": {
      "ms_sex_llm_v1": "female"
    },
    "doctype": {
      "ms_doctype_v1": "form"
    },
    "form_title": {
      "ms_form_title_llm_v1": "BIOGRAPHIC INFORMATION, G-325A ( (REV. 10-1-74) Y"
    },
    "countries": {
      "ms_countries_nlp_v1": [
        "Vietnam",
        "United States"
      ]
    },
    "years": {
      "ms_years_nlp_v1": [
        1925,
        1975,
        1973,
        2023,
        1963,
        1924,
        1915
      ]
    },
    "g325a": {
      "occupation": {
        "occupation_llm_v1": "['nurse']"
      },
      "reason": {
        "reason_llm_v1": "NATURALIZATION"
      },
      "nationality": {
        "nationality_llm_v1": "VIETNAM"
      }
    }
  },
  "is_g325a": true,
  "is_cert_naturalization": false,
  "full_text": "FORM G-325A (REV. 10-1-74) Y Screened by NARA, 7/6/2023 Form Approved UNITED STATES DEPARTMENT OF JUSTICE OMB No. 43-R436 Immigration and Naturalization Service BIOGRAPHIC INFORMATION 132 (Family name) (First name) (Middle name) MALE HDATE(Mo.-Day-Yr.) NATIONALITY AUTN REGISTR. AZION NO. Bui HUYNH DUCVAN FEMALE Sep.24.1915 YIETNAM (If any) 21206232 ALL OTHER NAMES USED (Including names by previous marriages) CITY AND COUNTRY OF BIRTH SOCIAL SECURITY NO. (If any) FAMILY NAME FIRST NAME DATE, CITY AND COUNTRY OF BIRTH(II known) CITY AND COUNTRY OF RESIDENCE FATHER Bui NGAi VAN NIET NAM HAI DUONG NORTH VIBT NAM MOTHER (Maiden name) VV DAT THi VIET NAM NORTH VIET NAM HUSBAND (If none, so state) FAMILY NAME FIRST NAME BIRTHDATE CITY & COUNTRY OF BIRTH DATE OF MARRIAGE PLACE OF MARRIAGE OR WIFE (For wife, give maiden name) WIFE TRAN THi TRINH 1924 NAM DINH VIETNAM 2.10.1944 NORTHVIETNAM FORMER HUSBANDS OR WIVES(if none,so state) FAMILY NAME (For wife, give maiden name) FIRST NAME BIRTHDATE DATE & PLACE OF MARRIAGE DATE AND PLACE OF TERMINATION OF MARRIAGE APPLICANT'S RESIDENCE LAST FIVE YEARS. LIST PRESENT ADDRESS FIRST. FROM TO STREET AND NUMBER CITY PROVINCE OR STATE COUNTRY MONTH YEAR MONTH YEAR PRESENT TIME 3 DO CHIEU BINHDVING CHAU THANH VIET NAM 8 1963 3 1973 10F KHAi DINH SAiGON DISTRICT 8th VIET NAM 3 1973 4 1975 APPLICANT'S LAST ADDRESS OUTSIDE THE UNITED STATES OF MORE THAN ONE YEAR FROM TO STREET AND NUMBER CITY PROVINCE OR STATE COUNTRY MONTH YEAR MONTH YEAR 10F KHAI DINH SAGON DISTRICT 8ts VIET NAM 3 1973 of 1975 APPLICANT'S EMPLOYMENT LAST FIVE YEARS. (IF NONE. so STATE.) LIST PRESENT EMPLOYMENT FIRST FROM TO FULL NAME AND ADDRESS OF EMPLOYER OCCUPATION (SPECIFY) MONTH YEAR MONTH YEAR PRESENT TIME VN GOVT. male NuRse Show below last occupation abroad if not shown above. (Include all information requested above.) THIS FORM IS SUBMITTED IN CONNECTION WITH APPLICATION FOR: SIGNATURE OF APPLICANT OR PETITIONER DATE NATURALIZATION ADJUSTMENT OF STATUS OTHER (SPECIFY): V. Refuged Hund MAY 11. 1925 IF YOUR NATIVE ALPHABET IS IN OTHER THAN ROMAN LETTERS. WRITE YOUR NAME IN YOUR NATIVE ALPHABET IN THIS SPACE; Are all copies legible? Yes PENALTIES: SEVERE PENALTIES ARE PROVIDED BY LAW FOR KNOWINGLY AND WILLFULLY FALSIFYING OR CONCEALING A MATERIAL FACT."
}