{
  "anumber": "A21201155",
  "id": "A21201155_0041",
  "page_index": 41,
  "resources": {
    "full_jpg": "https://dctn4zjpwgdwdiiy5odjv7o2se0bqgjb.lambda-url.us-east-1.on.aws/iiif/3/og-2023-kc-nara_A21201155_0041/full/max/0/default.jpg"
  },
  "fields": {
    "sex": {
      "ms_sex_llm_v1": "female"
    },
    "doctype": {
      "ms_doctype_v1": "form"
    },
    "form_title": {
      "ms_form_title_llm_v1": "Screened by NARA, 9/21/2023"
    },
    "countries": {
      "ms_countries_nlp_v1": [
        "Vietnam"
      ]
    },
    "years": {
      "ms_years_nlp_v1": [
        1919,
        2023
      ]
    }
  },
  "is_g325a": false,
  "is_cert_naturalization": false,
  "full_text": "Screened by NARA, 9/21/2023 TO WHOM IT MAY CONCERN: I am a and am applying for adjustment of my status. In order to complete my application, I need a police clearance for the period of time I lived in your area from $15.75 to 53177 at Hilleen 412 Phyllis Dr This is required by the Immigration and Naturalization Service. The information you need for the clearance is listed below: Full Name: LE CHI, THI. (Last) (First) (Middle) Name as appeared on I-94: LE THI CHI Race (Your Nationality) : VIET NAM... Date of Birth: 01.13.1919 Place of Birth: THAIBINH VIETNAM Height: 52. Weight: 95 Color of hair: : Black Color of eyes: Black Sex: Female Present address: 6562 Farinella Dr. CA 93647 Telephone Number: 714 847 4728 Thank you for your cooperation in this matter. NO RECORD; our files by name. DATE: Killeen Police Dept. Killeen, Texas."
}