{
  "anumber": "A21207655",
  "id": "A21207655_0040",
  "page_index": 40,
  "resources": {
    "full_jpg": "https://dctn4zjpwgdwdiiy5odjv7o2se0bqgjb.lambda-url.us-east-1.on.aws/iiif/3/og-2023-kc-nara_A21207655_0040/full/max/0/default.jpg"
  },
  "fields": {
    "sex": {
      "ms_sex_llm_v1": "female"
    },
    "doctype": {
      "ms_doctype_v1": "letter"
    },
    "form_title": {
      "ms_form_title_llm_v1": "The United States of America, 11319598"
    },
    "countries": {
      "ms_countries_nlp_v1": [
        "Vietnam",
        "United States"
      ]
    },
    "years": {
      "ms_years_nlp_v1": [
        2023,
        1915,
        1983
      ]
    },
    "certificate_naturalization": {
      "complexion": {
        "complexion_llm_v1": "medium"
      },
      "marital_status": {
        "marital_status_llm_v1": "MARRIED"
      },
      "year_naturalization": {
        "year_naturalization_llm_v1": 1983
      },
      "residence_naturlization": {
        "residence_naturlization_llm_v1": "San Bernardino, CA"
      }
    }
  },
  "is_g325a": false,
  "is_cert_naturalization": true,
  "full_text": "Screened by NARA, 9/21/2023 a TO BE FORWARDED TO No. 11319598 IMMIGRATION AND NATURALIZATION SERVICE CERTIFIED CATE 0 Delilion No. 480603 DUPLICATE AlienRegistration Na A21 207 655 Personala description of holderas, of date not naturalization: Date of birth OCTOBER 28, 1915 sex FEMALE complexion MEDIUM coloropeyes BROWN color of hair GRAY :height 5 feel 2 inches; weight120 pounds; visible distinctive marks NONE Maritalstatus MARRIED Country of formernationality VIETNAM I certify that the description, above given is true, and that the photograph hafficed hereto, is a likeness of me. / Bach Chu Tran / Complete and true signature of holder) UNITED STATES OF AMERICA CENTRAL DIST. OF CALIFORNIA }ss SS: Beitknown, that al a termofthe District Court of The United States held pursuant to lauzal Los Angeles on APRIL 22, 1983 BACH-CHI TRAN the Court havingfound that then residing at 5028 COYOTE LANE, SAN BERNARDINO, CA intends loreside permanently in the United. States when sorequired by the Naturalization Laws of the United States), hadin all other respects, complied with the applicable provisions of such naturalization laws, and was entilled to be Seal admitted docilizenship, thereupon ordered that such person be and(s)hewas admilled as a citizen of the United States of America. Intestimony whereof thesealoft the courtis hereunto,affixed this 22 ND day of APRIL in the year your Lord nineteen hundred and EIGHTY-THREE EDWARD M. KRITZMAN Clerk of the U. S. District Court. IT IS PUNISHABLE BY U.S. LAW TO COPY, PRINT OR PHOTOGRAPH THIS CERTIFICATE. By Patridoa Keyed Deputy Clerk."
}