{
  "anumber": "A21206025",
  "id": "A21206025_0012",
  "page_index": 12,
  "resources": {
    "full_jpg": "https://dctn4zjpwgdwdiiy5odjv7o2se0bqgjb.lambda-url.us-east-1.on.aws/iiif/3/og-2023-kc-nara_A21206025_0012/full/max/0/default.jpg"
  },
  "fields": {
    "sex": {
      "ms_sex_llm_v1": "male"
    },
    "doctype": {
      "ms_doctype_v1": "form"
    },
    "form_title": {
      "ms_form_title_llm_v1": "U.S. Department of Justice Immigration and Naturalization Service Application for Naturalization, N-4 (000 Rev 7/17/91)"
    },
    "countries": {
      "ms_countries_nlp_v1": [
        "Vietnam",
        "United States"
      ]
    },
    "years": {
      "ms_years_nlp_v1": [
        2023,
        1997,
        1915
      ]
    }
  },
  "is_g325a": false,
  "is_cert_naturalization": false,
  "full_text": "Screened by NARA, 7/28/2023 U.S. Department of Justice OMB #1115-0009 Immigration and Naturalization Service. Application for Naturalization START HERE - Please Type or Print FOR INS USE ONLY Returned Part 1. Information about you. Receipt Family Given Name LE Middle Name THiN Initial Thi U.S. Mailing Address - Care of 202 ARISTOTLE Resubmitted Street Number Apt. and Name # City SIMI VALLEY County VENTURA State CALiFoRNiA ZIP Code 93065 Reloc Sent Date of Birth (month/day/year) 06-21-1915 Country of Birth VIETNAM Social A Security # 586-34-4175 A21206025 Reloc Rec'd Part 2. Basis for Eligibility (check one). a. I have been a permanent resident for at least live (5) years 21 yrs. b. I have been a permanent resident for at least three (3) years and have been married to a United States Citizen for those three years. Applicant C. I am a permanent resident child of United States citizen parent(s) Interviewed d. I am applying on the basis of qualifying military service in the Armed Forces of the U.S. and have attached completed Forms N-426 and G-325B At interview e. Other. (Please specify section of law) request naturalization ceremony at court Part 3. Additional information about you. Remarks Date you became a permanent Port admitted with an immmigrant visa or INS Office resident (month/day/year) where granted adjustment of status. JUL 15 1997 6-13-75 LOS ANGELES 1C6 ARC # 04 206 025 Citizenship ViETNAMESE ( Name on alien registration card (if different than in Part 1) C2: consolidate w) VISA File Other names used since you becamo a permanent resident (including maiden name) None Sex Male Height Marital Status: Single Divorced Female 5'0\" Married Widowed Can you speak, read and write English ? No Yes. very little NO ARE Action Absences from the U.S.: APPROVED I.N.S. DISTRICT DIRECTOR Have you been absent from the U.S. since becoming a permanent resident? No Yes. If you answered \"Yes\" - complete the following, Begin with your most recent absence. If you need more room to explain the reason for an absence or to list more trips, continue on separate NOV 03 1997 paper. Did absence last Recommended by: LKristic Date left U.S. Date returned 6 months or more? Destination Reason for trip LOS 8429 04-17-96 05-13-96 Yes No VIETNAM visit Relatives Yes No No other To Be Completed by 2 Attorney or Representative, if any Yes No Fill in box if G-28 is attached to represent the applicant Yes No VOLAG# Yes No Yes No ATTY State License # Form N-400 (Rev. 07/17/91)N Continued on back."
}