{
  "anumber": "A21294604",
  "id": "A21294604_0041",
  "page_index": 41,
  "resources": {
    "full_jpg": "https://dctn4zjpwgdwdiiy5odjv7o2se0bqgjb.lambda-url.us-east-1.on.aws/iiif/3/og-2023-kc-nara_A21294604_0041/full/max/0/default.jpg"
  },
  "fields": {
    "sex": {
      "ms_sex_llm_v1": "male"
    },
    "doctype": {
      "ms_doctype_v1": "form"
    },
    "form_title": {
      "ms_form_title_llm_v1": "BIOGRAPHIC INFORMATION, FORM G-325A ( (REV. 10-1-74) Y"
    },
    "countries": {
      "ms_countries_nlp_v1": [
        "Vietnam",
        "United States"
      ]
    },
    "years": {
      "ms_years_nlp_v1": [
        1975,
        1938,
        1969,
        2023,
        1976,
        1930,
        1950,
        1915
      ]
    },
    "g325a": {
      "occupation": {
        "occupation_llm_v1": "[' retired', 'teacher']"
      },
      "reason": {
        "reason_llm_v1": "NATURALIZATION"
      },
      "nationality": {
        "nationality_llm_v1": "S. VIETNAM"
      }
    }
  },
  "is_g325a": true,
  "is_cert_naturalization": false,
  "full_text": "FORM G-325A (REV. 10-1-74) MIA 1-485 Screened by NARA 9/21/2023 Form Approved UNITED STATES DEPARTMENT OF JUSTICE T.C. +I S90 BIOGRAPHIC Immigration and Naturalization Service imprise QMN No. 43-R436 INFORMATION JAN 09 1976 (Family name) (First name) (Middle nome) MALE BIRTHDATE(Mo.-Day-Yr.) NATIONALITY ALIEN REGISTRATION NO. TRUONG TINH VAN FEMALE MAR 4 1915 VIETNAM (If any) (224) 294 604 ALL OTHER NAMES USED (Including names by previous marriages) CITY AND COUNTRY OF BIRTH SOCIAL SECURITY NO. NONE QUAN6 BINH S. VIETNAM (If any) 586-32-0564 FAMILY NAME FIRST NAME DATE, CITY AND COUNTRY OF BIRTH(If known) CITY AND COUNTRY OF RESIDENCE FATHER TRUONG TRONG S. VIETNAM S. VISTNAM MOTHER(Maiden name) NGUYEN VINH HUSBAND (If none, so state) FAMILY NAME FIRST NAME BIRTHDATE CITY & COUNTRY OF BIRTH DATE OF MARRIAGE PLACE OF MARRIAGE OR WIFE (For wife, give moiden name) JUNE TRAN king NEOC TH NGOC Not 5 KHANH HOA may I 1938 NHATRANG 5916 FORMER HUSBANDS OR WIVES[i none, $0 state) FAMILY NAME (For wife, give moiden name) FIRST NAME BIRTHDATE DATE & PLACE OF MARRIAGE DATE AND PLACE OF TERMINATION OF MARRIAGE APPLICANT'S RESIDENCE LAST FIVE YEARS. LIST PRESENT ADDRESS FIRST. FROM TO STREET AND NUMBER CITY PROVINCE OR STATE COUNTRY MONTH YEAR MONTH YEAR 10840 NW 37th CT CORALSPRINGS FLA U.S. MAY 1975 PRESENT TIME 17/2 NHAT LINH GIADINH SAIGON S. VIETNAM ABRIL 1975 APRIL 1975 9 LE Quy DON NHATRANG KHANH HOA S, VIETNAM 1930 ARRL 1975 APPLICANT'S LAST ADDRESS OUTSIDE THE UNITED STATES OF MORE THAN ONE YEAR FROM TO $TREET AND NUMBER CITY PROVINCE OR STATE COUNTRY MONTH YEAR MONTH YEAR 9 LE auy DON NHATRANG KHANHHOA VIETNAM 1950 APRIL 1975 APPLICANT'S EMPLOYMENT LAST FIVE YEARS. (IF NONE, so STATE.) LIST PRESENT EMPLOYMENT FIRST FROM TO FULL NAME AND ADDRESS OF EMPLOYER OCCUPATION SPECIFY) MONTH YEAR MONTH YEAR HUNG DAO HIGH SCHOOL) TEACHER ) 1969 PRESENT TIME NHATRANG, S. VIETNAM Show below last occupation abroad if not shown above. (Include all information requested above.) THIS FORM IS SUBMITTED IN CONNECTION WITH APPLICATION FOR: SIGNATURE OR PETITIONER ADJUSTMENT OF STATUS OTHER (SPECIFY) glovele OF APPLICANT DATE AUG 31975 NATURALIZATION IF YOUR NATIVE ALPHABET is IN OTHER THIAH ROWAR LETTERS. WHITE YOUR NAME IN YOUR NATIVE ALPHANET 15 THIS SPACE Are all copies legible? Yes PENALTIES: SEVERE PENALTIES ARE PROVIDED BY LAW FOR KNOWINGLY AND WILLFULLY FALSIFYING OR CONCEALING A MATERIAL FACT."
}