{
  "anumber": "A21203763",
  "id": "A21203763_0000",
  "page_index": 0,
  "resources": {
    "full_jpg": "https://dctn4zjpwgdwdiiy5odjv7o2se0bqgjb.lambda-url.us-east-1.on.aws/iiif/3/og-2023-kc-nara_A21203763_0000/full/max/0/default.jpg"
  },
  "fields": {
    "sex": {
      "ms_sex_llm_v1": "male"
    },
    "doctype": {
      "ms_doctype_v1": "letter"
    },
    "form_title": {
      "ms_form_title_llm_v1": "CERTIFICATE OF IMMIGRATION AND NATURALIZATION SERVICE, 11286101"
    },
    "countries": {
      "ms_countries_nlp_v1": [
        "Vietnam",
        "United States"
      ]
    },
    "years": {
      "ms_years_nlp_v1": [
        2023,
        1981,
        1915
      ]
    },
    "certificate_naturalization": {
      "complexion": {
        "complexion_llm_v1": "medium"
      },
      "marital_status": {
        "marital_status_llm_v1": "Married"
      },
      "year_naturalization": {
        "year_naturalization_llm_v1": 1981
      },
      "residence_naturlization": {
        "residence_naturlization_llm_v1": "817 S. Burlington Ave. 302, Los Angeles, Ca"
      }
    }
  },
  "is_g325a": false,
  "is_cert_naturalization": true,
  "full_text": "Screened by NARA, 9/21/2023 TO BE FORWARDED TO No. 11286101 IMMIGRATION AND NATURALIZATION SERVICE CATE Pelilion No. 452712 DUPLICATE AlienRegistration no A21 203 763 Personal, description, of holderas of date of naturalezations Date of birth January 1. 1915 :see_Male ; complexion Medium coloropeyes Brown color of hair Grey weight 138 pounds; visible distinctive marks None height 5 feel 7 inches; Maritalstatus Married Country of formernationality. Vietnam I certify that the description above given is true, and that thophotographiafford heretor is a likeness of me. Boushow / Complete and true signature of holder) UNITED STATES OF AMERICA }ss SS: CENTRAL DIST. OF CALIFORNIA Beit known, that al a termofthe District Court of The United States Esea held pursuant to lawal Los Angeles on June 22, 1981 the bourhavingfoundsha BEN SHAW then residing at 817 S. Burlington Ave. 302, Los Angeles, Ca. inlends loreside hermanently in the United. States when sorequired by the O Naturalization Laws of the United States), had in all other respects, complied with the applicable provisions, of such naturalization laws, and was entitled be Seal admitted docilisenships thereupon ordered that such person be and(s)hewas admitted as a citizen of the United States of America. Intestimony whereof thesealoft the courtis hereunto, affixed this 22nd day of June in the year of our Lord nineleen hundred and Eighty-One EDWARD M. KRITZMAN Clerk of the U. S. District Court. IT IS PUNISHABLE BY U.S. LAW TO COPY, PRINT OR PHOTOGRAPH THIS CERTIFICATE. By Maru ziledon Deputy Clerk."
}