{
  "anumber": "A21348654",
  "id": "A21348654_0058",
  "page_index": 58,
  "resources": {
    "full_jpg": "https://dctn4zjpwgdwdiiy5odjv7o2se0bqgjb.lambda-url.us-east-1.on.aws/iiif/3/og-2023-kc-nara_A21348654_0058/full/max/0/default.jpg"
  },
  "fields": {
    "sex": {
      "ms_sex_llm_v1": "female"
    },
    "doctype": {
      "ms_doctype_v1": "form"
    },
    "form_title": {
      "ms_form_title_llm_v1": "Biographic Information Form G-325A (Screened by NARA, 9/22/2023, FORM G-325A (REV. 8-27-72IN"
    },
    "countries": {
      "ms_countries_nlp_v1": [
        "Vietnam",
        "United States"
      ]
    },
    "years": {
      "ms_years_nlp_v1": [
        1954,
        2023,
        1975,
        1915
      ]
    },
    "g325a": {
      "occupation": {
        "occupation_llm_v1": "['n.a']"
      },
      "reason": {
        "reason_llm_v1": "NATURALIZATION"
      },
      "nationality": {
        "nationality_llm_v1": "VIETNAM"
      }
    }
  },
  "is_g325a": true,
  "is_cert_naturalization": false,
  "full_text": "FORM G-325A (REV. 8-27-72)N Screened by NARA. 9/22/2023 Form Approved UNITED STATES DEPARTMENT OF JUSTICE OMB No. 43-R436, Immigration and Naturalization Service BIOGRAPHIC INFORMATION (Family name) (First name) (Middle name) MALE BIRTHDATE(Mo.-Day-Yr.) NATIONALITY ALIEN REGISTRATION NO. Hugne THI FEMALE JAN/30/1915 (If-ghy) NGUYEN ALL OTHER NAMES USED (Including names by previous marriages) VIET NAM 421348654 CITY_AND COUNTRY OF BIRTH SOCIAL SECURITY NO. GIADINH VIETNAM (If any) FAMILY NAME FIRST NAME DATE, CITY AND COUNTRY OF BIRTH(If known) CITY AND COUNTRY OF RESIDENCE FATHER NGUYEN yi DEAD VIET_NAM MOTHER(Maiden name) PHU NHUONG DEAD HUSBAND (If none, so state) FAMILY NAME FIRST NAME BIRTHDATE CITY & COUNTRY OF BIRTH DATE OF MARRIAGE PLACE OF MARRIAGE OR (For wife, give maiden name) WIFE Bui THIEU DEAD FORMER HUSBANDS OR WIVES(if none, so state) FAMILY NAME (For wife, give maiden name) FIRST NAME BIRTHDATE DATE & PLACE OF MARRIAGE DATE AND PLACE OF TERMINATION OF MARRIAGE APPLICANT'S STREET RESIDENCE AND NUMBER LAST FIVE YEARS. LIST PRESENT ADDRESS FIRST. FROM TO CITY PROVINCE OR STATE COUNTRY MONTH YEAR MONTH YEAR 31 BACH-DANG GIADINII GIADINH VIETNAM PRESENT TIME July 1954 APPLICANT'S LAST ADDRESS OUTSIDE THE UNITED STATES OF MORE THAN ONE YEAR FROM TO STREET AND NUMBER CITY PROVINCE OR STATE COUNTRY MONTH YEAR MONTH YEAR 31 3 ACH DANG GIADINH GIADINH Vict. NAM July 1954 Alue e 1975 APPLICANT'S EMPLOYMENT LAST FIVE YEARS. (IF NONE, so STATE.) LIST PRESENT EMPLOYMENT FIRST. FROM TO FULL NAME AND ADDRESS OF EMPLOYER OCCUPATION (SPECIFY) MONTH YEAR MONTH YEAR PRESENT TIME Show below last occupation abroad if not shown above. (Include all information requested above.) THIS FORM IS SUBMITTED IN CONNECTION WITH APPLICATION FOR: SIGNATURE OF APPLICANT OR PETITIONER DATE NATURALIZATION ADJUSTMENT OF STATUS OTHER (SPECIFY): Aliving 10, MAY 1975 IF YOUR NATIVE ALPHABET IS IN OTHER THAN ROMAN LETTERS. WRITE YOUR NAME IN YOUR NATIVE ALPHABET IN THIS SPACE: Are all copies legible? Yes PENALTIES SEVERE PENALTIES ARE PROVIDED BY LAW FOR KNOWINGLY AND WILLFULLY FALSIFYING OR CONCEALING A MATERIAL FACT. APPLICANT: BE SURE TO PUT YOUR NAME AND ALIEN REGISTRATION NUMBER IN THE BOX OUTLINED BY HEAVY BORDER BELOW. COMPLETE THIS BOX (Family name) (Given name) (Middle name) (Alien registration number) NGUYEN HUONG THI A21 348 454 (OTHER AGENCY USE) INS USE (Office of Origin) the REFUGEE SL. Hd 9h 21 H VVW CP PENDLETON, CA 0016987 SPECIAL FORM G-325A (3) C."
}