{
  "anumber": "A21347299",
  "id": "A21347299_0012",
  "page_index": 12,
  "resources": {
    "full_jpg": "https://dctn4zjpwgdwdiiy5odjv7o2se0bqgjb.lambda-url.us-east-1.on.aws/iiif/3/og-2023-kc-nara_A21347299_0012/full/max/0/default.jpg"
  },
  "fields": {
    "sex": {
      "ms_sex_llm_v1": "female"
    },
    "doctype": {
      "ms_doctype_v1": "form"
    },
    "form_title": {
      "ms_form_title_llm_v1": "United States Department of Justice Immigration and Naturalization Service, G-325A"
    },
    "countries": {
      "ms_countries_nlp_v1": [
        "Vietnam",
        "United States"
      ]
    },
    "years": {
      "ms_years_nlp_v1": [
        1875,
        1945,
        2023,
        1883,
        1978
      ]
    },
    "g325a": {
      "occupation": {
        "occupation_llm_v1": "['custodian']"
      },
      "reason": {
        "reason_llm_v1": "NATURALIZATION"
      },
      "nationality": {
        "nationality_llm_v1": "VIETNAMESE"
      }
    }
  },
  "is_g325a": true,
  "is_cert_naturalization": false,
  "full_text": "INSTRUCTIONS: USE TYPEWRITER. BE SURE ARE Failure to answer fully all questions delays action. Screened by NARA, 8/29/2023 Do Not Remove Carbons: If typewriter Is not available, print heavity in block letters with ball-point pen. trus. PRINTING OFFICE 1977-137-015 FORM G-325A (REV. 10-1-74} Y Form Approved UNITED STATES DEPARTMENT OF JUSTICE DAUB No. 43-R436 LOS Immigration and Naturalization Service BIOGRAPHIC T/C = 245 INFORMATION JUL 8 1978 (Family name) (First name) (Middle name) MALE BIRTHDATE(Mo.-Do NATIONALITY (DAT ALIER REGISTRATION NO. HOANG Phung Van FEMALE 2-2-1915 VIETNAMESE (If K21 347 299 ALL OTHER NAMES USED (Including names by previous marriages) CITY AND COUNTRY OF BIRTH SOCIAL SECURITY NO. HOANG Van Phung (name as on I-94 Form) Cao Bang, North Vietnam (H 86 34 6321 FAMILY NAME FIRST NAME DATE, CITY AND COUNTRY OF BIRTH(IF known) CITY AND COUNTRY OF RESIDENCE HOANG Sach 1875, Kwang-Si, China Deceased FATHER DZIN MOTHER(Moiden name) Ly 1883, Kwang-Si, China Deceased HUSBAND (If none, so state) FAMILY NAME FIRST NAME BIRTHDATE CITY & COUNTRY OF BIRTH DATE OF MARRIAGE PLACE OF MARRIAGE OR (For wife, give maiden name) WIFE 8-20- Ha-Noi, 1945 Ha-Noi, NGUYEN Phuc 1926 Vietnam. Vietnam FORMER HUSBANDS OR WIVES[if none, so state) FAMILY NAME (For wife. give maiden against FIRST NAME BIRTHDATE DATE & PLACE OF MARRIAGE DATE AND PLACE OF TERMINATION OF MARRIAGE NONE APPLICANT'S RESIDENCE LAST FIVE YEARS LIST PRESENT ADDRESS FIRST. FROM TO STREET AND NUMBER CITY PROVINCE OR STATE COUNTRY MONTH YEAR MONTH YEAR 1512 West 3rd street Santa Ana California U.S.A. 05 77 PRESENT TIME -14691 Carfax# C Tustin California U.S.A. 02 76 04 77 -1722 Mitchell #138 Tustin California U.S.A. 08 75 02 76 -Pendleton Refugee Camp California U.S.A. 05 75 08 75 -183/16/1 Phan Thanh Gian Go Vap Gia Dinh VIETNAM 01 61 04 75 APPLICANTS LAST ADDRESS OUTSIDE THE UNITED STATES OF MORE THAN ONE YEAR FROM TO STREET AMD MUMBER CITY PROVINCE OR STATE COUNTRY MONTH YEAR MONTH YEAR -183/16/1 Phan Thanh Gian Go Vap Gia Dinh VIETNAM 01 61 04 75 APPLICANT'S EMPLOYMENT LAST FIVE YEARS. (IF NONE, so STATE.) LIST PRESENT EMPLOYMENT FIRST FROM TO FULL NAME AND ADDRESS OF EMPLOYER OCCUPATION [SPECIFY] MONTH YEAR MONTH YEAR Tustin Unified School District, 300 S.C st. Tustin,CA Custodian 08 75 PRESENT TIME Show below last occupation abroad if not shown above. (Include all information requested above.) Northrop Aircraft Co. Saigon, Vietnam . Supervisor of Motor Pool 12 67 D4 75 THIS FORM IS SUBMITTED IN CONNECTION WITH APPLICATION FOR: NATURALIZATION OTHER (SPECIFY) themy SIGNATURE or APPOILANT or PETITIONER DATE ADJUSTMENT OF STATUS 07-08-78 17 - RECIVE ALPHABET OTHER THIS ROMAN LETTERS. WRITE TOUR NAME IN TOUR annur ALPHANNET â‘‰ mos SPACE: Are all copies legible? Yes PENALTIES SEVERE PENALTIES ARE PROVIDED BY LAW FOR KNOWINGLY AND WILLFULLY FALSEFYING OR CONGEALING A MATERIAL FACT. APPLICANT: BE SURE TO PUT YOUR NAME AND ALIEN REGISTRATION NUMBER IN THE BOX OUTLINED BY HEAVY BORDER BELOW. COMPLETE THIS BOX (Family name] [Given name] (Middle name) (Allen registration number) HOANG Phung Van A21 347 299 586 34 6321 (OTHER AGENCY USE) INS USE (Office of Origin) OFFICE CODE: TYPE OF CASE: DATE: (3) c. FORM G-325A"
}