{
  "anumber": "A21348654",
  "id": "A21348654_0000",
  "page_index": 0,
  "resources": {
    "full_jpg": "https://dctn4zjpwgdwdiiy5odjv7o2se0bqgjb.lambda-url.us-east-1.on.aws/iiif/3/og-2023-kc-nara_A21348654_0000/full/max/0/default.jpg"
  },
  "fields": {
    "sex": {
      "ms_sex_llm_v1": "female"
    },
    "doctype": {
      "ms_doctype_v1": "letter"
    },
    "form_title": {
      "ms_form_title_llm_v1": "CERTIFICATE OF IMMIGRATION AND NATURALIZATION, No. 11315598"
    },
    "countries": {
      "ms_countries_nlp_v1": [
        "Vietnam",
        "United States"
      ]
    },
    "years": {
      "ms_years_nlp_v1": [
        2023,
        1984,
        1915
      ]
    },
    "certificate_naturalization": {
      "complexion": {
        "complexion_llm_v1": "medium"
      },
      "marital_status": {
        "marital_status_llm_v1": "widowed"
      },
      "year_naturalization": {
        "year_naturalization_llm_v1": 1984
      },
      "residence_naturlization": {
        "residence_naturlization_llm_v1": "Los Angeles"
      }
    }
  },
  "is_g325a": false,
  "is_cert_naturalization": true,
  "full_text": "Screened by NARA, 9/22/2023 JU:OF TO BE FORWARDED TO No. 11315598 IMMIGRATION AND NATURALIZATION SERVICE OBRRJOBD CATE 0 Pelilion No. 476970 DUPLICATE AlienRegistration Ra A21 348 654 Personal, description, of holders of date of naturalization: Date of birth JANUARY 1, 1915 FEMALE sex complexion MEDIUM BROWN ; colorobeyes colorof hair BLACK height 5 feet 0 inches; weight 95 pounds; visible NONE Maritalstatus WIDOWED Country of formernationality. VIETNAM I certify that the description, above given is Area and thatshephotograph effixed hereto is a likeness of me / Complete and true signature of holder) UNITED STATES OF AMERICA CENTRAL DIST. OF CALIFORNIA } SS: Beit known, that Lakatermolt the District The United States Court of held bursuant to law al Los Angeles on SEPTEMBER 12, 1984 the HUONG THI NGUYEN then residing at 506 1/2 S BURLINGTON AV . LOS ANGELES, CA inlends loreside permanentlyin, the United. States when sorequired bythe naturalization. Laws of the United States), had in all other respects, complied with the applicable provisions of such naturalization laws, and was entitled lobe Seal admitted docilisenship, thereupon ordered that such person be and (s)hewas admitted as a citizen of the United States of America. Indestimony whoreof Ethosealofthe,countis, hereunto affixed this 12TH dayof SEPTEMBER in the year of our. Lord nineteen hundred and EIGHTY-FOUR LEONARD A. BROSNAN STATISTICS Glerhofthe U.S. District Court. IT IS PUNISHABLE BY U. S. LAW TO COPY, PRINT OR PHOTOGRAPH THIS CERTIFICATE. By Latherns Jones Deputy Clerk."
}