{
  "anumber": "A21347299",
  "id": "A21347299_0013",
  "page_index": 13,
  "resources": {
    "full_jpg": "https://dctn4zjpwgdwdiiy5odjv7o2se0bqgjb.lambda-url.us-east-1.on.aws/iiif/3/og-2023-kc-nara_A21347299_0013/full/max/0/default.jpg"
  },
  "fields": {
    "sex": {
      "ms_sex_llm_v1": "female"
    },
    "doctype": {
      "ms_doctype_v1": "form"
    },
    "form_title": {
      "ms_form_title_llm_v1": "BIOGRAPHIC INFORMATION, G-325A"
    },
    "countries": {
      "ms_countries_nlp_v1": [
        "Vietnam",
        "United States"
      ]
    },
    "years": {
      "ms_years_nlp_v1": [
        1875,
        1945,
        2023,
        1926,
        1883,
        1915
      ]
    },
    "g325a": {
      "occupation": {
        "occupation_llm_v1": "['custodian']"
      },
      "nationality": {
        "nationality_llm_v1": "VIETNAMESE"
      }
    }
  },
  "is_g325a": true,
  "is_cert_naturalization": false,
  "full_text": "Screened by NARA. 8/29/2023 FORM G-325A (REV. 10-1-74) Y Form Approved UNITED STATES DEPARTMENT OF JUSTICE OMB No. 43-R436 Immigration and Naturalization Service BIOGRAPHIC INFORMATION (Family name) (First name) (Middle name) MALE BIRTHDATE(Mo.-Day-Yr.) NATIONALITY ALIEN REGISTRATION NO. HOANG Phung Van FEMALE 2-2-1915 VIETNAMESE (If 121 347 299 ALL OTHER NAMES USED (Including names by previous marriages) CITY AND COUNTRY OF BIRTH SOCIAL SECURITY NO. HOANG Van Phung (name as on I-94 Form) Cao Bang, North Vietnan (If one 986 34 6321 FAMILY NAME FIRST NAME DATE, CITY AND COUNTRY OF BIRTH(If known) CITY AND COUNTRY OF RESIDENCE HOANG Sach 1875, Kwang-Si, China Deceased FATHER DZIN Ly 1883, Kwang-Si, China Deceased MOTHER(Maiden name) HUSBAND If none, so state) FAMILY NAME FIRST NAME BIRTHDATE CITY & COUNTRY OF BIRTH DATE OF MARRIAGE PLACE OF MARRIAGE OR (For wife, give maiden name) WIFE 8-20- Ha-Noi, 1945 Ha-Nei, EGUYEN Phue 1926 Vietnem. Vietnam FORMER HUSBANDS OR WIVES(If none.so state) FAMILY NAME (for wife, give maiden name) FIRST NAME BIRTHDATE DATE & PLACE OF MARRIAGE DATE AND PLACE OF TERMINATION OF MARRIAGE NOME APPLICANT'S RESIDENCE LAST FIVE YEARS. LIST PRESENT ADDRESS FIRST. FROM TO STREET AND NUMBER CITY PROVINCE OR STATE COUNTRY MONTH YEAR MONTH YEAR 1512 West 3rd street Santa Ana California U.S.A. 05 77 PRESENT TIME -14691 Car fax C Tustin California U.S.A. 02 76 04 77 -1722 Mitchell #138 Tustin California U.S.A. 08 75 02 76 -Pendleton Refugee Camp California U.S.A. 05 75 08 75 -183/16/1 Phan Thank Gian Go Vap Gia Dinh VIETNAM 01 61 04 75 APPLICANT'S LAST ADDRESS OUTSIDE THE UNITED STATES OF MORE THAN ONE YEAR FROM TO STREET AND NUMBER CITY PROVINCE OR STATE COUNTRY MONTH YEAR MONTH YEAR -183/16/1 Phan Thank Gian Co Vap Gia Dinh VIETNAM 01 61 04 75 APPLICANT'S EMPLOYMENT LAST FIVE YEARS. (IF NONE, so STATE.) LIST PRESENT EMPLOYMENT FIRST. FROM TO FULL NAME AND ADDRESS OF EMPLOYER OCCUPATION SPECIFY) MONTH YEAR MONTH YEAR Tustin Unified School District, 300 s.c st.Tustin.CA. Custodian 08 75 PRESENT TIME Show below last occupation abroad if not shown above. (Include all information requested above.) Northrop Aircraft Co. Saigon, Vietnam Supervisor of Motor Pool 12 67 04 75 THIS FORM IS SUBMITTED IN CONNECTION WITH APPLICATION FOR: NATURALIZATION OTHER (SPECIFY): turny SIGNATURE OF APPURCANT of PETITIONER DATE ADJUSTMENT OF STATUS 07-08-78 IF YOUR NATIVE ALPHABET 3h OTHER THAN FORMAR LETTERS. WHITE YOUR NUMBER IN YOUR NATIVE ALPHABET IN THIS SMACK: Are all copies legible? Yes PENALTIES: SEVERE PENALTIES ARE PROVIDED BY LAW FOR KNOWINGLY AND WILLFULLY FALSIFYING OR CONCEALING A MATERIAL FACT. APPLICANT: BE SURE TO PUT YOUR NAME AND ALIEN REGISTRATION NUMBER IN THE BOX OUTLINED BY HEAVY BORDER BELOW. COMPLETE THIS BOX (Family name) (Given name) (Middle name) (Alien registration number) HOANG Phung Van A21 347 299 566 34 6321 (OTHER AGENCY USE) INS USE (Office of Origin) OFFICE CODE: TYPE OF CASE: DATE: (3) C. FORM G-325A"
}