{
  "anumber": "A21347299",
  "id": "A21347299_0034",
  "page_index": 34,
  "resources": {
    "full_jpg": "https://dctn4zjpwgdwdiiy5odjv7o2se0bqgjb.lambda-url.us-east-1.on.aws/iiif/3/og-2023-kc-nara_A21347299_0034/full/max/0/default.jpg"
  },
  "fields": {
    "sex": {
      "ms_sex_llm_v1": "male"
    },
    "doctype": {
      "ms_doctype_v1": "form"
    },
    "form_title": {
      "ms_form_title_llm_v1": "BIOGRAPHIC INFORMATION, G-325A"
    },
    "countries": {
      "ms_countries_nlp_v1": [
        "Vietnam",
        "United States"
      ]
    },
    "years": {
      "ms_years_nlp_v1": [
        1945,
        2023,
        1926,
        1915
      ]
    },
    "g325a": {
      "occupation": {
        "occupation_llm_v1": "['driver', ' special']"
      },
      "reason": {
        "reason_llm_v1": "Naturalization"
      },
      "nationality": {
        "nationality_llm_v1": "VIET NAM"
      }
    }
  },
  "is_g325a": true,
  "is_cert_naturalization": false,
  "full_text": "FORM G-325A (REV. 8-27-72)N Form Approved Screened by NARA 8/29/2023 UNITED STATES DEPARTMENT OF JUSTICE OMB No. 43-R436 Immigration and Naturalization Service BIOGRAPHIC INFORMATION (Family nam) (First name) (Middle pame) MALE BIRTHDATE(Mo.-Day-Yr.) NATIONALITY ALIEN REGISTRATION NO. HOANG PHUNG VEN FEMALE 1915 ViET NAM 247 99 ALL OTHER NAMES USED (Includi ing HOUSE previous morriages) CITY AND COUNTRY OF BIRTH SOCIAL SECURITY NO. CAO (If any) FAMILY NAME FIRST NAME DATE, CITY AND COUNTRY OF BIRTH (If known) CITY AND COUNTRY OF RESIDENCE FATHER MOTHER (Maiden nome) HUSBAND (If none, so state) FAMILY NAME FIRST NAME BIRTHDATE CITY & COUNTRY OF BIRTH DATE OF MARRIAGE PLACE OF MARRIAGE OR (For wife, give molden name) WIFE 1945 Naugen FORMER HUSBANDS OR WIVES(If none, so stole) FAMILY NAME (For wife, give moiden name) FIRST NAME BIRTHDATE DATE & PLACE OF MARRIAGE DATE AND PLACE OF TERMINATION OF MARRIAGE program PHUC 1926 APPLICANT'S RESIDENCE LAST FIVE YEARS. LIST PRESENT ADDRESS FIRST. FROM TO STREET AND NUMBER CITY PROVINCE OR STATE COUNTRY MONTH YEAR MONTH YEAR PRESENT TIME 1115 REF PS APPLICANT'S LAST ADDRESS OUTSIDE THE UNITED STATES OF MORE THAN ONE YEAR FROM TO STREET AND NUMBER CITY PROVINCE OR STATE COUNTRY MONTH YEAR MONTH YEAR APPLICANT'S EMPLOYMENT LAST FIVE YEARS. (IF NONE, so STATE.) LIST PRESENT EMPLOYMENT FIRST FROM TO FULL NAME AND ADDRESS OF EMPLOYER OCCUPATION SPECIFY! MONTH YEAR MONTH YEAR PRESENT TIME PAGE - Comman LAC. 4F APRIL 19th NORTHROP PAGE TECHNOLOGY PARK ViAGiNia 41100 Show below last occupation abroad if not shown above. (Include all information requested above.) THIS FORM IS SUBMITTED IN CONNECTION WITH APPLICATION FOR: SIGNATURE OF APPLICANT OR_BERTIONER DATE IATURALIZATION ADJUSTMENT OF STATUS OTHER (SPECIFY): Refugee 9-5-7975 IF YOUR NATIVE ALPHAGET IS 13 OTHER THAN RIGHLAN LETTERS. WRITE YOUR NAME IN YOUR NATIVE ALPHANT IN THIS SPACE Are all copies legible? Yes PENALTIES SEVERE PENALTIES ARE PROVIDED BY LAW FOR KROWINGLY AND WILLFULLY FALSIFYING OR CONCEALING A MATERIAL FACT APPLICANT: BE SURE TO PUT YOUR NAME AND ALIEN REGISTRATION NUMBER IN THE BOX OUTLINED BY HEAVY BORDER BELOW. COMPLETE THIS BOX (Family name) (Given name) (Middle name) {Alien registration number) HOMEL PHUNG VAN A21 347 299 (OTHER AGENCY USE) INS USE (Office of Origin) NR 5207 VIETNAM STATE CP PENDLETON, SL. Hd 6T b II NVW SPEC be I FORM G-325A (3) C. 5/10/75"
}