{
  "anumber": "A21344739",
  "id": "A21344739_0000",
  "page_index": 0,
  "resources": {
    "full_jpg": "https://dctn4zjpwgdwdiiy5odjv7o2se0bqgjb.lambda-url.us-east-1.on.aws/iiif/3/og-2023-kc-nara_A21344739_0000/full/max/0/default.jpg"
  },
  "fields": {
    "sex": {
      "ms_sex_llm_v1": "female"
    },
    "doctype": {
      "ms_doctype_v1": "form"
    },
    "form_title": {
      "ms_form_title_llm_v1": "Processing Sheet"
    },
    "countries": {
      "ms_countries_nlp_v1": [
        "Vietnam",
        "United States"
      ]
    },
    "years": {
      "ms_years_nlp_v1": [
        1975,
        1970,
        2023,
        1995
      ]
    }
  },
  "is_g325a": false,
  "is_cert_naturalization": false,
  "full_text": "Screened by NARA, 9/22/2023 a U.S. Department of Justice COMPANY Immigration & Naturalization Service PROCESSING SHEET File No: A 344939 DESCRIPTION SECTION OF LAW Sex : MALE ( FEMALE its it 316(a) ( ) 325 Marital Status : (S) (M) (D) (W) 319(a) ( ) 328 Height : Ft. 5 , In. 2 ( ) 319(b) ( ) 329 Nationality : VIETNAM ( ) 322 ( ) 405 INITIAL INTERVIEW : JAN 10 1995 FINAL ACTION (Date) Speaks English: is Reads W Writes and Understands 20 ( ) Denial : Date & Initials ( ) Withdrawal : Date & Initials Government : OK() I.N.S. ( E.T.S. ( ) CASAS ( ( ) Oath Taken Certificate Issued: REEXAM : ACTION or DOCUMENTS REQUIRED ( Date and Initials ) ( ) See Attached N-14b ( ) Reexamination DOCUMENTS PRESENTED I 551 ( ) Visa File ( ) Post Audit A.R.C. : A21344739 ( ) Other : D.O.B. : 10-21-15 COMMENTS P.O.E. : Los C.O.A. : IC6 D.O.E. : 6-1-75 55/15 VIETNAM CID / CDL : Initials 29th DOB/915 Recommendation : JAN 10 1995 55 APP APPROVAL (STAMP) FINAL HEARING 1970 DISTRICT DIRECTOR JAN 110 1995) DOE 1975 John DATE 15 recommended by: 532 1990 TIME Attorney Waiver Executed, If Attorney Present, List Name : 3 Months Residence OK for Fingerprints NEG. 40 Nazi Negative Day-Time Phone :(714)-546-7142 Ext OATH OF ALLEGIANCE Name Change : ) Modified Oath; Delete Part(s) : ( Promise to Bear Arms, ) Noncombat Duty OATH WITH U.S. DISTRICT COURT 246 I HEREBY DECLARE, on oath, That I absolutely and entirely renounce and abjure all allegiance and fidelity to any foreign prince, potentate, state, or sovereignty of whom or which I have heretofore been a subject or citizen; That I will support and defend the Constitution and the Laws of the United States of America against all enemies, foreign and domestic; That will bear true faith and allegiance to the same; That I will bear arms on behalf of the United States when required by Law; That I will perform noncombatant service in the Armed Forces of the United States when required by the law; That I will perform work of national importance under civilian direction when required by the Law; and That I take this obligation freely without any mental reservation or purpose of evasion; so HELP ME GOD. In acknowledgement my signature. Signature than whereof I have hereunto affixed Keep This Sheet On Top Of All Material In File Until Initial Decision Is Made"
}