{
  "anumber": "A21432711",
  "id": "A21432711_0015",
  "page_index": 15,
  "resources": {
    "full_jpg": "https://dctn4zjpwgdwdiiy5odjv7o2se0bqgjb.lambda-url.us-east-1.on.aws/iiif/3/og-2023-kc-nara_A21432711_0015/full/max/0/default.jpg"
  },
  "fields": {
    "sex": {
      "ms_sex_llm_v1": "female"
    },
    "doctype": {
      "ms_doctype_v1": "form"
    },
    "form_title": {
      "ms_form_title_llm_v1": "BIOGRAPHIC INFORMATION, FORM G-325A ( (REV. 10-1-74) Y"
    },
    "countries": {
      "ms_countries_nlp_v1": [
        "Vietnam",
        "United States"
      ]
    },
    "years": {
      "ms_years_nlp_v1": [
        1917,
        1936,
        2023,
        1978,
        1915
      ]
    },
    "g325a": {
      "occupation": {
        "occupation_llm_v1": "['unemployed']"
      },
      "nationality": {
        "nationality_llm_v1": "VIETNAMESE"
      }
    }
  },
  "is_g325a": true,
  "is_cert_naturalization": false,
  "full_text": "Screened by NARA, 9/22/2023 FORM-G-325A (REV. 10-1-74) Y Form Approved UNITED STATES DEPARTMENT OF JUSTICE LOS OMB No. 43-R436 Immigration and Naturalization Service BIOGRAPHIC T/C - 245 U.E 15 1978 INFORMATION For Sale by the Superintendent of Documents, U.S. Government Printing OfficeAUG 5 1978 Washington, DC 20402 (Family name) (First name) (Middle name) MALE BIRTHDATE(Mo.-Day-Yr.) NATIONALITY (DATE ALIEN REGISTRATION NO. NGUYEN NGOC MINH THI FEMALE 1-2-1915 VIETNAMESE \"A21-432-711 ALL OTHER NAMES USED (Including names by previous marriages) CITY AND COUNTRY OF BIRTH SOCIAL SECURITY NO. IIII NNONE PHUC YEN, VIETNAM (If any) 586-34-8866 FAMILY NAME FIRST NAME DATE, CITY AND COUNTRY OF BIRTH(If known) CITY AND COUNTRY OF RESIDENCE FORGOT / HANOi VN DECEASED FATHER NGUYEN, NGUYEN MOTHER (Maiden name) VU, NGHIA FORGOT, HANOi VN DECEASED HUSBAND (If none, so state) FAMILY NAME FIRST NAME BIRTHDATE CITY & COUNTRY OF BIRTH DATE OF MARRIAGE PLACE OF MARRIAGE OR WIFE (For wife, give maiden name) (DECEASED) NGUYEN CAC 1917 HAI DUONG,UN 1936 VIETNAM FORMER HUSBANDS OR WIVES( none, so state) FAMILY NAME (For wife, give maiden name) FIRST NAME BIRTHDATE DATE & PLACE OF MARRIAGE DATE AND PLACE OF TERMINATION OF MARRIAGE NONE APPLICANT'S RESIDENCE LAST FIVE YEARS. LIST PRESENT ADDRESS FIRST. FROM TO STREET AND NUMBER CITY PROVINCE OR STATE COUNTRY MONTH YEAR MONTH YEAR 12700 CRANBROOK AVE HAWTHORNE CA U.S.A 7 75 PRESENT TIME 16767 MAG NOLIA ENCINO CA USA 5 75 Z 75 575/20 PHAN THANH GIAN SAIGON SAIGON VN 5 72 4 75 APPLICANT'S LAST ADDRESS OUTSIDE THE UNITED STATES OF MORE THAN ONE YEAR FROM TO STREET AND NUMBER CITY PROVINCE OR STATE COUNTRY MONTH YEAR MONTH YEAR 575/20 PHAN THANH GIAN SAIGON SAIGON UN 5 72 4 is APPLICANT'S EMPLOYMENT LAST FIVE YEARS. (IF NONE, so STATE.) LIST PRESENT EMPLOYMENT FIRST FROM TO FULL NAME AND ADDRESS OF EMPLOYER OCCUPATION (SPECIFY) MONTH YEAR MONTH YEAR UNEMPLO YED PRESENT TIME Show below last occupation abroad if not shown above. (Include all information requested above.) Housewife THIS FORM IS SUBMITTED IN CONNECTION WITH APPLICATION FOR: SIGNATURE OF APPLICANT OR PETITIONER DATE NATURALIZATION ADJUSTMENT OF STATUS nguyhu the ugae mich 5-16-78 OTHER (SPECIFY): IF YOUR NATIVE ALPHABET IS IN OTHER THAN ROMAN LETTERS. WRITE YOUR NAME IN YOUR NATIVE ALPHABET IN THIS SPACE: Are all copies legible? Yes NONE PENALTIES: SEVERE PENALTIES ARE PROVIDED BY LAW FOR KNOWINGLY AND WILLFULLY FALSIFYING OR CONCEALING A MATERIAL FACT."
}