{
  "anumber": "A21430343",
  "id": "A21430343_0027",
  "page_index": 27,
  "resources": {
    "full_jpg": "https://dctn4zjpwgdwdiiy5odjv7o2se0bqgjb.lambda-url.us-east-1.on.aws/iiif/3/og-2023-kc-nara_A21430343_0027/full/max/0/default.jpg"
  },
  "fields": {
    "sex": {
      "ms_sex_llm_v1": "female"
    },
    "doctype": {
      "ms_doctype_v1": "form"
    },
    "form_title": {
      "ms_form_title_llm_v1": "APPLICATION FOR PAROLE"
    },
    "countries": {
      "ms_countries_nlp_v1": [
        "Vietnam"
      ]
    },
    "years": {
      "ms_years_nlp_v1": [
        2023,
        1975
      ]
    }
  },
  "is_g325a": false,
  "is_cert_naturalization": false,
  "full_text": "Screened by NARA, 7/3/2023 A No. APPLICATION FOR PAROLE A21 430 343 Location VIETNAM - CAMBODIA PROGRAM AGA (W) Date MAY 2, 1975 Name of Applicant: (Last Name) (First Name) (Middle Name) HUYNH BINH Applicant is: Male Female Single Married Child between 14 and 21 Head of family numbering and spouse. Family members' documents housed in following A files: FOIA (b) (6) Relatives or friends in U.S. (Not accompanying) Name Relationship Address Sponsoring Agency, if any: I state under oath that I have have never been convicted of a crime, and have have never been a member of the communist party or any party affiliated with the communist party. Signature of Applicant I am satisfied not satisfied that the applicant is admissible inadmissible under the applicable paragraphs of Section 212 (a) of the Act. Name of Interpreter: (Type) Eligible for defector status. Ineligible for defector status. Signature of Interpreter Signature of Immigration Officer Form G-645 (4-22-75)"
}