{
  "anumber": "A21431061",
  "id": "A21431061_0066",
  "page_index": 66,
  "resources": {
    "full_jpg": "https://dctn4zjpwgdwdiiy5odjv7o2se0bqgjb.lambda-url.us-east-1.on.aws/iiif/3/og-2023-kc-nara_A21431061_0066/full/max/0/default.jpg"
  },
  "fields": {
    "sex": {
      "ms_sex_llm_v1": "female"
    },
    "doctype": {
      "ms_doctype_v1": "form"
    },
    "form_title": {
      "ms_form_title_llm_v1": "APPLICATION FOR IMMIGRANT VISA AND ALIEN REGISTRATION"
    },
    "countries": {
      "ms_countries_nlp_v1": [
        "United States"
      ]
    },
    "years": {
      "ms_years_nlp_v1": [
        2023,
        1915
      ]
    }
  },
  "is_g325a": false,
  "is_cert_naturalization": false,
  "full_text": "Screened by NARA, 9/22/2023 Form FS-510 (English) 2-68 Form Approved. DEPARTMENT OF STATE Budget Bureau No. 47-R0150. APPLICATION FOR IMMIGRANT VISA AND ALIEN REGISTRATION INSTRUCTIONS: This form must be filled out in DUPLICATE by typewriter, or if by hand in legible block letters. ALL questions must be answered, if applicable. Questions which are not applicable should be so marked. If there is insufficient room on the form, answer on separate sheets, in duplicate using the same numbers as appear on the form. Attach the sheets to the forms. DO NOT SIGN this form until instructed to do so by the consular officer. The fee for filing this application for an immigrant visa is $5.00. The fee should be paid in United States dollars or local currency equivalent or by bank draft, when you appear before the consular officer. WARNING: Any false statement or concealment of a material fact may resuls in your permanent exclusion from the United States. Even though you should be admitted to the United States, a frandulent entry could be grounds for your prosecution and/or deportation. 1. BUILY QUANE first name NCA name 2. Other names used or by which known (If marvied woman, give maiden name) 3. Full name in native alphabet (If Roman letters not used) - 4. Date of birth 5. Age 6. Place of birth (Day) (Month) (Year) 31 12 1915 60 (City or town) (Province) (Country) THANH HOA U.M 7. Nationality 8. Sex 9. Marital status Male Female VIETNAMESE Single (never married) Married Widowed Divorced Separated Including my present marriage, I have been married times. 10. Occupation PRO FESSOR 11. Present address 12. Purpose in going to the United States 13. Name and address of wife/husband (Give maiden name of wife) 14. Names and addresses of children under 21 years of age 15. Person(s) named in 13 and 14 (will) (will not) accompany or follow me to the United States. (Cross out words that do not apply) 16. Length of intended stay (If permanently, so state) 17. Intended port of entry PERMANENT NO LLCL 18. Final address in the United States 19. Do you have a ticket to final destination? 1619.ULLI pip PL KAILUA no HAWAI 20. Person you intend to join (Give name, address and relationship, 21. Name and address of sponsoring person or organization if any) (If different from 20) FOIA (b)(6) same AS 20 22. Personal description LOL 23. Marks of identification (a) Color of hair (c) Height BLACK 5 feet 3 inches (b) Color of eyes (d) Complexion BROWN 24. The following documents are submitted in support of this application Birth certificate Death certificate Evidence of own assets Medical record(s) Police certificate(s) Divorce decree Affidavit of support Photographs Marriage certificate Military. record Offer of employment Other (describe) THIS FORM MAY BE OBTAINED GRATIS AT CONSULAR OFFICES OF THE UNITED STATES OF AMERICA"
}