{
  "anumber": "A21485800",
  "id": "A21485800_0047",
  "page_index": 47,
  "resources": {
    "full_jpg": "https://dctn4zjpwgdwdiiy5odjv7o2se0bqgjb.lambda-url.us-east-1.on.aws/iiif/3/og-2023-kc-nara_A21485800_0047/full/max/0/default.jpg"
  },
  "fields": {
    "sex": {
      "ms_sex_llm_v1": "male"
    },
    "doctype": {
      "ms_doctype_v1": "form"
    },
    "form_title": {
      "ms_form_title_llm_v1": "BIOGRAPHIC INFORMATION, G-325A"
    },
    "countries": {
      "ms_countries_nlp_v1": [
        "Pakistan",
        "United States",
        "India"
      ]
    },
    "years": {
      "ms_years_nlp_v1": [
        1921,
        1971,
        1910,
        1905,
        2023,
        1976
      ]
    },
    "g325a": {
      "occupation": {
        "occupation_llm_v1": "['none']"
      },
      "reason": {
        "reason_llm_v1": "NATURALIZATION"
      },
      "nationality": {
        "nationality_llm_v1": "INDIAN"
      }
    }
  },
  "is_g325a": true,
  "is_cert_naturalization": false,
  "full_text": "Screened by NARA, 7/31/2023 FORM G-325A (REV. 8-27-72)N Form Approved UNITED STATES DEPARTMENT OF JUSTICE OMB No. 43-R436 Immigration and Naturalization Service BIOGRAPHIC INFORMATION (Family name) (First name) (Middle name) MALE BIRTHDATE(Mo.-Day-Yr.) NATIONALITY ALIEN REGISTRATION NO. PINJANI CHETANRAM SHIVANDASS FEMALE gime 6\"1905 INDIAN (If any) A21485800 ALL OTHER NAMES USED (Including names by previous marriages) CITY AND COUNTRY OF BIRTH SOCIAL SECURITY NO sukkur such W. PAKISTAN (If any) 420-98-7535 FAMILY NAME FIRST NAME DATE, CITY AND COUNTRY OF BIRTH(If known) CITY AND COUNTRY OF RESIDENCE FATHER PINJANI SHIYANDASS - sukkus simth W.Pakisten sukkur Smith W. Pakeline MOTHER (Maiden name) Aturbai - sukkus Sinth W. Pakistin sukkus Smith W. Pakistur HUSBAND (If none, so state) FAMILY NAME FIRST NAME BIRTHDATE CITY & COUNTRY OF BIRTH DATE OF MARRIAGE PLACE OF MARRIAGE OR (For, wife, give maiden name) WIFE Vaswani SugniBil 1910 Larkana Smith W. Pakistan April 1921 smile W. Pakislas FORMER HUSBANDS OR WIVES(if none, so state) None FAMILY NAME (For wife, give maiden name) FIRST NAME BIRTHDATE DATE & PLACE OF MARRIAGE DATE AND PLACE OF TERMINATION OF MARRIAGE APPLICANT'S RESIDENCE LAST FIVE YEARS. LIST PRESENT ADDRESS FIRST. FROM TO STREET AND NUMBER CITY PROVINCE OR STATE COUNTRY MONTH YEAR MONTH YEAR 4024 CEDAR GATERoal HuntsVille Alahama U.S.A May 1976 PRESENT TIME R- 511 New Ryjndes Nagar New Deli Delhi India April 1971 April 1976 APPLICANT'S LAST ADDRESS OUTSIDE THE UNITED STATES OF MORE THAN ONE YEAR FROM TO STREET AND NUMBER CITY PROVINCE OR STATE COUNTRY MONTH YEAR MONTH YEAR R-511 New Rejuder Nagar Newseth Delhi Infia April 1971 April 1976 APPLICANT'S EMPLOYMENT LAST FIVE YEARS. (IF NONE, so STATE.) LIST PRESENT EMPLOYMENT FIRST. FROM TO FULL NAME AND ADDRESS OF EMPLOYER OCCUPATION (SPECIFY) MONTH YEAR MONTH YEAR None PRESENT TIME Show below last occupation abroad if not shown above. (Include all information requested above.) THIS FORM IS SUBMITTED IN CONNECTION WITH APPLICATION FOR: SIGNATURE OFMAPPLICANT OR PETITIONER DATE NATURALIZATION ADJUSTMENT OF STATUS OTHER (SPECIFY): August 11,1976 IF YOUR NATIVE ALPHIBAT IS IN OTHER THAN ROMAN LETTERS. WRITE YOUR NAME IN YOUR NATIVE ALPHABET IN THIS SPACE: Are all copies legible? Yes PENALTIES SEVERE PENALTIES ARE PROVIDED BY LAW FOR KNOWINGLY AND WILLFULLY FALSIFYING OR CONCEALING A MATERIAL FACT."
}