{
  "anumber": "A21430343",
  "id": "A21430343_0017",
  "page_index": 17,
  "resources": {
    "full_jpg": "https://dctn4zjpwgdwdiiy5odjv7o2se0bqgjb.lambda-url.us-east-1.on.aws/iiif/3/og-2023-kc-nara_A21430343_0017/full/max/0/default.jpg"
  },
  "fields": {
    "sex": {
      "ms_sex_llm_v1": "female"
    },
    "doctype": {
      "ms_doctype_v1": "form"
    },
    "form_title": {
      "ms_form_title_llm_v1": "BIOGRAPHIC INFORMATION, FORM G-325A ( (REV. 10-1-74) Y"
    },
    "countries": {
      "ms_countries_nlp_v1": [
        "Vietnam",
        "United States"
      ]
    },
    "years": {
      "ms_years_nlp_v1": [
        1910,
        2023,
        1935,
        1978
      ]
    },
    "g325a": {
      "occupation": {
        "occupation_llm_v1": "['vietnam', ' sewing', ' retired']"
      },
      "reason": {
        "reason_llm_v1": "Yes"
      },
      "nationality": {
        "nationality_llm_v1": "VIETNAM"
      }
    }
  },
  "is_g325a": true,
  "is_cert_naturalization": false,
  "full_text": "Screened by NARA, 7/3/2023 FORM G-325A (REV. 10-1-74) Y Form Approved UNITED STATES DEPARTMENT OF JUSTICE LOS OMB No. 43-R436 BIOGRAPHIC Immigration and Naturalization Service TIC = 24.5 INFORMATION MAY 6 1978 (Family name) (First name) HATEL (Middle name) MALE BIRTHDATE(Mo.-Day-Yr. NATIONALITY ALIEN REGISTRATION NO. HUYNH BINH FEMALE 9-23-15 VIETNAM (If any) 21-430-343 ALL OTHER NAMES USED (Including names by previous marriages) CITY AND COUNTRY OF BIRTH SOCIAL SECURITY NO. NONE CHOCON VietNAM (If any) 586-40-0488 FAMILY NAME FIRST NAME DATE, CITY AND COUNTRY OF BIRTH(If known) CITY AND COUNTRY OF RESIDENCE FATHER HWYNH TE CHiNA DECEASED MOTHER(Maiden name) DO DANG CHiNA ViETNAM HUSBAND (If none, so state) FAMILY NAME FIRST NAME BIRTHDATE CITY & COUNTRY OF BIRTH OR DATE OF MARRIAGE PLACE OF MARRIAGE WIFE (For wife, give maiden name) 5-11 CHIANG RANG 1910 SAiGON 1935 ViEtNAM VIETNAM FORMER HUSBANDS OR WIVES(if none, so state) FAMILY NAME (For wife, give maiden name) FIRST NAME BIRTHDATE DATE & PLACE OF MARRIAGE DATE AND PLACE OF TERMINATION OF MARRIAGE NONE APPLICANT'S RESIDENCE LAST FIVE YEARS. LIST PRESENT ADDRESS FIRST. FROM TO STREET AND NUMBER CITY PROVINCE OR STATE COUNTRY MONTH YEAR MONTH YEAR 1414 MAGDALENA ST. L.A CA USA 10 77 PRESENT TIME 288 19613 S Normantal Ave Cerritos CA USA 5 75 10 77 88 Tran Quy ST Saison Vietzem / 74 4 95 440 Trang Aoang Quan Sangon Vietnam 60 / 74 APPLICANT'S LAST ADDRESS OUTSIDE THE UNITED STATES OF MORE THAN ONE YEAR FROM TO STREET AND NUMBER CITY PROVINCE OR STATE COUNTRY MONTH YEAR MONTH YEAR 88 Tran Quy 85 Saigon Vietnam / 74 4 75 APPLICANT'S EMPLOYMENT LAST FIVE YEARS. (IF NONE, so STATE.) LIST PRESENT EMPLOYMENT FIRST. FROM TO FULL NAME AND ADDRESS OF EMPLOYER OCCUPATION (SPECIFY) MONTH YEAR MONTH YEAR NONE PRESENT TIME Show below last occupation abroad if not shown above. (Include all information requested above.) ViETNAM THIS FORM IS SUBMITTED IN CONNECTION WITH APPLICATION FOR: SIGNATURE OF APPLICANT OR PETITIONER senting 65 69 DATE NATURALIZATION ADJUSTMENT OF STATUS Hugh Buth OTHER (SPECIFY): 4-10-78 IF YOUR NATIVE ALPHABET IS IN OTHER THAN ROMAN LETTERS. WRITE YOUR NAME IN YOUR NATIVE ALPHABET IN THIS SPACE: Are all copies legible? Yes PENALTIES SEVERE PENALTIES ARE PROVIDED BY LAW FOR KNOWINGLY AND WILLFULLY FALSIFYING OR CONCEALING A MATERIAL FACT."
}