{
	"anumber": "A21431061",
	"id": "A21431061_0038",
	"page_index": 38,
	"resources": {
		"full_jpg": "https://dctn4zjpwgdwdiiy5odjv7o2se0bqgjb.lambda-url.us-east-1.on.aws/iiif/3/og-2023-kc-nara_A21431061_0038/full/max/0/default.jpg"
	},
	"fields": {
		"sex": {
			"ms_sex_llm_v1": "female"
		},
		"doctype": {
			"ms_doctype_v1": "form"
		},
		"form_title": {
			"ms_form_title_llm_v1": "Biographic Information, FORM G-325A ( (REV. 10-1-74)"
		},
		"countries": {
			"ms_countries_nlp_v1": ["Vietnam", "United States"]
		},
		"years": {
			"ms_years_nlp_v1": [1970, 2023, 1968]
		},
		"g325a": {
			"occupation": {
				"occupation_llm_v1": "['unemployed']"
			},
			"reason": {
				"reason_llm_v1": "NATURALIZATION"
			},
			"nationality": {
				"nationality_llm_v1": "Vietnamese"
			}
		}
	},
	"is_g325a": true,
	"is_cert_naturalization": false,
	"full_text": "Screened by NARA, 9/22/2023 FORM G-325A (REV. 10-1-74) Y Form Approved UNITED STATES DEPARTMENT OF JUSTICE OMB No. 43-R436 Immigration and Naturalization Service BIOGRAPHIC INFORMATION (Family name) (First name) (Middle name) MALE BIRTHDATE(Mo.-Day-Yr.) NATIONALITY ALIEN REGISTRATION NO. BUI NGA QUANG FEMALE 12/31/15 Vietnamese (If OAV) A21-431-061 ALL OTHER NAMES USED (Including names by previous marriages) CITY AND COUNTRY OF BIRTH SOCIAL SECURITY NO. VAN NG OC THANH HOA, VIETNAM 970494-3530 FAMILY NAME FIRST NAME DATE, CITY AND COUNTRY OF BIRTH(If known) CITY AND COUNTRY OF RESIDENCE BUI HOANG VIETNAM FATHER VIETNAM (dead) MOTHER (Maiden name) LE NHON VIETNAM VIETNAM (dead) HUSBAND (If none, so state) FAMILY NAME FIRST NAME BIRTHDATE CITY & COUNTRY OF BIRTH DATE OF MARRIAGE PLACE OF MARRIAGE OR (For wife, give maiden name) WIFE TRAN DANG 6/1/20 VIETNAM 9/24/39 VIETNAM FORMER HUSBANDS OR WIVES( none,so state) none FAMILY NAME (For wife, give maiden name) FIRST NAME BIRTHDATE DATE & PLACE OF MARRIAGE DATE AND PLACE OF TERMINATION OF MARRIAGE 21-948-Ahona-st: Ewa-Beach Hawaii APPLICANT'S RESIDENCE LAST FIVE YEARS. LIST PRESENT ADDRESS FIRST. FROM TO STREET AND NUMBER CITY PROVINCE OR STATE COUNTRY MONTH YEAR MONTH YEAR 91-918 Ahona st. Ewa Beach Ha.waii USA July 77 PRESENT TIME 1355 Manu-Mele st. Kailua Ha.waii USA June 75 July 77 1619 Ulupii P1. Kaihua Hawaii USA April 75 June 75 14/40G Ky Dong st. Saigon Vietnam Vietnam Jan. 70 April 75 APPLICANT'S LAST ADDRESS OUTSIDE THE UNITED STATES OF MORE THAN ONE YEAR FROM TO STREET AND NUMBER CITY PROVINCE OR STATE COUNTRY MONTH YEAR MONTH YEAR 14/40G Ky Dong st. Saigon Vietnam Vietnam Jan. 70 April 75 APPLICANT'S EMPLOYMENT LAST FIVE YEARS. (IF NONE, so STATE.) LIST PRESENT EMPLOYMENT FIRST. FROM TO FULL NAME AND ADDRESS OF EMPLOYER OCCUPATION (SPECIFY) MONTH YEAR MONTH YEAR unemployed PRESENT TIME J. C Penny , Ala Moana Branch Genator July 75 Oct. 75 I was Vietnamese Senator under President Ngo Dinh Diem, served 2 yrsterms. Itaught French Literature from 1968 to 1970, and retired at 1970. Show below last occupation abroad if not shown above. (Include all information requested above.) none THIS FORM IS SUBMITTED IN CONNECTION WITH APPLICATION FOR: SIGNATURE OF APPLICANT OR PETITIONER DATE NATURALIZATION ADJUSTMENT OF STATUS OTHER (SPECIFY): Permanent resident IF YCUR-NATIVE-ALPHABET IS IN OTHER THAN ROMAN LETTERS. WRITE YOUR NAME IN YOUR NATIVE ALPHABET IN THIS SPACE: Are all copies legible? Yes BUI, NGA QUANG PENALTIES: SEVERE PENALTIES ARE PROVIDED BY LAW FOR KNOWINGLY AND WILLFULLY FALSIFYING OR CONCEALING A MATERIAL FACT. APPLICANT: BE SURE TO PUT YOUR NAME AND ALIEN REGISTRATION NUMBER IN THE BOX OUTLINED BY HEAVY BORDER BELOW. COMPLETE THIS BOX (Family name) (Given name) (Middle name) (Alien registration number) Bul NGA QUANG 121 431 061 (OTHER AGENCY USE) INS USE (Office of Origin) OFFICE CODE: TYPE OF CASE: DATE: (3) C. FORM G-325A"
}
