{
  "anumber": "A21431061",
  "id": "A21431061_0001",
  "page_index": 1,
  "resources": {
    "full_jpg": "https://dctn4zjpwgdwdiiy5odjv7o2se0bqgjb.lambda-url.us-east-1.on.aws/iiif/3/og-2023-kc-nara_A21431061_0001/full/max/0/default.jpg"
  },
  "fields": {
    "sex": {
      "ms_sex_llm_v1": "female"
    },
    "doctype": {
      "ms_doctype_v1": "form"
    },
    "form_title": {
      "ms_form_title_llm_v1": "Processing Sheet"
    },
    "countries": {
      "ms_countries_nlp_v1": [
        "United States"
      ]
    },
    "years": {
      "ms_years_nlp_v1": [
        2023,
        1996
      ]
    }
  },
  "is_g325a": false,
  "is_cert_naturalization": false,
  "full_text": "Screened by NARA, 9/22/2023 U.S. Department of Justice Immigration and Naturalization Service PROCESSING SHEET File No: A 21431061 DESCRIPTION SECTION OF LAW Sex: Male IT Female 316(a) 325 Marital Status: Single [ ] Married Divorce Widow 319(a) 328 Height: Feet 5 Inches 8 319(b) 329 Country of Former Nationality: Vietner 322 405 4-22-96 FINAL ACTION INITIAL INTERVIEW: English 60/15 (Date) 6015 Denial: Date & Initials Speaks Reads Writes Understands Withdrawal: Date & Initials Government: OK I.N.S E.T.S. CASAS NAS Oath Taken Certificate Issued: REEXAM: ACTION or DOCUMENTS REQUIRED (Date and Initials) S/R See Attached N-14b Reexamination DOCUMENTS PRESENTED Visa File Post Audit A.R.C. : 21 43 1 061 Other: D.O.B. 12-31-15 P.O.E. : HHW C.O.A.: +C6 COMMENTS D.O.E. : 070875 CID/CDL A4436209 3166 Recommendation : ge JBanta 65/5 APPRO APPROVAL (STAMP) FINAL HEARING INS DIS TRICT DIRECTOR 6/26/96 APR 22 1996 DATE Responsed aBarla 10'3' LOS 4671 TIME Attorney Waiver Executed. If Attorney Present, List Name: 3 Months Residence OK Fingerprints NEG. 40 [ Nazi Negative 99% Day-Time Phone: 014 - 961 - 0172 Ext D OATH OF ALLEGIANCE Name Change: no change Modified Oath: Delete Part(s): Promise to Bear Arms, Noncombat Duty OATH WITH U.S. DISTRICT COURT: 246 I HEREBY DECLARE, on oath. That I absolutely and entirely renounce and abjure all allegiance and fidelity to any foreign prince, potentate, state, or sovereignty of whom or which I have heretofore been a subject or citizen; That I will support and defend the Constitution and the laws of the United States of America against all enemies, foreign and domestic; that I will bear true faith and allegiance to the same; that I will bear arms on behalf of the United States when required by the law; that I will perform noncombatant service in the Armed Forces of the United States when required by the law, that I will perform work of national importance under civilian direction when required by the law: and that I take this obligation freely, without mental reservation of evasion; so HELP ME God. In acknowledgment whereof I have baroast officed my signature Signature! any or purpose"
}