{
  "anumber": "A21556137",
  "id": "A21556137_0014",
  "page_index": 14,
  "resources": {
    "full_jpg": "https://dctn4zjpwgdwdiiy5odjv7o2se0bqgjb.lambda-url.us-east-1.on.aws/iiif/3/og-2023-kc-nara_A21556137_0014/full/max/0/default.jpg"
  },
  "fields": {
    "sex": {
      "ms_sex_llm_v1": "male"
    },
    "doctype": {
      "ms_doctype_v1": "form"
    },
    "form_title": {
      "ms_form_title_llm_v1": "Biographic Information, G-325A ( (REV. 8-27-72N)"
    },
    "countries": {
      "ms_countries_nlp_v1": [
        "United States",
        "India"
      ]
    },
    "years": {
      "ms_years_nlp_v1": [
        1949,
        1923,
        1975,
        1908,
        1974,
        2023,
        1904,
        1922,
        1977
      ]
    },
    "g325a": {
      "occupation": {
        "occupation_llm_v1": "['retired', ' self']"
      },
      "nationality": {
        "nationality_llm_v1": "Indian"
      }
    }
  },
  "is_g325a": true,
  "is_cert_naturalization": false,
  "full_text": "Screened by NARA, 7/31/2023 FORM G-325A (REV. 8-27-72)N Form Approved UNITED STATES DEPARTMENT OF JUSTICE COS OMB No. 43-R436 BIOGRAPHIC Immigration and Naturalization Service I/C 3 245 INFORMATION APR 1.1977 (Family name) (First name) (Middle name) MALE BIRTHDATE(Mo.-Day-Yr.) NATIONALITY ALIEN REGISTRATION NO. KAMBOJ, SANTOSH KUMAR FEMALE 11-22-1904 INDIAN (If any) A21556137 ALL OTHER NAMES USED (Including names by previous marriages) CITY AND COUNTRY OF BIRTH SOCIAL SECURITY NO. NONE RANI PUR INDIA (If any) - FAMILY NAME FIRST NAME DATE, CITY AND COUNTRY OF BIRTH(If known) CITY AND COUNTRY OF RESIDENCE FATHER KAMBOJ THAKUR date of Birth (Not known) INDIA (deceased) MOTHER (Maiden name) KAMBOJ UTTAM date of Birth (Not Known) India ( \" / HUSBAND (If none, so state) FAMILY NAME FIRST NAME BIRTHDATE CITY & COUNTRY OF BIRTH OR DATE OF MARRIAGE PLACE OF MARRIAGE WIFE (For wife, give maiden name) KAMBOJ PERSINNI 1-1-1908 JAGRAON INDIA 10-15-1923 Jagraon India FORMER HUSBANDS OR WIVES(if none, so state) FAMILY NAME (For wife, give maiden name) FIRST NAME BIRTHDATE DATE & PLACE OF MARRIAGE DATE AND PLACE OF TERMINATION OF MARRIAGE NONE APPLICANT'S RESIDENCE LAST FIVE YEARS. LIST PRESENT ADDRESS FIRST. FROM TO STREET AND NUMBER CITY PROVINCE OR STATE COUNTRY MONTH YEAR MONTH YEAR 12950 MACLAY ST SYLMAR CALIF U.S.A 7 1974 PRESENT TIME 1418696 SHIDIPURA NEW DELHI INDIA INDIA / 1949 7 1975 APPLICANT'S LAST ADDRESS OUTSIDE THE UNITED STATES OF MORE THAN ONE YEAR FROM TO STREET AND NUMBER CITY PROVINCE OR STATE COUNTRY MONTH YEAR MONTH YEAR 1418696 SHIDI PURA NEW DELHI DELHI INDIA / 1949 7 1975 APPLICANT'S EMPLOYMENT LAST FIVE YEARS. (IF NONE, SO STATE.) LIST PRESENT EMPLOYMENT FIRST. FROM TO FULL NAME AND ADDRESS OF EMPLOYER OCCUPATIONISPECIFYI MONTH YEAR MONTH YEAR SELF RETIRED PRESENT TIME SELF MEDICAL 1922 1974 Show below last occupation abroad if not shown above. (Include all information requested above.) THIS FORM IS SUBMITTED IN CONNECTION WITH APPLICATION FOR: SIGNATURE OF APPLICANT OR PETITIONER DATE INATURALIZATION ADJUSTMENT OF STATUS OTHER (SPECIFY): Sautosh Kumar 1-12-1976 IF YOUR NATIVE ALPHABET IS IN OTHER THAN ROMAN LETTERS. WRITE YOUR NAME IN YOUR NATIVE ALPHABET IN THIS SPACE: Are all copies legible? Yes gi4th PENALTIES SEVERE PENALTIES ARE PROVIDED BY LAW FOR KNOWINGLY AND WILLFULLY FALSIFYING OR CONCEALING A MATERIAL FACT."
}