{
  "anumber": "A21555065",
  "id": "A21555065_0018",
  "page_index": 18,
  "resources": {
    "full_jpg": "https://dctn4zjpwgdwdiiy5odjv7o2se0bqgjb.lambda-url.us-east-1.on.aws/iiif/3/og-2023-kc-nara_A21555065_0018/full/max/0/default.jpg"
  },
  "fields": {
    "sex": {
      "ms_sex_llm_v1": "male"
    },
    "doctype": {
      "ms_doctype_v1": "form"
    },
    "form_title": {
      "ms_form_title_llm_v1": "Biographic Information, G-325A ( (REV. 10-1-74) Y"
    },
    "countries": {
      "ms_countries_nlp_v1": [
        "Pakistan",
        "United States",
        "India"
      ]
    },
    "years": {
      "ms_years_nlp_v1": [
        1943,
        1840,
        2023,
        1926,
        1944,
        1915,
        1977,
        1880,
        1900
      ]
    },
    "g325a": {
      "occupation": {
        "occupation_llm_v1": "['none']"
      },
      "reason": {
        "reason_llm_v1": "NATURALIZATION"
      },
      "nationality": {
        "nationality_llm_v1": "INDIA"
      }
    }
  },
  "is_g325a": true,
  "is_cert_naturalization": false,
  "full_text": "Screened by NARA, 8/1/2023 FORM G-325A (REV. 10-1-74) Y Form Approved UNITED STATES DEPARTMENT OF JUSTICE LOS OMB No. 43-R436 BIOGRAPHIC Immigration and Naturalization Service I/C a INFORMATION MAY 4 1977 (Family name) (First name) (Middle name) MALE BIRTHDATE(Mo.-Day-Yr.) NATIONALITY ALIEN REGISTRATION NO. NARANG SEWA RAM FEMALE 11-5-1899 INDIA (If any) A21 555 065 ALL OTHER NAMES USED (Including names by previous marriages) CITY AND COUNTRY OF BIRTH CAMPBELL PUR (PAK) SOCIAL SECURITY NO. NONE (If any) 552-39-8451 FAMILY NAME FIRST NAME DATE, CITY AND COUNTRY OF BIRTH(If known) CITY AND COUNTRY OF RESIDENCE FATHER NARANG HARI 1840 HAZRO PAKISTAN DIST. ATTOCK MOTHER (Maiden name) SACHDEV BISHAN 1880 HAZRO PAKISTAN DIST. ATTOCK HUSBAND (If none, so state) FAMILY NAME OR FIRST NAME BIRTHDATE CITY & COUNTRY OF BIRTH DATE OF MARRIAGE PLACE OF MARRIAGE (For wife, give maiden name) WIFE CHABRA SATWANT HARIPUR MA y 1926 PAKISTAN 1944 HARIPUR FORMER HUSBANDS OR WIVES (if none, so state) FAMILY NAME (For wife, give maiden name) FIRST NAME BIRTHDATE DATE & PLACE OF MARRIAGE DATE AND PLACE OF TERMINATION OF MARRIAGE KATHURIA RAMRAKHI 1900 Nov. 1915 NOV. 1943 EXPIRED RAWALPINDi (PAR). APPLICANT'S RESIDENCE LAST FIVE YEARS. LIST PRESENT ADDRESS FIRST. FROM TO STREET AND NUMBER CITY PROVINCE OR STATE COUNTRY MONTH YEAR MONTH YEAR 15910 HOOVER T. GARDENA CA. U.S.A. 10 75 PRESENT TIME 65174 ROMTAK ROAD NEW DE2HI DELHI INDIA I 58 10 75 APPLICANT'S LAST ADDRESS OUTSIDE THE UNITED STATES OF MORE THAN ONE YEAR FROM TO STREET AND NUMBER CITY PROVINCE OR STATE COUNTRY MONTH YEAR MONTH YEAR 65/74 Rohtak Road. NEW DELHI DELHI. INDIA. / 58 10 75 APPLICANT'S EMPLOYMENT LAST FIVE YEARS. (IF NONE, SO STATE.) LIST PRESENT EMPLOYMENT FIRST. FROM TO FULL NAME AND ADDRESS OF EMPLOYER OCCUPATION (SPECIFY) MONTH YEAR MONTH YEAR PRESENT TIME NONE Show below last occupation abroad if not shown above. (Include all information requested above.) THIS FORM IS SUBMITTED IN CONNECTION WITH APPLICATION FOR: SIGNATURE OF APPLICANT OR PETITIONER DATE NATURALIZATION ADJUSTMENT OF STATUS (SPECIFY): STATUSAS PERMANENTRES Sewakam narang 2-1-76 OTHER IF YOUR NATIVE ALPHABET IS IN OTHER THAN ROMAN LETTERS. WRITE YOUR NAME IN YOUR NATIVE ALPHABET IN THIS SPACE: Are all copies legible? Yes PENALTIES: SEVERE PENALTIES ARE PROVIDED BY LAW FOR KNOWINGLY AND WILLFULLY FALSIFYING OR CONCEALING A MATERIAL FACT."
}