{
  "anumber": "A21519707",
  "id": "A21519707_0042",
  "page_index": 42,
  "resources": {
    "full_jpg": "https://dctn4zjpwgdwdiiy5odjv7o2se0bqgjb.lambda-url.us-east-1.on.aws/iiif/3/og-2023-kc-nara_A21519707_0042/full/max/0/default.jpg"
  },
  "fields": {
    "sex": {
      "ms_sex_llm_v1": "male"
    },
    "doctype": {
      "ms_doctype_v1": "form"
    },
    "form_title": {
      "ms_form_title_llm_v1": "Los Angeles Naturalization Service Application Form G-325, FORM G-325 ( (REV. 5-1-79Y)"
    },
    "countries": {
      "ms_countries_nlp_v1": [
        "Vietnam",
        "United States"
      ]
    },
    "years": {
      "ms_years_nlp_v1": [
        1975,
        1943,
        1981,
        1955,
        1973,
        1083,
        2023,
        1983,
        1915
      ]
    },
    "g325a": {
      "occupation": {
        "occupation_llm_v1": "['pharmacist']"
      },
      "reason": {
        "reason_llm_v1": "NATURALIZATION"
      },
      "nationality": {
        "nationality_llm_v1": "VIET-NAM"
      }
    }
  },
  "is_g325a": true,
  "is_cert_naturalization": false,
  "full_text": "FORM G-325 (REV. 5.1-79)Y Screened by NARA. 9/22/2023 LOS UNITED STATES DEPARTMENT OF JUSTICE BIOGRAPHIC CIT - 400. Form Approved INFORMATION Immigration and Naturalization Service OMB No. 43-R436 JUN 10 1983 (Family name) (First name) (Middle name) MALE BIRTHDATE (Mo.-Day-Yr.) NATIONALITY NGUYEN QUANG FEMALE VIET-NAM date FILE NUMBER DUY 06-07-1915 A-21519707 ALL. OTHER NAMES USED (Including names by previous marriages) CITY AND COUNTRY OF BIRTH SOCIAL SECURITY NO. N.A. T-DONG VIET-NAM (If any) 566-37-9469 FAMILY NAME FIRST NAME DATE, CITY AND COUNTRY OF BIRTH (If known) CITY AND COUNTRY OF RESIDENCE FATHER NGUYEN TIEN HA-DONG VIET-NAM HA-DONG VIET-NAM MOTHER (Maiden name) LE XUYEN -id. Ld -id- -id. HUSBAND (If none, so state) FAMILY NAME FIRST NAME BIRTHDATE CITY & COUNTRY OF BIRTH DATE OF MARRIAGE PLACE OF MARRIAGE OR (For wife, give malden name) WIFE KY LAI 01-16-22 VINH 12-24-1943 HANOI VIET.NA (ViET-NAM) FORMER HUSBANDS OR WIVES (if none, 30 state) NON E FAMILY NAME (For wife, give maiden name) FIRST NAME BIRTHDATE DATE AND PLACE OF MARRIAGE DATE AND PLACE OF TERMINATION OF MARRIAGE APPLICANT'S RESIDENCE LAST FIVE YEARS. LIST PRESENT ADDRESS FIRST. FROM TO STREET AND NUMBER CITY PROVINCE OR STATE COUNTRY MONTH YEAR MONTH YEAR 930 So CHAMPLAIN CIRCLE ANAHEIM CALIFORNIA USA APRIL 76 PRESENT TIME 1101 PASED ROBLES id -id -id. MAY. 75 APRIL 76 APPLICANT'S LAST ADDRESS OUTSIDE THE UNITED STATES OF MORE THAN ONE YEAR. NONE FROM TO STREET AND NUMBER CITY PROVINCE OR STATE COUNTRY MONTH YEAR MONTH YEAR 4, LE LAI DALAT TUYEN-DUC VIET-NAM JANUARY 1955 MARCH 1975 APPLICANT'S EMPLOYMENT LAST FIVE YEARS. (IF NONE, so STATE.) LIST PRESENT EMPLOYMENT FIRST. FROM TO FULL NAME AND ADDRESS OF EMPLOYER OCCUPATION (Specify) MONTH YEAR MONTH YEAR ICN Co (INTERNATIONAL CHEMICAL a Lab. OCTOB 75 PRESENT TIME NUCLEAR CORPORATION) TECHNICIAN 2727 CAMPUS DRiVE IRVINE, CA - Show below last occupation abroad if not shown above. (Include all information requested above.) SLE-EMPLOYED, DALAT, VIETNAM (South) PHARMACIST JANUARY 1955 JUNE 1973 THIS FORM IS SUBMITTED IN CONNECTION WITH APPLICATION FOR: SIGNATURE OF APPLICANT DATE NATURALIZATION OTHER (SPECIFY) STATUS AS PERMANENT RESIDENT way Lanyer JULY 10, 1981 IF YOUR NATIVE ALPHABET IS N OTHER THAN ROMAN LETTERS, WRITE YOUR NAME IN YOUR NATIVE ALPHABET IN THIS SPACE: Are all copies legible? Yes PENALTIES: SEVERE PENALTIES ARE PROVIDED BY LAW FOR KNOWINGLY AND WILLFULLY FALSIFYING OR CONCEALING A MATERIAL FACT. APPLICANT: BE SURE TO PUT YOUR NAME AND ALIEN REGISTRATION NUMBER IN THE BOX OUTLINED BY HEAVY BORDER BELOW. COMPLETE THIS BOX (Family name) (Given name) (Middle name) (Allen registration number) NGUYEN, QUANG Duy A21 519 707 (OTHER AGENCY USE) INS USE (Office of Origin) OFFICE CODE: TYPE OF CASE: DATE: LOS CIT - 400g JUN 1083 date [1] Ident. FORM G-325"
}