{
  "anumber": "A21526240",
  "id": "A21526240_0031",
  "page_index": 31,
  "resources": {
    "full_jpg": "https://dctn4zjpwgdwdiiy5odjv7o2se0bqgjb.lambda-url.us-east-1.on.aws/iiif/3/og-2023-kc-nara_A21526240_0031/full/max/0/default.jpg"
  },
  "fields": {
    "sex": {
      "ms_sex_llm_v1": "female"
    },
    "doctype": {
      "ms_doctype_v1": "form"
    },
    "form_title": {
      "ms_form_title_llm_v1": "Biographic Information, OIMB No. 4-3-R86"
    },
    "countries": {
      "ms_countries_nlp_v1": [
        "United States",
        "India"
      ]
    },
    "years": {
      "ms_years_nlp_v1": [
        1907,
        1919,
        1972,
        1968,
        2023,
        1933,
        1976,
        4984,
        1936
      ]
    },
    "g325a": {
      "occupation": {
        "occupation_llm_v1": "['stock-exchange broker (self-employed)']"
      },
      "reason": {
        "reason_llm_v1": "NATURALIZATION"
      },
      "nationality": {
        "nationality_llm_v1": "INDIA"
      }
    }
  },
  "is_g325a": true,
  "is_cert_naturalization": false,
  "full_text": "Screened by NARA, 7/31/2023 FORM G-325 5-1-79)Y UNITED STATES DEPARTMENT OF JUSTICE Form Approved BIOGRAPHIC INFORMATION Instigration and Nat ralization Service OMB No. 43-R436 (Family same) (First name) (Middle name) MALE BIRTHDATE (Mo.-Day-Yr.) NATIONALITY FILE NUMBER LATHI GOVINDRAM TOTARAM FEMALE 12-22-1903 A-21-526-240 ALL OTHER NAMES USED (Including names by previous marriages) CITY AND COUNTRY OF BIRTH SOCIAL SECURITY NO. (If any) MARWADI GULAB TULSiRAM AMODA, INDIA 025-54-1034 FAMILY NAME FIRST NAME DATE, CITY AND COUNTRY OF BIRTH (If known) CITY AND COUNTRY OF RESIDENCE FATHER LATHI Totaram Dhanji AMODA, INDIA Deceased MOTHER (Maiden name) INDANi Rambai Koparel, India Deceased HUSBAND (If none, so state) FAMILY NAME FIRST NAME BIRTHDATE CITY & COUNTRY OF BIRTH DATE OF MARRIAGE PLACE OF MARRIAGE OR (For wife, give maiden same) WIFE Ladhe Bhaga Gopaldas Bhaga 7-18-1907 Varadsim, India 1919 Varadsim India FORMER HUSBANDS OR WIVES (If none, so state) FAMILY NAME (For wife, give maiden name) FIRST NAME BIRTHDATE DATE AND PLACE OF MARRIAGE DATE AND PLACE OF TERMINATION OF MARRIAGE None APPLICANT'S RESIDENCE LAST FIVE YEARS. LIST PRESENT ADDRESS FIRST. FROM TO STREET AND NUMBER CITY PROVINCE OR STATE COUNTRY MONTH YEAR MONTH YEAR 5627 Lexington Ave #6 Hollywood Calif U.S.A. Nov 76 PRESENT TIME 386 Cohley Porterville Calif U.S.A June 76 Nov 1976 34 Noanett Rd Needham Mass U.S.A. Oct 75 Jun 1976 B-6 ishwardas Mansion - Nana's Chawk Bembay Bombay India Oct 75 July 1972 U.S.A. July 72 Oct 1972 APPLICANT'S LAST ADDRESS OUTSIDE THE UNITED STATES OF MORE THAN ONE YEAR. FROM TO STREET AND NUMBER CITY PROVINCE OR STATE COUNTRY MONTH YEAR MONTH YEAR B-6 Ishwardas Mansion, Nana Chawk, Banbay India Nove 1933 July 1972 APPLICANT'S EMPLOYMENT LAST FIVE YEARS. (IF NONE, so STATE.) LIST PRESENT EMPLOYMENT FIRST. FROM TO FULL NAME AND ADDRESS OF EMPLOYER OCCUPATION (Specify) MONTH YEAR MONTH YEAR None Retired PRESENT TIME Show below last occupation abroad if not shown above. (Include all information requested above.) Stock-Exchange Broker (self-employed) Jan 1936 Dec 1968 THIS FORM IS SUBMITTED IN CONNECTION WITH APPLICATION FOR: SIGNATURE OF APPLICANT DATE NATURALIZATION OTHER (SPECIFY) STATUS AS PERMANENT RESIDENT Govindram. T. Latti IF YOUR NATIVE ALPHABET IS IN OTHER THAN ROMAN LETTERS, WRITE YOUR NAME IN YOUR NATIVE ALPHABET IN THIS SPACE Are all copies legible? Yes PENALTIES: SEVERE PENALTIES ARE PROVIDED BY LAW FOR KNOWINGLY AND WILLFULLY FALSIFYING OR CONCEALING A MATERIAL FACT. APPLICANT: BE SURE TO PUT YOUR NAME AND ALIEN REGISTRATION NUMBER IN ) THE BOX OUTLINED BY HEAVY BORDER BELOW. COMPLETE THIS BOX (Family name) (Given name) (Middle name) (Allen registration number) LATHI Govindram Totaram A-21-526-240 (OTHER AGENCY USE) INS USE (Office of Origin) OFFICE CODE: TYPE OF CASE: DATE: LOS 26 MAR 4984 CIT - (date) FORM O-325 [1] Ident."
}