{
  "anumber": "A21637344",
  "id": "A21637344_0048",
  "page_index": 48,
  "resources": {
    "full_jpg": "https://dctn4zjpwgdwdiiy5odjv7o2se0bqgjb.lambda-url.us-east-1.on.aws/iiif/3/og-2023-kc-nara_A21637344_0048/full/max/0/default.jpg"
  },
  "fields": {
    "sex": {
      "ms_sex_llm_v1": "male"
    },
    "doctype": {
      "ms_doctype_v1": "form"
    },
    "form_title": {
      "ms_form_title_llm_v1": "BIOGRAPHIC INFORMATION, G-325A ( (Rev. 10-1-82)"
    },
    "countries": {
      "ms_countries_nlp_v1": [
        "United States",
        "India"
      ]
    },
    "years": {
      "ms_years_nlp_v1": [
        1984,
        1907,
        2023,
        1935
      ]
    },
    "g325a": {
      "occupation": {
        "occupation_llm_v1": "['retired']"
      },
      "reason": {
        "reason_llm_v1": "NATURALIZATION"
      },
      "nationality": {
        "nationality_llm_v1": "Indian"
      }
    }
  },
  "is_g325a": true,
  "is_cert_naturalization": false,
  "full_text": "ScreeFoRM AF325A26/2023 i.s. Department of Justice B No. 1115-0066 Immigration and Naturalization Service BIOGRAPHIC INFORMATION Approval expires 4-30-85 (Family name) (First name) (Middle name) MALE BIRTHDATE(Mo.-Day-Yr.) NATIONALITY FILE NUMBER David Dorai James FEMALE 11.02.1907 Indian 21 637 344 ALL OTHER NAMES USED (Including names by previous marriages) CITY AND COUNTRY OF BIRTH SOCIAL SECURITY NO. Madras, India (If any) 585 25 9187 FAMILY NAME, FIRST NAME DATE, CITY AND COUNTRY OF BIRTH(If known) CITY AND. COUNTRY OF RESIDENCE. David Solomon Madras India (deceased) FATHER Samuel Mary Madras India (Deceased) MOTHER (Maiden name) HUSBAND (If none, so state) FAMILY NAME FIRST NAME BIRTHDATE CITY & COUNTRY 06 BIRTH DATE OF MARRIAGE PLACE OF MARRIAGE OR (For wife, give maiden name) Mangalore Robertsonpet WIFE Maben Irene 9.1.1915. India 02.6.1935 K. G.F. India FORMER HUSBANDS OR WIVES(if none, so state) FAMILY NAME (For wife, give maiden name) FIRST NAME BIRTHDATE DATE & PLACE OF MARRIAGE DATE AND PLACE OF TERMINATION OF MARRIAGE 1-28-80 Alburgue U.M Deceased APPLICANT'S RESIDENCE LAST FIVE YEARS. LIST PRESENT ADDRESS FIRST. FROM TO CITY PROVINCE OR STATE COUNTRY MONTH YEAR MONTH YEAR STREET AND NUMBER 83 PRESENT TIME 2077 Sprague #1 Anaheim Cali fornia U.S.A March 205 Palmcrest Dr. #32 Daly City alifornia U.S.A. Oct 81 Feb 835 40,8409 Commanche N. E. Albuquerque. New Mexico. U.S.A Feb 78 Sep 81. APPLICANT'S LAST ADDRESS OUTSIDE THE UNITED STATES OF MORE THAN ONE YEAR FROM TO STREET AND NUMBER CITY PROVINCE OR STATE COUNTRY MONTH YEAR MONTH YEAR APPLICANT'S EMPLOYMENT LAST FIVE YEARS. (IF NONE, so STATE.) LIST PRESENT EMPLOYMENT FIRST FROM TO FULL NAME AND ADDRESS OF EMPLOYER OCCUPATION (SPECIFY) MONTH YEAR MONTH YEAR PRESENT TIME None Show below last occupation abroad if not shown above. (Include all information requested above.) P Topograhical Survey. Survey Of India Retired THIS FORM IS SUBMITTED IN CONNECTION WITH APPLICATION FOR: SIGNATURE OF APPLICANT DATE NATURALIZATION STATUS AS PERMANENT RESIDENT OTHER (SPECIFY): Joran Dain #. 3.14.1983 IF YOUR NATIVE ALPHABET IS IN OTHER THAN ROMAN LETTERS. WRITE YOUR NAME IN YOUR NATIVE ALPHABET IN THIS SPACE: Are all copies legible? Yes PENALTIES: SEVERE PENALTIES ARE PROVIDED BY LAW FOR KNOWINGLY AND WILLFULLY FALSIFYING OR CONCEALING A MATERIAL FACT. APPLICANT: BE SURE TO PUT YOUR NAME AND ALIEN REGISTRATION NUMBER IN THE BOX OUTLINED BY HEAVY BORDER BELOW. COMPLETE THIS BOX (Family name) (Given name) (Middle name) (Alien registration number) David Dorai James A21 637 344 LOS CIT e 400 7 AUG 1984 date Form G-325 A (Rev. 10-1-82) (1) Ident."
}