{
  "anumber": "A21637344",
  "id": "A21637344_0018",
  "page_index": 18,
  "resources": {
    "full_jpg": "https://dctn4zjpwgdwdiiy5odjv7o2se0bqgjb.lambda-url.us-east-1.on.aws/iiif/3/og-2023-kc-nara_A21637344_0018/full/max/0/default.jpg"
  },
  "fields": {
    "sex": {
      "ms_sex_llm_v1": "female"
    },
    "doctype": {
      "ms_doctype_v1": "form"
    },
    "form_title": {
      "ms_form_title_llm_v1": "BIOGRAPHIC INFORMATION, G-325A ( (REV. 10-1-74) Y"
    },
    "countries": {
      "ms_countries_nlp_v1": [
        "United States",
        "India"
      ]
    },
    "years": {
      "ms_years_nlp_v1": [
        1907,
        2023,
        1935,
        1915
      ]
    },
    "g325a": {
      "occupation": {
        "occupation_llm_v1": "['retired']"
      },
      "reason": {
        "reason_llm_v1": "NATURALIZATION"
      },
      "nationality": {
        "nationality_llm_v1": "Indian"
      }
    }
  },
  "is_g325a": true,
  "is_cert_naturalization": false,
  "full_text": "FORM G-325A (REV. 10-1-74) Y Screened by NARA 7/26/2023 Form Approved UNITED STATES DEPARTMENT OF JUSTICE OMB No. 43-R436 Immigration and Naturalization Service BIOGRAPHIC INFORMATION (Family name) (First name) (Middle name) MALE IRTHDATE(Mo.-Day-Yr.) NATIONALITY ALIEN REGISTRATION NO. DAVID DORAI JAMES FEMALE Nov. 2=1907 INDIAN (If any) A21637 ALL OTHER NAMES USED (Including names by previous marriages) CITY AND COUNTRY OF BIRTH SOCIAL SECURITY NO. 344 NONE MADRAS INDIA. (If any) FAMILY NAME FIRST NAME DATE, CITY AND COUNTRY OF BIRTH( (If known) CITY AND COUNTRY OF RESIDENCE. PAUL NOT known, INDIA FATHER DAVID NOT LIVING MOTHER (Maiden name) DAVID MARY NOT known INDIA. NOT LIVING. HUSBAND (If none, so state) FAMILY NAME FIRST NAME BIRTHDATE CITY & COUNTRY OF BIRTH OR DATE OF MARRIAGE PLACE OF MARRIAGE WIFE (For wife, give maiden name) SEPT 19 MANGALORE FEB 6th 1935 BANGALORE DIST., MABEN IRENE 1915 INDIA INDIA FORMER HUSBANDS OR WIVES( none, so state) FAMILY NAME (For wife, give maiden name) FIRST NAME BIRTHDATE DATE & PLACE OF MARRIAGE DATE AND PLACE OF TERMINATION OF MARRIAGE NONE - - - APPLICANT'S RESIDENCE LAST FIVE YEARS. LIST PRESENT ADDRESS FIRST. FROM TO STREET AND NUMBER CITY PROVINCE OR STATE COUNTRY MONTH YEAR MONTH YEAR 2713 WYOMING N. E APT 7. ALBUG. N. MEXICO U.S.A. JUNE 77 PRESENT TIME 213 E. 11 MILE ROAD DETROIT MICHIGHN U-S-A. FEB 77 JUNE 77 114, WHEELER ROAD BANGHLORE HALDIAMYSORE INDIA Nor 71 FEB 77. APPLICANT'S LAST ADDRESS OUTSIDE THE UNITED STATES OF MORE THAN ONE YEAR FROM TO STREET AND NUMBER CITY PROVINCE OR STATE COUNTRY MONTH YEAR MONTH YEAR was 114, WHEELER ROADI BANGALORE MYSORE INDIA. Nov 71 FEB 77 APPLICANT'S EMPLOYMENT LAST FIVE YEARS. (IF NONE, SO STATE.) LIST PRESENT EMPLOYMENT FIRST. FROM TO FULL NAME AND ADDRESS OF EMPLOYER OCCUPATION (SPECIFY) MONTH YEAR MONTH YEAR PRESENT TIME RET IRED. 8 Show below last occupation abroad if not shown above. (Include all information requested above.) SURVEYOR , SURVEY OF INDIA. THIS FORM IS SUBMITTED IN CONNECTION WITH APPLICATION FOR: SIGNATURE OF APPLICANT OR PETITIONER DATE NATURALIZATION ADJUSTMENT OF STATUS 7120w oct. 18.77 OTHER (SPECIFY): IF YOUR-NATIVE ALPHABET IS IN OTHER THAN ROMAN LETTERS. WRITE YOUR NAME IN YOUR NATIVE ALPHABET IN THIS SPACE: Are all copies legible? Yes PENALTIES: SEVERE PENALTIES ARE PROVIDED BY LAW FOR KNOWINGLY AND WILLFULLY FALSIFYING OR CONCEALING A MATERIAL FACT."
}