{
  "anumber": "A21769890",
  "id": "A21769890_0041",
  "page_index": 41,
  "resources": {
    "full_jpg": "https://dctn4zjpwgdwdiiy5odjv7o2se0bqgjb.lambda-url.us-east-1.on.aws/iiif/3/og-2023-kc-nara_A21769890_0041/full/max/0/default.jpg"
  },
  "fields": {
    "sex": {
      "ms_sex_llm_v1": "female"
    },
    "doctype": {
      "ms_doctype_v1": "form"
    },
    "form_title": {
      "ms_form_title_llm_v1": "Biographical Information, G-325A ( (REV. 8-27-72N)"
    },
    "countries": {
      "ms_countries_nlp_v1": [
        "United States",
        "India"
      ]
    },
    "years": {
      "ms_years_nlp_v1": [
        2023
      ]
    },
    "g325a": {
      "occupation": {
        "occupation_llm_v1": "['none']"
      },
      "reason": {
        "reason_llm_v1": "ADJUSTMENT OF STATUS"
      },
      "nationality": {
        "nationality_llm_v1": "INDIA"
      }
    }
  },
  "is_g325a": true,
  "is_cert_naturalization": false,
  "full_text": "UNITED STATES DEP TMEN OF JUSTICE Screened by NARA 8/1/2023 office code 0300 - NYC FORM G-325A (REV. 8-27-72)N Form Approved BIOGRAPHIC Immigration and Naturalization Service INFORMATION type case Sec. 242 OMB No. 43-R436 6-14-14 (Family name) (First name) (Middle name) BIRTHDATE (Mo.-Day-Yr.) Rate NATIONALITY ALIEN REGISTRATION NO MALI E TRIVEDI PADMAPRABHA P FEMALE 11-2-07 INDIA (If any) A21769890 ALL OTHER NAMES USED (Including names by previous marriages) CITY AND COUNTRY OF BIRTH SOCIAL SECURITY NO. NONE SURAT - INDIA (If any) FAMILY NAME FIRST NAME DATE, CITY AND COUNTRY OF BIRTH (If known) CITY AND COUNTRY OF RESIDENCE FATHER DAVE HARIKRISHNA INDIA INDIA (DEAD) MOTHER (Maiden name) PANDYA DHRUMURM INDIA INDIA (PFAD) HUSBAND (If none, so state) FAMILY NAME FIRST NAME BIRTHDATE CITY & COUNTRY OF BIRTH DATE OF MARRIAGE PLACE OF MARRIAGE OR (For wife, give maiden name) WIFE TRIVEDI PREMKRI- SURAT-INDIA 5/1/9 SURAT INDIA SHINA FORMER HUSBANDS OR WIVES (If none, so state) NONE FAMILY NAME (For wife, give maiden name) FIRST NAME BIRTHDATE DATE & PLACE OF MARRIAGE DATE AND PLACE OF TERMINATION OF MARRIAGE APPLICANT'S RESIDENCE LAST FIVE YEARS. LIST PRESENT ADDRESS FIRST. FROM TO STREET AND NUMBER CITY PROVINCE OR STATE COUNTRY MONTH YEAR MONTH YEAR Hudson River state Hosp Roughkeepsie NY IN \\ 74 PRESENT TIME NAPEANSEA RD BOMBAY-6 INDIA INDIA 12 69 \\ 74 APPLICANT'S LAST ADDRESS OUTSIDE THE UNITED STATES OF MORE THAN ONE YEAR, FROM TO STREET AND NUMBER CITY PROVINCE OR STATE COUNTRY MONTH YEAR MONTH YEAR 62A, N'APEAN SEA RD BOMBAY MAHARASTRA INDIA 12 69 \\ 74 APPLICANT'S EMPLOYMENT LAST FIVE YEARS. (IF NONE, so STATE.) LIST PRESENT EMPLOYMENT FIRST. FROM TO FULL NAME AND ADDRESS OF EMPLOYER OCCUPATION (Specify) MONTH YEAR MONTH YEAR PRESENT TIME NONE Show below last occupation abroad if not shown above. (Include all information requested above.) NONE THIS FORM IS SUBMITTED IN CONNECTION WITH APPLICATION FOR: SIGNATURE OF APPLICANT OR PETITIONER DATE NATURALIZATION OTHER (SPECIFY) ADJUSTMENT OF STATUS Padmaprabha T. Trivedi IF YOUR NATIVE ALPHABET IS IN OTHER THAN ROMAN LETTERS, WRITE YOUR NAME IN YOUR NATIVE ALPHABET IN THIS SPACE: Are all copies legible? Yes in. Fricel. PENALTIES: SEVERE PENALTIES ARE PROVIDED BY LAW FOR KNOWINGLY AND WILLFULLY FALSIFYING OR CONCEALING A MATERIAL FACT."
}