{
  "anumber": "A21773532",
  "id": "A21773532_0024",
  "page_index": 24,
  "resources": {
    "full_jpg": "https://dctn4zjpwgdwdiiy5odjv7o2se0bqgjb.lambda-url.us-east-1.on.aws/iiif/3/og-2023-kc-nara_A21773532_0024/full/max/0/default.jpg"
  },
  "fields": {
    "sex": {
      "ms_sex_llm_v1": "male"
    },
    "doctype": {
      "ms_doctype_v1": "form"
    },
    "form_title": {
      "ms_form_title_llm_v1": "BIOGRAPHIC INFORMATION, G-325A"
    },
    "countries": {
      "ms_countries_nlp_v1": [
        "United States",
        "India"
      ]
    },
    "years": {
      "ms_years_nlp_v1": [
        1905,
        1972,
        1948,
        1973,
        1902,
        1947
      ]
    },
    "g325a": {
      "occupation": {
        "occupation_llm_v1": "['n.a']"
      },
      "reason": {
        "reason_llm_v1": "Yes"
      },
      "nationality": {
        "nationality_llm_v1": "India"
      }
    }
  },
  "is_g325a": true,
  "is_cert_naturalization": false,
  "full_text": "FORM G-325A (REV.8-27-72)N UNITED STATES DEPARTMENT OF JUSTICE office code 0300MB = Form No. Approved 43-R436 Immigration and Naturalization Service NYC BIOGRAPHIC type case INFORMATION Sec. 245 (Family name) (First name) (Middle.name) Shukla Parvati MALE BIRTHDATE (Mo.-Day-Yr.) NATIONALITY ALIEN REGISTRATION NO. Devi India FEMALE 8 21 1905 (If any) 2/22/03 ALL OTHER NAMES USED (Including names by previous marriages) CITY AND COUNTRY OF BIRTH India SOCIAL SECURITY NO. Bilga (If any) - FAMILY NAME FIRST NAME DATE, CITY AND COUNTRY OF BIRTH(If known) CITY AND COUNTRY OF RESIDENCE Bishan Das S Deceased) FATHER Luddar Ram Rakhi (Deceased) INDIA MOTHER (Maiden name) HUSBAND (If none, so state) FAMILY NAME FIRST NAME BIRTHDATE CITY & COUNTRY OF BIRTH DATE OF MARRIAGE PLACE OF MARRIAGE OR (For wife, give maiden name) WIFE Shukla (Deceased) Dec 28 HADIABAD Dont know HAD, ABAD Shive 1902 INDIA INDIA FORMER HUSBANDS OR WIVES(if none, so state) FAMILY NAME (For wife, give maiden name) FIRST NAME BIRTHDATE DATE & PLACE OF MARRIAGE DATE AND PLACE OF TERMINATION OF MARRIAGE APPLICANT'S RESIDENCE LAST FIVE YEARS. LIST PRESENT ADDRESS FIRST. FROM TO STREET AND NUMBER CITY PROVINCE OR STATE COUNTRY MONTH YEAR MONTH YEAR 3233 Yorktown U.S. A. - PRESENT TIME Comer St He ight N .Y. Sept 1972 27/1 Shakti Nagar Delhi INdia India Sept 1948 Sept 19 APPLICANT'S LAST ADDRESS OUTSIDE THE UNITED STATES OF MORE THAN ONE YEAR FROM TO STREET AND NUMBER CITY PROVINCE OR STATE COUNTRY MONTH YEAR MONTH YEAR 27/3 Shakti Nagar Delhi India India Sept 1947 1973 APPLICANT'S EMPLOYMENT LAST FIVE YEARS. (IF NONE, so STATE.) LIST PRESENT EMPLOYMENT FIRST. FROM TO FULL NAME AND ADDRESS OF EMPLOYER OCCUPATION (SPECIFY) MONTH YEAR MONTH YEAR PRESENT TIME None None Show below last occupation abroad if not shown above. (Include all information requested above.) THIS FORM IS SUBMITTED IN CONNECTION WITH APPLICATION FOR: SIGNATURE OF. APPLICANT OR PETITIONER DATE NATURALIZATION ADJUSTMENT OF STATUS Shashe Kaur Shunle OTHER (SPECIFY): IF YOUR NATIVE ALPHABET IS IN OTHER THAN ROMAN LETTERS. WRITE YOUR NAME IN YOUR NATIVE ALPHABET IN THIS SPACE: Are all copies legible? Yes PENALTIES: SEVERE PENALTIES ARE PROVIDED BY LAW FOR KNOWINGLY AND WILLFULLY FALSIFYING OR CONCEALING A MATERIAL FACT."
}