{
  "anumber": "A21772021",
  "id": "A21772021_0035",
  "page_index": 35,
  "resources": {
    "full_jpg": "https://dctn4zjpwgdwdiiy5odjv7o2se0bqgjb.lambda-url.us-east-1.on.aws/iiif/3/og-2023-kc-nara_A21772021_0035/full/max/0/default.jpg"
  },
  "fields": {
    "sex": {
      "ms_sex_llm_v1": "female"
    },
    "doctype": {
      "ms_doctype_v1": "form"
    },
    "form_title": {
      "ms_form_title_llm_v1": "Biographic Information, G-325A ( (REV. 8-27-72N)"
    },
    "countries": {
      "ms_countries_nlp_v1": [
        "Pakistan",
        "United States"
      ]
    },
    "years": {
      "ms_years_nlp_v1": [
        1907,
        1921,
        1956,
        1973,
        1901,
        2023
      ]
    },
    "g325a": {
      "occupation": {
        "occupation_llm_v1": "['none']"
      },
      "reason": {
        "reason_llm_v1": "NATURALIZATION"
      },
      "nationality": {
        "nationality_llm_v1": "Indian"
      }
    }
  },
  "is_g325a": true,
  "is_cert_naturalization": false,
  "full_text": "Screened by NARA, 8/1/2023 FORM G-325A (REV. 8-27-72)N UNITED STATES DEPARTMENT OF JUSTICE tyle ouse Sec. 245 form Approved BIOGRAPHIC Immigration and Naturalization Service OMB No. R436 INFORMATION 7-1-24 date (Family name) (First name) (Middle name) MALE BIRTHDATE (Mo.-Day-Yr.) NATIONALITY ALIEN REGISTRATION NO. SINGH LACHHMI B FEMALE June1, 1907 Indian (If any) - ALL OTHER NAMES USED (Including names by previous marriages) CITY AND COUNTRY OF BIRTH SOCIAL SECURITY NO. DABKALAN, Pakistan (If any) - FAMILY NAME FIRST NAME DATE, CITY AND COUNTRY OF BIRTH (If known) CITY AND COUNTRY OF RESIDENCE FATHER Wadhwa Niamet Ram Pakistan Not alive MOTHER (Maiden name) Tikaii Pakistan Not alive HUSBAND (If none, so state) FAMILY NAME FIRST NAME BIRTHDATE CITY & COUNTRY OF BIRTH DATE OF MARRIAGE PLACE OF MARRIAGE OR WIFE (For wife, give maiden name) SINGH PIAR April/1901 Waryam, 1921 Dalikalan Pakistan FORMER HUSBANDS OR WIVES (If none, so state) None FAMILY NAME (For wife, give maiden name) FIRST NAME BIRTHDATE DATE & PLACE OF MARRIAGE DATE AND PLACE OF TERMINATION OF MARRIAGE APPLICANT'S RESIDENCE LAST FIVE YEARS. LIST PRESENT ADDRESS FIRST. FROM TO STREET AND NUMBER CITY PROVINCE OR STATE COUNTRY MONTH YEAR MONTH YEAR 147-10,4 Ave, Apt # 6K New York N.Y. U.S.A. Aug 1973 PRESENT TIME 45/10, E. Patel Nagar N.Delhi DELHI INDIA 1956 Aug 1973 APPLICANT'S LAST ADDRESS OUTSIDE THE UNITED STATES OF MORE THAN ONE YEAR. FROM TO STREET AND NUMBER CITY PROVINCE OR STATE COUNTRY MONTH YEAR MONTH YEAR APPLICANT'S EMPLOYMENT LAST FIVE YEARS. (IF NONE, so STATE.) LIST PRESENT EMPLOYMENT FIRST. FROM TO FULL NAME AND ADDRESS OF EMPLOYER OCCUPATION (Specify) MONTH YEAR MONTH YEAR PRESENT TIME None Show below last occupation abroad if not shown above. (Include all information requested above.) THIS FORM IS SUBMITTED IN CONNECTION WITH APPLICATION FOR: SIGNATURE OF APPLICANT OR PETITIONER DATE NATURALIZATION OTHER (SPECIFY) ADJUSTMENT OF STATUS IF YOUR NATIVE ALPHABET IS IN OTHER THAN ROMAN LETTERS, WRITE YOUR NAME IN YOUR NATIVE ALPHABET IN THIS SPACE: Are all copies legible? Yes PENALTIES: SEVERE PENALTIES ARE PROVIDED BY LAW FOR KNOWINGLY AND WILLFULLY FALSIFYING OR CONCEALING A MATERIAL FACT."
}