{
  "anumber": "A23792632",
  "id": "A23792632_0034",
  "page_index": 34,
  "resources": {
    "full_jpg": "https://dctn4zjpwgdwdiiy5odjv7o2se0bqgjb.lambda-url.us-east-1.on.aws/iiif/3/og-2023-kc-nara_A23792632_0034/full/max/0/default.jpg"
  },
  "fields": {
    "sex": {
      "ms_sex_llm_v1": "female"
    },
    "doctype": {
      "ms_doctype_v1": "form"
    },
    "form_title": {
      "ms_form_title_llm_v1": "Application for Naturalization"
    },
    "countries": {
      "ms_countries_nlp_v1": [
        "Vietnam",
        "United States"
      ]
    },
    "years": {
      "ms_years_nlp_v1": [
        2023
      ]
    }
  },
  "is_g325a": false,
  "is_cert_naturalization": false,
  "full_text": "Screened by NARA, 2/6/2023 U.S. Department of Justice OMB #1115-0009 Immigration and Naturalization Servine Application for Naturalization START HERE - Please Type or Print FOR INS USE ONLY Returned Receipt Part 1. Information about you. Family Given Middle Name NGUYEN Name NGOI Initial THI U.S. Mailing Address . Care of Resubmitted Street Number Apt. and Name 10242 STANFORD ST # 5 City County GARDEN GROVE ORANGE State ZIP Reloc Sent CALIFORNIA Code 92640 Date of Birth Country (month/day/year) 01-01-11 of Birth VIETNAM Social A Security # 586-18-3120 # 23-792-632 Reloc Rec'd Part 2. Basis for Eligibility (check one). a. XX I have been a permanent resident for at least live (5) years b. I have been a permanent resident for at least three (3) years and have been married to a United States Citizen for those three years. Applicant Interviewed C. I am a permanent resident child of United States citizen parent(s) d. I am applying on the basis of qualifying military service in the Armed Forces of the U.S. and have attached completed Forms N-426 and G-325B At interview c. Other. (Please specify section of law) request naturalization ceremony at court Part 3. Additional information about you. Remarks Date you became a permanent Port admitted with an immmigrant visa or INS Office resident (month/day/year) where granted adjustment of stalus. 06/10/79 NOL IC6 Citizenship VIETNAMESE Name on alien registration card (if different than in Part 1) SAME AS ABOVE Other names used since you became a permanent resident (including maiden name) NONE Sox Male Height Marital Status: Single Divorced Female Married Widowed 5.00 Can you speak, read and write English ? No es. Action Absences from the U.S.: Have you been absent from the U.S. since becoming a permanent resident? No Yes If you answered \"Yes\" . complete the following. Begin with your most recent absence If you need more room to explain the reason for an absence or to list more trips, continue on separate paper. Did absence last Date left U.S. Date returned 6 months or more? Destination Reason for trip Yes No To Be Completed by Yes No Attorney or Representative, if any Fill in box if G-28 is attached to represent Yes No the applicant Yes No VOLAG# Yes No Yes NO ATTY State License N Form N.400 (Rev 07/17/91)N Continued on back."
}