{
  "anumber": "A26271163",
  "id": "A26271163_0135",
  "page_index": 135,
  "resources": {
    "full_jpg": "https://dctn4zjpwgdwdiiy5odjv7o2se0bqgjb.lambda-url.us-east-1.on.aws/iiif/3/og-2023-kc-nara_A26271163_0135/full/max/0/default.jpg"
  },
  "fields": {
    "doctype": {
      "ms_doctype_v1": "form"
    },
    "form_title": {
      "ms_form_title_llm_v1": "ADJ. Processing Sheet"
    },
    "countries": {
      "ms_countries_nlp_v1": [
        "United States"
      ]
    },
    "years": {
      "ms_years_nlp_v1": [
        2023
      ]
    }
  },
  "is_g325a": false,
  "is_cert_naturalization": false,
  "full_text": "Screened by NARA, 6/1/2023 UNITED STATES DEPARTMENT OF JUSTICE IMMIGRATION AND NATURALIZATION SERVICE ADJ. Processing Sheet Application or Fetition Form No. I-485 - I-485A - I-485C File No. A26271163 Attorney of Record: CATEGORY A ( ) NATIONALITY DOB CATEGORY B ( ) COUNTRY CHARGE ( ) PREFERENCE 203 (a) ( ) PRIORITY ( ) NONPREFERENCE 203 (a) (8) PRIORITY ( ) SECTION 1 CUBAN PRIORITY LABOR CERTIFICATION BLANKET ( ) INDIVIDUAL ( ) EXEMPT ( ) VALID TO SUPPORTING Neer DISTRIBUTE ACTION DOCUMENTS (If Checked) TAKEN B/C Notification to D&D M/C Copy 4, I-181 to Alien Photos I-181 to State Support I-181 to File (Cat. A Case) I-508 G-325A #1 I-88 G-325A #2 I-413 (F/P) G-325A #3 G-325A #4 to Consul at MEDICAL & INTERVIEW DATE RESCHEDULED DATE CLASS OF ADMIS- Medical OK Medical SION (Symbol) Interview Interview OTHER CLERICAL ACTION: Type I-151, omitting entry date, place and lamination. Affix photo. Insert I-151 in file with I-357, G-153 and return envelope. Prepare I-486 - in Category A date 45 days after all G-325A's sent and mail to applicant. In Cate- gory B hold undated I-486 in file. OFFICER INSTRUCTIONS: GRANT - DENY sa 3-23-83 DECISION (Circle One) (Officer's Initials) (Date)"
}