{
  "anumber": "A27436780",
  "id": "A27436780_0010",
  "page_index": 10,
  "resources": {
    "full_jpg": "https://dctn4zjpwgdwdiiy5odjv7o2se0bqgjb.lambda-url.us-east-1.on.aws/iiif/3/og-2023-kc-nara_A27436780_0010/full/max/0/default.jpg"
  },
  "fields": {
    "sex": {
      "ms_sex_llm_v1": "female"
    },
    "doctype": {
      "ms_doctype_v1": "form"
    },
    "form_title": {
      "ms_form_title_llm_v1": "U.S. Department of Justice Immigration and Naturalization Service BIOGRAPHIC INFORMATION, G-325A"
    },
    "countries": {
      "ms_countries_nlp_v1": [
        "Taiwan",
        "China",
        "United States"
      ]
    },
    "years": {
      "ms_years_nlp_v1": [
        1985,
        2023,
        1911
      ]
    },
    "g325a": {
      "occupation": {
        "occupation_llm_v1": "['n.a']"
      },
      "reason": {
        "reason_llm_v1": "NATURALIZATION"
      },
      "nationality": {
        "nationality_llm_v1": "Taiwan"
      }
    }
  },
  "is_g325a": true,
  "is_cert_naturalization": false,
  "full_text": "Screened by NARA, 8/1/2023 LOS U.S. Department of Justice FORM G-325A T/C = 245, OMB No. 1115-0066 Immigration and Naturalization Service BIOGRAPHIC INFORMATION JUN 25 1985 Approval expires 4-30-85 (DATE) (Family name) (First name) (Middle name) MALE BIRTHDATE(Mo.-Day- NATIONALITY FILE NUMBER LIU, Chen FEMALE 11-16-1911 Taiwan 127436780 ALL OTHER NAMES USED (Including names by previous marriages) CITY AND COUNTRY OF BIRTH SOCIAL SECURITY NO. Shong-Chen, Honan, China (If any) FAMILY NAME FIRST NAME DATE, CITY AND COUNTRY OF BIRTH(If known) CITY AND COUNTRY OF RESIDENCE LIU, Hsing-Tang China China FATHER LIU, Gung Hsiao-Feng China Taiwan MOTHER(Maiden name) HUSBAND (If none, so state) FAMILY NAME FIRST NAME BIRTHDATE CITY & COUNTRY OF BIRTH DATE OF MARRIAGE PLACE OF MARRIAGE OR (For wife, give maiden name) China WIFE PAN Jui-Fen -15-17 HoFai, AnHwai 6-16-36 Chien-su FORMER HUSBANDS OR WIVES(if none,so state) none FAMILY NAME (For wife, give maiden name) FIRST NAME BIRTHDATE DATE & PLACE OF MARRIAGE DATE AND PLACE OF TERMINATION OF MARRIAGE APPLICANT'S RESIDENCE LAST FIVE YEARS. LIST PRESENT ADDRESS FIRST. FROM TO STREET AND NUMBER CITY PROVINCE OR STATE COUNTRY MONTH YEAR MONTH YEAR 20720 Community St. Canoga Park, Ca. U.S.A. 5 85 PRESENT TIME 13 Lane 88 Min Kuo Rd. Chiayi Taiwan Taiwan 11 81 5 85 8450 Airline Hwy Baton Rouge, LA. U.S.A. 11 80 11 81 13 Lane 88 Min Kuo Rd. Chiayi Taiwan Taiwan 12 48 11 80 APPLICANT'S LAST ADDRESS OUTSIDE THE UNITED STATES OF MORE THAN ONE YEAR FROM TO STREET AND NUMBER CITY PROVINCE OR STATE COUNTRY MONTH YEAR MONTH YEAR 13 Lane 88 Min Kuo Rd Chiayi Taiwan Taiwan 12 48 11 80 APPLICANT'S EMPLOYMENT LAST FIVE YEARS. (IF NONE, so STATE.) LIST PRESENT EMPLOYMENT FIRST FROM TO FULL NAME AND ADDRESS OF EMPLOYER OCCUPATION SPECIFY) MONTH YEAR MONTH YEAR PRESENT TIME none Show below last occupation abroad if not shown above. (Include all information requested above.) THIS FORM IS SUBMITTED IN CONNECTION WITH APPLICATION FOR: SIGNATURE OF APPLICANT DATE NATURALIZATION STATUS AS PERMANENT RESIDENT OTHER (SPECIFY): Liu CHEW 6-6-85 IF YOUR NATIVE ALPHABET IS IN OTHER THAN ROMAN LETTERS. WRITE YOUR NAME IN YOUR NATIVE ALPHABET IN THIS SPACE: Are all copies legible? Yes PENALTIES: SEVERE PENALTIES ARE PROVIDED BY LAW FOR KNOWINGLY AND WILLFULLY FALSIFYING OR CONCEALING A MATERIAL FACT. APPLICANT: BE SURE TO PUT YOUR NAME AND ALIEN REGISTRATION NUMBER IN THE BOX OUTLINED BY HEAVY BORDER BELOW. COMPLETE THIS BOX (Family name) (Given name) (Middle name) (Alien registration number) LIU, Chen A27 436 780 COS T/C = 245 JUN 25 1985 (DATE) Form G-325 A (Rev. 10-1-82) (1) Ident."
}