{
  "anumber": "A28688810",
  "id": "A28688810_0000",
  "page_index": 0,
  "resources": {
    "full_jpg": "https://dctn4zjpwgdwdiiy5odjv7o2se0bqgjb.lambda-url.us-east-1.on.aws/iiif/3/og-2023-kc-nara_A28688810_0000/full/max/0/default.jpg"
  },
  "fields": {
    "sex": {
      "ms_sex_llm_v1": "female"
    },
    "doctype": {
      "ms_doctype_v1": "form"
    },
    "form_title": {
      "ms_form_title_llm_v1": "REQUEST FOR ASYLUM IN THE UNITED STATES"
    },
    "countries": {
      "ms_countries_nlp_v1": [
        "United States",
        "Nicaragua"
      ]
    },
    "years": {
      "ms_years_nlp_v1": [
        1909,
        1907,
        1900,
        1987
      ]
    }
  },
  "is_g325a": false,
  "is_cert_naturalization": false,
  "full_text": "U.S. Department of Justice OMB No. 1115-0086 Imm-gration and Naturalization Service REQUEST FOR ASYLUM IN THE UNITED STATES 2430 First S LLA, OCT OFFICE 1987 Date: INS Office: 1. Family Name OROZCO TERESA Jasef Sex C-170467 4. A28 number if 688 810 All other names used at any time (include maiden name if married) Marital status TERESA (Month) OROZCO (Day) Aguilate Male Single Divorced Female Married Widowed I was born: (Year) in (Town or City) (State or Province) (Country) Nationality - at 12-06-1900 birth At present man Other nationalities que Nicaragua 5. ou stateless? Vicaragua If stateless, how did become Same da I a 7. Religion 8. Languages spoken 9. Ethnic Address group United Tishanic CAthelic in States (In care of, C/O, if appropriate) Spoush 10. Telephone number (Number and street) (Apt. No.) (City or town) (State) (Zip Code) (include area code 305 335 NE 25 is beam Ha 33137 573-9047 11. Address abroad prior to coming to the United States (Number and street) (City) (Province) (Country) Repto hina Lines dil Colegio Student Maria 1/2eal N Mga; NIC; 12. My last arrival in the U.S. occurred on: (Mo/Day/Yr) Corayond As Visitor 5-30-84 Stowaway I Crewman Other (Specify) tourst At the port of (City/State) Duam H. Means of arrival (Name of vessel or airline and flight number. etc.) AIR PL. I was was not inspected Date authorized stay expires (Mo/Day/Yr) 5-30-81-11-25-87 13. My nonimmigrant visa number is 010305 it was issued by the U.S. Consul on 5-22-84 (If none, state \"none (Mo/Day/Yr) at (City, County) Managua Nicaraguer From To 14. Name and location of schools attended Type of school Highest grade Title of degree or Mo/Yr Mo/Yr completed certification MAVaguz vie; magarth Geopia printed 1907 1909 2-grado 15. What specific skills do you have? 16. Social Security No. (if any) to seev 17. Name of husband or wife (wife's maiden name) why) have widowed 18. My husband or wife resides with me apart from me (if apart, explain Address (Apt. No.) (No. and street) (Town or city) (Province or state) (Country) MIA #48 EMPLOYMENT AUTHORIZED THRU 10/1/88 Form I-589 (OVER) (Rev. 10-1-85) Y RECEIVED TRANS IN RET'D TRANS. OUT COMPLETED DEC02 1987 Page 1"
}