{
  "anumber": "A28621564",
  "id": "A28621564_0050",
  "page_index": 50,
  "resources": {
    "full_jpg": "https://dctn4zjpwgdwdiiy5odjv7o2se0bqgjb.lambda-url.us-east-1.on.aws/iiif/3/og-2023-kc-nara_A28621564_0050/full/max/0/default.jpg"
  },
  "fields": {
    "sex": {
      "ms_sex_llm_v1": "female"
    },
    "doctype": {
      "ms_doctype_v1": "form"
    },
    "form_title": {
      "ms_form_title_llm_v1": "BIOGRAPHIC INFORMATION, G-325A"
    },
    "countries": {
      "ms_countries_nlp_v1": [
        "United States",
        "Nicaragua"
      ]
    },
    "years": {
      "ms_years_nlp_v1": [
        2023,
        1987
      ]
    },
    "g325a": {
      "occupation": {
        "occupation_llm_v1": "['bacteriologist']"
      },
      "reason": {
        "reason_llm_v1": "NATURALIZATION"
      },
      "nationality": {
        "nationality_llm_v1": "Nicaraguan"
      }
    }
  },
  "is_g325a": true,
  "is_cert_naturalization": false,
  "full_text": "Screened by NARA, 7/28/2023 INSTRUCTIONS. USE TYPEWRITER. BE SURE ALL COPIES ARE LEGIBLE. Failure to answer fully all questions delays action. Do Not Remove Carbons: If tvoewriter is not available, print heavily in block letters with ball-point pen. *U.S.GPO:1987-0-169-4 For sale by the Superintendent of Documents. U.S. Government Printing Office. Washington, D.C. 20402 (Per 100) U.S. Department of Justice FORM G-325A OMB No. 1115-0066 Immigration and Naturalization Service BIOGRAPHIC INFORMATION Approval expires 4-30-85 (Family name) (First name) (Middle name) ROMAN MALE BIRTHDATE(Mo.-Day-Yr.) NATIONALITY FILE NUMBER Jose Antonio FEMALE 10/17/09 Nicaraguan 4 127 170 699 73 ALL OTHER NAMES USED (Including names by previous marriages) CITY AND COUNTRY OF BIRTH Tono Roman SOCIAL SECURITY NO. Jinotepe, Carazo, Nicaragua (If any) n/a FAMILY NAME FIRST NAME DATE, CITY AND COUNTRY OF BIRTH(If known) CITY AND COUNTRY OF RESIDENCE. FATHER Roman y Reyes, Victor n/a Jinotepe, Carazo, Nic. Deceased MOTHER(Moiden name) Avellan, Juana n/a Jinotepe, Carazo, Nic. Deceased HUSBAND (If none, so state) FAMILY NAME OR FIRST NAME BIRTHDATE CITY & COUNTRY OF BIRTH WIFE (For wife, give maiden name) DATE OF MARRIAGE PLACE OF MARRIAGE 08/10/41 Mercado Otilia 01/04/22 San Marcos, Nic Jinotepe Jinotepe Nicaragua FORMER HUSBANDS OR WIVES(if none,so state) FAMILY NAME (For wife, give maiden name) FIRST NAME BIRTHDATE DATE & PLACE OF MARRIAGE DATE AND PLACE OF TERMINATION OF MARRIAGE n/a APPLICANT'S RESIDENCE LAST FIVE YEARS. LIST PRESENT ADDRESS FIRST. FROM TO STREET AND NUMBER CITY PROVINCE OR STATE COUNTRY MONTH YEAR MONTH YEAR 3325 S.W. 47th Street Miami Florida USA 08 84 PRESENT TIME Bosques de Altamira #227 Managua Nicaragua Nicaragua 01 73 08 84 APPLICANT'S LAST ADDRESS OUTSIDE THE UNITED STATES OF MORE THAN ONE YEAR FROM TO STREET AND NUMBER CITY PROVINCE OR STATE COUNTRY MONTH YEAR MONTH YEAR Bosques de Altamira #227 Managua Nicaragua Nicaragua 01 73 08 84 APPLICANT'S EMPLOYMENT LAST FIVE YEARS. (IF NONE. so STATE.) LIST PRESENT EMPLOYMENT FIRST FROM TO FULL NAME AND ADDRESS OF EMPLOYER OCCUPATIONISPECIFYY MONTH YEAR MONTH YEAR Unemployed 08 84 PRESENT TIME Centro de Diagnostico Clinico, Managua, Nicaragua Bacteriologist 09 76 08 84 Show below last occupation abroad if not shown above. (Include all information requested above.) THIS FORM IS SUBMITTED IN CONNECTION WITH APPLICATION FOR: SIGNATURE OF APPLICANT DATE NATURALIZATION STATUS AS PERMANENT RESIDENT OTHER (SPECIFY): Political Asylum April 20, 1987 IF YOUR NATIVE ALPHABET IS THAN ROMAN TERS WRITE YOUR NAME IN YOUR NATIVE ALPHABET IN THIS SPACE Are all copies legible? Yes PENALTIES SEVERE PENALTIES ARE PROVIDED BY LAW FOR KNOWINGLY AND WILLFULLY FALSIFYING OR CONCEALING A MATERIAL FACT. APPLICANT: BE SURE TO PUT YOUR NAME AND ALIEN REGISTRATION NUMBER IN THE BOX OUTLINED BY HEAVY BORDER BELOW. COMPLETE THIS BOX (Family name) (Given name) (Middle name) (Alien registration number) ROMAN JOSE ANTONIO Form G-325 A (Rev. 10-1-82) (1) IDENT."
}