{
  "anumber": "A28621564",
  "id": "A28621564_0114",
  "page_index": 114,
  "resources": {
    "full_jpg": "https://dctn4zjpwgdwdiiy5odjv7o2se0bqgjb.lambda-url.us-east-1.on.aws/iiif/3/og-2023-kc-nara_A28621564_0114/full/max/0/default.jpg"
  },
  "fields": {
    "sex": {
      "ms_sex_llm_v1": "female"
    },
    "doctype": {
      "ms_doctype_v1": "form"
    },
    "form_title": {
      "ms_form_title_llm_v1": "U.S. Department of Justice Immigration and Naturalization Service, FORM G-325A"
    },
    "countries": {
      "ms_countries_nlp_v1": [
        "United States",
        "Nicaragua"
      ]
    },
    "years": {
      "ms_years_nlp_v1": [
        1989,
        2023,
        1909
      ]
    },
    "g325a": {
      "occupation": {
        "occupation_llm_v1": "[' retired', 'bacteriologist']"
      },
      "reason": {
        "reason_llm_v1": "NATURALIZATION"
      },
      "nationality": {
        "nationality_llm_v1": "NICARAGUAN"
      }
    }
  },
  "is_g325a": true,
  "is_cert_naturalization": false,
  "full_text": "Screened by NARA, 7/28/2023 U.S. Department of Justice FORM G-325A OMB No. 1115-0066 Immigration and Naturalization Service BIOGRAPHIC INFORMATION Approval expires 4-30-85 (Family name) (First name) (Middle name) MALE BIRTHDATE(Mo.+Day-Yr.) NATIONALITY FILE NUMBER ROMAN, Jose Antonio FEMALE 10/17/1909 NiCARAGUAN A- 28 621 564 ALL OTHER NAMES USED (Including names by previous marriages) CITY AND COUNTRY OF BIRTH SOCIAL SECURITY NO. Jinotepe, NiCARAGUA (If any) 595-52- 1218 FAMILY NAME FIRST NAME DATE, CITY AND COUNTRY OF BIRTH(If known) CITY AND COUNTRY OF RESIDENCE. Romany Reyes, Victor M. - n/a Jinotepe, Nicaragua Deceased FATHER MOTHER (Maiden name) Avellan, Juana - n/a Jinotepe, Nicaragua Deceased HUSBAND (If none, so state) FAMILY NAME FIRST NAME BIRTHDATE CITY & COUNTRY OF BIRTH DATE OF MARRIAGE PLACE OF MARRIAGE OR (For wife, give maiden name) WIFE (deceased MERCADO, Otilia 1/04/22 San Maros, 8/10/41 Jinotepe, Nicaragua Nicaragua FORMER HUSBANDS OR WIVES(if none,so state) FAMILY NAME (For wife, give maiden name) FIRST NAME BIRTHDATE DATE & PLACE OF MARRIAGE DATE AND PLACE OF TERMINATION OF MARRIAGE N/A - - - APPLICANT'S RESIDENCE LAST FIVE YEARS. LIST PRESENT ADDRESS FIRST. FROM TO STREET AND NUMBER CITY PROVINCE OR STATE COUNTRY MONTH YEAR MONTH YEAR 13325 S.W. 47 St. Miami Florida U.S.A. 08 84 PRESENT TIME Bosques de Altamira #227 Managua Nicaragua Nicaragua 01 73 08 84 APPLICANT'S LAST ADDRESS OUTSIDE THE UNITED STATES OF MORE THAN ONE YEAR FROM TO STREET AND NUMBER CITY PROVINCE OR STATE COUNTRY MONTH YEAR MONTH YEAR Bosques de Attamira # 227 Managua NiCARAGUA Nicaragua 01 73 08 84 APPLICANT'S EMPLOYMENT LAST FIVE YEARS. (IF NONE, so STATE.) LIST PRESENT EMPLOYMENT FIRST FROM TO FULL NAME AND ADDRESS OF EMPLOYER OCCUPATION (SPECIFY) MONTH YEAR MONTH YEAR Retired Retiree 08 84 PRESENT TIME Centro de Diagnostico Cl√≠nico Managua, NiCARAGUA Bacteriologist 09 76 08 84 Medical Corps - National Guard 11 06 40 07 79 Show below last occupation abroad if not shown above. (Include all information requested above.) Centro de Diagnostico Clinico - Managua, NiCAR Bacteriologist 09/76 08 84 THIS FORM IS SUBMITTED IN CONNECTION WITH APPLICATION FOR: SIGNATURE DATE NATURALIZATION STATUS AS PERMANENT RESIDENT OTHER (SPECIFY): NATIVE ALPHABET OF APPLICANT IS IN OTHER-THAN ROMAN LETTERS. WRITE 12-22-88 IF YOUR YOUR NAME IN YOUR NATIVE ALPHABET IN THIS SPACE: Are all copies legible? Yes N/A PENALTIES: SEVERE PENALTIES ARE PROVIDED BY LAW FOR KNOWINGLY AND WILLFULLY FALSIFYING OR CONCEALING A MATERIAL FACT. APPLICANT: BE SURE TO PUT YOUR NAME AND ALIEN REGISTRATION NUMBER IN THE BOX OUTLINED BY HEAVY BORDER BELOW. COMPLETE THIS BOX (Family name) (Given name) (Middle name) (Alien registration number) ROMAN, JOSE ANTONio A 28 621 564 May MIA TCI-485 APR 14 1989 Form G-325 A (Rev. 10-1-82) (1) Ident."
}