{
  "anumber": "A28688810",
  "id": "A28688810_0022",
  "page_index": 22,
  "resources": {
    "full_jpg": "https://dctn4zjpwgdwdiiy5odjv7o2se0bqgjb.lambda-url.us-east-1.on.aws/iiif/3/og-2023-kc-nara_A28688810_0022/full/max/0/default.jpg"
  },
  "fields": {
    "sex": {
      "ms_sex_llm_v1": "female"
    },
    "doctype": {
      "ms_doctype_v1": "form"
    },
    "form_title": {
      "ms_form_title_llm_v1": "U.S. Department of Justice Immigration and Naturalization Service BIOGRAPHIC INFORMATION, G-325A"
    },
    "countries": {
      "ms_countries_nlp_v1": [
        "United States",
        "Nicaragua"
      ]
    },
    "years": {
      "ms_years_nlp_v1": [
        1988,
        1892,
        1935
      ]
    },
    "g325a": {
      "occupation": {
        "occupation_llm_v1": "[' retired', 'manager']"
      },
      "reason": {
        "reason_llm_v1": "NATURALIZATION"
      },
      "nationality": {
        "nationality_llm_v1": "Nicaragua"
      }
    }
  },
  "is_g325a": true,
  "is_cert_naturalization": false,
  "full_text": "U.S. Department of Justice F G-325A OMB No. 1115-0066 Immigration and Naturalization Service BIOGRAPHIC INFORMATION Approval expires 4-30-85 (Family name) (First name) (Middle name) MALE BIRTHDATE(Mo.-Day-Yr.) NATIONALITY FILE NUMBER passp OROZCO TERESA FEMALE 12-6-1900 ALL OTHER NAMES USED (Including names by previous marriages) CITY AND COUNTRY OF BIRTH Nicaugus AC -170467 SOCIAL SECURITY NO. TERESA OROZCO AguiLAR FAMILY NAME FIRST NAME DATE, CITY AND COUNTRY OF BIRTH(If known) Managua CITY AND COUNTRY OF RESIDENCE. Nicarez (If any) FATHER Longing OROZOO Leon Nie; pecansed MOTHER(Maiden name) FAMILY PASTORA NAME AguiLAR FIRST NAME 11 11 / 11 HUSBAND (If none, so state) widownifi BIRTHDATE CITY & COUNTRY OF BIRTH DATE OF MARRIAGE PLACE OF MARRIAGE OR WIFE (For wife, give maiden name) FORMER HUSBANDS OR WIVES(if none, so state) FAMILY NAME (For wife, give maiden name) FIRST NAME BIRTHDATE DATE & PLACE OF MARRIAGE DATE AND PLACE OF TERMINATION OF MARRIAGE CONFRERAS Nafaleon 1892 Nie; 1935 Nie; 2/80 Deceased- APPLICANT'S RESIDENCE LAST FIVE YEARS. LIST PRESENT ADDRESS FIRST. FROM TO STREET AND NUMBER CITY PROVINCE OR STATE COUNTRY MONTH YEAR MONTH YEAR 335 NE 25th aug lla U.S.A 5 84 PRESENT TIME APPLICANT'S LAST ,ADDRESS OUTSIDE THE UNITED STATES OF MORE THAN ONE YEAR DIGANT STREET Reference AND 12 and FROM TO PROVINCE OR STATE COUNTRY MONTH YEAR MONTH YEAR APPLICANT'S EMPLOYMENT LAST FIVE YEARS. (IF NONE, so STATE.) LIST PRESENT EMPLOYMENT FIRST Managua N/C. 4 FROM 74 5 84 TO FULL NAME AND ADDRESS OF EMPLOYER OCCUPATION (SPECIFY) MONTH YEAR MONTH YEAR Domente PRESENT TIME Show below last occupation abroad if not shown above. (Include all information requested above.) managua WITH APPLICATION FOR: SIGNATURE OF APPLICANT Houseuff THIS FORM IS SUBMITTED IN CONNECTION Nicaragua NATURALIZATION STATUS AS PERMANENT RESIDENT OTHER (SPECIFY): XPresa orance DATE 9-29/87 asylm IF YOUR NATIVE ALPHABET IS IN OTHER THAN ROMAN LETTERS. WRITE YOUR NAME IN YOUR NATIVE ALPHABET IN THIS SPACE: Are all copies legible? Yes PENALTIES: SEVERE PENALTIES ARE PROVIDED BY LAW FOR KNOWINGLY AND WILLFULLY FALSIFYING OR CONCEALING A MATERIAL FACT. BE SURE TO PUT YOUR NAME AND ALIEN REGISTRATION NUMBER IN AND APPLICANT: THE BOX OUTLINED BY HEAVY BORDER BELOW. 688810 COMPLETE THIS BOX (Family name) (Given name) (Middle name) (Alien registration number) OROZCO TERESA passf C-170467 MIA T.C.1589 I'M DEC 2 0 1988 Form G-325 A (Rev. 10-1-82) (1) Ident."
}