{
	"anumber": "A28729371",
	"id": "A28729371_0003",
	"page_index": 3,
	"resources": {
		"full_jpg": "https://dctn4zjpwgdwdiiy5odjv7o2se0bqgjb.lambda-url.us-east-1.on.aws/iiif/3/og-2023-kc-nara_A28729371_0003/full/max/0/default.jpg"
	},
	"fields": {
		"sex": {
			"ms_sex_llm_v1": "female"
		},
		"doctype": {
			"ms_doctype_v1": "form"
		},
		"form_title": {
			"ms_form_title_llm_v1": "Application for Permanent Residence, I-485 ( (08-01-85) N"
		},
		"countries": {
			"ms_countries_nlp_v1": ["Nicaragua"]
		},
		"years": {
			"ms_years_nlp_v1": [1988, 2023, 1987]
		}
	},
	"is_g325a": false,
	"is_cert_naturalization": false,
	"full_text": "Screened by NARA. 7/28/2023 U.S. Department of Justice OMB # 1115-0053 Immigration and Naturalization Service (INS) Application for Permanent Residence Expires 8/85 DO NOT WRITE IN THIS BLOCK Case ID# Action Stamp Fee Stamp APPROVED 28 729 371 DIRECTOR G-28 or Volag# DEC 12 1988 Section of Law Sec. 214(d), INA M Hallany Eligibility Under Sec. 245 Sec 209(b), INA Approved Visa Petition Dependent of Principal Alien Sec. 13. Act of 9/11/57 Special Immigrant Sec. 245, INA Other Sec. 249, INA Country Chargeable Preference A. Reason for this application I am applying for lawful permanent residence for the following reason: (check the box that applies) 1. An immigrant visa number is immediately available to me because A visa petition has already been approved for me (approval notice is attached) A visa petition is being filed with this application 2. I entered as the fiance(e) of a U.S. citizen and married within 90 days (approval notice and marriage certificate are attached) 3. I am an asylee eligible for adjustment 4. Other: B. Information about you 1. Name Family name in CAPS) (First (Middle) 11. On what date did you last enter the U.S.? SANCHEZ. - Zepeda FRANCISCA 03-09-74 2. Address (Number and Street (Apartment Number) 12. Where did you last enter the U.S.? (City and State) 7602 San Vicente Ave. Los Angeles, California (Town or City) (State/Country) (ZIP/Postal Code) 13. What means of travel did you use? (Plane, car. etc.) Paramount, California 90723 Plane 3. Place of Birth (Town or City (State/Country) 14. Were you inspected by a U.S. immigration officer? Nagarote, Leon Nicaragua Yes No 4. Date of Birth 5. Sex 6. Marital Status 15. In what status did you last enter the U.S.? (Mo/Day/Yr) (Visitor, student, exchange alien, crewman, temporary worker, Male Married Single without inspection, etc.) 10-04-12 Female Widowed Divorced Visitor 7. Social Security Number 8. Alien Registration Number (if any) 16. Give your name EXACTLY as it appears on your Arrival/Departure None A28729371 Record (Form I-94). 9. Country of Citizenship Francisca Sanchez Zepeda NICARAGUA 17. Arrival/Departure Record (1-94) Number 18. Visa Number 10. Have you ever applied for permanent resident status in the U.S.? 1051 Yes No 013811 (If Yes, give the date and place of filing and final disposition) 19. At what Consulate was your nonimmigrant visa issued? Date (Mo/Dav/YY) Managua, Nicaragua 11-07-73 20. Have you ever been married before? Yes No If Yes, (Names of prior husbands/wives) (Country of citizenship) (Date marriage ended) EMPLOYMENT AUTHORIZED 21. Has your husband/wife ever been married before? Yes No Not applicable DATE 2 4 1987 LOS If Yes, (Names of prior husbands/wives) (Country of citizenship) (Date marriage ended) CR AC SIGNATURE IE DO A- AUG 1 8 1988 11 INITIAL RECEIPT RESUBMITTED RELOCATED COMPLETED Rec'd Sent Approved Denied Returned FORM I-485 (08-01-85) N"
}
