{
  "anumber": "A28743491",
  "id": "A28743491_0045",
  "page_index": 45,
  "resources": {
    "full_jpg": "https://dctn4zjpwgdwdiiy5odjv7o2se0bqgjb.lambda-url.us-east-1.on.aws/iiif/3/og-2023-kc-nara_A28743491_0045/full/max/0/default.jpg"
  },
  "fields": {
    "sex": {
      "ms_sex_llm_v1": "male"
    },
    "doctype": {
      "ms_doctype_v1": "form"
    },
    "form_title": {
      "ms_form_title_llm_v1": "U.S. Department of Justice Immigration and Naturalization Service BIOGRAPHIC INFORMATION, G-325A ( (Rev. 10-1-82)"
    },
    "countries": {
      "ms_countries_nlp_v1": [
        "Pakistan",
        "India"
      ]
    },
    "years": {
      "ms_years_nlp_v1": [
        1988
      ]
    },
    "g325a": {
      "occupation": {
        "occupation_llm_v1": "['retired']"
      },
      "reason": {
        "reason_llm_v1": "NATURALIZATION"
      },
      "nationality": {
        "nationality_llm_v1": "India"
      }
    }
  },
  "is_g325a": true,
  "is_cert_naturalization": false,
  "full_text": "U.S. Department of Justice Scree PORMAB25123/2023 OMB No. 1115-0066 Immigration and Naturalization Service BIOGRAPHIC INFORMATION Approval expires 4-30-85 (Family name) (First name) (Middle name) MALE BIRTHDATE (Mo.-Day-Yr.) NATIONALITY FILF NUMBER SINGH JASWANT FEMALE 4-17-1897 India 5-287434911 ALL OTHER NAMES USED (Including names by previous marriages) CITY AND COUNTRY OF BIRTH SOCIAL SECURITY NO. None Mullan, Pakistan (If any) None FAMILY NAME FIRST NAME DATE, CITY AND COUNTRY OF BIRTH (If known) CITY AND COUNTRY OF RESIDENCE . FATHER Singh, Thakur Pakistan deceased MOTHER (Maiden name) Kamn, Bhagwan Pakistan deceased HUSBAND (If none, so state) FAMILY NAME FIRST NAME BIRTHDATE CITY & COUNTRY OF BIRTH DATE OF MARRIAGE PLACE OF MARRIAGE OR (For wife, give maiden name) WIFE Kaur Beant-Kaur India India FORMER HUSBANDS OR WIVES (if none, so state) FAMILY NAME (For wife, give maiden name) FIRST NAME BIRTHDATE DATE & PLACE OF MARRIAGE DATE AND PLACE OF TERMINATION OF MARRIAGE None APPLICANT'S RESIDENCE LAST FIVE YEARS. LIST PRESENT ADDRESS FIRST. FROM TO STREET AND NUMBER CITY PROVINCE OR STATE COUNTRY MONTH YEAR MONTH YEAR 3115 Fish Canyon Duarte California USA 11 79 PRESENT TIME APPLICANT'S LAST ADDRESS OUTSIDE THE UNITED STATES OF MORE THAN ONE YEAR FROM TO STREET AND NUMBER CITY PROVINCE OR STATE COUNTRY MONTH YEAR MONTH YEAR 33 NSE 01â‚« River Rd. Jullulber City India 70 79 APPLICANT'S EMPLOYMENT LAST FIVE YEARS. (IF NONE, so STATE.) LIST PRESENT EMPLOYMENT FIRST FROM TO FULL NAME AND ADDRESS OF EMPLOYER OCCUPATION (SPECIFY) MONTH YEAR MONTH YEAR Retired 79 PRESENT TIME Show below last occupation abroad if not shown above. (Include all information requested above.) Retired Jullulber City, India 70 79 THIS FORM IS SUBMITTED IN CONNECTION WITH APPLICATION FOR: SIGNATURE OF APPLICANT NATURALIZATION STATUS AS PERMANENT RESIDENT Jaswar Sight 10-3-86 DATE OTHER (SPECIFY): IF YOUR NATIVE ALPHABET IS IN OTHER THAN ROMAN LETTERS, WRITE YOUR NAME IN YOUR NATIVE ALPHABET IN THIS SPACE: Are all copies legible? Yes PENALTIES: SEVERE PENALTIES ARE PROVIDED BY LAW FOR KNOWINGLY AND WILLFULLY FALSIFYING OR CONCEALING A MATERIAL FACT. APPLICANT: BE SURE TO PUT YOUR NAME AND ALIEN REGISTRATION NUMBER IN THE BOX OUTLINED BY HEAVY BORDER BELOW. COMPLETE THIS BOX (Family name) (Given name) (Middle name) (Alien registration number' SINGH JASWANT A28743491 6/30/88 (OTHER AGENCY USE) INS USE (Office of Origin) OFFICE CODE: LOS TYPE OF CASE T/C - 245 DATE: APR 0 4 1988 (DATE) Form G-325A (Rev. 10-1-82) (3) C."
}