{
  "anumber": "A28749561",
  "id": "A28749561_0102",
  "page_index": 102,
  "resources": {
    "full_jpg": "https://dctn4zjpwgdwdiiy5odjv7o2se0bqgjb.lambda-url.us-east-1.on.aws/iiif/3/og-2023-kc-nara_A28749561_0102/full/max/0/default.jpg"
  },
  "fields": {
    "doctype": {
      "ms_doctype_v1": "form"
    },
    "form_title": {
      "ms_form_title_llm_v1": "RECORD OF DEPORTABLE ALIEN"
    },
    "countries": {
      "ms_countries_nlp_v1": [
        "Mexico",
        "United States"
      ]
    },
    "years": {
      "ms_years_nlp_v1": [
        897,
        2023,
        1978,
        1986
      ]
    }
  },
  "is_g325a": false,
  "is_cert_naturalization": false,
  "full_text": "Screened by NARA, 4/27/2023 RECORD OF DEPORTABLE ALIEN (See A.M. - 2790.31 - 34 for Instructions) Family Name (Capital Letters) Given Name Middle Name Sex Hair Eyes Complexion MAGANA-TORRES, EFRAIN M GRY BRN MEDIUM Country of Citizenship Passport Number and Country of Issue File Number A28749561 Height Weight Occupation MEXICO N/A N/A 70\" 150 GARDNER U.S. Address (Residence) (Number) (Street) (City) (State) (Zip Code) Scars or Marks MONROYA, CALIFORNIA. (STREET UNKNOWN) N/V Date Place Time Manner of Last Entry Possenger Boarded At F.B.I. No. Marital Status Widow(er) Single Married 03/23/87 6 MILES EAST POE/SYS1:5PM EWI Separated Divorced Number, Street, City, Province (State) and Country of Permanent Residence Method of Location/Apprehension SAN JOSE MICHOACAN, MEXICO Birthdate Date of Action Location Code (At/Near) Date & Hour 07/25/15 (71) 03/23/87 SDC/BRF SYS 03/23/87 2;00PM City, Province (State) and Country of Birth AR Lifted By 70. SAME AS ABOVE (35) Not Lifted ROBERTS/ARNOLD Visa Issued AI-NIV No Social me Status at Entry Status When Found SYS IN TRAVEL Date Visa Issued Social Send C.O. Rec. Check Length of Time Illegally in U.S. To: SUD AT ENTRY. Immigration Record Criminal Record CLAIMS NONE CLAIMS NONE. Name Address and Nationality of Spouse (Maiden Name, if appropriate) Number & Nationality of minor Children MARIA MAGANA (SAS), MEX. 2 MEX/ 1USC. Father's Name, and Nationality and Address if Known Mother's Present and Maiden Names Nationality, and Address, if Known EFRAIN MAGANA (DEC) GUADALUPE TORRES (SAS) MEX. Monies Due/Property in U.S. Not in Immediate Fingerprinted Lookout Book Checked Deportation Charge(s) (Code Words) Possession None Claimed See Form 1-43 Yes No Not Listed Listed Code ROTEN Name and Address of (Last) (Current) U.S. Employer Type of Employment Salary From: To: N?A N/A $ hr N/A Narrative (Outline particulars under which alien located/apprehended Include details, not shown above re time, place. manner of last entry and elements which establish administrative and/or criminal violation Indicate means and route of travel to interior Alien has been advised of communication privileges pursuant to 8 CFR 242.2(e) Initial JAG Date 03/23/87 Subject claims he knowningly and willfully entered the United States at a place not designated as a Port of Entry thus avoiding inspection by U.S. Immigration Officers. Subject Magana= +TORRES, EFRAIN, WAS App rehended by Agents C. Arnold and L. Roberts at 2; 10PM this date. Agents apprehended the subject from astolen vehicle driven by FOIA (b)(6) Subject was a co-principal in a 1986 White Toyota Camary, CA. Plates 2CKJo81 (STOLEN) Subject at first wanted a voluntary return, but know Subject claims he wants aformal deportation hearing. For information concerning this subject, please see attached I-213 of LOPEZ-GUTIERREZ, RAUL. Subject Re-INtERViewed ON 3/24/87, b, Agent S Clovere AT that time MAGANA stated that he had first entered the U. in MARCH OF 1978. HE Remained HERE 3903 November 0897 1986 de her to mexico to usit his SICK mother. MAGANA my Returned Claims that he obtained PERMISSION FROM the INS/COP Prior to leaving For mexico (was (Signature every and Title) BPA. (If space insufficient show \"continued\" and continue ON reverse, from bottom up): OVER DISTRIBUTION Received (subject and documents) (report of interview) from WA/OSE SS :01 Wd 3/24/87 Officer GARVEY, JAMES A. 03/23/87 19 of ( ) M. was Disposition dep proc. (Receiving Officer) Study Form 1-213 (Rev. 4-16-79)Y UNITED STATES DEPARTMENT OF JUSTICE Immigration and Naturalization Service"
}