{
  "anumber": "A28766477",
  "id": "A28766477_0011",
  "page_index": 11,
  "resources": {
    "full_jpg": "https://dctn4zjpwgdwdiiy5odjv7o2se0bqgjb.lambda-url.us-east-1.on.aws/iiif/3/og-2023-kc-nara_A28766477_0011/full/max/0/default.jpg"
  },
  "fields": {
    "sex": {
      "ms_sex_llm_v1": "female"
    },
    "doctype": {
      "ms_doctype_v1": "form"
    },
    "form_title": {
      "ms_form_title_llm_v1": "Application for Permanent Residence, I-485 ( (REV. 2-27-87)N"
    },
    "countries": {
      "ms_countries_nlp_v1": [
        "Nicaragua"
      ]
    },
    "years": {
      "ms_years_nlp_v1": [
        2023,
        1983
      ]
    }
  },
  "is_g325a": false,
  "is_cert_naturalization": false,
  "full_text": "Screened by NARA, 6/1/2023 U 3. Department of Justice OMB # 1115-0053 Immigration and Naturalization Service (INS) Application for Permanent Residence DO NOT WRITE IN THIS BLOCK Case ID# Action Stamp Fee Stamp A# 28766477 G-28 or Volag# Section of Law Eligibility Under Sec. 245 Sec. 209(b). INA Approved Visa Petition Sec. 214(d), INA Dependent of Principal Alien Sec. 13, Act of 9/11/57 Special Immigrant Sec. 245, INA Other Sec. 249, INA Country Chargeable Preference A. Reason for this application I am applying for lawful permanent residence for the following reason: (check the box that applies) 1. An immigrant visa number is immediately available to me because A visa petition has already been approved for me (approval notice is attached) A visa petition is being filed with this application 2. I entered as the flance(e) of a U.S. citizen and married within 90 days (approval notice and marriage certificate are attached) 3. I am an asylee eligible for adjustment 4. Other: B. Information about you 2 1. Name (Family name in CAPS) (First) (Middle) 11. On what date did you last enter the U.S.? ROCHA Carlos Alberto DEC. 1983 E. Address (Number and Street) (Apartment Number) 12. Where did you last enter the U.S.? (City and State) 238 S. Reno st. #2 (Town or City) (State/Country) (ZIP/Postal Code) 13. What means of travel did you use? (Plane, car, etc.) las Angeles,CA Los Angetes CA90057 PLANE 3. Place of Birth (Town or City) (State Country) 14. Were you inspected by a U.S. immigration officer? Dirlamba , NICARAGUA Yes No 4. Date of Birth 5, Sex 6. Marit= CARUS 15 In what status did you last enter the U.S.? (Mo/Day/Yr) Male Single (Visitor, student, exchange alien, crewman, temporary worker, 4-11-02 without inspection, etc.) Female Widowed Divorced VISITOR B-2 7. Social Security Number 8. Allen Registration Number (if any) 16. Give your name EXACTLY as it appears on your Arrival/Departure 572-97-4857(A28766477 Record (Form I-94). 9. Country of Citizenship Unkn- (I-94 (Rot) STATELESS 17. Arrival/Departure Record (1-94) Number 18. Visa Number 10. Have you ever applied for permanent resident status in the U.S.? Unkn. Union. Yes No (If Yes, give the date and place of filing and final disposition) 19. At what Consulate was your nonimmigrant visa issued? Date 20. Have you ever been married before? Yes Managera (Mo/Day/Yr) Unch No If Yes, Autobacha (Names of prior husbands/wives) ended) Maura (Country Modgaragua of citizenship) (Date marriage 21. Has your husband/wife ever been married before? Vies If Yes, (Names of prior husbands/wives) A. None VALLD UNTIL TE CRANIA DO LOS SAMPLE AUTHORIZED deceased (Country of citizenship) (Date marriage ended) N/A INITIAL RECEIPT RESUBMITTED RELOCATED COMPLETED Rec'd Sent Approved Denied Returned FORM I-485 (REV. 2-27-87)N"
}