{
  "anumber": "A28766478",
  "id": "A28766478_0020",
  "page_index": 20,
  "resources": {
    "full_jpg": "https://dctn4zjpwgdwdiiy5odjv7o2se0bqgjb.lambda-url.us-east-1.on.aws/iiif/3/og-2023-kc-nara_A28766478_0020/full/max/0/default.jpg"
  },
  "fields": {
    "sex": {
      "ms_sex_llm_v1": "female"
    },
    "doctype": {
      "ms_doctype_v1": "form"
    },
    "form_title": {
      "ms_form_title_llm_v1": "Biographic Information, G-325A"
    },
    "countries": {
      "ms_countries_nlp_v1": [
        "United States",
        "Nicaragua"
      ]
    },
    "years": {
      "ms_years_nlp_v1": [
        1925,
        1989
      ]
    },
    "g325a": {
      "occupation": {
        "occupation_llm_v1": "['n.a']"
      },
      "nationality": {
        "nationality_llm_v1": "Stateless"
      }
    }
  },
  "is_g325a": true,
  "is_cert_naturalization": false,
  "full_text": "LOS U.S. Department of Justice ScreeFoRM T/C- 245 OMB No. 1115-0066 Immigration and Naturalization Service BIOGRAPHIC INFORMATION MAY 10 1989 (Family name) (First name) (Middle name) SILVA DE ROCHA Andrea Pastora MALE BIRTHDATE(Mo.-Day-Yr.) NATIONALITY FILE NUMBER FEMALE 11-30-08 Stateless A28766478 ALL OTHER NAMES USED (Including names by previous marriages) CITY AND COUNTRY OF BIRTH SOCIAL SECURITY NO. SILVA SILVA Maula Managua, NICARAGUA (If any) 510-97-8975 FAMILY NAME FIRST NAME / DATE, CITY AND COUNTRY OF BIRTH(If known) CITY AND COUNTRY OF RESIDENCE FATHER SILVA, Jose luis; Unca, Managua, NICARAGUA , Deceased MOTHER (Maiden name) SILVA Cteronima Unkn Manaha NICARAGUA. Deceased HUSBAND (If none, so state) FAMILY NAME FIRST NAME OR BIRTHDATE CITY & COUNTRY OF BIRTH DATE OF MARRIAGE WIFE (For wife, give maiden name) PLACE OF MARRIAGE ROCHA Carlos 4/14/02 Diliamba, Dillamba, NICARAGUA 1925 WICARAGUA FORMER HUSBANDS OR WIVES(if none, so state) FAMILY NAME (For wife, give maiden name) FIRST NAME BIRTHDATE DATE & PLACE OF MARRIAGE DATE AND PLACE OF TERMINATION OF MARRIAGE None N/A N 1A APPLICANT'S RESIDENCE LAST FIVE YEARS. LIST PRESENT ADDRESS FIRST. FROM TO STREET AND NUMBER CITY PROVINCE OR STATE COUNTRY MONTH YEAR MONTH YEAR 238 S. Reno St.#2 los Angeles CA USA 6 85 PRESENT TIME 2107 S Norwood St. Los Angeles CA USA 12 83 6 85 APPLICANT'S LAST ADDRESS OUTSIDE THE UNITED STATES OF MORE THAN ONE YEAR FROM TO STREET AND NUMBER CITY PROVINCE OR STATE COUNTRY MONTH YEAR MONTH Calle Relag YEAR Daksamba - NICAPAGUA - 10 12 83 APPLICANT'S EMPLOYMENT LAST FIVE YEARS. (IF NONE, so STATE.) LIST PRESENT EMPLOYMENT FIRST FROM TO FULL NAME AND ADDRESS OF EMPLOYER OCCUPATION (SPECIFY) MONTH YEAR MONTH YEAR PRESENT TIME None Show below last occupation abroad if not shown above. (Include all information requested above.) None THIS FORM IS SUBMITTED IN CONNECTION WITH APPLICATION FOR: NATURALIZATION OTHER (SPECIFY): Maura S SIGNATURE N/A OF sndelg APPLICANT Rocha 4/14/89 DATE postoran/A STATUS AS PERMANENT RESIDENT IF YOUR NATIVE ALPHABET IS IN OTHER THAN ROMAN LETTERS. WRITE YOUR NAME IN YOUR NATIVE ALPHABET IN THIS SPACE: Are all copies legible? Yes 8/31/89 PENALTIES SEVERE PENALTIES ARE PROVIDED BY LAW FOR KNOWINGLY AND WILLFULLY FALSIFYING OR CONCEALING A MATERIAL FACT. N/A APPLICANT: BE SURE TO PUT YOUR NAME AND ALIEN REGISTRATION NUMBER IN THE BOX OUTLINED BY HEAVY BORDER BELOW. COMPLETE THIS BOX (Family name) (Given name) (Middle name) (Alien registration number) SILVA DE ROCHA A26 766 478 LOS T/C - 245 MAY 10 1989 (DATE) Form G-325 A (Rev. 10-1-82) (1) Ident."
}