{
	"anumber": "A28706315",
	"id": "A28706315_0020",
	"page_index": 20,
	"resources": {
		"full_jpg": "https://dctn4zjpwgdwdiiy5odjv7o2se0bqgjb.lambda-url.us-east-1.on.aws/iiif/3/og-2023-kc-nara_A28706315_0020/full/max/0/default.jpg"
	},
	"fields": {
		"sex": {
			"ms_sex_llm_v1": "female"
		},
		"doctype": {
			"ms_doctype_v1": "form"
		},
		"form_title": {
			"ms_form_title_llm_v1": "U.S. Department of Justice Immigration and Naturalization Service, Form G-325A"
		},
		"countries": {
			"ms_countries_nlp_v1": ["Pakistan", "United States", "India"]
		},
		"years": {
			"ms_years_nlp_v1": [1985, 2023, 1911, 1987]
		},
		"g325a": {
			"occupation": {
				"occupation_llm_v1": "['n.a']"
			},
			"reason": {
				"reason_llm_v1": "NATURALIZATION"
			},
			"nationality": {
				"nationality_llm_v1": "Indian"
			}
		}
	},
	"is_g325a": true,
	"is_cert_naturalization": false,
	"full_text": "Screened by 8/2/2023 ave ns no ab th in ett int *U.S. GPO: 1986-155-463 For sale by the Superintendent of Documents. U.S. Government Printing Office, Washington, D.C. 20402 (Per 100) U.S. Department of Justice FORM G-325A OMB No. 1115-0066 Immigration and Naturalization Service BIOGRAPHIC INFORMATION Approval expires 4-30-85 (Family name) (First name) (Middle name) MALE BIRTHDATE (Mo.-Day-Yr.) NATIONALITY FILE NUMBER KESWANI Mulidevi P FEMALE 3/14/1911 Indian 1 28 706 315 ALL OTHER NAMES USED (Including names by previous marriages) CITY AND COUNTRY OF BIRTH SOCIAL SECURITY NO. Mulidevi Seswani, Keswani, Bulibhai Matiari, Pakistan (If any) FAMILY NAME FIRST NAME DATE, CITY AND COUNTRY OF BIRTH (If known) CITY AND COUNTRY OF RESIDENCE FATHER SESWANI Mulchand Pakistan Deceased MOTHER (Maiden name) SESWANI Rani Pakistan Deceased HUSBAND (If none, so state) FAMILY NAME FIRST NAME BIRTHDATE CITY & COUNTRY OF BIRTH DATE OF MARRIAGE PLACE OF MARRIAGE OR (For wife, give maiden name) WIFE none FORMER HUSBANDS OR WIVES (if none, so state) FAMILY NAME (For wife, give maiden name) FIRST NAME BIRTHDATE DATE & PLACE OF MARRIAGE DATE AND PLACE OF TERMINATION OF MARRIAGE KESWANI Pitamba- 1906 Tando-Adam Jaipur, India das Pakistan 1926 1985 APPLICANT'S RESIDENCE LAST FIVE YEARS. LIST PRESENT ADDRESS FIRST. FROM TO STREET AND NUMBER CITY PROVINCE OR STATE COUNTRY MONTH YEAR MONTH YEAR 18528 Dylan St. Northridge CA USA 9 85 PRESENT TIME 18 Kanwarangar Jaipur Rajasthan India 66 9 86 APPLICANT'S LAST ADDRESS OUTSIDE THE UNITED STATES OF MORE THAN ONE YEAR FROM TO STREET AND NUMBER CITY PROVINCE OR STATE COUNTRY MONTH YEAR MONTH YEAR same as above APPLICANT'S EMPLOYMENT LAST FIVE YEARS. (IF NONE. so STATE.) LIST PRESENT EMPLOYMENT FIRST FROM TO FULL NAME AND ADDRESS OF EMPLOYER OCCUPATION (SPECIFY) MONTH YEAR MONTH YEAR none PRESENT TIME 818-266-9 5186689 Show below last occupation abroad if not shown above. (Include all information requested above.) none THIS FORM IS SUBMITTED IN CONNECTION WITH APPLICATION FOR SIGNATURE OF APPLICANT DATE NATURALIZATION STATUS AS PERMANENT RESIDENT Mali Devi OTHER (SPECIFY): 1/15/1987 IF YOUR NATIVE ALPHABET IS IN OTHER THAN ROMAN LETTERS. WRITE YOUR NAME IN YOUR NATIVE ALPHABET IN THIS SPACE Are all copies legible? Yes that zat PENALTIES: SEVERE PENALTIES ARE PROVIDED BY LAW FOR KNOWINGLY AND WILLFULLY FALSIFYING OR CONCEALING A MATERIAL FACT. APPLICANT: BE SURE TO PUT YOUR NAME AND ALIEN REGISTRATION NUMBER IN THE BOX OUTLINED BY HEAVY BORDER BELOW. COMPLETE THIS BOX (Family name) (Given name) (Middle name) (Alien registration number) KESWANI A28 706 315 Mulidevi P. (OTHER AGENCY USE) INS USE (Office of Origin) OFFICE CODE: TYPE OF CASE: DATE: Form G-325 A (Rev. 10-1-82) (2) Rec Br."
}
