{
  "anumber": "A28708181",
  "id": "A28708181_0003",
  "page_index": 3,
  "resources": {
    "full_jpg": "https://dctn4zjpwgdwdiiy5odjv7o2se0bqgjb.lambda-url.us-east-1.on.aws/iiif/3/og-2023-kc-nara_A28708181_0003/full/max/0/default.jpg"
  },
  "fields": {
    "sex": {
      "ms_sex_llm_v1": "male"
    },
    "doctype": {
      "ms_doctype_v1": "form"
    },
    "form_title": {
      "ms_form_title_llm_v1": "Application for Naturalization, N-4"
    },
    "countries": {
      "ms_countries_nlp_v1": [
        "Pakistan",
        "United States",
        "India"
      ]
    },
    "years": {
      "ms_years_nlp_v1": [
        2023
      ]
    }
  },
  "is_g325a": false,
  "is_cert_naturalization": false,
  "full_text": "Screened by NARA, 8/22/2023 U.S. Department of Justice OMB #1115-0009 Immigration and Naturalization Service Application for Naturalization START HERE - Please Type or Print FOR INS USE ONLY Returned Part 1. Information about you. Family Given Middle Name BAKHSHI Name SHEILA Initial U.S. Mailing Address - Care of Street Number 10681 S. Doroth Resubmitted Apt. and Name 12102 ZEUS AVE City Villa Park County Orange 3 NORWALK 2 & tos ANGELES State ZIP 9286 Reloc Sent CA 5/7/15 Code 90650 4 - Date of Birth TRANSPORTATION Country (month/day/year) 751515 of Birth INDIA (Now PAKISTAN) Social A Security # 564-99-7430 A28708181 Reloc Rec'd Part 2. Basis for Eligibility (check one). a. have been a permanent resident for at least five (5) years b. I have been a permanent resident for at least three (3) years and have been married to a United States Citizen for those three years. Applicant Interviewed C. I am a permanent resident child of United States citizen parent(s) d. I am applying on the basis of qualifying military service in the Armed Forces of the U.S. and have attached completed Forms N-426 and G-325B At interview e. Other. (Please specify section of law) request naturalization ceremony at court Part 3. Additional information about you. Remarks Date you became a permanent Port admitted with an immmigrant visa or INS Office resident (month/day/year where granted adjustment of status. NO SHOW 7-21-87 Los ANGELES DATE 10-15-97 Citizenship INDIA Name on alien registration card (if different than in Part 1) B. R. RICHINS SAME Other names used since you became a permanent resident (including maiden name) NONE Sex Male Height Marital Status: Single Divorced Female 5'0\" Married Widowed Can you speak, read and write English ? No Yes yes 6 Action Absences from the U.S.: Have you been absent from the U.S. since becoming a permanent resident? No Yes If you answered \"Yes\" , complete the following, Begin with your most recent absence. If you need more room to explain the reason for an absence or to list more trips, continue on separate paper. Did absence last Date left U.S. Date returned 6 months or more? Destination Reason for trip 12-5-94 11-13-94 12-5-944 Yes No INDIA MARRIAGE OF Yes No GRADDAUGHTER To Be Completed by At Attorney or Representative, if any 0 Yes NQ 7 Fill in box if G-28 is attached to represent the applicant Yes No VOLAG# Yes No Yes No ATTY State License # Form N-400 (Rev. 07/17/91)N Continued on back."
}