{
  "anumber": "A28767853",
  "id": "A28767853_0009",
  "page_index": 9,
  "resources": {
    "full_jpg": "https://dctn4zjpwgdwdiiy5odjv7o2se0bqgjb.lambda-url.us-east-1.on.aws/iiif/3/og-2023-kc-nara_A28767853_0009/full/max/0/default.jpg"
  },
  "fields": {
    "sex": {
      "ms_sex_llm_v1": "female"
    },
    "doctype": {
      "ms_doctype_v1": "form"
    },
    "form_title": {
      "ms_form_title_llm_v1": "BIOGRAPHIC INFORMATION, G-325 A ( (Rev. 10-1-82)"
    },
    "countries": {
      "ms_countries_nlp_v1": [
        "Mexico",
        "United States"
      ]
    },
    "years": {
      "ms_years_nlp_v1": [
        1917,
        1981,
        1987,
        2023,
        1926,
        1913,
        1967,
        1976
      ]
    },
    "g325a": {
      "occupation": {
        "occupation_llm_v1": "['n.a']"
      },
      "reason": {
        "reason_llm_v1": "NATURALIZATION"
      },
      "nationality": {
        "nationality_llm_v1": "Mexican"
      }
    }
  },
  "is_g325a": true,
  "is_cert_naturalization": false,
  "full_text": "U.S. Department of Justice ScreeRM 325A 6/1/2023 OMB No. 1115-0066 Immigration and Naturalization Service BIOGRAPHIC INFORMATION DEC 01 1981 Approval expires 4-30-85 (Family name) (First name) (Middle name) MALE BIRTHDATE (Mo.-Day-Yr.) NATIONALITY FILE NUMBER Fernandez Felicitas Zavala KXFEMALE June 13, 1913 Mexican 28761853 ALL OTHER NAMES USED (Including names by previous marriages) CITY AND COUNTRY OF BIRTH SOCIAL SECURITY NO. None Zacatecas Mexico (If any) 571-86-3337 FAMILY NAME FIRST NAME DATE, CITY AND COUNTRY OF BIRTH(If known) CITY AND COUNTRY OF RESIDENCE FATHER Fernandez Victorio Zacatecas Mexico Decesed MOTHER (Maiden name) Zavala Carmen Zacatecas Mexico Decesed HUSBAND (If none, so state) FAMILY NAME FIRST NAME BIRTHDATE CITY & COUNTRY OF BIRTH DATE OF MARRIAGE PLACE OF MARRIAGE OR WIFE (For wife, give maiden name) for 40 years Common-law Duenez Martin Nov.5,1917 Durango Mexico common-law N/A FORMER HUSBANDS OR WIVES(if none,so state) FAMILY NAME (For wife. give maiden name) FIRST NAME BIRTHDATE DATE & PLACE OF MARRIAGE DATE AND PLACE OF TERMINATION OF MARRIAGE Hernandez Jose Unknown 1926 Mexico Deceased APPLICANT'S RESIDENCE LAST FIVE YEARS. LIST PRESENT ADDRESS FIRST. FROM TO STREET AND NUMBER CITY PROVINCE OR STATE COUNTRY MONTH YEAR MONTH YEAR 3814 1/2 Hammel St. L.A. California U.S.A. Dec. 1976 PRESENT TIME Record St. L.A. California U.S.A. May 1967 Nov. 1976 APPLICANT'S LAST ADDRESS OUTSIDE THE UNITED STATES OF MORE THAN ONE YEAR FROM TO STREET AND NUMBER CITY PROVINCE OR STATE COUNTRY MONTH YEAR MONTH YEAR Juan de Dios Pesa Ave. No.865BIS Tijuana Baja California Mexico APPLICANT'S EMPLOYMENT LAST FIVE YEARS. (IF NONE. so STATE.) LIST PRESENT EMPLOYMENT FIRST FROM TO FULL NAME AND ADDRESS OF EMPLOYER OCCUPATION SPECIFY MONTH YEAR MONTH YEAR PRESENT TIME Show below last occupation abroad if not shown above. (Include all information requested above.) THIS FORM IS SUBMITTED IN CONNECTION WITH APPLICATION FOR: SIGNATURE OF APPLICANT DATE NATURALIZATION STATUS AS PERMANENT RESIDENT OTHER (SPECIFY): Felositos Fernands IF YOUR NATIVE ALPHABET IS IN OTHER THAN ROMAN LETTERS WRITE YOUR NAME IN YOUR NATIVE ALPHABET IN THIS SPACE Are all copies legible? Yes PENALTIES: SEVERE PENALTIES ARE PROVIDED BY LAW FOR KNOWINGLY AND WILLFULLY FALSIFYING OR CONCEALING A MATERIAL FACT. APPLICANT: BE SURE TO PUT YOUR NAME AND ALIEN REGISTRATION NUMBER IN THE BOX OUTLINED BY HEAVY BORDER BELOW. COMPLETE THIS BOX (Family name) (Given name) (Middle name) (Alien registration number) FERNANDEZ FELICITAS A28161 853 LOS T/C # 249 (DATE) Form G-325 A (Rev. 10-1-82) (1) IDENT. DEC 01 1987"
}