{
  "anumber": "A28793184",
  "id": "A28793184_0016",
  "page_index": 16,
  "resources": {
    "full_jpg": "https://dctn4zjpwgdwdiiy5odjv7o2se0bqgjb.lambda-url.us-east-1.on.aws/iiif/3/og-2023-kc-nara_A28793184_0016/full/max/0/default.jpg"
  },
  "fields": {
    "sex": {
      "ms_sex_llm_v1": "female"
    },
    "doctype": {
      "ms_doctype_v1": "form"
    },
    "form_title": {
      "ms_form_title_llm_v1": "U.S. Department of Justice Immigration and Naturalization Service, G-325A"
    },
    "countries": {
      "ms_countries_nlp_v1": [
        "Mexico",
        "United States"
      ]
    },
    "years": {
      "ms_years_nlp_v1": [
        1987
      ]
    },
    "g325a": {
      "occupation": {
        "occupation_llm_v1": "['field worker - babysitter']"
      },
      "reason": {
        "reason_llm_v1": "YES"
      },
      "nationality": {
        "nationality_llm_v1": "MEXICAN"
      }
    }
  },
  "is_g325a": true,
  "is_cert_naturalization": false,
  "full_text": "U.S. Department of Justice FORM G-325A LOS OMB No. 1115-0066 Immigration and Naturalization Service BIOGRAPHIC INFORMATION IT/C: 249 NOV 27 1987 Approval expires 4-30-85 (DATE) (Family name) (First name) (Middle name) MALE BIRTHDATE (Mo.-Day-Yr.) NATIONALITY FILE NUMBER MONTESDEOCA, ANDREA FEMALE 11-04-01 MEXICANA 28793184 ALL OTHER NAMES USED (Including names by previous marriages) CITY AND COUNTRY OF BIRTH SOCIAL SECURITY NO. NONE PIHUAMO JALISCO MEX (If any) 552-63-6555 FAMILY NAME FIRST NAME DATE, CITY AND COUNTRY OF BIRTH (If known) CITY AND COUNTRY OF RESIDENCE los ANGELES FATHER OLIVERA, CAL.U.SA. MOTHER (Maiden name) MONTEDEOCA, PELiPA: PiHUAMO. JALISCO MEXiCO HUSBAND (If none, SO state) FAMILY NAME FIRST NAME BIRTHDATE CITY & COUNTRY OF BIRTH DATE OF MARRIAGE PLACE OF MARRIAGE OR (For wife, give maiden name) WIFE NONE FORMER HUSBANDS OR WIVES (if none, SO state) FAMILY NAME (For wife, give maiden name) FIRST NAME BIRTHDATE DATE & PLACE OF MARRIAGE DATE AND PLACE OF TERMINATION OF MARRIAGE NONE APPLICANT'S RESIDENCE LAST FIVE YEARS. LIST PRESENT ADDRESS FIRST. FROM TO STREET AND NUMBER CITY PROVINCE OR STATE COUNTRY MONTH YEAR MONTH YEAR 3100 STERRAST LIA CALIF MEXICO 6-77 77 PRESENT TIME Los ANGELES CAL 5 87 90031 APPLICANT'S LAST ADDRESS OUTSIDE THE UNITED STATES OF MORE THAN ONE YEAR FROM TO STREET AND NUMBER CITY PROVINCE OR STATE COUNTRY MONTH YEAR MONTH YEAR NONE. APPLICANT'S EMPLOYMENT LAST FIVE YEARS. (IF NONE, SO STATE.) LIST PRESENT EMPLOYMENT FIRST FROM TO FULL NAME AND ADDRESS OF EMPLOYER RETIRED OCCUPATION (SPECIFY) MONTH YEAR MONTH YEAR PRESENT TIME Show below last occupation abroad if not shown above. (Include all information requested above.) FiELD WORKER. BAbySiTTiNG THIS FORM IS SUBMITTED IN CONNECTION WITH APPLICATION FOR: SIGNATURE OF APPLICANT DATE NATURALIZATION STATUS AS PERMANENT RESIDENT OTHER (SPECIFY): X 05-14-87 IF YOUR NATIVE ALPHABET IS IN OTHER THAN ROMAN LETTERS, WRITE YOUR NAME IN YOUR NATIVE ALPHABET IN THIS SPACE: Are all copies legible? Yes ANDRE MONTEDEOCA, PENALTIES: SEVERE PENALTIES ARE PROVIDED BY LAW FOR KNOWINGLY AND WILLFULLY FALSIFYING OR CONCEALING A MATERIAL FACT. APPLICANT: BE SURE TO PUT YOUR NAME AND ALIEN REGISTRATION NUMBER IN THE BOX OUTLINED BY HEAVY BORDER BELOW. COMPLETE THIS BOX (Family name) (Given name) (Middle name) (Alien registration number) A287931841 LOS IT/C: 249 NOV ? (DATE) Form G-325 A (Rev. 10-1-82) (1) IDENT."
}