{
  "anumber": "A28729371",
  "id": "A28729371_0026",
  "page_index": 26,
  "resources": {
    "full_jpg": "https://dctn4zjpwgdwdiiy5odjv7o2se0bqgjb.lambda-url.us-east-1.on.aws/iiif/3/og-2023-kc-nara_A28729371_0026/full/max/0/default.jpg"
  },
  "fields": {
    "sex": {
      "ms_sex_llm_v1": "female"
    },
    "doctype": {
      "ms_doctype_v1": "form"
    },
    "form_title": {
      "ms_form_title_llm_v1": "Petition for Alien Relative, Form I-130 ( (Rev. 06-23-86) Y"
    },
    "countries": {
      "ms_countries_nlp_v1": [
        "Nicaragua"
      ]
    },
    "years": {
      "ms_years_nlp_v1": [
        1988,
        2023
      ]
    }
  },
  "is_g325a": false,
  "is_cert_naturalization": false,
  "full_text": "Screened by NARA, 7/20/2023 U.S. Department of Justice OMB No. 1115-0054 Immigration and Naturalization Service (IN' Petition for Alien Re'otive DO NOT WRITE IN THIS BLOCK Case ID# Action Stamp Fee Stamp A# 28 729 3711 PPROVED CHRISTON G-28 or Volag# DEC 12 1988 12/24/87 130405 10 05.00 Section of Law: Petition was filed on EMPL (priority date) 201 (b) spouse 203 (a)(1) 22 12/24/87 201 (b) child 203 (a)(2) M. Kelland Personal Interview Previously Forwarded 10012 708:31 201 (b) parent 203 (a)(4) Document Check Stateside Criteria 203 (a)(5) o's 2879 Field Investigations I-485 Simultaneously AM CON: REMARKS: A. Relationship 1. The alien relative is my: 2. Are you related by adoption? Husband/Wife Parent Brother/Sister Child Yes No B. Information about you C. Information about your alien relative 1. Name (Family name in CAPS) (First) (Middle) 1. Name (Family name in CAPS) (First) (Middle) SANCHEZ ARMANDO SANCHEZ - Zepeda FRANCISCA 2. Address (Number and Street) (Apartment Number) 2. Address (Number and Street) (Apartment Number) 13632 Fanshaw Ave., 7602 San Vicente AVe., (Town or City) (State/Country) (ZIP/Postal Code) (Town or City) (State/Country) (ZIP/Postal Code) Paramount, California 90723 Paramount, California 90723 3. Place of Birth (Town or City) (State/Country) 3. Place of Birth (Town or City) (State/Country) Nagarote, Leon Nicaragua Nagarote, Leon, Nicaragua 4. Date of Birth 5. Sex 6. Marital Status 4. Date of Birth 5. Sex 6. Marital Status (Mo/Day/Yr) (Mo/Day/Yr) Male Married Single Male Married Single 03-30-32 Female Widowed Divorced 10-4-12 Female Widowed Divorced 7. Other Names Used (including maiden name) 7. Other Names Used (including maiden name) Armando Juan Sanchez Munguia Francisca Zepeda Sanchez 8. Date and Place of Present Marriage (if married) 8. Date and Place of Present Marriage (if married) 02-15-63 Nicaragua None 9. Social Security Number 10. Alien Registration Number (if any) 9. Social Security Number 10. Alien Registration Number (if any) FOIA (b)(6) FOIA (b)(6) A28729371 11. Names of Prior Husbands/Wives 12. Date(s) Marriage(s) Ended 11. Names of Prior Husbands/Wives 12. Date(s) Marriage(s) Ended None None n Name changed by decree of Court from SANCHEZ, JUAN ARMANDO 13. If you are a U.S. citizen, complete the following: 13. Has your relative ever been in the U.S.? My citizenship was acquired through (check one) Yes No Birth in the U.S. 14. If your relative is currently in the U.S., complete the following: Naturalization He or she last arrived as a (visitor, student. exchange alien, crewman, Give number of certificate, date and place it was issued stowaway, temporary worker, without inspection, etc.) seen 12940314 7/10/87 LOS Angeles, Ca. B-2 Parents Pet80676850 correct CODY Arrival/Departure Record (1-94) Number Date arrived (Month/Day/Year) Have you obtained a certificate of citizenship in your own name? 434626714 Yes No 03-09-74 If \"Yes\", give number of certificate date and place it was issued Date authorized stay expired, or will expire as shown on Form I-94 or I-95 Expired 15. Name and address of present employer (if any) 14. If you are a lawful permanent resident alien, complete the following. None Date and place of admission for, or adjustment to, lawful permanent Date this employment began (month/day/year) residence: None INITIAL RECEIPT RESUBMITTED RELOCATED COMPLETED Rec'd Sent Approved Denied Returned Form I-130 (Rev. 06-23-86) Y"
}