{
  "anumber": "A28743491",
  "id": "A28743491_0007",
  "page_index": 7,
  "resources": {
    "full_jpg": "https://dctn4zjpwgdwdiiy5odjv7o2se0bqgjb.lambda-url.us-east-1.on.aws/iiif/3/og-2023-kc-nara_A28743491_0007/full/max/0/default.jpg"
  },
  "fields": {
    "sex": {
      "ms_sex_llm_v1": "male"
    },
    "doctype": {
      "ms_doctype_v1": "form"
    },
    "form_title": {
      "ms_form_title_llm_v1": "Application for Naturalization"
    },
    "countries": {
      "ms_countries_nlp_v1": [
        "Pakistan",
        "United States",
        "India"
      ]
    },
    "years": {
      "ms_years_nlp_v1": [
        1897,
        2023,
        1988,
        1997
      ]
    }
  },
  "is_g325a": false,
  "is_cert_naturalization": false,
  "full_text": "Screened by NARA, 8/23/2023 U.S. Department of Justice OMB #1115-0009 Immigration and Naturalization Se Application for Naturalization START HERE - Please Type or Print FOR INS USE ONLY Part 1. Information about you. 1 Returned Family Given Middle Name SINGH Name JASWANT Initial U.S. Mailing Address - Care of Resubmitted Street Number Apt. and Name 1206, FOX GLOVE CT. # 1206 City GLENDORA County L.A. State ZIP CALIFORNIA Code 91741 Reloc Sent Date of Birth Country (month/day/year) APRIL 17H,1897 of Birth INDIA NOW PAKISTAN Social A Security # 557-59-5638 28743491 Reloc Rec'd Part 2. Basis for Eligibility (check one). a. Thave been a permanent resident for at least live (5) years b. I have been a permanent resident for at least three (3) years and have been married to a United States Citizen for those three years. Applicant C. I am a permanent resident child of United States citizen parent(s) and have attached completed Forms N-426 and G-325B 02/08/14 Interviewed d. I am applying on the basis of qualifying military service in the Armed Forces of the U.S. F.H. e. Other. (Please specify section of law) At interview 12117 Part 3. Additional information about you. request naturalization ceremony at court resident (month/day/year) Date you became a neumahent 15-885 Port admitted with an immmigrant visa or INS Office where granted adjustment of status. 30TH JUNE 1988 6-59808 Remarks 3169 ARC/SIR LOS ANGELES IRO Citizenship INDIA Name on alien registration card (if different than in Part 1) same ib Other names used since you became a permanent resident (including maiden name) non over 75-ys Sex Male Height Marital Status: 5' 4/ Single Divorced Female 11/20/96 Married Widowed Can you speak, read and write English ? Yes. NO FD258 An 1/18/96 No Action Absences from the U.S.: APPROVED INS DISTRICT DIRECTOR Have you been absent from the U.S. since becoming a permanent resident? No Yes If you answered \"Yes\" , complete the following, Begin with your most recent absence If you need more room to explain the reason for an absence or to list more trips, continue on separate AUG 0 8 1997 paper. Recommended by+ build Did absence last Date left U.S. Date returned 6 months or more? Destination Reason for trip LOS 4740 19THMAY199 6-91 Yes No NEW DELHI TO VISIT FAMILY Yes No others To Be Completed by 2 Attorney or Representative, if any Yes No Fill in box if G-28 is attached to represent the applicant Yes No VOLAG# Yes No Yes No ATTY State License # Form N-400 (Rev 07/17/91)N Continued on back."
}