{
  "anumber": "A29253711",
  "id": "A29253711_0023",
  "page_index": 23,
  "resources": {
    "full_jpg": "https://dctn4zjpwgdwdiiy5odjv7o2se0bqgjb.lambda-url.us-east-1.on.aws/iiif/3/og-2023-kc-nara_A29253711_0023/full/max/0/default.jpg"
  },
  "fields": {
    "sex": {
      "ms_sex_llm_v1": "female"
    },
    "doctype": {
      "ms_doctype_v1": "form"
    },
    "form_title": {
      "ms_form_title_llm_v1": "RECORD OF DEPORTABLE ALIEN"
    },
    "countries": {
      "ms_countries_nlp_v1": [
        "Honduras",
        "Mexico",
        "United States"
      ]
    },
    "years": {
      "ms_years_nlp_v1": [
        2023
      ]
    }
  },
  "is_g325a": false,
  "is_cert_naturalization": false,
  "full_text": "Screened by NARA, 6/1/2023 RECORD OF DEPORTABLE ALIEN (See A.M. - 2790.31 - 34 for Instructions) Family Name (Capital Letters) Given Name Middle Name Sex Hair Eyes Complexion RODRIGUEZ-SANCHEZ HERMINIA F GREY brn LIGHT Country of Citizenship Passport Number and Country of Issue File Number Height Weight Occupation HONDURAS A29253711 58' 150 RETIRED U.S. Address (Residence) (Number) (Street) (City) (State) (Zip Code) Scars or Marks tip of right little NONE finger is amputated Date, Place, Time, Manner of Last Entry 09-30-88, 5 MILES WEST Passenger Boarded At F.B.I. No. Marital Status Widow(er) Single Married SYS, POE. 1900 HRS ; EWI, A FOOT Separated Divorced Number, Street, City, Province (State) and Country of Permanent Residence BARRIO SANTANITA 1011 Method XXXXX Apprehension AVENIDA, CASA #1090, HONDURAS BORDER PATROL/LINEWATCH Birthdate Date of Action Location Code Near) Date & Hour 07-04-12 (76) 09-30-88 SDC/IMB SAN YSIDRO 09-30-88 2000Hrs. City, Province (State) and Country of Birth AR Form: (Type & No.) Lifted By SAN LUCAS, HONDURAS Not Lifted WELSH Visa Issued -NIV No. Social Security Account Name Status at Entry Status When Found N/A N/A EWI IN TRAVEL Date Visa Issued Social Security No. Send C.O. Rec. Check Length of Time Illegally in U.S. To: N/A N/A AT ENTRY Immigration Record Criminal Record CLAIMS NONE CLAIMS NONE Name, Address, and Nationality of Spouse (Maiden Name, if appropriate) Number & Nationality of minor Children BRIJIDIO BORJAS, HONDURAS, (DECEASED) N/A Father's Name, and Nationality and Address, if Known Mother's Present and Maiden Names, Nationality, and Address, if Known CORNELIO RODRIGUEZ, HONDURAS, (DECEASED) CELESTINA SANCHEZ, HONDURAS, (DECEASED) Monies Due/Property in U.S. Not in Immediate Fingerprinted Lookout Book Checked Deportation Charge(s) (Code Words) Possession None Claimed See Form 1-43 Yes No Not Listed Listed, Code ROTEN Name and Address of (Last) (Current) U.S. Employer Type of Employment Salary From: To: N/A N/A 8809-1394 $ hr. N/A Narrative (Outline particulars under which alien located/apprehended. Include details, not shown above, re time, place, manner of last entry, and elements which establish ad- ministrative and/or criminal violation. Indicate means and route of travel to interior) Alien has been advised of communication privileges pursuant to 8 CFR 242.2(e). Initial jec Date 09-30-88 MONEY NONE BAGGAGE: LARGE PURSE Subject Herminia RODRIGUEZ-Sanchez openely admits to being a citizen and native of Honduras illegally in the United States. Subject also admits to have entered the United States at a place not designated as a Port of Entry, thereby evading inspection by Immigration Officers on 09-30-88, about 5 miles west of the San Ysidro Port of Entry. Subject claims that she left San Pedro Sola Honduras, with her grandson FOIA (b)(6) and traveled by commercial busline until reaching Tijuana B.C. Mexico 09-29-88. Subject claims to have entered into Mexico illegally without a passport or permit. Subject claims that no arrangements were made with anyone to be smuggled into the United States and that her sole purpose in coming to the United States was to give her grandson a better life. Subject intended to reside with her grandaughter who resides in Los Angelas California. Subject had in her possession a telephone number where she was to contact her grandaughter FOIA (b)(6) the residence address is unknown. RC.CONTINJER) (If space insufficient, she and reyerse, from bottom up): (Signature and Title) DISTRIBUTION Received (subject and documents) (report of interview) from WA/ose Officer: J.E. COLLINS 09-30 88 SYS 10 P 19 at M. Disposition dep proc (Receiving Officer) An Form 1-213 (Rev. 4-16-79)Y UNITED STATES DEPARTMENT OF JUSTICE Immigration and Naturalization Service"
}