{
  "anumber": "A29338098",
  "id": "A29338098_0003",
  "page_index": 3,
  "resources": {
    "full_jpg": "https://dctn4zjpwgdwdiiy5odjv7o2se0bqgjb.lambda-url.us-east-1.on.aws/iiif/3/og-2023-kc-nara_A29338098_0003/full/max/0/default.jpg"
  },
  "fields": {
    "sex": {
      "ms_sex_llm_v1": "female"
    },
    "doctype": {
      "ms_doctype_v1": "form"
    },
    "form_title": {
      "ms_form_title_llm_v1": "Application for Permanent Residence"
    },
    "countries": {
      "ms_countries_nlp_v1": [
        "Haiti"
      ]
    },
    "years": {
      "ms_years_nlp_v1": [
        1990,
        1989,
        1998,
        2023,
        1902
      ]
    }
  },
  "is_g325a": false,
  "is_cert_naturalization": false,
  "full_text": "Screened by NARA, 7/28/2023 U.S. Department of Justice Immigration and Naturalization Service (INS) Application for Permanent Residence OMB # 1115-0053 DO NOT WRITE IN THIS BLOCK Case ID# Action Stamp Fee Stamp A# APPROVED 2829303111 I.N.S DISTRICT DIRECTOR G-28 or Volag# JAN 05 1990 Section of Law Eligibility Under Sec. 245 Sec. 209(b). INA Approved Visa Petition District RECEIVED APR1989 CASHIER MIA-IER FLA OFFICE SCHOOL Sec. 214(d). INA Recommended by: Dependent of Principal Alien Sec. 13, Act of 9/11/57 MIA Special Immigrant Sec. 245, INA Other Sec. 249, INA Country Chargeable Preference A. Reason for this application PERICOMPUTER I am applying for lawful permanent residence for the following reason: (check the box that applies) 1. An immigrant visa number is immediately available to me because NR X100 A visa petition has already been approved for me (approval notice is attached) A visa petition is being filed with this application APR 2 8 1989 2. I entered as the flance(e) of a U.S. citizen and married within 90 days (approval notice and marriage certificate are attached) MD 3. I am an asylee eligible for adjustment 4. Other: B. Information about you 1. Name (Family name in CAPS) (First) (Middle) 11. On what date did you last enter the U.S.? REMY ROZAIRe Oct. 6 1998 2. Address (Number and Street) (Apartment Number) 12. Where did you last enter the U.S.? (City and State) 1795 N.W illsheet House MIAMI FLa (Town or City) (State/Country) (ZIP/Postal Code) 13. What means of travel did you use? (Plane) car, etc.) MIAMI FLa. 33167 Plane Q 3. Place of Birth (Town or City) (State/Country) 14. Were you inspected by a U.S. immigration officer? HAiti Yes No 4. Date of Birth 5. Sex 6. Marital Status 15. In what status did you last enter the U.S.? (Mo/Day/Yr) 03/23/1902 Male Married Single (Visitor student, exchange alien, crewman, temporary worker, without inspection, etc.) Female Widowed Divorced B-2 7. Social Security Number 8. Alien Registration Number (if any) 16. Give your name EXACTLY as It appears on your Arrival/Departure NoNe A2700333 098 Record (Form I-94). 9. Country of Citizenship REMY ROZAIRe HAITI 17. Arrival/Departure Record (1-94) Number 18. Visa Number 10. Have you ever applied for permanent resident status in the U.S.? Yes No 800 00199931 184061 (If Yes, give the date and place of filing and final disposition) 19. At what Consulate was your nonimmigrant visa issued? Date PORT-AU-PRINCE, ,HAITI (Mo/Day/Yr) 6/14/24 20. Have you ever been married before? Yes No If Yes, (Names of prior husbands/wives) (Country of citizenship) (Date marriage ended) HAITI N/A 21. Has your husband/wife ever been married before? Yes No If Yes. (Names of prior husbands/wives) (Country of citizenship) (Date marriage ended) N/A HAiTI N/A #187 EMPLOYMENT AUTHORIZED THRU 2 1990 MIA M. Dan INITIAL RECEIPT RESUBMITTED RELOCATED COMPLETED Rec'd Sent Approved Denied Returned MD FORM I-485 (REV. 2-27-87)N"
}