{
  "anumber": "A34590015",
  "id": "A34590015_0004",
  "page_index": 4,
  "resources": {
    "full_jpg": "https://dctn4zjpwgdwdiiy5odjv7o2se0bqgjb.lambda-url.us-east-1.on.aws/iiif/3/og-2023-kc-nara_A34590015_0004/full/max/0/default.jpg"
  },
  "fields": {
    "sex": {
      "ms_sex_llm_v1": "female"
    },
    "doctype": {
      "ms_doctype_v1": "form"
    },
    "form_title": {
      "ms_form_title_llm_v1": "Certificate Preparation Sheet and Oath Declaration"
    },
    "countries": {
      "ms_countries_nlp_v1": [
        "Mexico",
        "United States"
      ]
    },
    "years": {
      "ms_years_nlp_v1": [
        2023
      ]
    }
  },
  "is_g325a": false,
  "is_cert_naturalization": false,
  "full_text": "Screened by NARA, 6/1/2023 U.S. Department of Justice Immigration and Naturalization Service Certificate Preparation Sheet and Oath Declaration A# 034590 015 Daytime Phone # 805 487 8281 NAME (If name Change, ENTER new Name): Check BOX if there is a change of name: Maria (FIRST) Isabel (MIDDLE) CaraccE de Rocha (LAST) (Check Sex) MALE: Date of birth: 02/08914 FEMALE: Month Day Complete Year Height: 45 Marital Status; ENTER \"S\" Single, \"M\" Married, \"D\" Divorced, or \"W\" Widow (er): M (Feet) (inches) Country of Former Nationality: mexico (Enter Actual Name of Country) Oath of Allegiance I HEREBY DECLARE, on oath, that I absolutely and entirely renounce and abjure all allegiance and fidelity to any foreign prince, potentate, state, or sovereignty, of whom or which I have heretofore been a subject or citizen; that I will support and defend the Constitution and laws of the United States of America against all enemies, foreign and domestic; that I will bear truth faith and allegiance to the same; that I will bear arms on behalf of the United States when required by the law; that I will perform noncombatant service in the Armed Forces of the United States when required by the law; that I will perform work of national importance under civilian direction when required by the law; and that I take this obligation freely, without any mental reservation or purpose of evasion; so HELP ME GOD. In acknowledgement whereof I have hereunto affixed my signature. X / 12/21/99 Applicant's Signature (name change) Date Form N-649 (Rev. 11/1/98)N"
}