{
  "anumber": "A39228199",
  "id": "A39228199_0029",
  "page_index": 29,
  "resources": {
    "full_jpg": "https://dctn4zjpwgdwdiiy5odjv7o2se0bqgjb.lambda-url.us-east-1.on.aws/iiif/3/og-2023-kc-nara_A39228199_0029/full/max/0/default.jpg"
  },
  "fields": {
    "sex": {
      "ms_sex_llm_v1": "male"
    },
    "doctype": {
      "ms_doctype_v1": "letter"
    },
    "form_title": {
      "ms_form_title_llm_v1": "Affidavit of Support"
    },
    "countries": {
      "ms_countries_nlp_v1": [
        "United States"
      ]
    },
    "years": {
      "ms_years_nlp_v1": [
        1937,
        2023,
        1964
      ]
    }
  },
  "is_g325a": false,
  "is_cert_naturalization": false,
  "full_text": "Sreened by NARA, 9/25/2023 UNITED STATES DEPARTMENT OF JUSTICE Form approved Immigration and Naturalization Service OMB No. 43-R423 AFFIDAVIT OF SUPPORT (ANSWER ALL ITEMS; FILL IN WITH TYPEWRITER OR PRINT IN BLOCK LETTERS IN INK.) I, David LIU (Shi-yun) , residing at 2519 Saltbush Ct. Palmdale, (Name) (Street and Number) Ca 93550 U.S.A. (City) (State) (ZIP Code if in U.S.) (Country) BEING DULY SWORN DEPOSE AND SAY: 1. I was born on Oct. 21, 1937 at Canton, China (Date) (City) (Country) If you are not a native born United States citizen, answer the following as appropriate: a. If a United States citizen through naturalization, give certificate of naturalization number I.0534845 10/15/176 L.A. b. If a United States citizen through parent(s) or marriage, give citizenship certificate number c. If United States citizenship was derived by some other method, attach a statement of explanation. d. If a lawfully admitted permanent resident of the United States, give 'A' number 2. That I am 47 years of age and have resided in the United States since (date) 9/1964 3. That this affidavit is executed in behalf of the following person: Chi LIU Male 70 (Name) (Sex) (Age) Republic of China Married Father (Citizen of - Country) (Marital Status) (Relationship to Deponent) 3/F-2, 135, sec. 1, Hsin-Hai Rd. , Taipei, Taiwan Republic of China (Presently resides at - Street and Number) (City) (State) (Country) 4. That this affidavit is made by me for the purpose of assuring the United States Government that the person named in item 3 will not become a public charge in the United States. 5. That I am willing and able to receive, maintain and support the person named in item 3. That I am ready and willing to deposit a bond, if necessary, to guarantee that such person will not become 2 public charge during his or her stay in the United States, or to guarantee that the above named will maintain his or her nonimmigrant status if admitted temporarily and will depart prior to the expiration of his or her authorized stay in the United States. 6. That I understand this affidavit will be binding upon me for a period of three (3) years after entry of the person named in item 3 and that the information and documenation provided by me may be made available to the Secretary of Health and Human Services. 7. That I am employed as, or engaged in the business of teacher with A.V. Union High Sch Dist. (Type of business) (Name of concern) at Lancaster, Ca 93534 (Street and Number) (City) (State) (ZIP Code) I derive an annual income of (if self-employed, I have attached a copy of my last income tax return or report of commercial rating concern which I certify to be true and correct to the best of my knowledge and belief. See instruction for nature of evidence of net worth to be submitted.) $ 31,758.00 I have on deposit in savings banks in the United States $ 7,088 I have other personal property, the reasonable value of which is $ 15,000 I have stocks and bonds with the following market value, as indicated on the attached list which I certify to be true and correct to the best of my knowledge and belief. $ 5,000 I have life insurance in the sum of $ 100,000 With a cash surrender value of $ 0 I own real estate valued at $ 125,000 With mortgages or other encumbrances thereon amounting to $ 84,000 Which is located at 2519 Saltbush Ct. Palmdale, Ca 93550 (Street and number) (City) (State) (ZIP Code) Form I-134 (Rev. 9-30-80) N"
}