{
  "anumber": "A40040848",
  "id": "A40040848_0007",
  "page_index": 7,
  "resources": {
    "full_jpg": "https://dctn4zjpwgdwdiiy5odjv7o2se0bqgjb.lambda-url.us-east-1.on.aws/iiif/3/og-2023-kc-nara_A40040848_0007/full/max/0/default.jpg"
  },
  "fields": {
    "sex": {
      "ms_sex_llm_v1": "female"
    },
    "doctype": {
      "ms_doctype_v1": "form"
    },
    "form_title": {
      "ms_form_title_llm_v1": "Petition for Naturalization"
    },
    "countries": {
      "ms_countries_nlp_v1": [
        "China",
        "United States"
      ]
    },
    "years": {
      "ms_years_nlp_v1": [
        1989,
        2023,
        1909,
        1987
      ]
    }
  },
  "is_g325a": false,
  "is_cert_naturalization": false,
  "full_text": "Screened by NARA, 9/25/2023 U.S. Department of Justice Application Petition for Naturalization to File OMB 6/3/92 #1115-0009 Immigration and Naturalization Service by 40 40.00 This block for government use only. Please read the instructions before filling out this form. Section of Law 3/6/20 1. Your name (Exactly as it appears on your Alien Registration Receipt Card) 15. Place you were admitted for permanent residency (City and State) SHEN, Yu Ling Los Angeles, California 2. Your Alien Registration Number 3. Your Social Security Number 16. Date your continuous residency began in the U.S. (Month/Day/Year) A40040848 558-95-0487 May 29, 1987 4. Your name (Full true and correct name, if different from above) 17. How long have you continuously resided in the State where you now live? Number of Months) 60 months 5. Any other names you have used (Including maiden) 18. Do you intend to reside permanently in the United States? SHEN ing, SHEN Lin (If No, explain fully) Yes No 6. You may, by law, change your name at the time you are naturalized. If you wish to do so, please print or type that name below, or the name you want your certificate of naturalization issued under. 7. Your date of birth (Month/Day/Year) 8. Your Sex Feb. 12, 1909 Male Female 9. Your place of birth (City or Town) 19. Have you served in the United States Armed Forces? Jiangvin (If Yes, complete all of #19.) Yes No (County, Province or State) (Country) Branch of Service (Indicate if Reserve or National Guard) Jiangsu China Inducted Enlisted 10. Was your father or mother ever a United States citizen? Location where you entered (City and State) (If Yes, explain fully) Yes No Service began (Month/Day/Year) Service ended (Month/Day/Year) 11. Can you read and write English? Service number Yes No 12. Can you speak English? Rank at discharge Yes No 13. Can you sign your name in English Type of discharge Yes No 14. Date you were admitted for permanent residency (Month/Day/Year) Reason for discharge (Alienage, conscientious objector, other) May 29, 1987 20. At what addresses in the United States have you lived during the last 5 years? List present address first Street Address City, county and State From (Month/Day/Year) To (Month/Day/Year) Monterey Park 1701 South McPherrin Avenue Los Angeles, California Sep. 24, 1989 Present Monterey Park 1370 Sunnyslope Drive Los Angeles, California May 29, 1987 Sep. 24, 1989 21. What employment have you held during the last 5 years? List present or most recent employment first. (If none, write \"None\".) Name and Address of Employer Occupation or Type of Business From (Month/Day/Year) To (Month/Day/Year) None Not December letter SSI R Form N-400 (10/26/89) N"
}