{
  "anumber": "A40040848",
  "id": "A40040848_0004",
  "page_index": 4,
  "resources": {
    "full_jpg": "https://dctn4zjpwgdwdiiy5odjv7o2se0bqgjb.lambda-url.us-east-1.on.aws/iiif/3/og-2023-kc-nara_A40040848_0004/full/max/0/default.jpg"
  },
  "fields": {
    "sex": {
      "ms_sex_llm_v1": "male"
    },
    "doctype": {
      "ms_doctype_v1": "form"
    },
    "form_title": {
      "ms_form_title_llm_v1": "Title: U.S. Department of Justice, Immigration and Naturalization Service\\nForm Number: G-325 ( (Rev. 10-1-82) Y"
    },
    "countries": {
      "ms_countries_nlp_v1": [
        "China",
        "United States"
      ]
    },
    "years": {
      "ms_years_nlp_v1": [
        1888,
        1958,
        1988,
        1874,
        1989,
        1982,
        1987,
        1986,
        1992,
        2023,
        1909,
        1913,
        1991,
        1939
      ]
    },
    "g325a": {
      "occupation": {
        "occupation_llm_v1": "['marine supply co.', ' owner']"
      },
      "reason": {
        "reason_llm_v1": "NATURALIZATION"
      },
      "nationality": {
        "nationality_llm_v1": "Chinese"
      }
    }
  },
  "is_g325a": true,
  "is_cert_naturalization": false,
  "full_text": "Screened by NARA, 9/25/2023 U.S. Department of Justice OMB No. 1115-0066 Immigration and Naturalization Service BIOGRAPHIC INFORMATION (Family name) (First name) (Middle name) MALE BIRTHDATE (Mo.-Day-Yr.) NATIONALITY FILE NUMBER SHEN Yu Ling FEMALE Feb. 12, 1909 Chinese A40040848 ALL OTHER NAMES USED (Including names by previous marriages) CITY AND COUNTRY OF BIRTH SOCIAL SECURITY NO. SHEN Ling, SHEN Lin Jiangyin, Jiangsu, China (If any) 558-95-0487 FAMILY NAME FIRST NAME DATE, CITY AND COUNTRY OF BIRTH (If known) CITY AND COUNTRY OF RESIDENCE. FATHER SHEN Zhen-jia Oct. 1874 Jiangyin, China Deceased MOTHER (Maiden name) JIN Shi May 1888 Jiangyin, China Deceased HUSBAND (If none, so state) FAMILY NAME FIRST NAME BIRTHDATE CITY & COUNTRY OF BIRTH DATE OF MARRIAGE PLACE OF MARRIAGE OR (For wife, give maiden name) WIFE None FORMER HUSBANDS OR WIVES (if none, so state) FAMILY NAME (For wife, give maiden name) FIRST NAME BIRTHDATE DATE & PLACE OF MARRIAGE DATE AND PLACE OF TERMINATION OF MARRIAGE CHIANG Shi-ying 5-13-1913 2-15-1939 China 4-19-1991 Los Angeles (Deceased) APPLICANT'S RESIDENCE LAST FIVE YEARS. LIST PRESENT ADDRESS FIRST. FROM TO STREET AND NUMBER CITY PROVINCE OR STATE COUNTRY MONTH YEAR MONTH YEAR 1701 South McPherrin Avenue Monterey Park California U.S.A. Sep. 1989 PRESENT TIME 70 Tin Hau Temple Road #407 Hong Kong Mar. 1989 Sep. 1989 1370 Sunnyslope Drive Monterey Park California U.S.A. Jun. 1988 Mar. 1989 70 Tin Hau Temple Road #407 Hong Kong Dec. 1987 Jun. 1988 1370 Sunnyslope Drive Monterey Park California U.S.A. May 1987 Dec. 1987 APPLICANT'S LAST ADDRESS OUTSIDE THE UNITED STATES OF MORE THAN ONE YEAR FROM TO STREET AND NUMBER CITY PROVINCE OR STATE COUNTRY MONTH YEAR MONTH YEAR 70 Tin Hau Temple Road #407 Hong Kong Aug. 1982 May 1987 APPLICANT'S EMPLOYMENT LAST FIVE YEARS. (IF NONE, so STATE) LIST PRESENT EMPLOYMENT FIRST FROM TO FULL NAME AND ADDRESS OF EMPLOYER OCCUPATION (SPECIFY) MONTH YEAR MONTH YEAR None PRESENT TIME Show below last occupation abroad if not shown above. (Include all information requested above.) Marine Supply Co. 5 Prat Avenue 4/f1., Kowloon, Hong Kong Owner Aug. 1958 Dec. 1986 THIS FORM IS SUBMITTED IN CONNECTION WITH APPLICATION FOR: SIGNATURE OF APPLICANT NATURALIZATION OTHER (SPECIFY): Unshir DATE June 1, 1992 STATUS AS PERMANENT RESIDENT IF YOUR NATIVE ALPHABET IS IN OTHER THAN ROMAN LETTERS, WRITE YOUR NAME IN YOUR NATIVE ALPHABET IN THIS SPACE: Are all copies legible? Yes PENALTIES: SEVERE PENALTIES ARE PROVIDED BY LAW FOR KNOWINGLY AND WILLFULLY FALSIFYING OR CONCEALING A MATERIAL FACT. APPLICANT: BE SURE TO PUT YOUR NAME AND ALIEN REGISTRATION NUMBER IN THE BOX OUTLINED BY HEAVY BORDER BELOW. COMPLETE THIS BOX (Family name) (Given name) (Middle name) (Alien registration number) SHEN Yu Ling A40040848 Form G-325 (Rev. 10-1-82) Y (1) Ident."
}