{
  "anumber": "A40269175",
  "id": "A40269175_0002",
  "page_index": 2,
  "resources": {
    "full_jpg": "https://dctn4zjpwgdwdiiy5odjv7o2se0bqgjb.lambda-url.us-east-1.on.aws/iiif/3/og-2023-kc-nara_A40269175_0002/full/max/0/default.jpg"
  },
  "fields": {
    "sex": {
      "ms_sex_llm_v1": "female"
    },
    "doctype": {
      "ms_doctype_v1": "form"
    },
    "form_title": {
      "ms_form_title_llm_v1": "APPLICATION FOR IMMIGRANT VISA AND ALIEN REGISTRATION"
    },
    "countries": {
      "ms_countries_nlp_v1": [
        "United States"
      ]
    },
    "years": {
      "ms_years_nlp_v1": [
        1918,
        1906,
        1968
      ]
    }
  },
  "is_g325a": false,
  "is_cert_naturalization": false,
  "full_text": "creened by NARA, 8/22/202 OPTIONAL RM 230 (English/VICT namese) (Rev. 6-82) DEPT. OF ST. FROM APPROVED 50230-104 O.M.B. No. 1405-0015 APPLICATION FOR IMMIGRANT VISA AND ALIEN REGISTRATION DON XIN CHIEU-KHAN NHAP-CU V DANG-KY NGOAI-KIEU INSTRUCTIONS: This form must be filled out in DUPLICATE by typewriter, or if by hand in legible block letters. All questions must be answered, if applicable. Questions which are not applicable should be so marked. If there is insufficient room on the form, answer on separate sheets, in dupli- cate, using the same numbers as appear on the form. Attach the sheets to the forms. DO NOT SIGN this form until instructed to do so by the consular officer, The fee for filing this application for an immigrant visa is $25.00. The fee should be paid in United States dollars or local currency equivalent or by bank draft, when you appear before the consular officer. WARNING: Any false statement or concealment of a material fact may result in your permanent exclusion from the United States. Even though you should be admitted to the United States, a fraudulent entry could be grounds for your prosecution and/or deportation. LOI CHI DAN: Mâu don nay phai dien lam HAI BAN bang may chu, hay neu viet tay thi phai viet loi chu in cho ro dqc. Phai trà loi tat ca moi cau hoi, neu có the Câu não Khong tra loi duoc thi ghi N/A. Neu Khong du chô tren mau don thi tra loi tren giay phy, cung lam hai ban va ghi so thu tu nhu tren mau don. Dinh cac to phy Kem voi mau don. XIN DUNG KY TEN tren mau don truoc Khi duoc vien chuc lanh-su chi dan. Le phi nhan don xin chieu-Khan nhap- nay là 25 My-Kim. Phai trá bang My-Kim hay bang tien dia phuong theo hoi-xuat, hay bang ngan-phieu ngan-hang, Khi duong don ra trinh truoc vien chuc lanh-su. LOI CANH-CAO: Moi nguoi Khai man hay che dau su that CO the dua toi hau qua bi loai tru vinh-vien vao Hoa-Ky. Du cho co dude nhan vao Hoa-Ky roi, thi su nhap-canh gian-lan cung du truy-to hay bi truc-xuat, hay ca hai. 1. Family name Ho First name ten Middle name ten lót LUU THONG 2. Other names used or by which known (If married woman, give maiden name) Nhung ten Khac dude dung hay duoc nguoi ta goi (Neú là phu-n co chong thi xin ghi nhu-danh) NONE 3. Full name in native alphabet (If Roman letters not used) HQ va ten viet theo tho-ngú (Neú Khong dung loi chu La-Ma abc) NONE 4. Date of birth 5. Age 6. Place of birth (day) (Month) (year) Tuoi' (City or town) (Province) (Country) Ngay Thang nam 06 MAY DI (Thanh-phô hay thi-x) (Tinh) (Nuoc, Xii) 1906 KNANG TUNG CHINA 7. Nationality 8. Sex phai 9. Merital status tinh-trang gia-dinh quoc-tich Male Female Single (never married) doc-than nam nu' Married co vo'co chong Widowed VIETNAMESE góa V góa chong Divorced ly-di Separated I Ly-than Including my present marriage, I have been married times. 10. Occupation nghe-nghiep 11. Present address Dia -chi hien-tai \"RETIRED XA TAN Hoi HUYEN CAI LAY TREN LIANG 12. Name, address, date and place of birth of wife/husband (Give maiden name of wife) [Ten ho, dia-chi, ngay sinh, noi sinh cua v hay chong (Neu là V thi xin ghi nhú danh)] VO THI KHA (DOB: 1918) BEN TRE, DEAD iN 1968 Date and place of marriage (Ngay va noi lap hon-thu) 13. Names, addresses, dates and places of birth of all children (Ten ho, lia-chi, ngay sinh, noi sinh cua tât ca' các con cai) SEE AFFIDAVIT ATTACHED 14. Person(s) named in 12 and 13 who will accompany or follow me to the United States 15. Final address in the United States Dia-chi cudi'cung [(Nhung) ngdoi c6 Khai ten 8'muc 12 va 13 ma secung di hay se di sau duong don toi Hoa-Ky 82 SUMMERSTONE toi Hoa-Ky. SEE AFFIDAVIT IRVINE, CA. 92714 16. Person you intend to join (Give name, address, and relationship, if any) 17. Name and address of sponsoring person or organization Duong don có y-dinh (i 8' Voi ai (Xin cho ten, dia-chi, va lien-he neu co). (If different from 16) Ten va dia-chi cua nguoi hay co-quan bao-tro (neu' Khac voi ten ghi O'muc 16) ANDY LUU (SON) SEE No THIS FORM MAY BE OBTAINED GRATIS AT CONSULAR OFFICES OF THE, UNITED STATES OF AMERICA (MAU DON NAY CO THE LANH MIEN-PH TAI CAC LANH-SU QUAN HOA-KY) NSN. 7540-00-149-0919 Mâu in ra trudc day khong con xu dung duoc nua) Previous edition not usable"
}