{
  "anumber": "A41446957",
  "id": "A41446957_0010",
  "page_index": 10,
  "resources": {
    "full_jpg": "https://dctn4zjpwgdwdiiy5odjv7o2se0bqgjb.lambda-url.us-east-1.on.aws/iiif/3/og-2023-kc-nara_A41446957_0010/full/max/0/default.jpg"
  },
  "fields": {
    "sex": {
      "ms_sex_llm_v1": "female"
    },
    "doctype": {
      "ms_doctype_v1": "form"
    },
    "form_title": {
      "ms_form_title_llm_v1": "Processing Sheet"
    },
    "countries": {
      "ms_countries_nlp_v1": [
        "Honduras",
        "United States"
      ]
    },
    "years": {
      "ms_years_nlp_v1": [
        2023,
        1996
      ]
    }
  },
  "is_g325a": false,
  "is_cert_naturalization": false,
  "full_text": "Screened by NARA, 6/2/2023 U.S. Department of Justice Immigration and Naturalization Service PROCESSING SHEET File No: A 41446957 DESCRIPTION SECTION OF LAW Sex: Male Female 316(a) [ 325 Marital Status: Single [ ] Married Divorce Widow 319(a) 328 Height: Feet 5 Inches 3 319(b) 329 Nationality: Honduras 322 405 AUG 14 1996 FINAL ACTION INITIAL INTERVIEW: English NOV 12 1996 NO NO NO (Date) No 1 Denial: Date & Initials Speaks Reads Writes Understands Withdrawal: Date & Initials Government: OK 40 E.T.S. CASAS NAS I Oath Taken Certificate Issued: REEXAM: ACUTION or DOCUMENTS REQUIRED (Date and Initials) See Attached N-14b Reexamination DOCUMENTS PRESENTED Visa File Post Audit A.R.C. : 41446957 Other: D.O.B. : 072715 P.O.E. : LOS C.O.A.: IR5 COMMENTS D.O.E. : 112688 CID/CDL : A8362285 UNE - could not put under OATH. not Recommendation RX APPROVAL (STAMP) FINAL HEARING 50/20 or 55/15. DATE TIME Attorney Waiver Executed. If Attorney Present, List Name: Months Residence OK [ Fingerprints NEG. 40 Nazi Negative Day-Time Phone: ( ) - - Ext OATH OF ALLEGIANCE Name Change: Modified Oath: Delete Part(s): Promise to Bear Arms, Noncombat Duty OATH WITH U.S. DISTRICT COURT: 246 I HEREBY DECLARE, on oath. That I absolutely and entirely renounce and abjure all allegiance and fidelity to any foreign prince, potentate, state, or sovereignty of whom or which I have heretofore been a subject or citizen; That I will support and defend the Constitution and the laws of the United States of America against all enemies, foreign and domestic; that I will bear true faith and allegiance to the same; that I will bear arms on behalf of the United States when required by the law; that I will perform noncombatant service in the Armed Forces of the United States when required by the law, that I will perform work of national importance under civilian direction when required by the law; and that I take this obligation freely, without any mental reservation or purpose of evasion; so HELP ME God. In acknowledgment whereof I have hereunto officed my signature Form I-468 Signature:"
}