{
  "anumber": "A41488327",
  "id": "A41488327_0001",
  "page_index": 1,
  "resources": {
    "full_jpg": "https://dctn4zjpwgdwdiiy5odjv7o2se0bqgjb.lambda-url.us-east-1.on.aws/iiif/3/og-2023-kc-nara_A41488327_0001/full/max/0/default.jpg"
  },
  "fields": {
    "sex": {
      "ms_sex_llm_v1": "male"
    },
    "doctype": {
      "ms_doctype_v1": "form"
    },
    "form_title": {
      "ms_form_title_llm_v1": "APPLICATION FOR IMMIGRANT VISA AND ALIEN REGISTRATION"
    },
    "countries": {
      "ms_countries_nlp_v1": [
        "United States"
      ]
    },
    "years": {
      "ms_years_nlp_v1": [
        1912,
        2023,
        1940,
        1922,
        1944
      ]
    }
  },
  "is_g325a": false,
  "is_cert_naturalization": false,
  "full_text": "Screened by NARA, 8/15/2023 FORM APPROVED O.M.B. No. 1405-0015 OPTIONAL FORM 230 (English) (Rev. 6-82) OF STATE APPLICATION FOR IMMIGRANT VISA AND ALIEN REGISTRATION - 105 INSTRUCTIONS: This form must be filled out in DUPLICATE by typewriter, or if by hand in legible block letters. All questions must be answered, if applicable. Questions which are not applicable should be so marked. If there is insufficient room on the form, answer on separate sheets, in dupli- cate, using the same numbers as appear on the form. Attach the sheets to the forms. 00 NOT SIGN this form until instructed to do so by the consular officer. The fee for filing this application for an immigrant visa is $25.00. The fee should be paid in United States dollars or local currency equivalent or by bank draft, when you appear before the consular officer. WARNING: Any false statement or concealment of a material fact may result in your permanent exclusion from the United States. Even though you should be admitted to the United States, a fraudulent entry could be grounds for your prosecution and/or deportation. 1. Family name First name KASUBHAI Middle name EBRAHIM MOHAMEDALI 2. Other names used or by which known (If married woman, give maiden name) -NIL - 3. Full name in native alphabet (If Roman letters not used) 4. Date of birth 5. Age 6. Place of birth (Day) (Month) (Year) (City or town) (Province) (Country) 5 - 9 - 1912 76 SURAT - GUJARAT - INDIA. 7. Nationality 8. Sex 9. Marital status Male Female Single (never married) Married Widowed Divorced Separated INDIAN Including my present marriage, I have been married times. 10. Occupation 11. Present address 1604, MAZAGDAN TOWERS, RETIRED. MATHARPAKADI RD., MAZAGOAN, BOMBAY- 10, 12. Name, address, date and place of birth of wife/husbend (Give maiden name of wife) SUGRA HUSEINALI PALIDA- - PALIDA HOUSE, HAIDERALI KASSAMJ ST., SURAT. / 5-11-1922/ SURAT. Date and place of marriage YEAR 1940 - SURAT. 13. Names, addresses, dates and places of birth of all children (a) TAHER E. KASUBHAI - 7220, CANOGA PARK, DENNIS LANE, +1307/15-11-1941 SURAT. merid (b) NAFISA H. JHINA - 64,WODEHOUSE RD, COLASA, BOMBAY -4-1944/ SURAT. (c) JABIR E. KASUSHAI - 22487, E.BIRDS EYE DRIVE, DIAMOND BAR, 8.2.1948/ ISURA BOMBAY. married (d) FOIA (b)(6) 14. Person(s) named in 12 and 13 who will accompany or follow 15. Final address in the United States me to the United States MR. TAER. E. KASUBHAI my WIFE. 7220, DENNIS LANE, S46RA E. KASUBHAI CANOGA PARK CA-91307 16. Person you intend to join (Give name, address, and relationship, 17. Name and address of sponsoring person or organization (If if any) TAHER E. KASUBHAI, different from 16) 7220, DENNIS LANE, CANOGA PARK, SAME AS IN(16) CA 91307 / SON. 18. Personal description 19. Marks of identification (a) Color of hair (c) Height GREY 5 feet 3 inches SCAR NEAR EYE (b) Color of eyes (d) Complexion 20. Purpose in going to the United States BROWN WHEAT PERMANENT SETTLEMENT. 21. Length of intended stay (If permanently, so state) 22. Intended port of entry 23. Do you have a ticket to final destination? PERMANENTLY. LOS ANGELES. YES. THIS FORM MAY BE OBTAINED GRATIS AT CONSULAR OFFICES OF THE UNITED STATES OF AMERICA NSN 7540-00-149-0919 Previous edition not usable"
}