{
  "anumber": "A41804438",
  "id": "A41804438_0038",
  "page_index": 38,
  "resources": {
    "full_jpg": "https://dctn4zjpwgdwdiiy5odjv7o2se0bqgjb.lambda-url.us-east-1.on.aws/iiif/3/og-2023-kc-nara_A41804438_0038/full/max/0/default.jpg"
  },
  "fields": {
    "sex": {
      "ms_sex_llm_v1": "male"
    },
    "doctype": {
      "ms_doctype_v1": "form"
    },
    "form_title": {
      "ms_form_title_llm_v1": "Immigrant Visa and Alien Registration"
    },
    "countries": {
      "ms_countries_nlp_v1": [
        "Pakistan",
        "United States"
      ]
    },
    "years": {
      "ms_years_nlp_v1": [
        1997
      ]
    }
  },
  "is_g325a": false,
  "is_cert_naturalization": false,
  "full_text": "OPTIONAL FORM 155B (REV. 11-95) DEPT OF STATE NSN 7540-01-351-9176 50155-301 ONUVEDSTAVVESOFAMERICA 46480459 , , IMMIGRANT VISA AND ALIEN REGISTRATION 41804438 UPPALFamDHIAN SINGH (First Name) (Middle Name) AKA: SINGH, DHIAN 8 ACTION BY IMMIGRATION INSPECTOR THE IMMIGRANT NAMED ABOVE ARRIVED IN THE UNITED INELIGIBILITY FOR VISA WAIVED UNDER SECTION STATES VIA (Name of vessel or flight no. of arrival) Immigration H Naturalization Service CHICAGO: ILLINOIS - 545 ADMITTED A1 127 212(g)(2) (B) GENDER: MALE CITY AND COUNTRY OF BIRTH DAY-MO-YR OF BIRTH NOV 14 1997 RAWALPINDI, PAKISTAN 13JAN1906 CITY AND COUNTRY OF LAST RESIDENCE NATIONALITY ARC NEW DELHI, IND INDIAN CLASS TO 41.804438 MARITAL STATUS MOTHER'S FIRST NAME FATHER'S FIRST NAME WIDOWED BEY BHEJA FINAL ADDRESS ERUDEHPIPALOF & APT# IF APPLICABLE CITY, STATE, AND ZIP CODE IN THE UNITED STATES 1900 S WESTNEDGE AVENUE KALAMAZOO, MI 49008 SEC. 212(a)(5)(A) NOT REQUIRED OCCURRON RETIRED This visa is issued under Section 221 of the Immigration and Nationality Act, and upon the basis of the facts stated in the application. Possession of a visa does not entitle the bearer to enter the United States if at the time he seeks to enter he is found to be inadmissible. Upon arrival in the United States, it must be surrendered to a United States Immigration Officer. IMMIGRANT CLASSIFICATION EMBASSY CLASSIFICATIONSEMBOL AMERICAN NEW DELHI FOREIGN STADEAKISTANMITATION AT NWD199671902601 46480459 ISSUED ON 04 NOV 1997 (Month) (Year) Consular Officer of the United States of America THE VALIDITY OF THIS VISA EXPIRES MIDNIGHT AT THE END OF 05MAY1998 (Month) (Year) PASSPORT NO. -177823 OR OTHER TRAVEL DOCUMENTS (Describe) R-J FU, S- 220 UNITED STATES OF AMERICA Tariff No. 21 Fee Paid $ or Local Currency Equivalent IV-46,480,459 ACTION OF I.J. ACTION ON APPEAL U.S.P.H.S."
}