{
  "anumber": "A41804894",
  "id": "A41804894_0019",
  "page_index": 19,
  "resources": {
    "full_jpg": "https://dctn4zjpwgdwdiiy5odjv7o2se0bqgjb.lambda-url.us-east-1.on.aws/iiif/3/og-2023-kc-nara_A41804894_0019/full/max/0/default.jpg"
  },
  "fields": {
    "sex": {
      "ms_sex_llm_v1": "male"
    },
    "doctype": {
      "ms_doctype_v1": "form"
    },
    "form_title": {
      "ms_form_title_llm_v1": "APPLICATION FOR IMMIGRANT VISA AND ALIEN REGISTRATION"
    },
    "countries": {
      "ms_countries_nlp_v1": [
        "United States",
        "India"
      ]
    },
    "years": {
      "ms_years_nlp_v1": [
        1912,
        1923,
        1942,
        2023,
        1939
      ]
    }
  },
  "is_g325a": false,
  "is_cert_naturalization": false,
  "full_text": "Screened by NARA, 9/26/2023 FORM APPROVED O.M.B. No.-1405-0015 OPTIONAL FORM 230 (English) (Rev. 6-82) DEPT. OF STATE APPLICATION FOR IMMIGRANT VISA AND ALIEN REGISTRATION 50230-105 INSTRUCTIONS: This form must be filled out in DUPLICATE by typewriter, or if by hand in legible block letters. All questions must be answered, if applicable. Questions which are not applicable should be so marked. If there is insufficient room on the form, answer on separate sheets, in dupli- cate, using the same numbers as appear on the form. Attach the sheets to the forms. DO NOT SIGN this form until instructed to do so by the consular officer. The fee for filing this application for an immigrant visa is $25.00. The fee should be paid in United States dollars or local currency equivalent or by bank draft, when you appear before the consular officer. WARNING: Any false statement or concealment of a material fact may result in your permanent exclusion from the United States. Even though you should be admitted to the United States, a fraudulent entry could be grounds for your prosecution and/or deportation. 1. Family name First name Middle name Judge Jagdev Singh Judge agdev Singh. 2. Other names used or by which known (If married woman, give maiden name) Not applicable. 3. Full name in native alphabet (If Roman letters not used) 4. Date of birth 5. Age 6. Place of birth (Day) (Month) (Year) (City or town) (Province) (Country) 18th April 1912 74 Lahore Punjab India. W.Pakistan. 7. Nationality 8. Sex 9. Marital status Indian Male Female Single (never married) Married Widowed Divorced Separated Including my present marriage, I have been married times. 10. Occupation 11. Present address Upper Storey Arorbans Press, Kttra Sales Tax Practitioner. Sher Singh, Amritsar-Punjab-India 12. Name, address, date and place of birth of wife/husband (Give maiden name of wife) Judge Charanjit Kaur, Upper Storey, Arorbans Press, Katr. Sher Singh, Amritsar- Punjab-India 23rd Nov, 1923- Gurdaspur-pb. Date and place of marriage December 29,1939 - Gurdaspur-Punjab-India 13. Names, addresses, dates and places of birth of all children 1. Lily Singh, Road, Thorntonheath, SURREY_LONDON_ 2.5.1942-Lahore W.Pakistan 2. Judge Sateshwar Singh, Upper Storey Arorbans Press, Katra Sher Singh, Amritsar - 27.8.46 - Simla -India. 3. Judge Jag eshwar Singh, 1168, Ranj Ka Bagh, Amritsar-Punjab - India, 7.8.48 - Phillaur - Punjab - India (Distt. Jalandhar). 14. Person(s) named in 12 and 13 who will accompany or follow 15. Final address in the United States me to the United States 1. Judge Harcharan Singh, Judge Charanjit Kaur. 4454, Jupiter Drive,Riverside CA92505 2. Mr. P. S. Walia, 33 Horse Show Lane, Rolling Hill Calif 90274. 16. Person you intend to join (Give name, address, and relationship, 17. Name and address of sponsoring person or organization (If ifany) 1. Bibi Sumitter Kaur (Sister) different from 16) Horse Shoe Lane, Rolling Hill S, Calif- Mr. P.S. Walia 74. 2) Judge Harcharan Singh, 4454 33 Honse Shoe Lane, Rolling Hills/ (B rother). Jupiter Drive, Riverside CA Calif 90 274 92505. 18. Personal description 19. Marks of identification (a) Color of hair (c) Height 1 M. 66 cm. Scar on right shin. Black & G.reay feet inches (b) Color of eyes (d) Complexion 20. Purpose in going to the United States Going as an Bhack Fair. Immionant 21. Length of intended stay (If permanently, so state) 22. Intended port of entry 23. Do you have a ticket to final destination? California I will purchase the ticket Permanently. (Los angl es) after obtaining the Visa. THIS FORM MAY BE OBTAINED GRATIS AT CONSULAR OFFICES OF THE UNITED STATES OF AMERICA NSN 7540-00-149-0919 Previous edition not usable"
}