{
  "anumber": "A42210183",
  "id": "A42210183_0051",
  "page_index": 51,
  "resources": {
    "full_jpg": "https://dctn4zjpwgdwdiiy5odjv7o2se0bqgjb.lambda-url.us-east-1.on.aws/iiif/3/og-2023-kc-nara_A42210183_0051/full/max/0/default.jpg"
  },
  "fields": {
    "sex": {
      "ms_sex_llm_v1": "female"
    },
    "doctype": {
      "ms_doctype_v1": "form"
    },
    "form_title": {
      "ms_form_title_llm_v1": "APPLICATION FOR IMMIGRANT VISA AND ALIEN REGISTRATION"
    },
    "countries": {
      "ms_countries_nlp_v1": [
        "United States",
        "Somalia"
      ]
    },
    "years": {
      "ms_years_nlp_v1": [
        2075,
        1943,
        1928,
        1945,
        1955,
        1948,
        1913,
        1940
      ]
    }
  },
  "is_g325a": false,
  "is_cert_naturalization": false,
  "full_text": "FORM APPROVED O.M.B. No. 47-RO150 TIONAL FORM 230 (English) (Rev. 7-79) $125 DEPT. OF STATE 50230-104 APPLICATION FOR IMMIGRANT VISA AND ALIEN REGISTRATION INSTRUCTIONS: This form must be filled out in DUPLICATE by typewriter, or if by hand in legible block letters. All questions must be answered, if applicable. Questions which are not applicable should be so marked. If there is insufficient room on the form, answer on separate sheets, in duplicate using the same numbers as appear on the form Attach the sheets to the forms. DO NOT SIGN this form until instructed to do so by the consular officer. The fee for filing this application for an immigrant visa is $5.00. The fee should be paid in United States dollars or local currency equivalent or by bank draft, when you appear before the consular officer. WARNING: Any false statement or concealment of a material fact may result in your permanent exclusion from the United States. Even though you should be admitted to the United States, a fraudulent entry could be grounds for your prosecution and/or deportation. 1. Family name First name Middle name ADEN WARSAME FADUMA ADEN 2. Other names used or by which known (If married woman, give maiden name) FADUMA 3. Full name in native alphabet (If Roman letters not used) FADUMA ADEN WARSAME 4. Date of birth 5. Age 6. Place of birth (Day) (Month) (Year) 77 (City or town) (Province) (Country) 1913 YEARS GALKAIO MUDUG SOMALiA 7. Nationality 8. Sex 9. Marital status SOMALi Male Female Single (never married) Married Widowed Divorced Separated Including my present marriage, I have been married ONE times. 10. Occupation 11. Present address HOUSE WiFE P.O.Box.2075 MOSADISHU, SOMALiA. 12. Name, address, date and place of birth of wife/husband (Give maiden name of wife) FADUMA ADEN WARSAME; P.O. Box 2075 MOSADISHU, SOMALiA. 1913 iN GALKAIO. Date and place of marriage 1928 iN MOGADISHU 13. Names, addresses, dates and places of birth of all children. KHADIJA F. HERSi 1943 MOGADISHU, SOMALiA 0.80X 2075 MOGADISHU, SOMALiA HAWA 4. HERS, 1955. MOGADISHU, SOMALIA SADIA F. HERSi 1948 SOMALIA ZEillAB f HERSi 1940, MOGADISHU SOMALIA AHMED F. HERS 1945, MOGADISHU SOMALIA MAYEL ALi HAJi yusuf 28-8-76 ROMA, ITALI ADOPTED childREN HASSAN ALiHAJi yusuf, 21-12-78 MOGADISHU, SOMALiA 14. Person(s) named in 12 and 13 who will accompany or follow 15. Final address in the United States me to the United States 14531 S.FREEMAN AVE # 5 LAWNDALE CA 90260 16. Person you intend to join (Give name, address and relationship, 17. Name and address of sponsoring person or organization (If if any) ABDULLAHI F. HERSi different from 16) SAME AS NUMBER 16. 14531 5. FREEMAN AVE #5 LAWNDALE CA 90260 HE is MY SON 18. Personal description 19. Marks of identification (a) Color of hair (c) Height BLACK 1 feet 66 inches NiL (b) Color of eyes (d) Complexion 20. Purpose in going to the United States BLACK BLACK To SEE MY SON. 21. Length of intended stay (If permanently, so state) 22. Intended port of entry 23. Do you have a ticket to final destination? Two YEARS Los ANGELES YES THIS FORM MAY BE OBTAINED GRATIS AT CONSULAR OFFICES OF THE UNITED STATES OF AMERICA NSN 7540-00-149-0919 Previous edition not usable"
}