{
  "anumber": "A42939792",
  "id": "A42939792_0020",
  "page_index": 20,
  "resources": {
    "full_jpg": "https://dctn4zjpwgdwdiiy5odjv7o2se0bqgjb.lambda-url.us-east-1.on.aws/iiif/3/og-2023-kc-nara_A42939792_0020/full/max/0/default.jpg"
  },
  "fields": {
    "sex": {
      "ms_sex_llm_v1": "female"
    },
    "doctype": {
      "ms_doctype_v1": "form"
    },
    "form_title": {
      "ms_form_title_llm_v1": "APPLICATION FOR IMMIGRANT VISA AND ALIEN REGISTRATION"
    },
    "countries": {
      "ms_countries_nlp_v1": [
        "United States",
        "India"
      ]
    },
    "years": {
      "ms_years_nlp_v1": [
        1918,
        1907,
        2023,
        1948
      ]
    }
  },
  "is_g325a": false,
  "is_cert_naturalization": false,
  "full_text": "Screened by NARA, 8/14/2023 Abul OMB APPROVAL NO. 1405-0015 EXPRESS 08-31-92 ESTIMATED BURDEN : 1 HOUR APPLICATION FOR IMMIGRANT VISA AND ALIEN REGISTRATION PART I - BIOGRAPHIC DATA INSTRUCTIONS: Complete one copy of this form for yourself and each member of your family, regardless of age, who will immigrate with you. Please print or type your answer to all questions. Questions that are Not Applicable should be so marked. If there is insufficient room on the form, answer on a separate sheet using the same numbers as appear on the form. Attach the sheet to this form. WARNING: Any false statement or concealment of a material fact may result in your permanent explusion from the United States. This form is Part I of two parts which, together with Optional Form OF-230 PART II, constitute the complete Application for Immigrant Visa and Alien Registration. 1. FAMILY NAME FIRST NAME MIDDLE NAME DA SILVA ABEL TOLENTINO PIEDADE 2. OTHER NAMES USED OR BY WHICH KNOWN (If married woman, give maiden name) NOT APPLICABLE 3. FULL NAME IN NATIVE ALPHABET (If Roman letters not used) NOT APPLICABLE. 4. DATE OF BIRTH 5. AGE 6. PLACE OF BIRTH (Day) (Month) (Year) (City or town) (Province) (Country) 10 th SEPTEMBER 1907 84 yere. VELIM GOA INDIA. 7. NATIONALITY (If dual national, 8. SEX 9. MARITAL STATUS give both) L Male Single (Never married) Married Widowed Divorced INDIAN Separated Female Including my present marriage, I have been married one times. 10. PERSONAL DESCRIPTION 11. OCCUPATION a. Color of hair GREY c. Height 5'5\" RETIRED CLERK b. Color of eyes BLACK d. complexion WHEAT 12. MARKS OF IDENTIFICATION 13. PRESENT ADDRESS A/2 PEARL HOUSES 205 DR. AMBEDKAR RD. NIL DADAR BOMBAY 400014 Telephone number: Home 4126579 Office 14. NAME OF SPOUSE (Maiden or family name) (First name) (Middle name) DA SILVA MARIA ALDA AMANDA 21st Date and place DECEMBER of birth of spouse : 1918 VELIM GOA INDIA Address of spouse (if different from your own) Same as at item 13. 15. LIST NAME, DATE AND PLACE OF BIRTH, AND ADDRESS OF ALL CHILDREN NAME DATE AND PLACE OF BIRTH ADDRESS (If different from your own) GLAVO DASILVA DECEASED) 25-3-1948 BOMBAY same as at item 13 our FOIA (b)(6) Augus ODETIE JACQLIES 13-6-1945 BOMBAY 15293 ELVIRA DRIVE SAN LEANDRO CA 94579 215A FOIA (b)(6) THIS FORM MAY BE OBTAINED GRATIS AT CONSULAR OFFICES OF THE UNITED STATES OF AMERICA OPTIONAL FORM, 230 I (ENGLISH) NSN 7540-00-149=-0919 REVISED 4-91 50230-108 Previous editions obsolete DEPT. OF STATE"
}