{
  "anumber": "A43150956",
  "id": "A43150956_0015",
  "page_index": 15,
  "resources": {
    "full_jpg": "https://dctn4zjpwgdwdiiy5odjv7o2se0bqgjb.lambda-url.us-east-1.on.aws/iiif/3/og-2023-kc-nara_A43150956_0015/full/max/0/default.jpg"
  },
  "fields": {
    "sex": {
      "ms_sex_llm_v1": "male"
    },
    "doctype": {
      "ms_doctype_v1": "form"
    },
    "form_title": {
      "ms_form_title_llm_v1": "U.S. Department of Justice Immigration and Naturalization Service BIOGRAPHIC INFORMATION, G-325A"
    },
    "countries": {
      "ms_countries_nlp_v1": [
        "United States",
        "Tanzania",
        "India"
      ]
    },
    "years": {
      "ms_years_nlp_v1": [
        1907,
        2023,
        1943
      ]
    },
    "g325a": {
      "occupation": {
        "occupation_llm_v1": "['self employed', ' software processor']"
      },
      "reason": {
        "reason_llm_v1": "OTHER (SPECIFY)"
      },
      "nationality": {
        "nationality_llm_v1": "Indian"
      }
    }
  },
  "is_g325a": true,
  "is_cert_naturalization": false,
  "full_text": "Screened by NARA, 8/4/2023 U.S. Department of Justice FORM G-325A OMB No. 1115-0066 Immigration and Naturalization Service BIOGRAPHIC INFORMATION / nam (First name) (Middle name) MALE BIRTHDATE(Mo.-Day-Yr.) NATIONALITY FILE NUMBER KANGRA KRISHAN K FEMALE 08-11-1943 INDIAN A ALL OTHER NAMES USED (Including names by previous marriages) CITY AND COUNTRY OF BIRTH SOCIAL SECURITY NO. NA HARIANA, HOSHIARDUR, INDIA (If any) 458370426 FAMILY NAME FIRST NAME DATE, CITY AND COUNTRY OF BIRTH(If known) CITY AND COUNTRY OF RESIDENCE MOTHER (Maiden name) FATHER RANGRA KUNDAN , 10-16-1907 ; HARIANA, ,HOSHIAPUR, / HARIANA, HOSHIARRUR EXPIRED INDIA INDIA HUSBAND (If none, so state) FAMILY NAME FIRST NAME BIRTHDATE CITY & COUNTRY OF BIRTH DATE OF MARRIAGE PLACE OF MARRIAGE OR (For wife, give maiden name) WIFE KASHYAP SUDHA 7-13-47 MWANZA 09-26-71 CHANDIGARH TANZANIA INDIA FORMER HUSBANDS OR WIVES(if none, so state) NA FAMILY NAME (For wife, give maiden name) FIRST NAME BIRTHDATE DATE & PLACE OF MARRIAGE DATE AND PLACE OF TERMINATION OF MARRIAGE APPLICANT'S RESIDENCE LAST FIVE YEARS. LIST PRESENT ADDRESS FIRST. FROM TO STREET AND NUMBER CITY PROVINCE OR STATE COUNTRY MONTH YEAR MONTH YEAR 100 MORRIS PARKWAY PRESENT TIME VALLEY NEW YORK USA March 83 VALLEY STREAM STREAM NY 11580 APPLICANT'S LAST ADDRESS OUTSIDE THE UNITED STATES OF MORE THAN ONE YEAR NA FROM TO STREET AND NUMBER CITY PROVINCE OR STATE COUNTRY MONTH YEAR MONTH YEAR APPLICANT'S EMPLOYMENT LAST FIVE YEARS. (IF NONE, so STATE.) LIST PRESENT EMPLOYMENT FIRST FROM TO FULL NAME AND ADDRESS OF EMPLOYER OCCUPATIONISPECIFYI MONTH YEAR MONTH YEAR SELF EMPLOYED ;KSAM GROWTH INC SOFTWARE JULY 85 PRESENT TIME DATA Processor Show below last occupation abroad if not shown above. (Include all information requested above.) THIS FORM IS SUBMITTED IN CONNECTION WITH APPLICATION FOR: SIGNATURE OF APPLICANT DATE NATURALIZATION STATUS AS PERMANENT RESIDENT OTHER (SPECIFY): PermANENT RESIDENCE For FATHER Krishin K Rangs 7/16/90 IF YOUR NATIVE ALPHABET is IN OTHER THAN ROMAN LETTERS. WRITE TOUR NAME IN YOUR NATIVE ALPHABET IN THIS SPACE: Are all copies legible? Yes gom 210151 PENALTIES: SEVERE PENALTIES ARE PROVIDED BY LAW FOR KNOWINGLY AND WILLFULLY FALSIFYING OR CONCEALING A MATERIAL FACT. APPLICANT: BE SURE TO PUT YOUR NAME AND ALIEN REGISTRATION NUMBER IN THE BOX OUTLINED BY HEAVY BORDER BELOW. COMPLETE THIS BOX (Family name) (Given name) (Middle name) (Alien registration number) NATULARISED CITIZEM OF USA, 12240248512-5-85, BrookLyn, KRISHAN RANGRA KKR NY RANGRA KRISHAN K. Form G-325 A (Rev. 10-1-82) (1) Ident."
}