{
  "anumber": "A43274002",
  "id": "A43274002_0042",
  "page_index": 42,
  "resources": {
    "full_jpg": "https://dctn4zjpwgdwdiiy5odjv7o2se0bqgjb.lambda-url.us-east-1.on.aws/iiif/3/og-2023-kc-nara_A43274002_0042/full/max/0/default.jpg"
  },
  "fields": {
    "sex": {
      "ms_sex_llm_v1": "female"
    },
    "doctype": {
      "ms_doctype_v1": "form"
    },
    "form_title": {
      "ms_form_title_llm_v1": "APPLICATION FOR IMMIGRANT VISA AND ALIEN REGISTRATION"
    },
    "countries": {
      "ms_countries_nlp_v1": [
        "Pakistan",
        "United States",
        "India"
      ]
    },
    "years": {
      "ms_years_nlp_v1": [
        1910,
        1903,
        2023
      ]
    }
  },
  "is_g325a": false,
  "is_cert_naturalization": false,
  "full_text": "Screened by NARA, 9/27/2023 OMB APPROVAL NO. 1405-0015 EXPIRES: 9-30-95 ESTIMATED BURDEN: &HOUR APPLICATION FOR IMMIGRANT VISA AND ALIEN REGISTRATION PART I - BIOGRAPHIC DATA INSTRUCTIONS: Complete one copy of this form for yourself and each member of your family, regardless of age, who will immigrate with you. Please print or type your answer to all questions. Questions that are Not Applicable should be so marked. If there is insufficient room on the form, answer on a separate sheet using the same numbers as appear on the form. Attach the sheet to this form. WARNING: Any false statement or concealment of a material fact may result in your permanent exclusion from the United States. This form (OF-230 PART I) is Part I of two parts which, together with Optional Form OF-230 PART II, constitute the complete Application for Immigrant Visa and Alien Registration. 1. FAMILY NAME FIRST NAME MIDDLE NAME SIKRI NARAIN DASS 2. OTHER NAMES USED OR BY WHICH KNOWN (If married woman, give maiden name) N/A 3. FULL NAME IN NATIVE ALPHABET (If Roman letters not used) NARAIN DASS SIKRI 4. DATE OF BIRTH 5. AGE 6. PLACE OF BIRTH (Day) (Month) (Year) (City or town) (Province) (Country) 1 12 1903 91 Kot Sultan PUNJAB PAKISTAN 7. NATIONALITY (If dual national, 8. SEX 9. MARITAL STATUS give both) Male Single (Never married) Married Widowed Divorced Separated INDIA Female Including my present marriage, I have been married 1 times. 10. PERSONAL DESCRIPTION 11. OCCUPATION a. Color of hair Grey C. Height 5'-8\" Retired b. Color of eyes Brown d. Complexion Fair 12. MARKS OF IDENTIFICATION 13. PRESENT ADDRESS 157 Sector 14 Cut on right ear Faridabad 121007, Haryana India Telephone number: Home 8-282282 Office 14. NAME OF SPOUSE (Maiden or family name) (First name) (Middle name) SIKRI SUSHILA DEVI (Died 11/29/94) Date and place of birth of spouse: May 10, 1910 ; MULTAN, PAKISTAN Address of spouse (If different from your own): Deceased 15. LIST NAME, DATE AND PLACE OF BIRTH, AND ADDRESSES OF ALL CHILDREN N/A NAME DATE AND PLACE OF BIRTH ADDRESS (If different from your own) THIS FORM MAY BE OBTAINED GRATIS AT CONSULAR OFFICES OF THE UNITED STATES OF AMERICA OPTIONAL FORM 230 Part I (ENGLISH) REVISED 4-91 NSN 7540-00-130-8317 Previous editions obsolete DEPT. OF STATE 50230(1)-102"
}