{
  "anumber": "A43966574",
  "id": "A43966574_0004",
  "page_index": 4,
  "resources": {
    "full_jpg": "https://dctn4zjpwgdwdiiy5odjv7o2se0bqgjb.lambda-url.us-east-1.on.aws/iiif/3/og-2023-kc-nara_A43966574_0004/full/max/0/default.jpg"
  },
  "fields": {
    "sex": {
      "ms_sex_llm_v1": "male"
    },
    "doctype": {
      "ms_doctype_v1": "form"
    },
    "form_title": {
      "ms_form_title_llm_v1": "Immigrant Visa and Alien Registration"
    },
    "countries": {
      "ms_countries_nlp_v1": [
        "Pakistan",
        "United States"
      ]
    },
    "years": {
      "ms_years_nlp_v1": [
        1994,
        2023
      ]
    }
  },
  "is_g325a": false,
  "is_cert_naturalization": false,
  "full_text": "Screened by NARA, 8/17/2023 OPTIONAL FORM 155A, (REV. 6-91) DEPT. OF STATE NSN 7540-01-126-7761 50155-204 IV-43,966,574 IMMIGRANT VISA AND ALIEN REGISTRATION THE IMMIGRANT HAS BEEN PREMIOUSLY IN THE UNITED STATES OF: (Family Name) (First Name) (Middle Name) INS FILE #, IF KNOWN RAJA, MUZAFFAR KHAN ACTION BY IMMIGRATION INSPECTOR THE IMMIGRANT NAMED ABOVE ARRIVED IN THE UNITED INELIGIBILITY FOR VISA STATES VIA (Name of vessel or flight no. of arrival) WAIVED UNDER SECTION BNYC 2-13-94 212(e) 212(h) PK 717 Fib 13, 1994 212(g) 212(i) CITY AND COUNTRY OF BIRTH MO-DAY-YR OF BIRTH CB181 1994 RAWALPINDI, PAKISTAN 01JAN1903 CITY AND COUNTRY OF LAST RESIDENCE NATIONALITY IR-5 RAWALPINDI, PKST PAKISTANI A43966574 MARITAL STATUS MOTHER'S FIRST NAME FATHER'S FIRST NAME M S W D SEP X PYARI ALI AKBAR FINAL ADDRESS STREET ADDRESS, INCLUDE-IN CARE OF & APT# IF APPLICABLE CITY, STATE, AND ZIP CODE IN THE UNITED M HAFEEZ RAJA STATES 1662 HOLLEN BECK # 15 SUNNYVALLE CA, CA 94087 SEC. 212(a)(5) (A) OCCUPATION SEX LABOR CERTIFICATION NOT APPLICABLE NOT REQUIRED ATTACHED UNR RETIRED This visa is issued under Section 221 of the Immigration and Nationality Act, and upon the basis of the facts stated in the application. Possession of a visa does not entitle the bearer to enter the United States if at the time he seeks to enter he is found to be inadmissible. Upon arrival in the United States, it must be surrendered to a United States Immigration Officer. IMMIGRANT CLASSIFICATION CLASSIFICATION SYMBOL AMERICAN CONSULATE GENERAL IR5 FOREIGN STATE/OTHER AREA LIMITATION KARACHI, PAKISTAN PAKISTAN AT KRC199378500201 43966574 Patricia W Johnson ISSUED ON (Day) (Month) (Year) 21DEC1993 Consul of the United States Consular Officerol of America of America THE VALIDITY OF THIS VISA EXPIRES MIDNIGHT AT THE END OF (Day) (Month) (Year) 19APR1994 PASSPORT NO. AB 032674 OR OTHER TRAVEL DOCUMENTS (Describe) RESERVED 150 Tariff No. 21 Fee Paid $ IV-4 3,966,574 or Local Currency Equivalent ACTION OF I.J. ACTION ON APPEAL U.S.P.H.S. PROCESSED FOR 1-551. TEMPORARY EVIDENCE OF LAWFUL ADMISSION FOR PERMANENT RESIDENCE VALID UNTIL EMPLOYMENT AUTHORIZED AUG. 121084"
}