{
  "anumber": "A44052464",
  "id": "A44052464_0041",
  "page_index": 41,
  "resources": {
    "full_jpg": "https://dctn4zjpwgdwdiiy5odjv7o2se0bqgjb.lambda-url.us-east-1.on.aws/iiif/3/og-2023-kc-nara_A44052464_0041/full/max/0/default.jpg"
  },
  "fields": {
    "sex": {
      "ms_sex_llm_v1": "male"
    },
    "doctype": {
      "ms_doctype_v1": "letter"
    },
    "form_title": {
      "ms_form_title_llm_v1": "Certificate of Naturalization, 9711624"
    },
    "countries": {
      "ms_countries_nlp_v1": [
        "United States",
        "India"
      ]
    },
    "years": {
      "ms_years_nlp_v1": [
        1973,
        2023,
        1940
      ]
    },
    "certificate_naturalization": {
      "complexion": {
        "complexion_llm_v1": "fair"
      },
      "marital_status": {
        "marital_status_llm_v1": "married"
      },
      "year_naturalization": {
        "year_naturalization_llm_v1": 1973
      },
      "residence_naturlization": {
        "residence_naturlization_llm_v1": "Rockville, Maryland"
      }
    }
  },
  "is_g325a": false,
  "is_cert_naturalization": true,
  "full_text": "Screened by NARA, 8/17/2023 No. 9711624 Pelition no. 4402 AlienRegistration has FOIA (b)(6) ORIGINAL. Personal,description mofholdera Date of birth January 8, 1940 sean male i complexion fair coloroleyes hazel colorofhair black theight 5 feet 7 inches; weight 148 pounds, none Maritalstadus married Country of formermationaline India description influent heretois, whikeness ofime. Ferm Complete and true signature of holder) State of Maryland Montgomery County } SS: Beilknoun, that ala termofthe Circuit Court of Montgomery County Rockville, Maryland on October 19, 1973 the Drupad Batuklal Desai then residing and 1708 Shilling Lane, Wheaton, Maryland 20906 intendstoreside, ermanonthyinthe United States when so required by the Naturalizeation Laws of he United. States) hadinallythorneheads complied with sheapplicable provisions, of such naturalization laws, and was entilled/tobe Teal admitted stocilisenship suchper sombeandlshewas admilled as acilizen the United States of America. 19th with Indestimony where hereunto affered.,his dayof October in the year of own Lordnineleenhundredand seventy-three Haward m. Smith Clerk of the Circuit Court. IT IS PUNISHABLE BY U. S. LAW TO COPY, PRINT OR PHOTOGRAPH THIS CERTIFICATE. By Deputy Clerk."
}