{
  "anumber": "A44606320",
  "id": "A44606320_0086",
  "page_index": 86,
  "resources": {
    "full_jpg": "https://dctn4zjpwgdwdiiy5odjv7o2se0bqgjb.lambda-url.us-east-1.on.aws/iiif/3/og-2023-kc-nara_A44606320_0086/full/max/0/default.jpg"
  },
  "fields": {
    "sex": {
      "ms_sex_llm_v1": "female"
    },
    "doctype": {
      "ms_doctype_v1": "form"
    },
    "form_title": {
      "ms_form_title_llm_v1": "BIOGRAPHIC INFORMATION, G-325A ( (REV. 10-1-74) Y"
    },
    "countries": {
      "ms_countries_nlp_v1": [
        "United States",
        "India"
      ]
    },
    "years": {
      "ms_years_nlp_v1": [
        1937,
        1935,
        1974,
        1973,
        2023,
        1904,
        1976,
        1965
      ]
    },
    "g325a": {
      "occupation": {
        "occupation_llm_v1": "['vulcan trading co.-ballard per-bombay salesman']"
      },
      "reason": {
        "reason_llm_v1": "1"
      },
      "nationality": {
        "nationality_llm_v1": "Indian"
      }
    }
  },
  "is_g325a": true,
  "is_cert_naturalization": false,
  "full_text": "FORM G-325A (REV. 10-1-74) Y Screened by NARA, 9/14/2023 Form Approved UNITED STATES DEPARTMENT OF JUSTICE OMB No. 43-R436 Immigration and Naturalization Service BIOGRAPHIC INFORMATION (Family nome) (First name) (Middle name) MALE BIRTHDATE (Mo.-Day-Yr.) NATIONALITY ALIEN REGISTRATION NO. IMAM MAHMOODMIAN MOHAMED FEMALE 12-2-1904 INDIAN (If K567119 any) ALL OTHER NAMES USED (Including names by previous marriages) CITY AND COUNTRY OF BIRTH SOCIAL SECURITY NO. NONE RANDER - - INDIA (If any) 558-279782 FAMILY NAME FIRST NAME DATE, CITY AND COUNTRY OF BIRTH(If known) CITY AND COUNTRY OF RESIDENCE IMAM MOHAMMED RANDER INDIA RANDER- - INDIA FATHER MOTHER (Maiden name) BAIG FATIMA RANDER - INDIA RANDER - INDIA HUSBAND (If none, so state) FAMILY NAME FIRST NAME BIRTHDATE CITY & COUNTRY OF BIRTH DATE OF MARRIAGE PLACE OF MARRIAGE OR WIFE (For wife, give moiden name) RANDER- MIRZA FATIMA 9-15-9910 RANDER-INDIA 6-27-1927 INDIA FORMER HUSBANDS OR WIVES( (if none,so state) NONE FAMILY NAME (For wife, give maiden name) FIRST NAME BIRTHDATE DATE & PLACE OF MARRIAGE DATE AND PLACE OF TERMINATION OF MARRIAGE APPLICANT'S RESIDENCE LAST FIVE YEARS. LIST PRESENT ADDRESS FIRST. FROM TO STREET AND NUMBER CITY PROVINCE OR STATE COUNTRY MONTH YEAR MONTH YEAR 110 WEMBLEY DRIVE DALYCITY CALIF. U.S.A. JUNE 1976 PRESENT TIME 114 SARANG STREET BOMBAY MAHARASHTRA INDIA MAY 1935 JUNE 1976 2187 CARLMONT DRIVE BELMONT CALIF. U.S.A. AUG 1973 MAY 1974 APPLICANT'S LAST ADDRESS OUTSIDE THE UNITED STATES OF MORE THAN ONE YEAR FROM TO STREET AND NUMBER CITY PROVINCE OR STATE COUNTRY MONTH YEAR MONTH YEAR 114 SARANG STREET BOMBAY MAHARASHTRA INDIA MAY 1935 JUNE1976 APPLICANT'S EMPLOYMENT LAST FIVE YEARS. (IF NONE, so STATE.) LIST PRESENT EMPLOYMENT FIRST. FROM TO FULL NAME AND ADDRESS OF EMPLOYER NONE OCCUPATION (SPECIFY) MONTH YEAR MONTH YEAR PRESENT TIME Show below last occupation abroad if not shown above. (Include all information requested above.) VULCAN TRADING co.- BALLARD PIER- BOMBAY SALESMAN JUNE 1937 OCT 1965 THIS FORM IS SUBMITTED IN CONNECTION WITH APPLICATION FOR: SIGNATURE NATURALIZATION ADJUSTMENT OF STATUS IF YOUR NATIVE IS IN CHAN ROMAN LETTERS. WRITE YOUR NAME IN YOUR NATIVE ALPHABET LAL THIS SPACE: do ALPHABET OF APPLICANT OTHER PETITIONER DATE 7-26-1976 OTHER (SPECIFY): Are all copies legible? Yes PENALTIES: SEVERE PENALTIES ARE PROVIDED BY LAW FOR KNOWINGLY AND WILLFULLY FALSIFYING OR CONCEALING A MATERIAL FACT."
}