{
  "anumber": "A45069414",
  "id": "A45069414_0000",
  "page_index": 0,
  "resources": {
    "full_jpg": "https://dctn4zjpwgdwdiiy5odjv7o2se0bqgjb.lambda-url.us-east-1.on.aws/iiif/3/og-2023-kc-nara_A45069414_0000/full/max/0/default.jpg"
  },
  "fields": {
    "doctype": {
      "ms_doctype_v1": "form"
    },
    "form_title": {
      "ms_form_title_llm_v1": "Immigrant Visa and Alien Registration"
    },
    "countries": {
      "ms_countries_nlp_v1": [
        "United States",
        "India"
      ]
    },
    "years": {
      "ms_years_nlp_v1": [
        2023,
        1995
      ]
    }
  },
  "is_g325a": false,
  "is_cert_naturalization": false,
  "full_text": "Screened by NARA, 7/14/2023 OPTIONAL FORM 155A, (REV. 7-93) DEPT. OF STATE NSN 7540-01-126-7761 50155-205 IV-45,064,414 IMMIGRANT VISA AND ALIEN REGISTRATION X THE IMMIGRANT HAS BEEN PREVIOUSLY IN AKA DEV, MANGUBEN YASHVANTRAO THE UNITED STATES OF: (Family Name) (First Name) (Middle Name) INS FILE #, IF KNOWN MULEY, MANGUBEN BHALCHANDRA ACTION BY IMMIGRATION INSPECTOR THE IMMIGRANT NAMED ABOVE ARRIVED IN THE UNITED INELIGIBILITY FOR VISA WAIVED UNDER SECTION STATES VIA (Name of vessel or flight no. of arrival) 212(a)(3) (D) (iv) U. S. IMMIGRATION NEW YORK SILY 2544 AZ101 11-10-95 212(e) 212(h) 212(g) 212(I) NOV 67 1995 CITY AND COUNTRY OF BIRTH MO-DAY-YR OF BIRTH ADMITTED IRS SONGADH INDIA 07NOV1907 CITY AND COUNTRY OF LAST RESIDENCE NATIONALITY UNTIL CLASS BARODA IND INDIAN MARITAL STATUS MOTHER'S FIRST NAME FATHER'S FIRST NAME A45069414 M S W D SEP PARVATI YASHVANTRAO FINAL ADDRESS STREET ADDRESS, INCLUDE-IN CARE OF & APT# IF APPLICABLE CITY, STATE, AND ZIP CODE IN THE UNITED STATES R B MULEY 301 W HOPI DR HOLBROOK, AZ 86025 SEC. 212 (a) (5) (A) OCCUPATION SEX M LABOR CERTIFICATION NOT APPLICABLE NOT REQUIRED ATTACHED HOU HOUSEWIFE F This visa is issued under Section 221 of the Immigration and Nationality Act, and upon the basis of the facts stated in the application. Possession of a visa does not entitle the bearer to enter the United States if at the time he seeks to enter he is found to be inadmissible. Upon arrival in the United States, it must be surrendered to a United States Immigration Officer. IMMIGRANT CLASSIFICATION CLASSIFICATION SYMBOL AMERICAN CONSULATE GENERAL IR5 FOREIGN STATE/OTHER AREA LIMITATION AT BOMBAY INDIA Streecell BMB 8199483600201 45069414 ISSUED ON (Day) (Month) (Year) GEOFFREY H COM Consular Officer of the United States of America 24JUL1995 VICE CONSUL THE VALIDITY OF THIS VISA EXPIRES MIDNIGHT AT THE END OF (Day) (Month) (Year) 20NOV1995 PASSPORT NO. C 727920 OR OTHER TRAVEL DOCUMENTS (Describe) OGRAP RESERVED OREION SERIO LIMITED STATES Tariff No. 21 Fee Paid $ FOR I-551. or Local Currency EquivalentESSED TEMPORARY EVIDENCE OF IV- 5069414 ACTION OF I.J. LAWFUL ADM SACTION ON APPEAL U.S. P.H.S. PERMANENT RESIDENCE Info given to IRS on date of 1-551 Iss BPC Name, Addr. DOB A#, VALID EMPLOYMENT AUTHORIZED UNTIL adm, Occup & answers to Form 9003."
}