{
  "anumber": "A46040013",
  "id": "A46040013_0039",
  "page_index": 39,
  "resources": {
    "full_jpg": "https://dctn4zjpwgdwdiiy5odjv7o2se0bqgjb.lambda-url.us-east-1.on.aws/iiif/3/og-2023-kc-nara_A46040013_0039/full/max/0/default.jpg"
  },
  "fields": {
    "sex": {
      "ms_sex_llm_v1": "female"
    },
    "doctype": {
      "ms_doctype_v1": "form"
    },
    "form_title": {
      "ms_form_title_llm_v1": "Immigrant Visa and Alien Registration"
    },
    "countries": {
      "ms_countries_nlp_v1": [
        "United States"
      ]
    },
    "years": {
      "ms_years_nlp_v1": [
        1996
      ]
    }
  },
  "is_g325a": false,
  "is_cert_naturalization": false,
  "full_text": "OPTIONAL FORM 155A (REV. 11-95) DEPT OF STATE NSN 7540-01 1-126-7761 50155-206 UNVVEDSTATEESOFAMERICA IV-46040013 IMMIGRANT VISA AND ALIEN REGISTRATION Biera (Family Name) (First Name) (Middle Name) ESCOBAR DE RAY MUNDO, CASIMIRA INS FILE #. IF KNOWN ACTION BY IMMIGRATION INSPECTOR THE IMMIGRANT NAMED ABOVE ARRIVED IN THE UNITED INELIGIBILITY FOR VISA WAIVED UNDER SECTION STATES VIA (Name of vessel or flight no. of arrival) U.S. IMMIGRATION TA 520 GENDER: 160 LOS 4231 FEMALE CITY AND COUNTRY OF BIRTH DAY-MO-YR OF BIRTH WLL 21 1996 CUSCATLAN, EL SALVADOR 11MAR1911 CITY AND COUNTRY OF LAST RESIDENCE NATIONALITY ADMITTED IR5 LA LIBERTAD, ELSL SALVADORAN (CLASS) MARITAL STATUS MOTHER'S FIRST NAME FATHER'S FIRST NAME UNTR PERM RES MARRIED LINA ESTANI SLAO FINAL ADDRESS STREET ADDRESS, INCLUDE- IN CARE OF & APT# IF APPLICABLE CITY, STATE, AND ZIP CODE IN THE UNITED STATES 20714 ARCHWOOD ST CANOGA PARK, CA 91306 SEC. 212(a)(5)(A) OCCUPATION NOT REQUIRED HOU HOUSEWIFE This visa is issued under Section 221 of the Immigration and Nationality Act, and upon the basis of the facts stated in the application. Possession of a visa does not entitle the bearer to enter the United States if at the time he seeks to enter he is found to be inadmissible. Upon arrival in the United States, it must be surrendered to a United States Immigration Officer. IMMIGRANT CLASSIFICATION CLASSIFICATION SYMBOL AMERICAN EMBASSY IR5 FOREIGN STATE/OTHER AREA LIMITATION SAN SALVADOR AT EL SALVADOR SNS199673500501 46040013 ISSUED ON (Day) (Month) (Year) Consular Officer of the United States of America 22OCT1996 THE VALIDITY OF THIS VISA EXPIRES MIDNIGHT AT THE END OF (Day) (Month) (Year) 18FEB1997 PASSPORT NO. 0477955 OR OTHER TRAVEL DOCUMENTS (Describe) ATTACHED RESERVED PROCESSED FOR ISSI. ERVICE TEMPORARY BVIDE 1230F LAWRUL ADMISSION UNITED STATES OF AMERICA permanent RESIDENCE VALID UNTIL 20 DEC1997 Tariff No. 21 EMPLOYMENT AUTHORIZED Fee Paid $ or Local Currency Equivalent IV-46,040,013 ACTION OF I.J. ACTION ON APPEAL U.S.P.H.S."
}