{
  "anumber": "A46337255",
  "id": "A46337255_0004",
  "page_index": 4,
  "resources": {
    "full_jpg": "https://dctn4zjpwgdwdiiy5odjv7o2se0bqgjb.lambda-url.us-east-1.on.aws/iiif/3/og-2023-kc-nara_A46337255_0004/full/max/0/default.jpg"
  },
  "fields": {
    "sex": {
      "ms_sex_llm_v1": "female"
    },
    "doctype": {
      "ms_doctype_v1": "form"
    },
    "form_title": {
      "ms_form_title_llm_v1": "U.S. IMMIGRATION AND NATURALIZATION SERVICE, IV-46337255"
    },
    "countries": {
      "ms_countries_nlp_v1": [
        "Honduras",
        "United States"
      ]
    },
    "years": {
      "ms_years_nlp_v1": [
        2023,
        1999,
        1998
      ]
    }
  },
  "is_g325a": false,
  "is_cert_naturalization": false,
  "full_text": "Screened by NARA, 7/20/2023 OPTIONAL FORM 155A (REV. 1-95) DEPT OF STATE NSN 7540-01-126-7761 50155-206 DATE MERICA IV-46,337,255 GISTRATION (F. 09/29/1998 SRC-98-267-51809 SRCKMK09 ddle Name) HERRERA, INS FILE #, IF KNOWN AKA: GUARDADO, ELOISA ACTION BY IMMIGRATION INSPECTOR THE IMMIGRANT NAMED ABOVE ARRIVED IN THE UNITED INELIGIBILITY FOR VISA WAIVED UNDER SECTION STATES VIA (Name of vessel or flight no. of arrival) U. S. IMMIGRATION NEW YORK, N.Y. 2723 GENDER: LR680 Julio 1998 FEMALE JUL 20 1998 CITY AND COUNTRY OF BIRTH DAY-MO-YR OF BIRTH ADMITTED IR5 EL PROGRESO, HONDURAS 27JUN1915 CITY AND COUNTRY OF LAST RESIDENCE NATIONALITY UNTIL (CLASS) EL PROGRESO, HOND HONDURAN A46337255 MARITAL STATUS MOTHER'S FIRST NAME FATHER'S FIRST NAME WIDOWED MARIZ UNKNOWN FINAL ADDRESS STREET ADDRESS, INCLUDE- IN CARE OF & APT# IF APPLICABLE CITY, STATE, AND ZIP CODE IN THE UNITED STATES 766 JAQUES AVENUE RAHWAY, NJ 07065 SEC. 212(a)(5)(A) OCCUPATION NOT REQUIRED HOU HOUSEWIFE This visa is issued under Section 221 of the Immigration and Nationality Act, and upon the basis of the facts stated in the application. Possession of a visa does not entitle the bearer to enter the United States if at the time he seeks to enter he is found to be inadmissible. Upon arrival in the United States, it must be surrendered to a United States Immigration Officer. IMMIGRANT CLASSIFICATION CL ASSIFICATION SYMBOL AMERICAN EMBASSY IR5 FOREIGN STATE/OTHER AREA LIMITATION TEGUCIGALPA HONDURAS AT HONDURAS SHARON A. WEBER VICE CONSUL OF THE UNITED TGG199781401401 46337255 Art OR AMERICA ISSUED ON (Day) (Month) (Year) Consular Officer of the United States of America 16JUL1998 THE VALIDITY OF THIS VISA EXPIRES MIDNIGHT AT THE END OF (Day) (Month) (Year) 14JAN1999 PASSPORT NO. 738140 OR OTHER TRAVEL DOCUMENTS (Describe) RESERVED ELOISA HERRERA MINISTRY OF FOREIGN AFFAIRS UNITED Tariff No. 21 Fee Paid $ or Local Currency Equivalent 551. IV-46,337,255 TEMPORARY EVIDENCE OF LAWPUL ACTION OF ADMISSION FOR ACTION ON APPEAL U.S.P.H.S. PERMANENT RESIDENCE JUL 19 1999 VALID UNTIL EMPI OYMENT AUTHORIZE win 7 8/199998 +XX6631 JUL 31 1998"
}