{
  "anumber": "A55742403",
  "id": "A55742403_0004",
  "page_index": 4,
  "resources": {
    "full_jpg": "https://dctn4zjpwgdwdiiy5odjv7o2se0bqgjb.lambda-url.us-east-1.on.aws/iiif/3/og-2023-kc-nara_A55742403_0004/full/max/0/default.jpg"
  },
  "fields": {
    "sex": {
      "ms_sex_llm_v1": "female"
    },
    "doctype": {
      "ms_doctype_v1": "form"
    },
    "form_title": {
      "ms_form_title_llm_v1": "Immigration Form, 158B ( (REV. 11-95)"
    },
    "countries": {
      "ms_countries_nlp_v1": [
        "Haiti",
        "United States"
      ]
    },
    "years": {
      "ms_years_nlp_v1": [
        1908,
        2004,
        2023,
        2005,
        1915
      ]
    }
  },
  "is_g325a": false,
  "is_cert_naturalization": false,
  "full_text": "Screened by NARA, 8/17/2023 OPTIONAL FORM 1558 (REV. 11-95) DEPT OF STATE 50155-301 ONY v-49166244 IMMIGRAN TION 04/27/2004 SRC-04-144-53410 SRCJPT01 A55742403 (Family Name) (First Name) (Middle Name) JOSEPH, ANDREA INS FILE #. IF KNOWN JOSEPH, ADA ACTION BY IMMIGRATION INSPECTOR THE IMMIGRANT NAMED ABOVE ARRIVED IN THE UNITED ELIGIBILITY FOR VISA WAIVED UNDER SECTION STATES VIA (Name of vessel or flight no. of arrival) U.S. MIA ADMITTE AA 1908 GENDER (6) FEMALE CITY AND COUNTRY OF BIRTH DAY-MO-YR OF BIRTH APR202004 VALLEE DE JACMEL, HAITI 25AUG 1915 CITY AND COUNTRY OF LAST RESIDENCE NATIONALITY CLASS PORT AU PRINCE, HAITI HAITI UNTIL MARITAL STATUS MOTHER'S FIRST NAME FATHER'S FIRST NAME SINGLE DESULMA FIDELI FINAL ADDRESS STREET ADDRESS, INCLUDE-IN CARE OF & APT# IF APPLICABLE CITY, STATE, AND ZIP CODE IN THE UNITED STATES IRMA RAYNAL FOIA (b)(6) FOIA (b)(6) SEC. 212(a)(5)(A) OCCUPATION NOT REQUIRED NOT OCCUPATION NOT REPORTED This visa is issued under Section 221 of the Immigration and Nationality Act, and upon the basis of the facts stated in the application. Possession of a visa does not entitle the bearer to enter the United States if at the time he seeks to enter he is found to be inadmissible. Uponarrival in the United States, it must besurrendered to a United States Immigration Officer. IMMIGRANT CLASSIFICATION CLASSIFICATION SYMBOL AMERICAN U.S. EMBASSY IR5 FOREIGN STATE/OTHER AREALIMITATION AT PORT AU PRINCE, HAITI HAITI PTP200268203501 ISSUED ON (Day) (Month) (Year) Consular Officer of the United States of America 26MAR2004 THE VALIDITY OF THIS VISA EXPIRES MIDNIGHT AT THE END OF (Day) (Month) (Year) 25SEP2004 PASSPORT NO HA78446 HEAL SERV OR OTHER TRAVEL DOCUMENTS (Describe) RESERVED ISSUED TO: APR 21 2004 ISSUED BY: MIAMI. FLORIDA ISSUED ON: 19JUL2000 EXPIRES ON: 19JUL2005 Tariff No. 21 Fee Paid $ A55742403 or Local Currency Equivalent IV-49166,244 ACTION OF I.J. ACTION ON APPEAL U.S.P.H.S. PROCESSED FOR 1-551 TEMPORARY EVIDENCE OF LAWFOL ADMISSION FOR APR 26 2004. VALID UNTIL APRIL19,2005 2300362 EMPLOYMENT AUTHORIZED"
}