{
  "anumber": "A56064388",
  "id": "A56064388_0003",
  "page_index": 3,
  "resources": {
    "full_jpg": "https://dctn4zjpwgdwdiiy5odjv7o2se0bqgjb.lambda-url.us-east-1.on.aws/iiif/3/og-2023-kc-nara_A56064388_0003/full/max/0/default.jpg"
  },
  "fields": {
    "sex": {
      "ms_sex_llm_v1": "female"
    },
    "doctype": {
      "ms_doctype_v1": "form"
    },
    "form_title": {
      "ms_form_title_llm_v1": "U.S. IMMIGRATION, OPTIONAL FORM 1558 ( (REV. 11-95)"
    },
    "countries": {
      "ms_countries_nlp_v1": [
        "Haiti",
        "United States"
      ]
    },
    "years": {
      "ms_years_nlp_v1": [
        2023,
        2003,
        2002,
        1908
      ]
    }
  },
  "is_g325a": false,
  "is_cert_naturalization": false,
  "full_text": "Screened by NARA, 8/11/2023 OPTIONAL FORM 155B (REV. 11-95) DEPT OF STATE Tec ( ) 50155-301 CA /-48111687 IMMIGRA ATION 09/10/2002 SRC-02-264-53001 SRCMEN@ A56064388 (Family Name) warst Name) (Middle Name) MILEON, CHARITE KNOWN (2) CA] ACTION BY IMMIGRATION INSPECTOR THE IMMIGRANT NAMED ABOVE ARRIVED IN THE UNITED WANED] DISECTION STATES VIA (Name of vessel OF flight no. of arrival) U.S. IMMIGRATION -412 (2) (c) 060 MIA 3255 AA 1908 GENDER: ADMITTED FEMALE AUG 2 8 2002 CITY AND COUNTRY OF BIRTH DAY-MO-YR OF BIRTH PORT-AU-PRINCE, HAITI 12MAY1906 CLASS CITY AND COUNTRY OF LAST RESIDENCE NATIONALITY UNTIL PORT-AU-PRINCE, HAITI HAITI MARITAL STATUS MOTHER'S FIRST NAME FATHER'S FIRST NAME SINGLE CAROLE PIERISTE FINAL ADDRESS STREET ADDRESS, INCLUDE-IN CARE OF & APT# IF APPLICABLE CITY, STATE, AND ZIP CODE IN THE UNITED STATES FOIA (b)(6) FOIA (b)(6) SEC. 212(a)(5)(A) OCCUPATION NOT REQUIRED UNR UNEMPLOYED OR RETIRED This visa is issued under Section 221 of the Immigration and Nationality Act, and upon the basis of the facts stated in the application. Possession of a visa does not entitle the bearer to enter the United States if at the time he seeks to enter he is found to be inadmissible. Uponarrival in the United States, it must be surrendered toa United States Immigration Officer. IMMIGRANT CLASSIFICATION CLASSIFICATION SYMBOL AMERICAN U.S. EMBASSY IR5 FOREIGN STATE/OTHER AREA LIMITATION PORT AU PRINCE, HAITI AT HAITI e PTP200173401201 ISSUED ON (Day) (Month) (Year) Consular Officer of the United States of America 18JUL2002 THE VALIDITY OF THIS VISA EXPIRES MIDNIGHT AT THE END OF (Day) (Month) (Year) 17JAN2003 PASSPORT HAJ14178 OR-OTHER TRAVEL DOCUMENTS (Describe) RESERVED ISSUED TO: ISSUED BY: ISSUED ON: 15MAR2002 EXPIRES ON: 15MAR2007 Tariff No. 21 Fee Paid $ or Local Currency Equivalent PASSED A56064388 IV-48111637 PROCESSED 1-551 ACTION OF I.J ACTION P.H.S. TEMPORARY EVIDENCE OF LAWFUL. ADMISSION FOR PERMANENT RESIDENCE 2.9.2002 VALID UNTIL AUG 27 2003 FLORIDA 11730235 SEP 06 2002"
}