{
  "anumber": "A56035718",
  "id": "A56035718_0003",
  "page_index": 3,
  "resources": {
    "full_jpg": "https://dctn4zjpwgdwdiiy5odjv7o2se0bqgjb.lambda-url.us-east-1.on.aws/iiif/3/og-2023-kc-nara_A56035718_0003/full/max/0/default.jpg"
  },
  "fields": {
    "sex": {
      "ms_sex_llm_v1": "male"
    },
    "doctype": {
      "ms_doctype_v1": "form"
    },
    "form_title": {
      "ms_form_title_llm_v1": "Immigrant Visa"
    },
    "countries": {
      "ms_countries_nlp_v1": [
        "Haiti",
        "United States"
      ]
    },
    "years": {
      "ms_years_nlp_v1": [
        2023,
        2003,
        2002
      ]
    }
  },
  "is_g325a": false,
  "is_cert_naturalization": false,
  "full_text": "Screened by NARA, 9/14/2023 OPTIONAL FORM 155B (REV. 11-95) DEPT OF STATE NSN 50155-301 UNITED V-47038094 IMMIGRANT VIS A56035718 (Family Name) (Fir 07/05/2002 SRC-02-215-52433 SRCLMR02 LOUIS XVI, MICHEL DIT TRAGE INS EILE (A) 212[s] [2] [B] ACTION BY IMMIGRATION INSPECTOR THE IMMIGRANT NAMED ABOVE ARRIVED IN THE UNITED ELIGIBILITY FOR VISA WAMED UNDER LOGATION STATES VIA (Name of vessel or (light no. of arrival) IMMIGRATION AA1908 GENDER MALE ADMITTED CITY AND COUNTRY OF BIRTH DAY-MO-YR OF BIRTH JUN 5 2002 MOUSTIQUE, HAITI 18MAR1906 CITY AND COUNTRY OF LAST RESIDENCE NATIONALITY CLASS PORT AU PRINCE, HAITI HAITI MARITAL STATUS MOTHER'S FIRST NAME FATHER'S FIRST NAME WIDOWED ORELIA CETOUTE FINAL ADDRESS STREET ADDRESS, INCLUDE- IN CARE OF & APT# IF APPLICABLE CITY, STATE, AND ZIP CODE IN THE UNITED STATES BAZILE, ODETTE 6211 NW 18TH PLACE SUNRISE, FL 33313 SEC. 212(a)(5)(A) OCCUPATION NOT REQUIRED UNR UNEMPLOYED OR RETIRED This visa is issued under Section 221 of the Immigration and Nationality Act, and upon the basis of the facts stated in the application. Possession of a visa does not entitle the bearer to enter the United States if at the time he seeks to enter he is found to be inadmissible. Upon arrival in the United States, it must be surrendered toa United States Immigration Officer. IMMIGRANT CLASSIFICATION CLASSIFICATION SYMBOL AMERICAN U.S. EMBASSY IR5 FOREIGN STATE/OTHER AREA LIMITATION PORT AU PRINCE, HAITI HAITI AT LD PTP200171903601 ISSUED ON (Day) (Month) (Year) Consular Officer of the United States of America 11JUN2002 THE VALIDITY OF THIS VISA EXPIRES MIDNIGHT AT THE END OF (Day) (Month) (Year) 10DEC2002 PASSPORT HAF10250 U.S. OR OTHER TRAVEL DOCUMENTS (Describe) RESERVED ISSUED TO: ISSUED BY: MIAMI, FLORIDA CAMAGANGE 5 ISSUED ON: 29SEP2000 EXPIRES ON: 29SEP2005 Tariff No. 21 Fee Paid S A56035718 or Local Currency Equivalent IV-47038094 ACTION OF I.J. ACTION ON APPEAL U.S.P.H.S. PROCESSED FOR 1-551 EVIDENCE ADMISSION 2003 X3300107 VALID JUN 27 2002"
}