{
  "anumber": "A56064388",
  "id": "A56064388_0009",
  "page_index": 9,
  "resources": {
    "full_jpg": "https://dctn4zjpwgdwdiiy5odjv7o2se0bqgjb.lambda-url.us-east-1.on.aws/iiif/3/og-2023-kc-nara_A56064388_0009/full/max/0/default.jpg"
  },
  "fields": {
    "sex": {
      "ms_sex_llm_v1": "female"
    },
    "doctype": {
      "ms_doctype_v1": "form"
    },
    "countries": {
      "ms_countries_nlp_v1": [
        "Haiti"
      ]
    },
    "years": {
      "ms_years_nlp_v1": [
        1906,
        2023,
        2001,
        2002
      ]
    }
  },
  "is_g325a": false,
  "is_cert_naturalization": false,
  "full_text": "Screened by NARA, 8/11/2023 FOR Report 24 - Scheduled Applicants' Case Records Post: PTP Appointment Dates 18-JUL-2002 Through 18-JUL-2002 Requested By: EME Date/Time Prepared: 12-JUL-2002 08:48 Case: PTP2001734012 Case: PTP2001734012 P/A Name: MILEON, CHARITE Cross Reference: N Packet 3A Sent: Case Applicants Interview Status: Scheduled Packet 3 Sent: 24-SEP-2001 Derogatory Info: Total: 1 Transfered To: Date: Of230 P1 Received: 11-APR-2002 Provisional: N App Over 16: 1 Received From: NVC Date: 17-APR-2002 Has Docs (OF-230 P2): 11-APR-2002 Namecheck Stat: X Issued: 0 Termination Letter 1: Doc Qualified: 11-APR-2002 Post Clearance: X Refused: 0 Termination Letter 2: Reported Qualified: FBI Clearances: NP Traveling: 1 Packet 4 Sent: 03-JUN-2002 Finger Print: Will Join: 0 Purge Date: Packet 4A Sent: Used X Charge Foreign State Visa Class Priority Date Visas Frog: X HAT IR5 09-NOV-2000 Last Contact: 03-JUN-2002 Interview Date: 18-JUL-2002 Time: 07:00 Medical Appt. Time: Address Use Indicator: Letter Language: English Applicant Address Information Name: CHARITE MILEON Line 1: RUELLE ASSAD 6 # 2 Phone: Line 2: BIZOTON CARREFOUR Line 3: PORT-AU-PRINCE Line 4: HAITI Lawyer's Address/Name Information Name: Line 1: Phone: Line 2: Line 3: Line 4: Petitioner's Address Information Name: FOIA (b) (6) Line 1: Line 2: FOIA (b)(6) Phone: Type: Line 3: Line 4: Case Notes No. Author Date Created Subject 1 NVC 24-APR-2002 Text loaded from NVC PETITIONER SSN & DOB: FOIA (b)(6) X-REFERENCED NAME = RUTH ARISTOR Applicant ID: 1 A-Number: A56064388 N/C Status: X Applicant Status: Open Surname: MILEON Given Name: CHARITE POB:HAT City: PORT-AU-PRINCE Region: DOB: 12-MAY-1906 Gender: Female Rel To P/A: P/A FSC: HAT Occupation: Previous INS No.: Acc/Join: Accompanying P/A Adjudication Status: NA Adjudication Date: Adjudicated By: Visa Symbol: Authorized By: Issuance Date: Issued By: Clearance Destination Resp Request Received Followup Ind Date Date Date Type Text FNC N 20-DEC-2001 20-DEC-2001 ** This Report Contains Only IV Data. ** Page 69 of 80"
}