{
  "anumber": "A56035718",
  "id": "A56035718_0025",
  "page_index": 25,
  "resources": {
    "full_jpg": "https://dctn4zjpwgdwdiiy5odjv7o2se0bqgjb.lambda-url.us-east-1.on.aws/iiif/3/og-2023-kc-nara_A56035718_0025/full/max/0/default.jpg"
  },
  "fields": {
    "sex": {
      "ms_sex_llm_v1": "male"
    },
    "doctype": {
      "ms_doctype_v1": "form"
    },
    "form_title": {
      "ms_form_title_llm_v1": "Accountability Report, Report 71 - Ca"
    },
    "countries": {
      "ms_countries_nlp_v1": [
        "Haiti"
      ]
    },
    "years": {
      "ms_years_nlp_v1": [
        1906,
        2023,
        2001,
        2002
      ]
    }
  },
  "is_g325a": false,
  "is_cert_naturalization": false,
  "full_text": "Screened by NARA, 9/14/2023 Report 71 - Ca Accountability Report Post: PTP Requested By: MJLAF Date/Time Prepared: 11-JUN-2002 08:50 Case: PTP2001719036 P/A Name: LOUIS XVI, MICHEL DIT TRAGE Cross Reference: N Packet 3A Sent: Case Applicants Interview Status: Fail To Show Up Packet 3 Sent: 24-SEP-2001 Derogatory Info: Total: 1 Transfered To: Date: Of230 P1 Received: 05-MAR-2002 Provisional: N App Over 16: 1 Received From: NVC Date: 13-MAR-2002 Has Docs (OF-230 P2): 05-MAR-2002 Namecheck Stat: SP Issued: 0 Termination Letter 1: Doc Qualified: 05-MAR-2002 Post Clearance: X Refused: 0 Termination Letter 2: Reported Qualified: FBI Clearances: NP Traveling: 1 Packet 4 Sent: 01-APR-2002 Finger Print: Will Join: 0 Purge Date: Packet 4A Sent: Used X Charge Foreign State Visa Class Priority Date Visas Frog: X HAT IR5 27-NOV-2000 Last Contact: 01-APR-2002 Interview Date: 10-JUN-2002 Time: 07:00 Medical Appt. Time: Address Use Indicator: Letter Language: English Applicant Address Information Name: MICHEL DIT TRAGE LOUIS XVI Line 1: DELMAS 18 Phone: Line 2: RUE PEAN #26 Line 3: PORT-AU-PRINCE Line 4: HAITI Lawyer's Address/Name Information Name: Line 1: Phone: Line 2: Line 3: Line 4: Petitioner's Address Information Name: BAZILE, ODETTE Line 1: 6211 NW 18TH PL Phone: Line 2: SUNRISE FL33313 Type: Line 3: Line 4: Case Notes No. Author Date Created Subject 1 NVC 20-MAR-2002 Text loaded from NVC PETITIONER SSN & DOB: FOIA (b)(6) Critical Fields Changed Date/Time / Old Value / Applied to Changed By Critical Field New Value Applicant 01-APR-2002 13:27 INTERVIEW_APPOINTMENT_DTE_TM GERDESDB GERDES, DOMINIQUE B 10-JUN-02 26-MAR-2002 12:54 DOC_QUALIFIED_DTE BERNARDJEBERNARD, JANE EILEEN 05-MAR-02 Applicant ID: 1 A-Number: A56035718 N/C Status: X Applicant Status: Open Surname: LOUIS XVI Given Name: MICHEL DIT TRAGE POB:HAT City: MOUSTIQUE Region: DOB: 18-MAR-1906 Gender: Male Rel To P/A: P/A FSC: HAT Occupation: UNR Previous INS No.: Acc/Join: Accompanying P/A Adjudication Status: NA Adjudication Date: Adjudicated By: Visa Symbol: IR5 Authorized By: ** This Report Contains Only IV Data. ** Page 1 of 2"
}