{
  "anumber": "A56126907",
  "id": "A56126907_0003",
  "page_index": 3,
  "resources": {
    "full_jpg": "https://dctn4zjpwgdwdiiy5odjv7o2se0bqgjb.lambda-url.us-east-1.on.aws/iiif/3/og-2023-kc-nara_A56126907_0003/full/max/0/default.jpg"
  },
  "fields": {
    "sex": {
      "ms_sex_llm_v1": "male"
    },
    "doctype": {
      "ms_doctype_v1": "form"
    },
    "form_title": {
      "ms_form_title_llm_v1": "U.S. IMMIGRATION AND NATURALIZATION SERVICE, I-4"
    },
    "countries": {
      "ms_countries_nlp_v1": [
        "Haiti",
        "United States"
      ]
    },
    "years": {
      "ms_years_nlp_v1": [
        2023,
        2003,
        2002
      ]
    }
  },
  "is_g325a": false,
  "is_cert_naturalization": false,
  "full_text": "Screened by NARA, 8/11/2023 OPTIONAL FORM 155B (REV. 11-95) ees DEPT OF STATE 50155-301 RICA IV- 48382619 IMMIGI RATION 12/12/2002 SRC-03-052-50141 SRCMLW01 A56126907 (Family Name) (First Name) (Middle Name) GOMAN, FLORVILUS INS FICE F KNOWN CA - 212 [2]] ACTION BY IMMIGRATION INSPECTOR THE IMMIGRANT NAMED ABOVE ARRIVED IN THE UNITED INELIGIBILITY FOR VISA WAIVED UNDER SECTION STATES VIA (Name of vessel or flight no. of arrival) U.S. IMMIGRATION 060 MIA 3103 AA1646 GENDER: ADMITTI ED MALE DEC 0.3 2002 CITY AND COUNTRY OF BIRTH DAY-MO-YR OF BIRTH BORGNE, HAITI 14FEB1901 CITY AND COUNTRY OF LAST RESIDENCE NATIONALITY CLASS UNTIL PORT AU PRINCE, HAITI HAITI MARITAL STATUS MOTHER'S FIRST NAME FATHER'S FIRST NAME MARRIED JULIENNE BARRON FINAL ADDRESS STREET ADDRESS, INCLUDE- IN CARE OF & APT# F APPLICABLE CITY, STATE, AND ZIP CODE IN THE UNITED STATES FOIA (b)(6) FOIA (b)(6) SEC. 212(a)(5)(A) OCCUPATION NOT REQUIRED This visa is issued under Section 221 of the Immigration and Nationality Act, and upon the basis of the facts stated in the application. Possession of a visa does not entitle the bearer to enter the United States if at the time he seeks to enter he is found to be inadmissible. Upon arrival in the United States, it must be surrendered to a United States Immigration Officer. IMMIGRANT CLASSIFICATION CLASSIFICATION SYMBOL AMERICAN U.S. EMBASSY IR5 FOREIGN STATE/OTHER AREA LIMITATION AT PORT AU PRINCE, HAITI HAITI you PTP200176705401 ISSUED ON (Day) (Month) (Year) Consular Officer of the United States of America 26NOV2002 THE VALIDITY OF THIS VISA EXPIRES MIDNIGHT AT THE END OF (Day) (Month) (Year) 25MAY2003 PASSPORT NO HAI19147 OR OTHER TRAVEL DOCUMENTS (Describe) RESERVED ISSUED TO: ISSUED BY: UNITED STATES ISSUED ON: 09SEP2002 EXPIRES ON:09SEP2007 Tariff No. 21 Fee Paid $ or Local Currency Equivalent PRO A56126907 IV- 48382619 ACTION OF I.J. ACTION ON APPEAL TEMNORARY EVIDENCE OF MIAMI QUARANTINE LAWFUL, ADMISSION FOR PERMANENT RESIDENCE VALID Dec 02,2003 DEC 4 2002 DEC 10 2002 MIAMI, FLORIDA ELMORE,"
}