{
  "anumber": "A58402012",
  "id": "A58402012_0024",
  "page_index": 24,
  "resources": {
    "full_jpg": "https://dctn4zjpwgdwdiiy5odjv7o2se0bqgjb.lambda-url.us-east-1.on.aws/iiif/3/og-2023-kc-nara_A58402012_0024/full/max/0/default.jpg"
  },
  "fields": {
    "sex": {
      "ms_sex_llm_v1": "female"
    },
    "doctype": {
      "ms_doctype_v1": "form"
    },
    "form_title": {
      "ms_form_title_llm_v1": "Petition for Alien Relative"
    },
    "countries": {
      "ms_countries_nlp_v1": [
        "Haiti",
        "United States"
      ]
    },
    "years": {
      "ms_years_nlp_v1": [
        2004,
        2005,
        2023
      ]
    }
  },
  "is_g325a": false,
  "is_cert_naturalization": false,
  "full_text": "Screened by NARA, 9/13/2023 U.S. Department of Justice OMB #1115-0054 Immigration and Naturalization Service Petition for Alien Relative DO NOT WRITE IN THIS BLOCK - FOR EXAM A# Action Stamp PTP2005582026C Section of Law/Visa Category APPROVED 201(b) Spouse IR-1/CR-1 I.N.S. DISTRICT DIRECTOR 201(b) Child IR-2/CR-2 11/08/2004 EAC-05-020-51428 EACLRM01 201(b) Parent IR-5 203(a)(1) Unm. S or - F1-1 203(a)(2)(A)Spouse F2-1 MAR 8 2005 Petition was filed on: (priority date) 203(a)(2)(A) Child F2-2 Recommended by: Lin Personal Interview Pet. Ben. A\" 11-5-04 File Reviewed Previously Forwarded 203(a)(2)(B) Unm. S or D - F2-4 I-485 Filed/Simultaneously 203(a)(3) Married S or D F3-1 VSC 1 12091 Field Investigation 204(g) Resolved BIS 203(a)(4) Brother/Sister - F4-1 203(a)(2)(A) Resolved 203(g Resolved 2-10-05 Remarks: IRS A. Relationship You are the petitioner; your relative is the beneficiary. 1. I am filing this petition for my: 1672 NR Husband/Wife Parent Brother/Sister Child FOIA (b)(6) B. Information about you C. Information about your relative Name (Family name in CAPS) (First) (Middle) FOIA (b)(6) JEAN LAMERCE CLAMERCIE CYLOTTE : Address (Number and Street) (Apt. No.) c/o Florence Jean # 134 Lalue (Town or City) (State/Country) (Zip/Postal Code) Port-au Prince Haiti(WII) 1. Place of Birth (Town or City) (State (Country) Port-de-Pain Haiti I. Date of Birth 5. Gender 6. Marital Status (Month/Dav/Year) Male Married Single 3/12/14 Female Widowed Divorced . Other Names Used (including maiden name) oth villard/ VILLARD Date and Place of Present Marriage (if married) mall Villard : Social Security Number (if any) 10. Alien Registration Number 79 6 no - 1. Name(s) of Prior Husband(s)/Wive(s) 12. Date(s) Marriage(s) Ended Raymond Jean 5/25/72 3. Has your relative ever been in the U.S.? Yes No 4. If your relative is currently in the U.S., complete the following: He or she arrived as a:: (visitor, student, stowaway, without inspection, etc.) Arrival/Departure Record (I-94) Date arrived (Month/Day/Year) Date authorized stay expired, or will expire, as shown on Form I-94 or I-95 14a. If you are a lawful permanent resident alien, complete the 15. Name and address of present employer (if any) following: Date and place of admission for, or adjustment to, lawful permanent residence and class of admission. Date this employment began (Month/Day/Year) 16. Has your relative ever been under immigration proceedings? 14b. Did you gain permanent resident status through marriage to a United States citizen or lawful permanent resident? No Yes Where When Yes No Removal Exclusion/Deportation Recission Judicial Proceedings INITIAL RECEIPT RESUBMITTED RELOCATED: Rec'd Sent COMPLETED: Appv'd Denied Ret'd Form I-130 (Rev. 06/05/02) Y"
}