{
  "anumber": "A58402012",
  "id": "A58402012_0004",
  "page_index": 4,
  "resources": {
    "full_jpg": "https://dctn4zjpwgdwdiiy5odjv7o2se0bqgjb.lambda-url.us-east-1.on.aws/iiif/3/og-2023-kc-nara_A58402012_0004/full/max/0/default.jpg"
  },
  "fields": {
    "sex": {
      "ms_sex_llm_v1": "female"
    },
    "doctype": {
      "ms_doctype_v1": "form"
    },
    "form_title": {
      "ms_form_title_llm_v1": "APPLICATION FOR IMMIGRANT VISA AND ALIEN REGISTRATION"
    },
    "countries": {
      "ms_countries_nlp_v1": [
        "Haiti",
        "United States"
      ]
    },
    "years": {
      "ms_years_nlp_v1": [
        1919,
        1946,
        2007,
        2004,
        1914,
        1953,
        2023,
        1947
      ]
    }
  },
  "is_g325a": false,
  "is_cert_naturalization": false,
  "full_text": "Screened by NARA, 9/13/2023 ATP20055-82026 U.S. Department of State OMB APPROVAL NO. 1405-0015 EXPIRES: 07/31/2007 ESTIMATED BURDEN: 1 HOUR* (See Page 2) APPLICATION FOR IMMIGRANT VISA AND ALIEN REGISTRATION PART I - BIOGRAPHIC DATA INSTRUCTIONS: Complete one copy of this form for yourself and each member of your family, regardless of age, who will immigrate with you. Please print or type your answers to all questions. Mark questions that are Not Applicable with \"N/A\". If there is insufficient room on the form, answer on a separate sheet using the same numbers that appear on the form. Attach any additional sheets to this form. WARNING: Any false statement or concealment of a material fact may result in your permanent exclusion from the United States. This form (DS-230 PART I) is the first of two parts. This part, together with Form DS-230 PART II, constitutes the complete Application for Immigrant Visa and Alien Registration. 1. Family Name First Name Middle Name JEAN LAMERCIE CYLOTTE 2. Other Names Used or Aliases (If married woman, give maiden name) VILLARD 3. Full Name in Native Alphabet (If Roman letters not used) 4. Date of Birth (mm-dd-yyyy) 5. Age 6. Place of Birth 03/12/1914 92 (City or town) (Province) (Country) Port-de-Paix HAITI 7. Nationality (If dual national, 8. Gender 9. Marital Status give both) Male Single (Never married) Married Widowed HAITIAN Divorced Separated Female Including my present marriage, I have been married times. 10. Permanent address in the United States where you intend to live, if known (street address 11. Address in the United States where you want your Permanent including zip code). Include the name of a Resident Card (Green person who currently lives there Card) mailed, if different from address in item #10 (include the name of a person who currently lives there). FOIA (b)(6) Te Telephone number: 12. Tour Present Occupation 13. Present Address (Street Address) (City or Town) (Province) (Country) Retired 134 LALUE Port-an-Prince, - Haiti Telephone number: Home 509-238-3971 N/A 14. Name of Spouse (Maiden or family name) First Name Middle Name JEAN JOACHIM RAYMOND Date (mm-dd-yyyy) and place of birth of spouse: 09/14/1919 Port-au-Prince Address of spouse (If different from your own): Spouse's occupation! Businessman/Owner: bakery cafe Date of marriage (mm-dd-yyyy): 03/30/1946 15. Father's Family Name First Name Middle Name VILLARD SAMUEL 16. Father's Date of Birth (mm-dd-yyyy) Place of Birth Current Address Port-de-Paix If deceased, give year of death Not Known N/A 1947 17. Mother's Family Name at Birth First Name Middle Name PROPHETE PROPHELINE 18. Mother's Date of Birth (mm-dd-yyyy) Place of Birth Current Address Not known Bassin Bleu (Port-de-Paix N/A If deceased, give year of death 1953 DS-230 Part I THIS FORM MAY BE OBTAINED FREE AT CONSULAR OFFICES OF THE UNITED STATES OF AMERICA 07-2004 PREVIOUS EDITIONS OBSOLETE Page 1 of 4"
}