{
  "anumber": "A70370800",
  "id": "A70370800_0011",
  "page_index": 11,
  "resources": {
    "full_jpg": "https://dctn4zjpwgdwdiiy5odjv7o2se0bqgjb.lambda-url.us-east-1.on.aws/iiif/3/og-2023-kc-nara_A70370800_0011/full/max/0/default.jpg"
  },
  "fields": {
    "sex": {
      "ms_sex_llm_v1": "female"
    },
    "doctype": {
      "ms_doctype_v1": "form"
    },
    "form_title": {
      "ms_form_title_llm_v1": "U.S. Department of Justice Immigration and Naturalization Service, G-325A"
    },
    "countries": {
      "ms_countries_nlp_v1": [
        "Kenya",
        "United States",
        "Somalia"
      ]
    },
    "years": {
      "ms_years_nlp_v1": [
        1992,
        2023
      ]
    },
    "g325a": {
      "occupation": {
        "occupation_llm_v1": "[' merchant', 'barwaq stores (owner)']"
      },
      "reason": {
        "reason_llm_v1": "NATURALIZATION"
      },
      "nationality": {
        "nationality_llm_v1": "somali"
      }
    }
  },
  "is_g325a": true,
  "is_cert_naturalization": false,
  "full_text": "Screened by NARA, 7/21/2023 *U.S. GPO: 1988-213-342 For sale by the Superintendent of Documents, U.S. Government Printing Office, Washington D.C. 20402 (Per U.S. Department of Justice FORM G-325A CMB No. 1115-0066 Immigration and Naturalization Service BIOGRAPHIC INFORMATION (Family name) (First name) (Middle Name) MALE BIRTHDATE(Mo.-Day-Yr.) NATIONALITY FILE NUMBER AHMED MOHAMED HAGI FEMALE SOMALi A ALL OTHER NAMES USED (including names by previous marriages) CITY AND COUNTRY OF BIRTH SOCIAL SECURITY NO. N/A GALKAYO/SOMALIA (if any) FAMILY NAME FIRST NAME DATE, CITY AND COUNTRY OF BIRTH (if FATHER BATANNED known): CITY AND COUNTRY OF RESIDENCE AHMED SOMALIA DECEASED MOTHER (Maiden name) DINI HALIMO SOMALIA DECEASED HUSBAND (if none, so state) FAMILY NAME FIRST NAME BIRTHDATE CITY & COUNTRY OF BIRTH DATE OF MARRIAGE PLACE OF MARRIAGE OR (for wife. give maiden name) 1 WIFE FOIA (b)(6) FORMER HUSBANDS OR WIVES (if none, so state) FIRST NAME BIRTHDATE DATE & PLACE OF MARRIAGE DATE AND PLACE OF TERMINATION OF FAMILY NAME (For wife, give maiden name) MARRIAGE FOIA (b)(6) APPLICANT'S RESIDENCE LAST FIVE YEARS. LIST PRESENT ADDRESS FIRST. FROM TO STREET AND NUMBER CITY PROVINCE OR STATE COUNTRY MONTH YEAR MONTH YEAR 7 SUNGURA ROAD NAIROBI KENYa 07 92 PRESENT TIME BULO HAWO BYLO-HAWO GEDO SOMALIA 01 91 05 92 NASIB-BUNDO St MOGADISH BENADIR SOMAHA 07 87 01 91 APPLICANT'S LAST ADDRESS OUTSIDE THE UNITED STATES OF MORE THAN ONE YEAR FROM TO STREET AND NUMBER CITY PROVINCE OR STATE COUNTRY MONTH YEAR MONTH YEAR N/A N/A N/A N/A APPLICANT'S EMPLOYMENT LAST FIVE YEARS. (IF NONE, so STATE.) LIST PRESENT EMPLOYMENT FIRST FROM TO FULL NAME AND ADDRESS OF EMPLOYER OCCUPATION (SPECIFY) MONTH YEAR MONTH YEAR BARWAQO StoRES (OWNER) MERCHANT 07 87 PRESENT TIME 01 91 Show below last occupation abroad if not shown above. (Include all information requested above.) N/A THIS FORM IS SUBMITTED IN CONNECTION WITH APPLICATION FOR: SIGNATURE OF APPLICANT DATE NATURALIZATION STATUS AS PERMANENT RESIDENT OTHER (SPECIFY): x 06 NOV 1992 IF YOUR NATIVE ALPHABET IS IN OTHER THAN ROMAN LETTERS WRITE YOUR NAME IN YOUR NATIVE ALPHABET IN THIS SPACE Are all copies legible? Yes PENALTIES: SEVERE PENALTIES ARE PROVIDED BY LAW FOR KNOWINGLY AND WILLFULLY FALSIFYING OR CONCEALING A MATERIAL FACT. APPLICANT: BE SURE TO PUT YOUR NAME AND ALIEN REGISTRATION NUMBER IN THE BOX OUTLINED BY HEAVY BORDER BELOW COMPLETE THIS BOX (Family name) (Given name) (Middle name) (Alien registration number) AHMED MOHAMED HAGI Superscenders of Dave month 0.6 Government Form G-325 A (Rev. 10-182) (1) Ident."
}