{
  "anumber": "A71600737",
  "id": "A71600737_0025",
  "page_index": 25,
  "resources": {
    "full_jpg": "https://dctn4zjpwgdwdiiy5odjv7o2se0bqgjb.lambda-url.us-east-1.on.aws/iiif/3/og-2023-kc-nara_A71600737_0025/full/max/0/default.jpg"
  },
  "fields": {
    "sex": {
      "ms_sex_llm_v1": "female"
    },
    "doctype": {
      "ms_doctype_v1": "form"
    },
    "form_title": {
      "ms_form_title_llm_v1": "Petition for Alien Relative, Form 1-30 ( Rev. ( 10/89) USINS"
    },
    "countries": {
      "ms_countries_nlp_v1": [
        "Honduras"
      ]
    },
    "years": {
      "ms_years_nlp_v1": [
        1992,
        2023
      ]
    }
  },
  "is_g325a": false,
  "is_cert_naturalization": false,
  "full_text": "Screened by NARA, 7/20/2023 U.S. Department of Justice OMB #1115-0054 Immigration and Naturalization Service (INS) Petition for Alien Relative DO NOT WRITE IN THIS BLOCK - FOR EXAMINING OFFICE ONLY Case ID# Action Stamp Fee Stamp A# 0053 006 R 1 12/19/91 8:24 G-28 or Volag # APPROVED I130 75.00 INS DISTRICT DIRECTOR Section of Law: Petition was filed on: (priority date) 201 (b) spouse 203 (a)(1) AUG t 1 1992 Personal Interview Previously Forwarded 201 (b) child 203 (a)(2) Pet. Ben. \"A\" File Reviewed Stateside Criteria 201 (b) parent 203 (a)(4) 203 (a)(5) Field Investigations I-485 Simultaneously AM CON: 204 (a)(2)(A) Resolved 204 (h) Resolved Remarks: A. Relationship 1. The alien relative is my 2. Are you related by adoption? 3. Did you gain permanent residence through adoption? Husband/Wife Parent Brother/Sister Child FOIA (b)(6) B. Information about you C. Information about your alien relative 1. Name (Family name in CAPS) (First) (Middle) 1. Name (Family-name in CAPS) (First) (Middle) FOIA (b)(6) DIAZ MANUEL DE JESUS 2. Address (Number and Street) (Apartment Number) 2. Address (Number and Street) (Apartment Number) FOIA (b)(6) 8 Ave. S.O. 5 & 6 Calle #40/ (Town or City) (State/Country) (ZIP/Postal Code) (Town or City) (State/Country) (ZIP/Postal Code) FOIA (b)(6) Barrio el Benque San Pedro Sula (HONDURA 3. Place of Birth (Town or City) (State/Country) 3. Place of Birth (Town or City) (State/Country) S) FOIA (b)( Honduras Sinuapa Ocotepeque Honduras C.A 4. Date of Birth 5. Sex 6. Marital Status 4. Date of Birth 5. Sex 6. Marital Status FOIA (b)(6) (Mo/Day/Yr) lale FOIA Married FOIA (b)(6) Single (Mo/Day/Yr) Male Married Single FOIA (b)(6) emale Widowed Divorced 01/09/10 Female Widowed Divorced 7. Other Names Used (including maiden name) 7. Other Names Used (including maiden name) FOIA (b)(6) NONE 8. Date and Place of Present Marriage (if married) 8. Date and Place of Present Marriage (if married) 11/17/59 FOIA (b)(6) Honduras - Cortes San Pedro Sula 9. Social Security Number 10. Alien Registration Number (if anv) 9. Social Security Number 10. Alien Registration Number (if any) FOIA (b)(6) FOIA (b)(6) A71600737 11. Names of Prior Husbands/Wives 12. Date(s) Marriages(s) Endea 11. Names of Prior Husbands/Wives 12. Date(s) Marriages(s) Ended FOIA (b)(6) None 13. If you are a U.S. citizen, complete the following: 13. Has your relative ever been in the U.S.? Yes No FOIA (b)(6) 14. If your relative is currently in the U.S., complete the following: He or she last arrived as a (visitor, student, stowaway, without inspection, etc.) CA Arrival/Departure Record (I-94) Number Date rrived_(Month/Day/Year) 4 5 2 52 6 3 0 09/15/91 Date authorized stay expired, or will expire, as shown on Form I-94 or I-95 MARCH 14, 1992 15. Name and address of present employer (if any) 14a. If you are a lawful permanent resident alien, complete the following: None Date and place of admission for, or adjustment to, lawful permanent residence, Date this employment began (Month/Day/Year) and class of admission: N/A 16. Has you relative ever been under immigration proceedings? 14b. Did you gain permanent resident status through marriage to a United Yes No Where When seen States citizen or lawful permanent resident Certified a true and correct copy. FOIA (b)(6) Exclusion Deportation Recission Judicial Proceedings FOIA (b)(6) INITIAL RECEIPT RESUBMITTED RELOCATED COMPLETED Rec'd Sent Approved Denied Returned Contact Representative USINS Form 1-130 (Rev. 10/01/89). Information Officer, USINS"
}