{
  "anumber": "A71600737",
  "id": "A71600737_0016",
  "page_index": 16,
  "resources": {
    "full_jpg": "https://dctn4zjpwgdwdiiy5odjv7o2se0bqgjb.lambda-url.us-east-1.on.aws/iiif/3/og-2023-kc-nara_A71600737_0016/full/max/0/default.jpg"
  },
  "fields": {
    "sex": {
      "ms_sex_llm_v1": "male"
    },
    "doctype": {
      "ms_doctype_v1": "form"
    },
    "form_title": {
      "ms_form_title_llm_v1": "Application for Permanma. Residence, I-485"
    },
    "countries": {
      "ms_countries_nlp_v1": [
        "Honduras"
      ]
    },
    "years": {
      "ms_years_nlp_v1": [
        2023
      ]
    }
  },
  "is_g325a": false,
  "is_cert_naturalization": false,
  "full_text": "Screened by NARA, 7/20/2023 U.S. Department of Justice Immigration and Naturalization Service (IN Application for Permane Residence OMB # 1115-0053 DO NOT WRITE IN THIS BLOCK Case ID# Action Stamp Fee Stamp 0053 006 R 1 12/19/91 8:24 All 71600737 I485 120.00 G-28 or Volag# Section of Law Eligibility Under Sec. 245 Sec. 209(b). INA Sec. 214(d). INA free Approved Visa Petition Dependent of Principal Alien Sec. 13, Act of 9/11/57 Special Immigrant Sec. 245. INA Other Sec. 249, INA Country Chargeable Preference A. Reason for this application I am applying for lawful permanent residence for the following reason: (check the box that applies) 1. An Immigrant visa number is Immediately available to me because A visa petition has already been approved for me (approval notice is attached) A visa petition is being filed with this application 2. I entered as the flance(e) of a U.S. citizen and married within 90 days (approval notice and marriage certificate are attached) 3. I am an asylee eligible for adjustment 4. Other: B. Information about you 1. Name (Family name in CAPS) (First) (Middle) 11. On what date did you last enter the U.S.? MANUEL DE JESUS DIAZ 09/15/91 2. Address (Number and Street) (Apartment Number) 12. Where did you last enter the U.S.? (City and State) 8609 Lubao Ave. Los Angeles, CAlifornia (Town or City) (State/Country) (ZIP/Postal Code) 13. What means of travel did you use? (Plane, car, etc.) Canoga Park, California 91306 Plane 3. Place of Birth (Town or City) (State/Country) 14. Were you inspected by a U.S. immigration officer? Sinuapa, Ocotepeque, Honduras, C.A. Yes No 4. Date of Birth 5. Sex 6. Marital Status 15. In what status did you last enter the U.S.? (Mo/Day/Yr) X Male Married Single (Visitor, student, exchange alien, crewman, temporary worker, without inspection, etc.) 01/10/10 Female Widowed Divorced Visitor 7. Social Security Number 8. Allen Registration Number (if any) 16. Give your name EXACTLY as it appears on your Arrival/Departure A71600737 Record (Form I-94). 9. Country of Citizenship MANUEL DIAZ Honduras, C.A. 17. Arrival/Departure Record (1-94) Number 18. Visa Number 10. Have you ever applied for permanent resident status in the U.S.? Yes No 4 1 5 2 5 2 6 31 0 2 003313 1/7/91 (If Yes, give the date and place of filing and final disposition) 19. At what Consulate was your nonimmigrant visa issued? Date (Mo/Day/Yr) 20. Have you ever been married before? Yes No If Yes, (Names of prior husbands/wives) (Country of citizenship) (Date marriage ended) 21. Has your husband/wife ever been married before? Yes No If Yes. (Names of prior husbands/wives) (Country of citizenship) (Date marriage ended) INITIAL RECEIPT RESUBMITTED RELOCATED COMPLETED Rec'd Sent Approved Denied Returned FORM I-485 (REV. 2-27-87)N"
}