{
  "anumber": "A71833821",
  "id": "A71833821_0020",
  "page_index": 20,
  "resources": {
    "full_jpg": "https://dctn4zjpwgdwdiiy5odjv7o2se0bqgjb.lambda-url.us-east-1.on.aws/iiif/3/og-2023-kc-nara_A71833821_0020/full/max/0/default.jpg"
  },
  "fields": {
    "sex": {
      "ms_sex_llm_v1": "male"
    },
    "doctype": {
      "ms_doctype_v1": "form"
    },
    "form_title": {
      "ms_form_title_llm_v1": "U.S. Department of Justice Immigration and Naturalization Service BIOGRAPHIC INFORMATION, G-325 A ( (Rev. 10-1-82)"
    },
    "countries": {
      "ms_countries_nlp_v1": [
        "United States",
        "El Salvador"
      ]
    },
    "years": {
      "ms_years_nlp_v1": [
        1992,
        1993
      ]
    },
    "g325a": {
      "occupation": {
        "occupation_llm_v1": "[' retired', 'teacher - public school']"
      },
      "reason": {
        "reason_llm_v1": "ALIEN RELATIVE"
      },
      "nationality": {
        "nationality_llm_v1": "Salvadoran"
      }
    }
  },
  "is_g325a": true,
  "is_cert_naturalization": false,
  "full_text": "U.S. Department of Justice Screened FORM G-325A OMB No. 1115-0066 Immigration and Naturalization Service BIOGRAPHIC INFORMATION (Family name) (First name) (Middle name) MALE BIRTHDATE(Mo.-Day-Yr.) NATIONALITY FILE NUMBER DE VIDES MARGARITA MORENO FEMALE 6511 SALVADORAN A NONE ALL OTHER NAMES USED (Including names by previous marriages) CITY AND COUNTRY OF BIRTH s ANTA SOCIAL SECURITY NO. NONE ANA EL SALVADOR (If any) NONE FAMILY NAME FIRST NAME DATE, CITY AND COUNTRY OF BIRTH(If known) CITY AND COUNTRY OF RESIDENCE MORENO LULS DECEASE?) FATHER MOTHER (Maiden name) ROJAS HIGINIA DECEASED HUSBAND (If none, so state) FAMILY NAME FIRST NAME BIRTHDATE CITY & COUNTRY OF BIRTH DATE OF MARRIAGE PLACE OF MARRIAGE OR (For wife, give maiden name) WIFE NONE FORMER HUSBANDS OR WIVES(if none,s state) FAMILY NAME (For wife, give maiden name) FIRST NAME BIRTHDATE DATE & PLACE OF MARRIAGE DATE AND PLACE OF TERMINATION OF MARRIAGE NONE APPLICANT'S RESIDENCE LAST FIVE YEARS. LIST PRESENT ADDRESS FIRST. FROM TO STREET AND NUMBER CITY PROVINCE OR STATE COUNTRY MONTH YEAR MONTH YEAR 563 PECKAN DR LAPUEWTE CALIFORNIA USA 9 92 PRESENT TIME COLUNIA 5 AN LUIS SANTA EL SALVADOR EL 9 72 9 92 PASAJE F # 7 ANA SALVANOR APPLICANT'S LAST ADDRESS OUTSIDE THE UNITED STATES OF MORE THAN ONE YEAR FROM TO STREET AND NUMBER PASANE CITY PROVINCE OR STATE COUNTRY MONTH YEAR MONTH YEAR SANTA BL COLONIA SAWLUIS F47 ANA ELSMINADOR SALVADOR 9 72 992 APPLICANT'S EMPLOYMENT LAST FIVE YEARS. (IF NONE, so STATE.) LIST PRESENT EMPLOYMENT FIRST FROM TO FULL NAME AND ADDRESS OF EMPLOYER OCCUPATION (SPECIFY) MONTH YEAR MONTH YEAR TEACHER- PUBLIC S CHOOL TEMINER 959 PRESENT TIME SANTA ANA Show below last occupation abroad if not shown above. (Include all information requested above.) THIS FORM IS SUBMITTED IN CONNECTION WITH APPLICATION FOR: SIGNATURE OF APPLICANT DATE NATURALIZATION STATUS AS PERMANENT RESIDENT / 393 OTHER (SPECIFY): ALIEN RELATIVE IF YOUR NATIVE ALPHABET IS IN OTHER THAN ROMAN LETTERS. WRITE YOUR NAME IN YOUR KATIVE ALPHABET in THIS SPACE: Are all copies legible? Yes NOT APPLICABLE PENALTIES: SEVERE PENALTIES ARE PROVIDED BY LAW FOR KNOWINGLY AND WILLFULLY FALSIFYING OR CONCEALING A MATERIAL FACT. JUN 1993 APPLICANT: BE SURE TO PUT YOUR NAME AND ALIEN REGISTRATION NUMBER IN THE BOX OUTLINED BY HEAVY BORDER BELOW. COMPLETE THIS BOX (Family name) (Given name) (Middle name) (Alien registration number) DE VIDES MARGARITA MORENO A71833821 LOS T/C : 245 JUN 0.8 1992 (DATE Form G-325 A (Rev. 10-1-82) (8) Ident."
}