{
  "anumber": "A71833821",
  "id": "A71833821_0009",
  "page_index": 9,
  "resources": {
    "full_jpg": "https://dctn4zjpwgdwdiiy5odjv7o2se0bqgjb.lambda-url.us-east-1.on.aws/iiif/3/og-2023-kc-nara_A71833821_0009/full/max/0/default.jpg"
  },
  "fields": {
    "sex": {
      "ms_sex_llm_v1": "female"
    },
    "doctype": {
      "ms_doctype_v1": "form"
    },
    "form_title": {
      "ms_form_title_llm_v1": "Application for Permanent Residence, 1115-0053"
    },
    "countries": {
      "ms_countries_nlp_v1": [
        "El Salvador"
      ]
    },
    "years": {
      "ms_years_nlp_v1": [
        1993,
        2023
      ]
    }
  },
  "is_g325a": false,
  "is_cert_naturalization": false,
  "full_text": "Screened by NARA, 5/5/2023 U.S. Department of Justice OMB # 1115-0053 Immigration and Naturalization Service (INS) Application for Permanent Residence DO NOT WRITE IN THIS BLOCK Case ID# Action Stamp Fee Stamp A# 71833821 APPROVED INS DISTRICT DIRECTOR G-28 or Volag# Section of Law JUN 15 1993 Eligibility Under Sec. Sec. 209(b). INA Sec. 214(d), INA Sec. 13, Act of 9/11/57 LOS Garn by 4385 Approved Visa Petiting 004 01/04/93 12:44 120.00 1485 Recommended Dependent of Principal Alien Special Immigrant Sec. 245. INA Other Sec. 249, INA Country Chargeable Preference A. Reason for this application I am applying for lawful permanent residence for the following reason: (check the box that applies) 1. An immigrant visa number is immediately available to me because A visa petition has already been approved for me (approval notice is attached) A visa petition is being filed with this application 2. I entered as the flance(e) of a U.S. citizen and married within 90 days (approval notice and marriage certificate are attached) 3. I am an asylee eligible for adjustment 4. Other: B. Information about you 7/1 1. Name (Family name in CAPS) (First) (Middle) 11. On what date did you last enter the U.S.? de Vides Margarita M. 9-14-92 2. Address (Number and Street) (Apartment Number) 12. Where did you last enter the U.S.? (City and State) 563 Peekam Dr hos Angeles CA . (Town or City) (State/Country) (ZIP/Postal Code) 13. What means of travel did you use? (Plane, car, etc.) La Puente CA. 91746 Plane 3. Place of Birth (Town or City) (State/Country) 14. Were you inspected by a U.S. immigration officer? Santa ana FI Salvador Yes No 4. Date of Birth 5. Sex 6. Marital Status 15. In what status did you last enter the U.S.? (Mo/Day/Yr) Male Married Single (Visitor, student, exchange alien, crewman, temporary worker, without inspection, etc.) 6-5-1911 Female Widowed Divorced Visitor 7. Social Security Number 8. Alien Registration Number (if any) 16. Give your name EXACTLY as it appears on your Arrival/Departure A71833821 Record (Form 1-94). 9. Country of Citizenship Margarita Moreno 17. Arrival/Departure Record (I-94) Number 18. Visa Number 10. Have you ever applied for permanent resident status in the U.S.? Yes x No 282 82456703 (If Yes, give the date and place of filing and final disposition) 19. At what Consulate was your nonimmigrant visa issued? Date (Mo/Day/Yr) El Salvador 9/9/92 20. Have you ever been married before? Yes No If Yes, (Names of prior husbands/wives) (Country of citizenship) (Date marriage ended) N/A N/A N/A 21. Has your husband/wife ever been married before? Yes No If Yes, (Names of prior husbands/wives) (Country of citizenship) (Date marriage ended) N/A N/A N/A INITIAL RECEIPT RESUBMITTED RELOCATED COMPLETED Rec'd Sent Approved Denied Returned FORM I-485 (REV. 2-27-87)N"
}