{
  "anumber": "A71817091",
  "id": "A71817091_0005",
  "page_index": 5,
  "resources": {
    "full_jpg": "https://dctn4zjpwgdwdiiy5odjv7o2se0bqgjb.lambda-url.us-east-1.on.aws/iiif/3/og-2023-kc-nara_A71817091_0005/full/max/0/default.jpg"
  },
  "fields": {
    "sex": {
      "ms_sex_llm_v1": "female"
    },
    "doctype": {
      "ms_doctype_v1": "form"
    },
    "form_title": {
      "ms_form_title_llm_v1": "Application for Permanent Residence, I-485 ( (REV. 2-27-87N)"
    },
    "countries": {
      "ms_countries_nlp_v1": [
        "China"
      ]
    },
    "years": {
      "ms_years_nlp_v1": [
        1910,
        2023
      ]
    }
  },
  "is_g325a": false,
  "is_cert_naturalization": false,
  "full_text": "Screened by NARA, 9/13/2023 U.S. Department of Justice OMB # 1115-0053 Immigration and Naturalization Service (INC, Application for Perman it Residence DO NOT WRITE IN THIS BLOCK Case ID# Action Stamp Fee Stamp APPROVED A# INS DISTRICT DIRECTOR G-28 or Volag# JAN 2 1993 Section of Law Dahla Eligibility Under Sec. 245 Sec. 209(b), INA Re omme Approved Visa Petitign14 001 R 2 07/28/92 15:21 I485 120.00 Sec. 214(d), INA 4446 Dependent of Principal Alien Sec. 13, Act of 9/11/57 Special Immigrant Sec. 245, INA Other Sec. 249, INA Country Chargeable Preference A. Reason for this application I am applying for lawful permanent residence for the following reason: (check the box that applies) 1. X An immigrant visa number is immediately available to me because X A visa petition has already been approved for me (approval notice is attached) A visa petition is being filed with this application 2. I entered as the fiance(e) of a U.S. citizen and married within 90 days (approval notice and marriage certificate are attached) 3. I am an asylee eligible for adjustment 4. Other: B. Information about you 1. Name (Family name in CAPS) (First) (Middle) 11. On what date did you last enter the U.S.? PO Kam Ying 08/26/88 2. Address (Number and Street) (Apartment Number) 12. Where did you last enter the U.S.? (City and State) 751 Katherine Lane Los Angeles, California (Town or City) (State/Country) (ZIP/Postal Code) 13. What means of travel did you use? (Plane, car, etc.) Arcadia CA 91006 Plane 3. Place of Birth (Town or City) China CANTO (State/Country) 14. Were you inspected by a U.S. immigration officer? PR Yes No 4. Date of Birth 5. Sex 6. Marital Status 15. In what status did you last enter the U.S.? (Mo/Day/Yr) Male Married Single (Visitor, student, exchange alien, crewman, temporary worker, 11/25/1910 without inspection, etc.) Female Widowed Divorced Visitor (B-2) 7. Social Security Number 8. Alien Registration Number (if any) 16. Give your name EXACTLY as it appears on your Arrival/Departure None None A71817091 Record (Form 1-94). 9. Country of Citizenship PO, Kam Ying Hong Kong 17. Arrival/Departure Record (I-94) Number 18. Visa Number 10. Have you ever applied for permanent resident status in the U.S.? 075837 Yes No 0 2 4 1 2 8 6 6 6 0 1 (If Yes, give the date and place of filing and final disposition) 19. At what Consulate was your nonimmigrant visa issued? Date (Mo/Dav/Yo) Hong Kong 08/17/88 20. Have you ever been married before? x Yes No If Yes, (Names of prior husbands/wives) (Country of citizenship) (Date marriage ended) PR China N/A 21. Has your husband/wife ever been married before? Yes X No If Yes, (Names of prior husbands/wives) (Country of citizenship) (Date marriage ended) INITIAL RECEIPT RESUBMITTED RELOCATED COMPLETED Rec'd Sent Approved Denied Returned FORM I-485 (REV. 2-27-87)N"
}