{
	"anumber": "A72044315",
	"id": "A72044315_0030",
	"page_index": 30,
	"resources": {
		"full_jpg": "https://dctn4zjpwgdwdiiy5odjv7o2se0bqgjb.lambda-url.us-east-1.on.aws/iiif/3/og-2023-kc-nara_A72044315_0030/full/max/0/default.jpg"
	},
	"fields": {
		"sex": {
			"ms_sex_llm_v1": "female"
		},
		"doctype": {
			"ms_doctype_v1": "form"
		},
		"form_title": {
			"ms_form_title_llm_v1": "U.S. Department of Justice Immigration and Naturalization Service, FORM G-325A"
		},
		"countries": {
			"ms_countries_nlp_v1": ["Haiti", "United States", "Austria"]
		},
		"years": {
			"ms_years_nlp_v1": [2023]
		},
		"g325a": {
			"occupation": {
				"occupation_llm_v1": "['n.a']"
			},
			"reason": {
				"reason_llm_v1": "NATURALIZATION"
			},
			"nationality": {
				"nationality_llm_v1": "U.S."
			}
		}
	},
	"is_g325a": true,
	"is_cert_naturalization": false,
	"full_text": "Screened by NARA, 8/11/2023 INC. LEAVENWORTH KANSAS INSTRUCTIONS: USE TYPEWRITER. BE SURE ALL COPIES ARE LEGIBLE. Failure to answer fully all questions delays action. Do Not Remove Carbons: If typewriter is not available, print heavily in block letters with ball-point pen. U.S. Department of Justice FORM G-325A OMB No. 1115-0066 Immigration and Naturalization Service BIOGRAPHIC INFORMATION (Family name) (First name) (Middle name) MALE BIRTHDATE(Mo.-Day-Yr.) NATIONALITY FILE NUMBER DELVA ELIZABETH FEMALE 11/19/43 U.S. A U.S. All OTHER NAMES USED (Including names by previous marrieges) CITY AND COUNTRY OF BIRTH SOCIAL SECURITY NO. ELIZABETH HERAUX Port-Au-Prince, Haiti (If FOIA (b)(6) FAMILY NAME FIRST NAME DATE, CITY AND COUNTRY OF BIRTH(If known) CITY AND COUNTRY OF RESIDENCE FATHER HERAUX, GEORGES 06/06/07 Port-Au-Prince, Haiti Miami, FL MOTHER (Maiden name) KALMAR, GERTRUDE 08/08/13 Viena, Austria Deceased HUSBAND (If none, so state) FAMILY NAME FIRST NAME BIRTHDATE CITY & COUNTRY OF BIRTH DATE OF MARRIAGE PLACE OF MARRIAGE OR (For wife, give maiden name) Port-Au-Prince WIFE DELVA HENRY Haiti 05/12/63 Haiti FORMER HUSBANDS OR WIVES(if none, so state) FAMILY NAME (For wife, give maiden name) FIRST NAME BIRTHDATE DATE & PLACE OF MARRIAGE DATE AND PLACE OF TERMINATION OF MARRIAGE NONE APPLICANT'S RESIDENCE LAST FIVE YEARS. LIST PRESENT ADDRESS FIRST. FROM TO STREET AND NUMBER CITY PROVINCE OR STATE COUNTRY MONTH YEAR MONTH YEAR 348 Ballena Drive Diamond Bar CA USA 05 80 PRESENT TIME APPLICANT'S LAST ADDRESS OUTSIDE THE UNITED STATES OF MORE THAN ONE YEAR FROM TO STREET AND NUMBER CITY PROVINCE OR STATE COUNTRY MONTH YEAR MONTH YEAR APPLICANT'S EMPLOYMENT LAST FIVE YEARS. (IF NONE, so STATE.) LIST PRESENT EMPLOYMENT FIRST FROM TO FULL NAME AND ADDRESS OF EMPLOYER OCCUPATIONISPECIF MONTH YEAR MONTH YEAR MITUBISHI INTERNATIONAL CORP 12 63 PRESENT TIME Show below last occupation abroad if not shown above. (Include all information requested above.) THIS FORM IS SUBMITTED IN CONNECTION WITH APPLICATION FOR: SIGNATURE OF APPLICANT DATE NATURALIZATION STATUS AS PERMANENT RESIDENT OTHER (SPECIFY): Higabeth Selva 7/10/92 IF YOUR NATIVE ALPHABET IS IN OTHER THAN ROMAN LETTERS. WRITE YOUR NAME IN YOUR NATIVE ALPHABET IN THIS SPACE: Are all copies legible? Yes PENALTIES: SEVERE PENALTIES ARE PROVIDED BY LAW FOR KNOWINGLY AND WILLFULLY FALSIFYING OR CONCEALING A MATERIAL FACT. APPLICANT: BE SURE TO PUT YOUR NAME AND ALIEN REGISTRATION NUMBER IN THE BOX OUTLINED BY HEAVY BORDER BELOW. COMPLETE THIS BOX (Family name) (Given name) (Middle name) (Alien registration number) DELVA ELIZABETH Form G-325 A (Rev. 10-1-82) (1) Ident."
}
