{
  "anumber": "A72044147",
  "id": "A72044147_0027",
  "page_index": 27,
  "resources": {
    "full_jpg": "https://dctn4zjpwgdwdiiy5odjv7o2se0bqgjb.lambda-url.us-east-1.on.aws/iiif/3/og-2023-kc-nara_A72044147_0027/full/max/0/default.jpg"
  },
  "fields": {
    "doctype": {
      "ms_doctype_v1": "letter"
    },
    "form_title": {
      "ms_form_title_llm_v1": "UNITED STATES DEPARTMENT OF JUSTICE IMMIGRATION AND NATURALIZATION SERVICE"
    },
    "countries": {
      "ms_countries_nlp_v1": [
        "United States"
      ]
    },
    "years": {
      "ms_years_nlp_v1": [
        2023
      ]
    }
  },
  "is_g325a": false,
  "is_cert_naturalization": false,
  "full_text": "Screened by NARA, 7/14/2023 UNITED STATES DEPARTMENT OF JUSTICE IMMIGRATION AND NATURALIZATION SERVICE DATE: 09/06/92 MARIE C. VAUGUES FILE: A72044147 681 N.. W. 102 CT 0900 AM MIAMI, FL 33172 23/92 ato74 PLEASE COME TO THIS OFFICE: 7880 Biscayne Blvd. Room 490, Miami, FL, 33138 ON: 11/20/93 AT: 1100 PM regarding your application :for adjustment of status. Failure to respond to this request may result in denial of your application. BE ON TIME. A late arrival can cause you a long delay or postponement of the interview. EMERGENCY: If you must cancel this appointment because of an emergency, please indicate below the nature of the emergency and attach evidence of the emergency. Sign and date this form and return it to this office immediately. BRING WITH YOU: This letter; an interpreter if you do not speak English; all documents listed below (any document in a foreign language must be accompanied by a certified English translation). Documents submitted must be originals or certified copies that bear the seal of the issuing authority. Provide an addi- tional photocopy of any original document you wish returned. YOUR PASSPORT, birth certificate & original entry document -94) . PROOF OF SUPPORT. You and/or any employed family members mustpresent from each employer a letter on official stationery that indicates theposition, whether the position is temporary or permanent, current salary, and date of initial employment. IF YOU HAVE AT ANY TIME BEEN ARRESTED in any country of the world you must submit the following for EACH arrest: arresting officer's report; indictment (if applicable) and a document showing the disposition of the case. CURRENT MEDICAL REPORT: As soon as you receive this notice, you are required to make arrangements for your medical examination with one of the medical examiners on the attached list of INS-approved physicians who will perform the required laboratory and x-ray procedures, if required, as well as the medical examination. NOTE: Applicants 2 years of age or older are required to have a tuberculin skin test (Mantoux) as part of their medical examination followed by a chest x-ray examination, if reaction of 5min or greater. ROUTINELY, APPLICANTS UNDER 15 YEARS OF AGE ARE NOT REQUIRED TO HAVE SEROLOGY TESTS AS PART OF THEIR MEDICAL EXAMINATION. IF YOU ARE THE BENIFICIARY OF AN APPROVED VISA PETITION: Bring copies of all documents submitted with that petition."
}