{
	"anumber": "A72044147",
	"id": "A72044147_0032",
	"page_index": 32,
	"resources": {
		"full_jpg": "https://dctn4zjpwgdwdiiy5odjv7o2se0bqgjb.lambda-url.us-east-1.on.aws/iiif/3/og-2023-kc-nara_A72044147_0032/full/max/0/default.jpg"
	},
	"fields": {
		"sex": {
			"ms_sex_llm_v1": "male"
		},
		"doctype": {
			"ms_doctype_v1": "form"
		},
		"form_title": {
			"ms_form_title_llm_v1": "U.S. Department of Justice Immigration and Naturalization Service, G-325A"
		},
		"countries": {
			"ms_countries_nlp_v1": ["Haiti", "Burkina", "United States"]
		},
		"years": {
			"ms_years_nlp_v1": [1898, 2023, 1922, 1893]
		},
		"g325a": {
			"occupation": {
				"occupation_llm_v1": "['n.a']"
			},
			"nationality": {
				"nationality_llm_v1": "Haitian"
			}
		}
	},
	"is_g325a": true,
	"is_cert_naturalization": false,
	"full_text": "Screened by NARA, 7/14/2023 U.S. Department of Justice FORM G-325A OMB No. 1115-0066 Immigration and Naturalization Service BIOGRAPHIC INFORMATION (Family name) (First name) (Middle name) MALE BIRTHDATE(Mo.-Day-Yr.) NATIONALITY FILE NUMBER VAUGUES MarieC Ã‰CILE FEMALE 06/16/1898 HAITIAN A ALL OTHER NAMES USED (Including names by previous marriages) CITY AND COUNTRY OF BIRTH SOCIAL SECURITY NO. CAP H ATTIEN, HAITI (If any) N/A FAMILY NAME FIRST NAME DATE, CITY AND COUNTRY OF BIRTH(If known) CITY AND COUNTRY OF RESIDENCE FATHER BALMIR, JOSEPH JEREMIE , HAITI MOTHER(Maiden name) STERLIN CARIDA CAP - HAITIEN HAITI HUSBAND (If none, so state) FAMILY NAME FIRST NAME BIRTHDATE CITY & COUNTRY OF BIRTH DATE OF MARRIAGE PLACE OF MARRIAGE OR (For wife, give maiden name) WIFE VAUGUES, JUVIGNY 5/22/ CAP HAITIEN 1893 Sept 1922 Cap HAITIEN HAITI HAITI FORMER HUSBANDS OR WIVES(if none, so state) FAMILY NAME (For wife, give maiden nome) FIRST NAME BIRTHDATE DATE & PLACE OF MARRIAGE DATE AND PLACE OF TERMINATION OF MARRIAGE APPLICANT'S RESIDENCE LAST FIVE YEARS. LIST PRESENT ADDRESS FIRST. FROM TO STREET AND NUMBER CITY PROVINCE OR STATE COUNTRY MONTH YEAR MONTH YEAR 681 NW 102n\" Count MIA FLA USA 6 91 PRESENT TIME 19 RUE METELLUS, PR Beyer Petim Ville HAITI HAITI 12 88 6 91 Duagadouga Quaga BurkiNa BURKINA 12 83 12 88 APPLICANT'S LAST ADDRESS OUTSIDE THE UNITED STATES OF MORE THAN ONE YEAR FROM TO STREET AND NUMBER CITY PROVINCE OR STATE COUNTRY MONTH YEAR MONTH YEAR 19 Rue Metellus Place Boyer Petion Ville HAITI HAITI 12 88 6 91 APPLICANT'S EMPLOYMENT LAST FIVE YEARS. (IF NONE, so STATE.) LIST PRESENT EMPLOYMENT FIRST FROM TO FULL NAME AND ADDRESS OF EMPLOYER OCCUPATION (SPECIFY) MONTH YEAR MONTH YEAR PRESENT TIME N/A Show below last occupation abroad if not shown above. (Include all information requested above.) THIS FORM IS SUBMITTED IN CONNECTION WITH APPLICATION FOR: SIGNATURE OF APPLICANT DATE NATURALIZATION STATUS AS PERMANENT RESIDENT OTHER (SPECIFY): IF TE YOUR NAME YOUR NATIVE ALPHABET IN THIS SPACE: Cacil YOUR NATIVE ALPHABET IS IN OTHER THAN Kargenes ROMAN LETTERS. WRI IN Are all copies legible? Yes PENALTIES SEVERE PENALTIES ARE PROVIDED BY LAW FOR KNOWINGLY AND WILLFULLY FALSIFYING OR CONCEALING A MATERIAL FACT. APPLICANT: BE SURE TO PUT YOUR NAME AND ALIEN REGISTRATION NUMBER IN THE BOX OUTLINED BY HEAVY BORDER BELOW. COMPLETE THIS BOX (Family name) (Given name) (Middle name) (Alien registration number) VAUGUES CECILE A72044147 (OTHER AGENCY USE) INS USE (Office of Origin) OFFICE CODE: TYPE OF CASE: DATE: Form G-325 A (Rev. 10-1-82) (2) Rec Br."
}
