{
  "anumber": "A72845268",
  "id": "A72845268_0003",
  "page_index": 3,
  "resources": {
    "full_jpg": "https://dctn4zjpwgdwdiiy5odjv7o2se0bqgjb.lambda-url.us-east-1.on.aws/iiif/3/og-2023-kc-nara_A72845268_0003/full/max/0/default.jpg"
  },
  "fields": {
    "sex": {
      "ms_sex_llm_v1": "female"
    },
    "doctype": {
      "ms_doctype_v1": "form"
    },
    "form_title": {
      "ms_form_title_llm_v1": "Application for Permanent Residence, I-458"
    },
    "countries": {
      "ms_countries_nlp_v1": [
        "Haiti"
      ]
    },
    "years": {
      "ms_years_nlp_v1": [
        1994,
        1993,
        2023
      ]
    }
  },
  "is_g325a": false,
  "is_cert_naturalization": false,
  "full_text": "Screened by NARA, 7/27/2023 U.S. Department of Justice OMB # 1115-0053 Immigration and Naturalization Service (INS) Application for Permanent Residence DO NOT WRITE IN THIS BLOCK Case ID# Action Stamp Fee Stamp APPROVED A# 72845208 DISTRICT DIRECTOR G-28 or Volag# MIA 620/60 APR 15 1994 Section of Law Bab Eligibility Under Sec. 245 Sec. 209(b). INA Approved Visa Petition ( * Recommended Sec. 214(d), INA Dependent of Principal Alien Sec. 13, Act of 9/11/57 MIA Special Immigrant Sec. 245, INA Other Sec. 249, INA Country Chargeable Preference A. Reason for this application I am applying for lawful permanent residence for the following reason: (check the box that applies) 1. X An immigrant visa number is immediately available to me because PER COMPUTER A visa petition has already been approved for me (approval notice is attached) NR FCO X A visa petition is being filed with this application 2. I entered as the flance(e) of a U.S. citizen and married within 90 days (approval notice and marriage certificate NOV attached 1993 3. I am an asylee eligible for adjustment 4. Other: B. Information about you 1. Name (Family name in CAPS) (First) (Middle) 11. On what date did you last enter the U.S.? DIEUVILLE GELIN N/M/N 12-28-92 2. Address (Number and Street) (Apartment Number) 12. Where did you last enter the U.S.? (City and State) 1175 Manor Court Miami, Florida (Town or City) (State/Country) (ZIP/Postal Code) 13. What means of travel did you use? (Plane, car. etc.) Ft. Lauderdale, Florida 33326 Plane 3. Place of Birth (Town or City) (State/Country) 14. Were you inspected by a U.S. immigration officer? L' ARCAHALE, HAITI Yes No 4. Date of Birth 5. Sex 6. Marital Status 15. In what status did you last enter the U.S.? (Mo/Day/Yr) X Male Married Single (Visitor, student, exchange alien, crewman, temporary worker, without inspection, etc.) 12-5-1902 Female Widowed Divorced VISITOR 7. Social Security Number 8. Alien Registration Number (if any) 16. Give your name EXACTLY as It appears on your Arrival/Departure NONE A72845268 NONE Record (Form I-94). 9. Country of Citizenship DIEUVILLE GELIN HAITI 17. Arrival/Departure Record (1.94) Number 18. Visa Number 10. Have you ever applied for permanent resident status in the U.S.? 013126 Yes No 4 1 7 4 4 13 02 (If Yes, give the date and place of filing and final disposition) 19. At what Consulate was your nonimmigrant visa issued? Date (Mo/Day/Yr) PORT AU PRINCE 9-26-90 20. Have you ever been married before? Yes No If Yes, (Names of prior husbands/wives) (Country of citizenship) (Date marriage ended) 21. Has your husband/wife ever been married before? Yes X No If Yes, (Names of prior husbands/wives) (Country of citizenship) (Date marriage ended) INITIAL RECEIPT RESUBMITTED RELOCATED COMPLETED Rec'd Sent Approved Denied Returned FORM I-485 (REV. 2-27-87)N"
}