{
  "anumber": "A72851592",
  "id": "A72851592_0040",
  "page_index": 40,
  "resources": {
    "full_jpg": "https://dctn4zjpwgdwdiiy5odjv7o2se0bqgjb.lambda-url.us-east-1.on.aws/iiif/3/og-2023-kc-nara_A72851592_0040/full/max/0/default.jpg"
  },
  "fields": {
    "sex": {
      "ms_sex_llm_v1": "female"
    },
    "doctype": {
      "ms_doctype_v1": "form"
    },
    "form_title": {
      "ms_form_title_llm_v1": "U.S. Department of Justice Immigration and Naturalization Service, G-329A"
    },
    "countries": {
      "ms_countries_nlp_v1": [
        "United States"
      ]
    },
    "years": {
      "ms_years_nlp_v1": [
        1989,
        1907,
        2023
      ]
    },
    "g325a": {
      "occupation": {
        "occupation_llm_v1": "['none']"
      },
      "reason": {
        "reason_llm_v1": "NATURALIZATION"
      },
      "nationality": {
        "nationality_llm_v1": "haitien"
      }
    }
  },
  "is_g325a": true,
  "is_cert_naturalization": false,
  "full_text": "Screened by NARA, 8/11/2023 -++ U.S. Department of Justice FORM G-325A OMB No. 1115-0066 Immigration and Naturalization Service BIOGRAPHIC INFORMATION (Family name) (First name) (Middle name) MALE BIRTHDATE (Mo.-Day-Yr.) NATIONALITY FILE NUMBER JONASSAint ISMANIE FEMALE 05-02-1907 Haitien A- NONE ALL OTHER NAMES USED (Including names by previous marriages) CITY AND COUNTRY OF BIRTH SOCIAL SECURITY NO. same As ABOVE Port-SE-Bix (If any) NONE FAMILY NAME FIRST NAME DATE, CITY AND COUNTRY OF BIRTH (If known) CITY AND COUNTRY OF RESIDENCE FATHER JONASSAint , JEAN Port -se Paix Heiti DECEASES MOTHER (Maiden name) PEtit-FRERE VERNICIA PoRt-se. Paix Haiti DECEASES HUSBAND (If none, so state) FAMILY NAME FIRST NAME BIRTHDATE CITY & COUNTRY OF BIRTH DATE OF MARRIAGE PLACE OF MARRIAGE OR (For wife, give maiden name) WIFE JEAN (VERNEUS) VERNEUS Port-se-Paix DECEASES FORMER HUSBANDS OR WIVES (if none, so state) FAMILY NAME (For wife, give maiden name) FIRST NAME BIRTHDATE DATE & PLACE OF MARRIAGE DATE AND PLACE OF TERMINATION OF MARRIAGE APPLICANT'S RESIDENCE LAST FIVE YEARS. LIST PRESENT ADDRESS FIRST. FROM TO STREET AND NUMBER CITY PROVINCE OR STATE COUNTRY MONTH YEAR MONTH YEAR 717NW2NSAVE Fort LACroes FloRiDA BROWATS 1-15 1989 PRESENT TIME 20 APPLICANT'S LAST ADDRESS OUTSIDE THE UNITED STATES OF MORE THAN ONE YEAR FROM TO STREET AND NUMBER CITY PROVINCE OR STATE COUNTRY MONTH YEAR MONTH YEAR MONE APPLICANT'S EMPLOYMENT LAST FIVE YEARS. (IF NONE, SO STATE.) LIST PRESENT EMPLOYMENT FIRST FROM TO FULL NAME AND ADDRESS OF EMPLOYER OCCUPATION (SPECIFY) MONTH YEAR MONTH YEAR NONE PRESENT TIME Show below last occupation abroad if not shown above. (Include all information requested above.) THIS FORM IS SUBMITTED IN CONNECTION WITH APPLICATION FOR: NATURALIZATION STATUS AS PERMANENT RESIDENT OTHER (SPECIFY): SIGNATURE OF APPLICANT DATE 12-27-93 IF YOUR NATIVE ALPHABET IS IN OTHER THAN ROMAN LETTERS WRITE YOUR NAME IN YOUR NATIVE ALPHABET IN THIS SPACE Are all copies legible? Yes PENALTIES: SEVERE PENALTIES ARE PROVIDED BY LAW FOR KNOWINGLY AND WILLFULLY FALSIFYING OR CONCEALING A MATERIAL FACT APPLICANT: BE SURE TO PUT YOUR NAME AND ALIEN REGISTRATION NUMBER IN THE BOX OUTLINED BY HEAVY BORDER BELOW. COMPLETE THIS BOX (Family name) (Given name) (Middle name) (Ailen registration number) JONASSAiNT ISMANIE 72851392 (OTHER AGENCY USE) INS USE (Office of Origin) OFFICE CODE: TYPE OF CASE: DATE: Form G-325 A (Rev. 10-1-82) (2) Rec Br."
}