{
  "anumber": "A72845268",
  "id": "A72845268_0037",
  "page_index": 37,
  "resources": {
    "full_jpg": "https://dctn4zjpwgdwdiiy5odjv7o2se0bqgjb.lambda-url.us-east-1.on.aws/iiif/3/og-2023-kc-nara_A72845268_0037/full/max/0/default.jpg"
  },
  "fields": {
    "sex": {
      "ms_sex_llm_v1": "female"
    },
    "doctype": {
      "ms_doctype_v1": "form"
    },
    "form_title": {
      "ms_form_title_llm_v1": "U.S. Department of Justice Immigration and Naturalization Service, G-325A"
    },
    "countries": {
      "ms_countries_nlp_v1": [
        "Haiti",
        "United States"
      ]
    },
    "years": {
      "ms_years_nlp_v1": [
        2023,
        1946
      ]
    },
    "g325a": {
      "occupation": {
        "occupation_llm_v1": "['retired']"
      },
      "reason": {
        "reason_llm_v1": "NATURALIZATION"
      },
      "nationality": {
        "nationality_llm_v1": "Haitian"
      }
    }
  },
  "is_g325a": true,
  "is_cert_naturalization": false,
  "full_text": "Screened by NARA, 7/27/2023 U.S. Department of Justice FORM G-325A OMB No. 1115-0066 Immigration and Naturalization Service BIOGRAPHIC INFORMATION (Family name) Dieuville GELiN (First name) (Middle name MALE BIRTHDATE (Mo.-Day-Yr.) NATIONALITY FILE NUMBER FEMALE 12-5-1902 HAITIAN A- 72-845-268 ALL OTHER NAMES USED (Including names by previous marriages) None CITY AND COUNTRY OF BIRTH SOCIAL SECURITY NO. (If any) NOWE FAMILY NAME FIRST NAME DATE, CITY AND COUNTRY OF BIRTH (If known) CITY AND COUNTRY OF RESIDENCE FATHER MOTHER (Maiden name) DIEUVILLE HUSBAND (If none, so state) FAMILY NAME IBELISE ROMELUS ARCAHAIE HAITI. DECEASED SEI) FIRST-NAME BIRTHDATE CITY & COUNTRY OF BIRTH DATE OF MARRINGE 1 PLACE OF MARRIAGE OR (For wife, give maiden name) WIFE FORMER HUSBANDS OR WIVES (if none, so state) FAMILY NAME (For wife, give maiden name) FIRST NAME BIRTHDATE DATE & PLACE OF MARRIAGE DATE AND/PLACE OF TERMINATION, OF MARRIAGE Komain JESULE 2-10-22 9-15-83 HAITI ,Nov APPliCABlE APPLICANT'S RESIDENCE LAST FIVE YEARS. LIST PRESENT ADDRESS FIRST. FROM TO STREET AND NUMBER CITY PROVINCE OR STATE COUNTRY MONTH YEAR MONTH YEAR CiTy St M ARTIN P-AuP HAITI 1946 PRESENT TIME APPLICANT'S LAST ADDRESS OUTSIDE THE UNITED STATES OF MORE THAN ONE YEAR FROM TO STREET AND NUMBER CITY PROVINCE OR STATE COUNTRY MONTH YEAR MONTH YEAR CITEE St MARTIN P.An P. HATTI APPLICANT'S EMPLOYMENT LAST FIVE YEARS. (IF NONE, SO STATE.) LIST PRESENT EMPLOYMENT FIRST FROM TO FULL NAME AND ADDRESS OF EMPLOYER OCCUPATION (SPECIFY) MONTH YEAR MONTH YEAR RETIRED PRESENT TIME Show below last occupation abroad if not shown above. (Include all information requested above.) THIS FORM IS SUBMITTED IN CONNECTION WITH APPLICATION FOR: SIGNATURE OF APPLICANT DATE NATURALIZATION STATUS AS PERMANENT RESIDENT OTHER (SPECIFY): YOUR NATIVE ALPHABET IS IN OTHER THAN ROMAN LETTERS, WRITE YOUR NAME IN YOUR NATIVE ALPHABET IN THIS SPACE: Are all copies legible? Yes PENALTIES: SEVERE PENALTIES ARE PROVIDED BY LAW FOR KNOWINGLY AND WILLFULLY FALSIFYING OR CONCEALING A MATERIAL FACT. APPLICANT: BE SURE TO PUT YOUR NAME AND ALIEN REGISTRATION NUMBER IN THE BOX OUTLINED BY HEAVY BORDER BELOW. COMPLETE THIS BOX (Family name) (Given name) (Middle name) (Ailen registration number) (OTHER AGENCY USE) INS USE (Office of Origin) OFFICE CODE: TYPE OF CASE: DATE: Form G-325 A (Rev. 10-1-82) (3) C."
}