{
  "anumber": "A72937061",
  "id": "A72937061_0016",
  "page_index": 16,
  "resources": {
    "full_jpg": "https://dctn4zjpwgdwdiiy5odjv7o2se0bqgjb.lambda-url.us-east-1.on.aws/iiif/3/og-2023-kc-nara_A72937061_0016/full/max/0/default.jpg"
  },
  "fields": {
    "doctype": {
      "ms_doctype_v1": "form"
    },
    "form_title": {
      "ms_form_title_llm_v1": "Title: U.S. Department of Justice, Immigration and Naturalization Service\\nForm Number: G-325A"
    },
    "countries": {
      "ms_countries_nlp_v1": [
        "Pakistan",
        "United States",
        "India"
      ]
    },
    "years": {
      "ms_years_nlp_v1": [
        1984,
        2023,
        1968,
        1987
      ]
    },
    "g325a": {
      "occupation": {
        "occupation_llm_v1": "[' home opertr', 'board & care']"
      },
      "reason": {
        "reason_llm_v1": "NATURALIZATION"
      },
      "nationality": {
        "nationality_llm_v1": "Pakistan"
      }
    }
  },
  "is_g325a": true,
  "is_cert_naturalization": false,
  "full_text": "Screened by NARA, 8/7/2023 U.S. Department of Jastice FORM G-325A OMB No. 1115-0066 Immigration and Naturalization Service BIOGRAPHIC INFORMATION Approval expires 4-30-85 (Family name) (First name) (Middle name) MALE BIRTHDATE (Mo.-Day-Yr.) NATIONALITY FILE NUMBER SINGH Jagat FEMALE 10-15-06 A- ALL OTHER NAMES USED (Including names by previous marriages) CITY AND COUNTRY OF BIRTH SOCIAL SECURITY NO. Major Jagat Singh Gujranwala Pakistan (If any) FAMILY NAME FIRST NAME DATE, CITY AND COUNTRY OF BIRTH (If known) CITY AND COUNTRY OF RESIDENCE DAS RAM Deceased FATHER MOTHER (Maiden name) KUR ISHAR Deceased HUSBAND(If none, so state) FAMILY NAME FIRST NAME BIRTHDATE CITY & COUNTRY OF BIRTH DATE OF MARRIAGE PLACE OF MARRIAGE OR (For wife, give maiden name) WIFE 12-23-09 Bambawale Kaur Gurcharan Pakistan Pakistan FORMER HUSBANDS OR WIVES (If none, so state) FAMILY NAME (For wife, give maiden name) FIRST NAME BIRTHDATE DATE & PLACE OF MARRIAGE DATE AND PLACE OF TERMINATION OF MARRIAGE APPLICANT'S RESIDENCE LAST FIVE YEARS, LIST PRESENT ADDRESS FIRST FROM TO STREET AND NUMBER CITY PROVINCE OR STATE COUNTRY MONTH YEAR MONTH YEAR 1737 Holbrook Street Anaheim California USA May 1987 PRESENT TIME H-24 NDSE-1 N.Dehli Delhi India Apr 1968 Dec 1984 APPLICANT'S LAST ADDRESS OUTSIDE THE UNITED STATES OF MORE THAN ONE YEAR FROM TO STREET AND NUMBER CITY PROVINCE OR STATE COUNTRY MONTH YEAR MONTH YEAR H-24 NDSE-1 N.Dehli Delhi India Apr 1968 Dec 1984 APPLICANT'S EMPLOYMENT LAST FIVE YEARS. (IF NONE, SO STATE.) LIST PRESENT EMPLOYMENT FIRST FROM TO FULL NAME AND ADDRESS OF EMPLOYER OCCUPATION (SPECIFY) MONTH YEAR MONTH YEAR Captain Singh's Anaheim, California Board & Care May 1987 PRESENT TIME Guest Homes, Inc. Home Opertrs Show below last occupation abroad if not shown above. (Include all information requested above.) THIS FORM IS SUBMITTED IN CONNECTION WITH APPLICATION FOR: SIGNATURE OF APPLICANT DATE NATURALIZATION STATUS AS PERMANENT RESIDENT OTHER (SPECIFY): JAGAT SINGH If your native alphabet is other than roman letters, write your name in your native alphabet here: Are all copies legible? Yes PENALTIES: SEVERE PENALTIES ARE PROVIDED BY LAW FOR KNOWINGLY AND WILLFULLY FALSIFYING OR CONCEALING A MATERIAL FACT. BE SURE TO PUT YOUR NAME AND ALIEN REGISTRATION NUMBER IN APPLICANT: THE BOX OUTLINED BY HEAVY BORDER BELOW. COMPLETE THIS BOX (Family Name) (Given name) (Middle name) (Alien registration number) SINGH Jagat Form G-325 A (Rev. 10-1-82) (1) Ident."
}