{
  "anumber": "A72937061",
  "id": "A72937061_0038",
  "page_index": 38,
  "resources": {
    "full_jpg": "https://dctn4zjpwgdwdiiy5odjv7o2se0bqgjb.lambda-url.us-east-1.on.aws/iiif/3/og-2023-kc-nara_A72937061_0038/full/max/0/default.jpg"
  },
  "fields": {
    "sex": {
      "ms_sex_llm_v1": "male"
    },
    "doctype": {
      "ms_doctype_v1": "form"
    },
    "form_title": {
      "ms_form_title_llm_v1": "U.S. Department of Justice Immigration and Naturalization Service, G-325A"
    },
    "countries": {
      "ms_countries_nlp_v1": [
        "Pakistan",
        "United States"
      ]
    },
    "years": {
      "ms_years_nlp_v1": [
        2023,
        1986
      ]
    },
    "g325a": {
      "occupation": {
        "occupation_llm_v1": "['owner/operator']"
      },
      "reason": {
        "reason_llm_v1": "NATURALIZATION"
      },
      "nationality": {
        "nationality_llm_v1": "Indian"
      }
    }
  },
  "is_g325a": true,
  "is_cert_naturalization": false,
  "full_text": "Screened by NARA, 8/7/2023 FORM G-325A OMB No. 1115-0066 U.S. Department of Justice BIOGRAPHIC INFORMATION Approval expires 4-30-85 Immigration and Naturalization Service BIRTHDATE (Mo.-Day-Yr.) NATIONALITY FILE NUMBER (Family name) (First name) (Middle name) MALE SINGH Kanwar FEMALE 09/22/35 Indian FOIA (b)(6) A- CITY AND COUNTRY OF BIRTH SOCIAL SECURITY NO. ALL OTHER NAMES USED (Including names by previous marriages) Pakistan (If any) FOIA (b)(6) Captain Singh FAMILY NAME FIRST NAME DATE, CITY AND COUNTRY OF BIRTH (If known) CITY AND COUNTRY OF RESIDENCE Anaheim USA SINGH Jagat 40-15-06 Gujranwla, Pakistan FATHER Gurcharan â‘‰ 12-23-09 Bambawale, Pakistan Anaheim USA MOTHER (Maiden name) Kaur HUSBAND(If none, so state) FAMILY NAME FIRST NAME BIRTHDATE CITY & COUNTRY OF BIRTH DATE OF MARRIAGE PLACE OF MARRIAGE OR (For wife, give maiden name) 08/04/41 WIFE Kailash Pakistan KAUR FORMER HUSBANDS OR WIVES (If none, so state) FAMILY NAME (For wife, give maiden name) FIRST NAME BIRTHDATE DATE & PLACE OF MARRIAGE DATE AND PLACE OF TERMINATION OF MARRIAGE APPLICANT'S RESIDENCE LAST FIVE YEARS, LIST PRESENT ADDRESS FIRST FROM TO MONTH YEAR STREET AND NUMBER CITY PROVINCE OR STATE COUNTRY MONTH YEAR 1703 Hacienda Bouelvard La Harba Heigh California USA Feb 1986 PRESENT TIME APPLICANT'S LAST ADDRESS OUTSIDE THE UNITED STATES OF MORE THAN ONE YEAR FROM TO STREET AND NUMBER CITY PROVINCE OR STATE COUNTRY MONTH YEAR MONTH YEAR APPLICANT'S EMPLOYMENT LAST FIVE YEARS. (IF NONE, SO STATE.) LIST PRESENT EMPLOYMENT FIRST FROM TO FULL NAME AND ADDRESS OF EMPLOYER OCCUPATION (SPECIFY) MONTH YEAR MONTH YEAR Self-Employed Board / Care Homes for Elderly Owner/Operat Feb 1986 PRESENT TIME Show below last occupation abroad if not shown above. (Include all information requested above.) THIS FORM IS SUBMITTED IN CONNECTION WITH APPLICATION FOR: SIGNATURE DATE NATURALIZATION STATUS AS PERMANENT RESIDENT OTHER (SPECIFY): alphabet OF APPLICANT than letters, write in If your native is other roman your name your native alphabet here: Are all copies legible? Yes PENALTIES: SEVERE PENALTIES ARE PROVIDED BY LAW FOR KNOWINGLY AND WILLFULLY FALSIFYING OR CONCEALING A MATERIAL FACT. BE SURE TO PUT YOUR NAME AND ALIEN REGISTRATION NUMBER IN APPLICANT THE BOX OUTLINED BY HEAVY BORDER BELOW. COMPLETE THIS BOX (Family Name) (Given name) (Middle name) (Alien registration number) SINGH Kanwar 2873200011 (OTHER AGENCY USE) INS USE (Office of Origin) OFFICE CODE: TYPE OF CASE: DATE: Form G-325 A (Rev. 10-1-82) (2) Rec Br."
}