{
  "anumber": "A73780035",
  "id": "A73780035_0018",
  "page_index": 18,
  "resources": {
    "full_jpg": "https://dctn4zjpwgdwdiiy5odjv7o2se0bqgjb.lambda-url.us-east-1.on.aws/iiif/3/og-2023-kc-nara_A73780035_0018/full/max/0/default.jpg"
  },
  "fields": {
    "sex": {
      "ms_sex_llm_v1": "female"
    },
    "doctype": {
      "ms_doctype_v1": "letter"
    },
    "form_title": {
      "ms_form_title_llm_v1": "Certificate of Naturalization, 11 055186"
    },
    "countries": {
      "ms_countries_nlp_v1": [
        "Haiti",
        "United States"
      ]
    },
    "years": {
      "ms_years_nlp_v1": [
        2023,
        1983,
        1944
      ]
    },
    "certificate_naturalization": {
      "complexion": {
        "complexion_llm_v1": "dark"
      },
      "marital_status": {
        "marital_status_llm_v1": "married"
      },
      "year_naturalization": {
        "year_naturalization_llm_v1": 1983
      },
      "residence_naturlization": {
        "residence_naturlization_llm_v1": "Miami, Florida"
      }
    }
  },
  "is_g325a": false,
  "is_cert_naturalization": true,
  "full_text": "Screened by NARA, 8/7/2023 No. 11055186 Pedition No. 178879 ORIGINAL AlienRegistration has FOIA (b)(6) Personal,description of holdoris of date Date of birth November 29, 1944 sex female complexion dark coloropoyes brown colorofhair black height 5 feet inches; weight 130 pounds; visible distenctive,marks none Maritalstatus married Country of formermationality Haiti I certify that the drive, and thatthepholographaffued hereto is alikeness of me. Marie Clime Laorois Complete and true signature of holder) UNITED STATES OF AMERICA SOUTHERN DISTRICT OF FLORIDA } SS: Beilknown, that alatermofthe District The United States Court,of held pursuant, to lawal Miami, Florida on August 1, 1983 the Gourthavingfoundshal Marie Clenie Lacroix then/residing at Miami, Florida intends,loreside, hermanenMyin, the United States when sorequired byshe Naturalization Laws of the United States) had in allother respects, complied with sheapplicable provisions, of such naturalization, laws, and was entilled lobe Seal admilled docitiscenships such herson be and(s)hewas admilled as a cilixen the United States of America. Intestimony whereoft the courtis hereuntoufficed.,the 1st day of August inthenyeurofour Lordnineleenhundredana eighty-three Robert M. March IT IS PUNISHABLE BY U. S. LAW TO COPY, Glerk of the U. S: District Court. PRINT OR PHOTOGRAPH THIS CERTIFICATE. Deputy Glerk."
}