{
  "anumber": "A73779517",
  "id": "A73779517_0012",
  "page_index": 12,
  "resources": {
    "full_jpg": "https://dctn4zjpwgdwdiiy5odjv7o2se0bqgjb.lambda-url.us-east-1.on.aws/iiif/3/og-2023-kc-nara_A73779517_0012/full/max/0/default.jpg"
  },
  "fields": {
    "sex": {
      "ms_sex_llm_v1": "female"
    },
    "doctype": {
      "ms_doctype_v1": "form"
    },
    "form_title": {
      "ms_form_title_llm_v1": "Medical Examination of Aliens Seeking Adjustment of Status"
    },
    "countries": {
      "ms_countries_nlp_v1": [
        "El Salvador",
        "Nicaragua"
      ]
    },
    "years": {
      "ms_years_nlp_v1": [
        1903,
        2023,
        1986
      ]
    }
  },
  "is_g325a": false,
  "is_cert_naturalization": false,
  "full_text": "Screened by NARA, 7/7/2023 U.S. Department of Justice OMB #1115-0134 Immigration and Naturalization Service Medical Examination of Aliens Seeking Adjustment of Status (Please type or print clearly) 3. File number (A number) / certify that on the date shown / examined: 1. Name (Last in CAPS) 4. Sex GALLO Male Female (First) (Middle Initial) 5. Date of birth (Month/Day/Year) MARIANO DL J. 11-14-1903 2. Address (Street number and name) (Apt. number) 6. Country of birth 187 W 79st NICARAGUA (City) (State) (ZIP Code) 7. Date of examination (Month/Day/Year) Hisleah Fl 33014 2/17/95 General Physical Examination: I examined specifically for evidence of the conditions listed below. My examination revealed; No apparent defect, disease, or disability. The conditions listed below were found (check all boxes that apply). Class A Conditions Chancroid Hansen's disease, infectious Mental defect Psychopathic personality Chronic alcoholism HIV infection Mental retardation Sexual deviation Gonorrhea Insanity Narcotic drug addiction Syphilis, infectious Granuloma inguinale Lymphogranuloma venereum Previous occurrence of one Tuberculosis, active or more attacks of insanity Class B Conditions Other physical defect, disease or disability (specify below). Hansen's disease, not infectious Tuberculosis, not active Examination for Tuberculosis - Tuberculin Skin Test Examination for Tuberculosis - Chest X-Ray Report Reaction mm No reaction Not done Abnormal Normal Not done Doctor's name (please print) Date read Doctor's name (please print) Date read Salvador Serologic Test for Ginori,MD 2/21/95 Katert J. Hyman,MI 2/17/95 Syphilis Serologic Test for HIV Antibody Reactive Titer (confirmatory test performed) Nonreactive Positive (confirmed by Western biot) Negative Test Type Test Type RPR HIVaulit by Doctor's name (please print) Date read Doctor's name (please print) Date read PRIME LS 2/18/95 PILIME Jaso 2/18/95 Immunization Determination (DTP, OPV, MMR, Td-Refer to PHS Guidelines for recommendations.) Applicant is current for recommended age-specific immunizations. Applicant is not current for recommended age-specific immunizations and I have encouraged that appropriate immunizations be obtained. REMARKS: Civil Surgeon Referral for Follow-up of Medical Condition The alien named above has applied for adjustment of status. A medical examination conducted by me identified the conditions above which require resolution before medical clearance is granted or for which the alien may seek medical advice. Please provide follow-up services or refer the alien to an appropriate health care provider. The actions necessary for medical clearance are detailed on the reverse of this form. Follow-up Information: The alien named above has complied with the recommended health follow-up. Doctor's name and address (please type or print clearly) Doctor's signature Date Applicant Certification: I certify that I understand the purpose of the medical examination, I authorize the required tests to be completed, and the information on this form refers to me. Signature the Date 2/17/95 Civil Surgeon Certification: My examination showed the applicant to have met the medical examination and health follow-up requirements for adjustment of status. Doctor's and address (please type print clearly) was VW7 Doctor's signature Date Smirk 2/21/95 name or The Immigration and Naturalization Service is authorized to collect this information under the provisions of the Immigration and Nationality Act and the Immigration Reform and Control Act of 1986, Public Law 99-603. Form I 693 (Rev. 09/01/87) N PHYSICIAN OR HEALTH DEPARTMENT"
}