{
  "anumber": "A75287434",
  "id": "A75287434_0008",
  "page_index": 8,
  "resources": {
    "full_jpg": "https://dctn4zjpwgdwdiiy5odjv7o2se0bqgjb.lambda-url.us-east-1.on.aws/iiif/3/og-2023-kc-nara_A75287434_0008/full/max/0/default.jpg"
  },
  "fields": {
    "sex": {
      "ms_sex_llm_v1": "female"
    },
    "doctype": {
      "ms_doctype_v1": "form"
    },
    "form_title": {
      "ms_form_title_llm_v1": "Petition for Alien Relative, Form I-130 ( Rev. 4/4/91)"
    },
    "countries": {
      "ms_countries_nlp_v1": [
        "Haiti"
      ]
    },
    "years": {
      "ms_years_nlp_v1": [
        1989,
        2023,
        1997
      ]
    }
  },
  "is_g325a": false,
  "is_cert_naturalization": false,
  "full_text": "Screened by NARA, 8/7/2023 U.S. Department of Justice OMB #1115-0054 Immigration and Naturalization Service (INS) Petition for Alien Relative DO NOT WRITE IN THIS BLOCK - FOR EXAMINING OFFICE ONLY Case ID# Action Stamp Fee Stamp A# APPROVED I.N.S. DISTRICT DIRECTOR G-28 or Volag # Section of Law: MAR 10 1997 Petition was lied on: (priority date) 201 (b) spouse 203 (a)(1) 201 (b) child 203 (a)(2) Phone Personal Interview Previously Forwarded Pet Ben. \"A\" File Reviewed Stateside Criteria 201 (b) parent 203 (a)(4) 203 (a)(5) 8117 Field Investigations I-485 Simultaneously AM CON: 204 (a)(2)(A) Resolved 204 (h) Resolved Remarks: $ DRU A. Relationship 1. The alien relative is my 2. Are you related by adoption? 3. Did you gain permanent residence through adoption? Husband/Wife Parent Brother/Sister Child Yes No Yes No B. Information about you C. Information about your alien relative 1. Name (Family name in CAPS) (First) (Middle) 1. Name (Family name in CAPS) (First) (Middle) ELIACIN JAMES WILSON ELIACIN ANNETTE 2. Address (Number and Street) (Apartment Number) 2. Address (Number and Street) (Apartment Number) 13120 NW 19TH AVENUE 13120 NW 19TH AVE (Town or City) (State/Country) (ZIP/Postal Code) (Town or City) (State/Country) (ZIP/Postal Code) MIAMI FLORIDA 33167 MIAMI FLORIDA 33167 3. Place of Birth (Town or City) (State/Country) 3. Place of Birth (Town or City) (State/Country) SAINT MARC HAITI LEOGANE HAITI 4. Date of Birth 5. Sex 6. Marital Status 4. Date of Birth 5. Sex 6. Marital Status (Mo/Day/Yr) Male Married Single (Mo/Day/Yr) Male Married Single 05.12.35 Female Widowed Divorced 02.15.1905 Female Widowed Divorced 7. Other Names Used (including maiden name) 7. Other Names Used (including maiden name) SAME AS ABOVE SAME AS ABOVE 8. Date and Place of Present Marriage (if married) 8. Date and Place of Present Marriage (if married) 12.30.65, PORT AU PRINCE, HAITI N/A 9. Social Security Number 10. Alien Registration Number (if any) 9. Social Security Number 10. Alien Registration Number (if any) FOIA (b)(6) -NONE A75287434 11. Names of Prior Husbands/Wives 12. Date(s) Marriages(s) Ended 11. Names of Prior Husbands/Wives 12. Date(s) Marriages(s) Ended NONE NONE 13. If you are a U.S. citizen, complete the following: 13. Has your relative ever been in the U.S.? My citizenship was acquired through (check one) Yes No Birth in the U.S. 14. If your relative is currently in the U.S., complete the following: He or Naturalization (Give number of certificate, date and place it was issued) she last arrived as a (visitor, student, stowaway, without inspection, etc.) NÂ° 14479533, 02.08.91, BROOKLIN, NY VISITOR Parents Arrival/Departure Record (I-94) Number Date arrived (Month/Day/Year) Have you obtained a certificate of citizenship in your own name? JAN 02, 1989 Yes No Date authorized stay expired, or will expire, as shown on Form I-94 or I-95 If \"Yes\", give number of certificate, date and place it was issued LOST IT N/A 15. Name and address of present employer (if any) 14a. If you are a lawful permanent resident alien, complete the following: N/A Date and place of admission for, or adjustment to, lawful permanent residence, Date this employment began (Month/Day/Year) N/A and class of admission: N/A 16. Has you relative ever been under immigration proceedings? 14b. Did you gain permanent resident status through marriage to a United Yes No Where When States citizen or lawful permanent resident? Yes No Exclusion Deportation Recission Judicial Proceedings INITIAL RECEIPT RESUBMITTED RELOCATED COMPLETED Rec'd Sent Approved Denied Returned Form I-130 (Rev. 4/11/91) Y"
}