{
  "anumber": "A75287434",
  "id": "A75287434_0011",
  "page_index": 11,
  "resources": {
    "full_jpg": "https://dctn4zjpwgdwdiiy5odjv7o2se0bqgjb.lambda-url.us-east-1.on.aws/iiif/3/og-2023-kc-nara_A75287434_0011/full/max/0/default.jpg"
  },
  "fields": {
    "sex": {
      "ms_sex_llm_v1": "male"
    },
    "doctype": {
      "ms_doctype_v1": "letter"
    },
    "form_title": {
      "ms_form_title_llm_v1": "Certificate of Naturalization, NARA"
    },
    "countries": {
      "ms_countries_nlp_v1": [
        "Haiti",
        "United States"
      ]
    },
    "years": {
      "ms_years_nlp_v1": [
        1991,
        1935
      ]
    },
    "certificate_naturalization": {
      "complexion": {
        "complexion_llm_v1": "dark"
      },
      "marital_status": {
        "marital_status_llm_v1": "MARRIED"
      },
      "year_naturalization": {
        "year_naturalization_llm_v1": 1991
      },
      "residence_naturlization": {
        "residence_naturlization_llm_v1": "Brooklyn"
      }
    }
  },
  "is_g325a": false,
  "is_cert_naturalization": true,
  "full_text": "THE No. 14479533 Pelilion Dies 1121084 ORIGINAL INS Registration M FOIA (b)(6) Personal' description of holder us of dateef industriation: Date of birth MAY 12, 1935 sea MALE complexion DARK colorofoyes BLACK color of hair BLACK height 5 feel 4 inches; weight 170 pounds. visible distinctive marks NONE Marital status MARRIED Country of former nationality HAITI I certify that the description above given is true, and that the photographi affired Tierelois, a likeness of me. JAMES WiLSON EliAciN Complete and true signature of holder) United States of America Eastern District of N. Y. ps. SS: Beit known, that at a Jermof the District Court of The United States held pursuant to lawal Brooklyn on FEBRUARY 8, 1991 the Court having foundthat JAMES WILSON ELIACIN thenresiding at BROCKLYN, NEW YORK intendi loreside permanently. in the United States when sorequired by the naturalization lawsof the United States), had in all other respects complied with the applicable provisions of such naturalization laws, and was entished to be Seal admitted thereupon ordered Mal such pers son be and (s)hewas admitted as a citizen of helmited States of America In testimony whereof the sealofthe courtis 8TH day of FEBRUARY mineteen hundred and NINETY-ONE Robert C. Heinemann TO PUNISHABLE Clerk of the U.S. DISTRICT Court OF PHOTOGR- WITHOUTLAVIFULATHRT By Deputy Clerk FORM N-550-C (REV. 11-1-87)"
}