{
  "anumber": "A76229988",
  "id": "A76229988_0006",
  "page_index": 6,
  "resources": {
    "full_jpg": "https://dctn4zjpwgdwdiiy5odjv7o2se0bqgjb.lambda-url.us-east-1.on.aws/iiif/3/og-2023-kc-nara_A76229988_0006/full/max/0/default.jpg"
  },
  "fields": {
    "sex": {
      "ms_sex_llm_v1": "female"
    },
    "doctype": {
      "ms_doctype_v1": "form"
    },
    "form_title": {
      "ms_form_title_llm_v1": "Processing Information"
    },
    "countries": {
      "ms_countries_nlp_v1": [
        "Haiti",
        "United States"
      ]
    },
    "years": {
      "ms_years_nlp_v1": [
        2023
      ]
    }
  },
  "is_g325a": false,
  "is_cert_naturalization": false,
  "full_text": "Screened by NARA, 8/7/2023 Part 3. Processing Information. A. City/Town/Village of birth Current occupation BARADERE N/A Your mother's first name Your father's first name LOUISE EMILE Give your name exactly how it appears on your Arrival /Departure Record (Form I-94) N/A Place of last entry into the U.S. (City/State) In what status did you last enter? (Visitor, Student, exchange MIAMI, FL alien, crewman, temporary worker, without inspection, etc.) Were you inspected by a U.S. Immigration Officer? Yes No VISITOR Nonimmigrant Visa Number Consulate where Visa was issued 001081 PORT-AU-PRINCE HAITI Date Visa was Issued Sex: Male Female Marital Status: Married Single Divorced Widowed (month/day/year) 10-06-88 Have you ever before applied for permanent resident status in the U.S? No Yes (give date and place of filing and final disposition): B. List your present husband/wife, all of your sons and daughters (if you have none, write \"none\". If additional space is needed, use separate paper). Family Given Middle Date of Birth Name FOIA (b)(6) Country of birth Relationship Applying with you? FOIA (b)(6) Family Given Middle Date of Birth Name Initial FOIA (b)(6) (month/day/year) Country of birth A Relationship Applying with you? FOIA (b)(6) Family Given Middle Date of Birth Name Name Initial (month/day/year) Country of birth A Relationship Applying with you? # Yes No Family Given 2 Middle Date of Birth Name Name Initial (month/day/year) Country of birth Relationship bund ch No. Applying with you? Yes No Family Given Middle Date of Birth Name Name Initial (month/day/year) Country of birth Relationship A Applying with you? # Yes No C. List your present and past membership in or affiliation with every political organization, association, fund, foundation, party, club, society, or similar group in the United States or in any other place since your 16th birthday. Include any foreign military service in this part. If none, write \"none\". Include the name of organization, location, dates of membership from and to, and the nature of the organization. If additional space is needed, use separate paper. N/A Form I-485 (Rev. 09-09-92) N Continued On Next Page"
}