{
  "anumber": "A86927428",
  "id": "A86927428_0036",
  "page_index": 36,
  "resources": {
    "full_jpg": "https://dctn4zjpwgdwdiiy5odjv7o2se0bqgjb.lambda-url.us-east-1.on.aws/iiif/3/og-2023-kc-nara_A86927428_0036/full/max/0/default.jpg"
  },
  "fields": {
    "sex": {
      "ms_sex_llm_v1": "female"
    },
    "doctype": {
      "ms_doctype_v1": "form"
    },
    "form_title": {
      "ms_form_title_llm_v1": "Department of Homeland Security, G-325A, Biographic Information"
    },
    "countries": {
      "ms_countries_nlp_v1": [
        "Honduras",
        "United States"
      ]
    },
    "years": {
      "ms_years_nlp_v1": [
        1907,
        2013,
        2007,
        1937,
        2023,
        1932,
        1961,
        2003
      ]
    },
    "g325a": {
      "occupation": {
        "occupation_llm_v1": "['n.a']"
      },
      "reason": {
        "reason_llm_v1": "Naturalization"
      },
      "nationality": {
        "nationality_llm_v1": "U.S.A."
      }
    }
  },
  "is_g325a": true,
  "is_cert_naturalization": false,
  "full_text": "Screened by NARA, 7/17/2023 OMB No. 1615-0008; Exp. 05/31/09 Department of Homeland Security U.S. Citizenship and Immigration Services G-325A, Biographic Information (Family Name) (First Name) (Middle Name) Male Birth Date (mm/dd/yyyy) Citizenship/Nationality File Number ZELAYA Vilma Gloria Female 07/09/1937 U.S.A. A FOIA (b) (6) All Other Names Used (Including names by previous marriages) City and Country of Birth U.S. Social Security # (If any) VELASQUEZ-Rovelo, Vilma G. Tegucigalpa, Honduras FOIA (b)(6) Family Name First Name Date, City and Country of Birth (If known) City and Country of Residence Father VELASQUEZ Francisco 07/02/1907 Alianza, Honduras deceased Mother (Maiden Name) ROVELO Ela 02/14/2013 Tegucigalpa, Honduras Miami, Florida Husband or Wife (If none, Family Name First Name Birth Date City and Country of Birth Date of Marriage Place of Marriage so state.) (For wife, give maiden name) (mm/dd/yyyy) Tegucigalpa, (husband) ZELAYA Jacobo 04/29/1932 Tela, Honduras 01/12/1961 Honduras Former Husbands or Wives (If none, so state) First Name Birth Date Date and Place of Marriage Date and Place of Termination of Marriage Family Name (For wife, give maiden name) (mm/dd/yyyy) none Applicant's residence last five years. List present address first. From To Street and Number City Province or State Country Month Year Month Year FOIA (b)(6) Applicant's last address outside the United States of more than one year. From To Street and Number City Province or State Country Month Year Month Year not applicable Applicant's employment last five years. (If none, so state.) List present employment first. From To Full Name and Address of Employer Occupation (Specify) Month Year Month Year housewife/retired 08 2003 Present Time Show below last occupation abroad if not shown above. (Include all information requested above.) This form is submitted in connection with an application for: Signature of Applicant Date mother Naturalization Other (Specify): petition Status as Permanent Resident 07/02/2007 If your native alphabet is in other than Roman letters, write your name in your native alphabet below: Submit all copies of this form. none Penalties: Severe penalties are provided by law for knowingly and willfully falsifying or concealing a material fact. Applicant: Be sure to put your name and Alien Registration Number in the box outlined by heavy border below. Complete This Box (Family Name) (Given Name) (Middle Name) (Alien Registration Number) ROVELO Ela (1) Ident. See Instructions on Page 5 Form G-325A (Rev. 07/14/06)Y"
}