{
  "anumber": "A86927428",
  "id": "A86927428_0012",
  "page_index": 12,
  "resources": {
    "full_jpg": "https://dctn4zjpwgdwdiiy5odjv7o2se0bqgjb.lambda-url.us-east-1.on.aws/iiif/3/og-2023-kc-nara_A86927428_0012/full/max/0/default.jpg"
  },
  "fields": {
    "sex": {
      "ms_sex_llm_v1": "female"
    },
    "doctype": {
      "ms_doctype_v1": "form"
    },
    "form_title": {
      "ms_form_title_llm_v1": "Department of Homeland Security U.S. Citizenship and Immigration Services, G-325A, Biographic Information"
    },
    "countries": {
      "ms_countries_nlp_v1": [
        "Honduras",
        "United States"
      ]
    },
    "years": {
      "ms_years_nlp_v1": [
        2002,
        1946,
        2007,
        2023,
        1913,
        1997,
        2003,
        1978,
        2001,
        1915
      ]
    },
    "g325a": {
      "occupation": {
        "occupation_llm_v1": "['n.a']"
      },
      "reason": {
        "reason_llm_v1": "Naturalization"
      },
      "nationality": {
        "nationality_llm_v1": "Honduras"
      }
    }
  },
  "is_g325a": true,
  "is_cert_naturalization": false,
  "full_text": "Screened by NARA, 7/17/2023 OMB No. 1615-0008; Exp. 05/31/09 Department of Homeland Security U.S. Citizenship and Immigration Services G-325A, Biographic Information (Family Name) (First Name) (Middle Name) Male Birth Date (mm/dd/yyyy) Citizenship/Nationality File Number ROVELO Ela Female 02/14/1913 Honduras A All Other Names Used (Including names by previous marriages) City and Country of Birth U.S. Social Security # (If any) ROVELO-Sauceda, Ela Tegucigalpa, Honduras Family Name First Name Date, City and Country of Birth (If known) City and Country of Residence Father ROVELO Manuel XX-XX-XX Honduras deceased Mother (Maiden Name) SAUCEDA Juana XX-XX-XX Honduras deceased Husband or Wife (If none, Family Name First Name Birth Date City and Country of Birth Date of Marriage Place of Marriage so state.) (For wife, give maiden name) (mm/dd/yyyy) Former Husbands or Wives (If none, so state) First Name Birth Date Date and Place of Marriage Date and Place of Termination of Marriage Family Name (For wife, give maiden name) (mm/dd/yyyy) ROMERO Santos 12/15/1915 03/12/1946; Tegucigalpa 05/12/1997 Tegucigalpa, Honduras Honduras Applicant's residence last five years. List present address first. From To Street and Number City Province or State Country Month Year Month Year FOIA (b)(6) Casa #606, Calle Samota Tegucigalpa Distrito Central Honduras 02 2001 12 2002 Applicant's last address outside the United States of more than one year. From To Street and Number City Province or State Country Month Year Month Year Calle Principal, Casa #1821, Colonia Alame Tegucigalpa Distrito Central Honduras 01 2003 02 2007 Applicant's employment last five years. (If none, so state.) List present employment first. From To Full Name and Address of Employer Occupation (Specify) Month Year Month Year none retired 02 1978 Present Time Show below last occupation abroad if not shown above. (Include all information requested above.) retired 02 1978 This form is submitted in connection with an application for: Signature of Applicant Date Naturalization Other (Specify): Status as Permanent Resident Ela Routh S. 07/03/2007 Submit all copies of this form. If your native alphabet is in other than Roman letters, write your name in your native alphabet below: none Penalties: Severe penalties are provided by law for knowingly and willfully falsifying or concealing a material fact. Applicant: Be sure to put your name and Alien Registration Number in the box outlined by heavy border below. Complete This Box (Family Name) (Given Name) (Middle Name) (Alien Registration Number) ROVELO Ela See Instructions on Page 5 Form G-325A (Rev. 07/14/06)Y Page 4 (4) Consulate"
}