{
  "anumber": "A90662047",
  "id": "A90662047_0008",
  "page_index": 8,
  "resources": {
    "full_jpg": "https://dctn4zjpwgdwdiiy5odjv7o2se0bqgjb.lambda-url.us-east-1.on.aws/iiif/3/og-2023-kc-nara_A90662047_0008/full/max/0/default.jpg"
  },
  "fields": {
    "sex": {
      "ms_sex_llm_v1": "male"
    },
    "doctype": {
      "ms_doctype_v1": "form"
    },
    "form_title": {
      "ms_form_title_llm_v1": "Application for Status as a a Temporary Resident, A90662047"
    },
    "countries": {
      "ms_countries_nlp_v1": [
        "El Salvador"
      ]
    },
    "years": {
      "ms_years_nlp_v1": [
        2023,
        1982
      ]
    }
  },
  "is_g325a": false,
  "is_cert_naturalization": false,
  "full_text": "Screened by NARA, 7/7/2023 U. S. Department of Justice Application for Status as a Terry Immigration and Naturalization Service (Under Section 245A of the Immigration and A90662047 Please begin with item #1, after carefully reading the instructions. The block below, is for Government Use Only. 11/55 FEE 10.6004 Name and Location (City or Town) of Qualified Designated Entity Fee Stamp IMMIGRATION AND NATURALIZATION SERVICE CATHOLIC MIGRATION SERVICES, INC. DIOCESE OF BROOKLYN DATE 11/3/87 VERIFIED (NY) BY Je QUEENS - LO 75 GREENE AVENUE Fee Receipt No. (This application) P.O. BOX C XBK 88023 6004 BROOKLYN, NEW YORK 11202 Principal Applicant's File No. A- Qualified Designated Entity I.D. File No 03-004 00 A Applicant: Do not write above this line. See instructions before filing in application. If y on on this form use a separate sheet and identify each answer with the number of the correspo A90662047 in block letters in ink. 1. I hereby apply for status as indicated by the block checked below (check block A or A Temporary Residence as an alien who illegally entered the U.S. prior to January 1, 1982. B Temporary Residence as an alien who entered the U.S. as a nonimmigrant prior to January 1, 1982 and whose authorized stay expired before such date or whose unlawful status was known to the Government as of January 1, 1982. 2. Family Name (Last Name in CAPITAL Letters) (First Name) (Middle Name) 3. Date of Birth (Month/Day/Year) LOPEZ BONILLA TOMAS 12-29-04 4. Other Names Used or Known by (including maiden name, if married) 5. Telephone Numbers (include Area Codes) NONE Home: 718-235-5245 NONE Work: NONE 6. Home Address in the U.S. (No. and Street) (Apt. No.) (City) (State) (Zip Code) 218 ELDERTS LANE WOODHAVEN NY 11421 7. Mailing Address in the U.S. (if different from #6) (Apt. No.) (City) (State) (Zip Code) SAME AS #6 8. Last Address outside the U.S. (City or Town) (County, Province or State) (Country) SAN SALVADOR EL SALVADOR 9. Sex Male 10. Race Asian or Pacific Islander Black, not of Hispanic origin Other (specify below) Female Hispanic White, not of Hispanic origin 11. Marital Status Never Married Divorced 12. Country of Citizenship Now Married Separated Widowed EL SALVADOR 13. Place of Birth (City or Town) (County, Province or State) (Country) PARAISO DE OSORIO LA PAZ EL SALVADOR 14. Have you previously applied for temporary residence as a legalization applicant? 15. Do you have any other record with I&NS? No Yes (If \"Yes\" give date, place of filing, and final disposition, if known) No Yes (If \"Yes\" give number(s)) A- Other 16. When did you last come to the U.S.? (Month/Day/Year) 17. Manner of Entry (Visitor, Student, Crewman, etc.) 8/7/80 With visa (visitor, student, etc.) specify VISITOR Without visa 18. Place of Last Entry nye 19. List all Social Security Numbers used U.S. Port of entry (City and State) NEW YORK, NY (1) NONE (3) Border - Not through port (State) (2) (4) 20. Mother's Name (Maiden) (Last) (First) 21 Father's Name (Last) (First) Living Living BONILLA LOPEZ TRANSITO Deceased (year) UNKNOWN JUAN Deceased (year) UNKNOWN Form I-687 (04/01/87) Page 1 214004"
}