{
  "anumber": "A91178128",
  "id": "A91178128_0009",
  "page_index": 9,
  "resources": {
    "full_jpg": "https://dctn4zjpwgdwdiiy5odjv7o2se0bqgjb.lambda-url.us-east-1.on.aws/iiif/3/og-2023-kc-nara_A91178128_0009/full/max/0/default.jpg"
  },
  "fields": {
    "sex": {
      "ms_sex_llm_v1": "female"
    },
    "doctype": {
      "ms_doctype_v1": "form"
    },
    "form_title": {
      "ms_form_title_llm_v1": "Application for T Special Agriculture, I-700 ( 04/01/87"
    },
    "countries": {
      "ms_countries_nlp_v1": [
        "Haiti"
      ]
    },
    "years": {
      "ms_years_nlp_v1": [
        1985,
        1984,
        1986,
        1953,
        2023,
        1920
      ]
    }
  },
  "is_g325a": false,
  "is_cert_naturalization": false,
  "full_text": "Screened by NARA, 8/7/2023 U.S. Department of Justice Application for T #1115-0131 Immigration and Naturalization Service Special Agricultu lionality Act) A91178128 Please begin with item #1. after carefully reading the instructions. The block below is for Government Use Only. Name and Location (City or Town) of Qualified Designated Entity Fee Stamp 85W-87-080-2028 Fee Receipt No. (This application) Principal Applicant's File No A - Qualified Designated Entity I.D. No. File No. (This applicant) 91 178 128 Applicant Do not write above this line. See instructions before filling in application. If you need more space to answer fully any question on this form, use a separate sheet and identify each answer with the number of the corresponding question. Fill in with typewriter or print in block letters in ink. 1. I hereby apply for status as indicated by the block checked below (check block A or B). A Group I: Temporary Residence as an alien who has performed seasonal agricultural services in the U.S. for at least 90 days during each of the 12 month periods ending on May 1. 1984, 1985, and 1986. B Group II: Temporary Residence as an alien who has performed seasonal agricultural services in the U.S. for at least 90 days during the 12 month period ending on May 1, 1986. 2. Family Name (Last Name in CAPITAL Letters) (First Name) (Middle Name) 3. Date of Birth (Month/Day/Year) JACQUES CAMELIA EMILE 6/9/06 4. Other Names Used or Known by (Including maiden name, if married) 5. Telephone Numbers (Include Area Codes) Home: MRS. FRANCOIS ST-LOUIS JACQUES Work: (NONE) 6. Address (No. and Street) (Apt. No.) (Town or City) (State/Country) (ZIP/Postal Code) 9000 N.W. 35CT. MIAMI FLORIDA 33147 7. Last Address outside the U.S. (City or Town) (County, Province or State) (Country) FIRST AVENUE BOLOSSE #3 PORT-AU-PRINCE HAITI 8. Sex Male 9. Race Asian or Pacific Islander Black, not of Hispanic origin Other (specify below) Female Hispanic White, not of Hispanic origin 10. Marital Status Never Married Divorced 11. Country of Citizenship Now Married Separated Widowed HAITI 12. Place of Birth (City or Town) (County, Province or State) (Country) PORT-DE-PAIX - PORT-DE-PAIX HAITI 13. Have you previously applied for temporary residence as a Special Agricultural Worker? 14. Do you have any other record with I&NS? No Yes (if \"Yes\" give date, place of filing. and final disposition, if known) No Yes [If \"Yes\" give (number(s)) A - - 10 32595 Other 15. When did you last come to the U.S.? (Month/Day/Year) 16. Manner of Entry (Visitor, Student, Crewman, etc.) VISITOR With visa (visitor. student, etc.) specify 7/24/82 Without visa 17. Place of Last Entry MIAMI FLORIDA 8. List all Social Security Numbers used. U.S. Port of entry (City and State) (1) (3) Border - Not through port (State) (2) 594-14-8722 (4) 19. Mother's Name (Maiden) (Last) (First) Living 20. Father's Name (Last) (First) Living BRUNOR BRUNELIA Deceased (year) 1953 EMILE RAYMOND Deceased (year) 1920 Form 1-700 (04/01/87) Page 1"
}