{
  "anumber": "A91318117",
  "id": "A91318117_0073",
  "page_index": 73,
  "resources": {
    "full_jpg": "https://dctn4zjpwgdwdiiy5odjv7o2se0bqgjb.lambda-url.us-east-1.on.aws/iiif/3/og-2023-kc-nara_A91318117_0073/full/max/0/default.jpg"
  },
  "fields": {
    "sex": {
      "ms_sex_llm_v1": "male"
    },
    "doctype": {
      "ms_doctype_v1": "form"
    },
    "form_title": {
      "ms_form_title_llm_v1": "Application for Status as a a Temporary Resident, Form I-687 ( 04/01/87"
    },
    "countries": {
      "ms_countries_nlp_v1": [
        "Honduras"
      ]
    },
    "years": {
      "ms_years_nlp_v1": [
        1981,
        2023,
        1904,
        1982
      ]
    }
  },
  "is_g325a": false,
  "is_cert_naturalization": false,
  "full_text": "Screened by NARA, 7/13/2023 U.S. Department of Justice Application for Status as a T Immigration and Naturalization Service (Under Section 245A of the Immigra A91318117 Please begin with item #1, after carefully reading the instructions. The block below is for Government Name appleprat ventage of Qualified Emigrante Designated Entity Inc. Fee Stamp (AYUDANOS A CRECER) P. 0. BOX 430, INWOOD STATION NEW YORK, N. Y. 10034 TEL: (212) 283-1166-1179 Fee Receipt No. (This application) QDE No. 0035600 XMA881388005 155.00(4/15/59 Principal Applicant's File No. A Qualified Designated Entity I.D. No. File No. (This applicant) 00-356-00 A - Applicant: Do not write above this line. See instructions before filling in application. If you need more space to answer fully any question on this form, use a separate sheet and identify each answer with the number of the corresponding question. Fill in with typewriter or print in block letters in ink. 1. I hereby apply for status as indicated by the block checked below (check block A or B). Temporary Residence as an alien who illegally entered the U.S. prior to January 1, 1982. B Temporary Residence as an alien who entered the U.S. as a nonimmigrant prior to January 1. 1982 and whose authorized stay expired before such date or whose unlawful status was known to the Government as of January 1, 1982. 2. Family Name (Last Name in CAPITAL Letters) (First Name) (Middle Name) 3. Date of Birth (Month/Day/Year) VALERIO LAMBERT MEDARDA 6/8/1904 4. Other Names Used or Known by (Including maiden name, if married) 5. Telephone Numbers (Include Area Codes) N/A NONE Home: (212) 722-5101 WORK TATA 6. Home Address in the U.S. (No. and Street) (Apt. No.) (City) (State) (ZIP Code) 2217 8th AVE. 3J N.Y N.Y 10026 7. Mailing Address in the U.S. (if different from #6.) (Apt. No.) (City) (State) (ZIP Code) SAME AS #6 8. Last Address outside the U.S. (City or Town) (County, Province or State) (Country) SAN JUAN TELA DPTO ATLANTIDA HONDURAS 9. Sex Male 10. Race Asian or Pacific Islander Black, not of Hispanic origin Other (specify below) Female Hispanic White, not of Hispanic origin 11. Marital Status Never Married Divorced 12. Country of Citizenship Now Married Separated Widowed HONDURAS 13. Place of Birth (City or Town) (County, Province or State) (Country) SAD JUAN TELA ATLANTIDA HONDURAS 14. Have you previously applied for temporary residence as a legalization applicant? 15. Do you have any other record with I&NS? No Yes (if \"Yes\" give date, place of filing, and final disposition, if known) No Yes [If \"Yes\" give number(s)] N/A Other A N/A 16. When did you last come to the U.S.? (Month/Day/Year) 17. Manner of Entry (Visitor, Student, Crewman, etc.) With visa (visitor, student, etc.) specify VISITOR JANUARY 19, 1981 Without visa 18. Place of Last Entry U.S. Port of entry (City and State) LASUARDIA QUESNSANY NYC. N.Y 19. List all Social Security Numbers used. (1) (2) N/A (3) NONE Border - Not through port (State) (4) 20. Mother's Name (Maiden) (Last) (First) Living 21. Father's Name (Last) (First) Living 0 LAMBERT IgnAciA Deceased (year) unknown VALERIO SIMON Deceased (year) unknown Form I-687 (04/01/87) Page 1"
}