{
  "anumber": "A92050561",
  "id": "A92050561_0024",
  "page_index": 24,
  "resources": {
    "full_jpg": "https://dctn4zjpwgdwdiiy5odjv7o2se0bqgjb.lambda-url.us-east-1.on.aws/iiif/3/og-2023-kc-nara_A92050561_0024/full/max/0/default.jpg"
  },
  "fields": {
    "sex": {
      "ms_sex_llm_v1": "female"
    },
    "doctype": {
      "ms_doctype_v1": "form"
    },
    "form_title": {
      "ms_form_title_llm_v1": "Processing Sheet, A92050561"
    },
    "countries": {
      "ms_countries_nlp_v1": [
        "United States"
      ]
    },
    "years": {
      "ms_years_nlp_v1": [
        1995,
        1998,
        1996,
        1896,
        2023
      ]
    }
  },
  "is_g325a": false,
  "is_cert_naturalization": false,
  "full_text": "or CHOCOLATE Screened by Department NARA 7/13/2023 of Jus Immigration & Naturalizati Service PROCESSING SHEET File No: A92050561 DESCRIPTION SECTION OF LAW Sex : MALE ( FEMALE 316(a) ( ) 325 Marital Status : (S) (M) (P) (W) ) 319(a) ( ) 328 Height : Ft. , In. 319(b) ( ) 329 Nationality : Salvadoon ( 322 ( ) 405 INITIAL INTERVIEW : JAN 3 0 1995 FINAL ACTION (Date) Reads Writes nO Understands Denial : Date & Initials MAR 13 1998 AV Withdrawal : Date & Initials Government : OK (VIN.S. E.T.S. CASAS ( Oath Taken Certificate Issued: REEXAM MAR 11 1996 Remine Date and Initials ACTION or DOCUMENTS REQUIRED ( ) See Attached N-14b ( ) Reexamination DOCUMENTS PRESENTED ( ) Visa File A.R.C. : A92050561 ( Post Audit ) Other : D.O.B. : 01-13-15 P.O.E. : LOS C.O.A. wif COMMENTS D.O.E. : 05-068-9 DALS not undistand cm / CDL : Recommendation : RX mm or species English Initials and is not exempt APPROVAL (STAMP) FINAL HEARING from the requirements. DATE MAR 18 1896 reepan enterview CID # C28549258 TIME Applicant does not sheaking on understand English ( ) Attorney Waiver Executed, If Attorney Present, List Name : 3 Months Residence OK ( ) Fingerprints NEG. 40 Nazi Negative Day-Time Phone : 310-330-8219 Ext OATH OF ALLEGIANCE Name Change : ( ) Modified Oath; Delete Part(s) : Maria Ayala ( ) Promise to Bear Arms, Noncombat Duty OATH WITH U.S. DISTRICT COURT : 246 I HEREBY DECLARE, on oath, That I absolutely and eatirely recounce and abjure all allegiance and fidelity to any foreign prince, potentate, state, or sovereignty of whom or which I have beretofore been a subject or citizen; That I will support and defead the Constitution and the laws of the United States of America against all oceales, foreign and domestic; That will bear true faith and allegiance to the same; That I will bear arms on behalf of the United States when required by Law; That I will perform boocombatant service in the Armed Forces of the United States when required by the law; That I will perform work of national importance under civilian direction when required by the Law; and That I take this obligation freely without any mental reservation or purpose of evasion; so HELP ME GOD. In ackno wild gemeat whereof I have herounto affixed my signature. Signature xmy a Keep This Sheet On Top Of All Material In File Until Initial Decision Is Made"
}