{
  "anumber": "A92050561",
  "id": "A92050561_0080",
  "page_index": 80,
  "resources": {
    "full_jpg": "https://dctn4zjpwgdwdiiy5odjv7o2se0bqgjb.lambda-url.us-east-1.on.aws/iiif/3/og-2023-kc-nara_A92050561_0080/full/max/0/default.jpg"
  },
  "fields": {
    "sex": {
      "ms_sex_llm_v1": "female"
    },
    "doctype": {
      "ms_doctype_v1": "form"
    },
    "form_title": {
      "ms_form_title_llm_v1": "Application for Status as a Immigrant ( Under Section 2 of the Immigration and Naturalization Act"
    },
    "countries": {
      "ms_countries_nlp_v1": [
        "El Salvador"
      ]
    },
    "years": {
      "ms_years_nlp_v1": [
        1985,
        2023,
        1982
      ]
    }
  },
  "is_g325a": false,
  "is_cert_naturalization": false,
  "full_text": "Screened by NARA, 7/13/2023 U.S. Department of Justice Application for Status as a Immigration and Naturalization Service (Under Section 245A of the Imm A92050561 Please begin with item #1, after carefully reading the instructions. The block below is for Government Use Only. Name and Location (City or Town) of Qualified Designated Entity Fee Stamp $185.00 8-30-87 Fee Receipt No. (This application) T0870501013 Principal Applicant's File No. A Qualified Designated Entity I.D. No. File No. (This applicant) A -92 050 561 Applicant: Do not write above this line. See instructions before filling in application. If you need more space to answer fully any question on this form, use a separate sheet and identify each answer with the number of the corresponding question. Fill in with typewriter or print in block letters in ink. 1. I hereby apply for status as indicated by the block checked below (check block A or B). A Temporary Residence as an alien who illegally entered the U.S. prior to January 1, 1982. B Temporary Residence as an alien who entered the U.S. as a nonimmigrant prior to January 1, 1982 and whose authorized stay expired before such date or whose unlawful status was known to the Government as of January 1, 1982. 2. Family Name (Last Name in CAPITAL Letters) (First Name) (Middle Name) 3. Date of Birth (Month/Day/Year) AYALA de BARAHONA MARIA LEONOR 01-13-15 4. Other Names Used or Known by (Including maiden name, if married) 5. Telephone Numbers (Include Area Codes) Home: NONE Work: 6. Home Address in the U.S. (No. and Street) (Apt. No.) (City) (State) (ZIP Code) 3125 Lashbrook Ave El Monte California 91733 7. Mailing Address in the U.S. (if different from #6.) (Apt. No.) (City) (State) (ZIP Code) Same as above 8. Last Address outside the U.S. (City or Town) (County, Province or State) (Country) Calle Morazan # 13 Santiago Nonualco EL SALVADOR 9. Sex Male 10. Race Asian or Pacific Islander Black, not of Hispanic origin Other (specify below) Female Hispanic White, not of Hispanic origin 11. Marital Status Never Married Divorced 12. Country of Citizenship Now Married Separated Widowed EL SALVADOR 13. Place of Birth (City or Town) (County, Province or State) (Country) MERCEDES LA CEIBA LA PAZ EL SALVADOR 14. Have you previously applied for temporary residence as a legalization applicant? 15. Do you have any other record with I&NS? X No Yes (if \"Yes\" give date, place of filing, and final disposition, if known) No Yes [If \"Yes\" give number(s)] A - Other 16. When did you last come to the U.S.? (Month/Day/Year) 17. Manner of Entry (Visitor, Student, Crewman, etc.) With visa (visitor, student etc.) specify 11 20-80 Without visa 18. Place of Last Entry 19. List all Social Security Numbers used. J.S. Port of entry (City and State) (1) 568-17-5139 (3) Border - Not through port (State) (2) (4) 20. Mother's Name (Maiden) (Last) (First) Living 21. Father's Name (Last) (First) Living 1985 ZEPEDA, Maria Deceased (year) UNK 0 AYALA, Valentin Deceased (year) Form I-687 (04/01/87) Page 1"
}