{
  "anumber": "A92141101",
  "id": "A92141101_0085",
  "page_index": 85,
  "resources": {
    "full_jpg": "https://dctn4zjpwgdwdiiy5odjv7o2se0bqgjb.lambda-url.us-east-1.on.aws/iiif/3/og-2023-kc-nara_A92141101_0085/full/max/0/default.jpg"
  },
  "fields": {
    "sex": {
      "ms_sex_llm_v1": "female"
    },
    "doctype": {
      "ms_doctype_v1": "form"
    },
    "form_title": {
      "ms_form_title_llm_v1": "BIRTH CERTIFICATE TRANSLATION"
    },
    "countries": {
      "ms_countries_nlp_v1": [
        "El Salvador"
      ]
    },
    "years": {
      "ms_years_nlp_v1": [
        1988
      ]
    }
  },
  "is_g325a": false,
  "is_cert_naturalization": false,
  "full_text": "BIRTH CERTIFICATE TRANSLATION CIVIL REGISTRY OF : San Salvador COUNTRY OF : El Salvador BIRTH CERTIFICATE # 433 PAGE 141 BOOK # / REGISTRATION DATE: 2/23/14 NAME OF CHILD: Felicita Ordonez DATE OF BIRTH: 2/21/14 SEX: Female PLACE OF BIRTH: San Salvador El Salvador PARENTS FATHERS'S NAME Ramon Campos MOTHER'S NAME Antonia Ordonez PLACE OF BIRTH San Sahador , â‚¹1 Sahvador GRANDPARENTS PARENTAL NAMES MATERNAL NAMES PLACE OF BIRTH PLACE OF BIRTH WITNESSESES NOTES: Signed and sealed by the Civil Registty officials of San Salvador, E/Salvador STATE OF CALIFORNIA COUNTY OF LOS ANGELES I, Joaquin F. Bin a Notary Public in and for said State; do certify that the above abstract contains the essential information of this attached Birth Certificate in Spanish that I have translated into English Language to the best of my knowledge. IN WHITNESS WHEREOF I have unto set my hand and official seal. Date: 309/04/87 OFFICIAL SEAL JOAQUIN F BIN Joaquin Notary Public F. As Bin NOTARY PUBLIC - CALIFORNIA LOS ANGELES COUNTY My comm. expires JUN 6, 1988 2500 Wilehim Plvd.. #813, Los Angeles, CA 90057"
}