{
  "anumber": "A92348892",
  "id": "A92348892_0007",
  "page_index": 7,
  "resources": {
    "full_jpg": "https://dctn4zjpwgdwdiiy5odjv7o2se0bqgjb.lambda-url.us-east-1.on.aws/iiif/3/og-2023-kc-nara_A92348892_0007/full/max/0/default.jpg"
  },
  "fields": {
    "sex": {
      "ms_sex_llm_v1": "female"
    },
    "doctype": {
      "ms_doctype_v1": "form"
    },
    "form_title": {
      "ms_form_title_llm_v1": "Application for Naturalization, N-4"
    },
    "countries": {
      "ms_countries_nlp_v1": [
        "United States",
        "Nicaragua"
      ]
    },
    "years": {
      "ms_years_nlp_v1": [
        1995,
        1989,
        2023,
        1994,
        1915
      ]
    }
  },
  "is_g325a": false,
  "is_cert_naturalization": false,
  "full_text": "Screened by NARA, 7/5/2023 U.S. Department of Justice OMB #1115-0009 Immigration and Naturalization Service Application for Naturalization START HERE - Please Type or Print FOR INS USE ONLY Returned Part 1. Information about you. Receipt Family Given Middle Name CORNEJO, Name Margarita Initial U.S. Mailing Address - Care of Resubmitted Street Number Apt. and Name 5351 Monroe St. # 5 0610 001 R 5 10/11/94 12:22 City County N 400 95.00 Los Angeles Los Angeles State ZIP Reloc Sent California Code 90038 Date of Birth Country (month/day/year) May 15, 1915 of Birth Nicaragua Social A Security # 570-89-3451 # A92348892 Reloc Rec'd Part 2. Basis for Eligibility (check one). a. I have been a permanent resident for at least five (5) years b. I have been a permanent resident for at least three (3) years and have been married to a United States Citizen for those three years. Applicant I am a permanent resident child of United States citizen parent(s) Interviewed C. d. I am applying on the basis of qualifying military service in the Armed Forces of the U.S. NOV 08 1995 and have attached completed Forms N-426 and G-325B At interview e. Other. (Please specify section of law) request naturalization ceremony at court Part 3. Additional information about you. Remarks Date you became a permanent Port admitted with an immmigrant visa or INS Office resident (month/day/year) where granted adjustment of status. June 5, 1989 Los Angeles, CA 316(9) Citizenship Nicaragua Name on alien registration card (if different than in Part 1) CORNEJO DE MONTIEL, MArgarita Other names used since you became a permanent resident (including maiden name) None Sex Male Height Marital Status: Single Divorced Female 5'6 Married Widowed Can you speak, read and write English ? No Yes. 316a. Action Absences from the U.S.: A P.P INS DISTRIC Have you been absent from the U.S. since becoming a permanent resident? No Yes DIREC If you answered \"Yes\" , complete the following. Begin with your most recent absence. If you need more room to explain the reason for an absence or to list more trips, continue on separate paper. Did absence last Date left U.S. Date returned 6 months or more? Destination Reason for trip 4491 Yes No Yes No To Be Completed by Attorney or Representative, if any Yes No Fill in box if G-28 is attached to represent the applicant Yes No VOLAG# Yes No Yes No ATTY State License # Form N-400 (Rev 07/17/91)N Continued on back. OCT 12 1994"
}