{
  "anumber": "A94192315",
  "id": "A94192315_0019",
  "page_index": 19,
  "resources": {
    "full_jpg": "https://dctn4zjpwgdwdiiy5odjv7o2se0bqgjb.lambda-url.us-east-1.on.aws/iiif/3/og-2023-kc-nara_A94192315_0019/full/max/0/default.jpg"
  },
  "fields": {
    "sex": {
      "ms_sex_llm_v1": "female"
    },
    "doctype": {
      "ms_doctype_v1": "form"
    },
    "form_title": {
      "ms_form_title_llm_v1": "Application for Employment Authorization"
    },
    "countries": {
      "ms_countries_nlp_v1": [
        "United States",
        "El Salvador"
      ]
    },
    "years": {
      "ms_years_nlp_v1": [
        2023,
        1991
      ]
    }
  },
  "is_g325a": false,
  "is_cert_naturalization": false,
  "full_text": "Screened by NARA, 6/29/2023 U.S. Department of Justice # 685 OMB # 1115 0163 Immigration and Naturalization Service Application for Employment Authorization Do Not Write in This Block Please Complete Both Sides of Form Remarks Action Stamp ROVE Fee Stamp DISTRICT DIRECTOR A# 94192315 AUG 17 1991 #135. Applicant is filing under 274a.12 912 by Chuewoll 0137043 Application Approved. Employment Authorized 7 Extended OF (Circle One) 8/7/91 (Date). until 21692 (Date). Subject to the following conditions: Application Denied. Failed to establish eligibility under 8 CFR 274a.12 (a) or (c). Failed to establish economic necessity as required in 8 CFR 274a. 12(c) (13) (14) (18) and 8 CFR 214.2(f) I am applying for: Permission to accept employment Replacement (of lost employment authorization document). Extension of my permission to accept employment (attach previous employment authorization document). 1. Name (Family Name in CAPS) (First) (Middle) 11. Have you ever before applied for employment authorization from INS? ALVARENGA, MARIA JUANA Yes (If yes, complete below) No 2. Other Names Used (Include Maiden Name) Which INS Office? Date(s) NONE N/A 3. Address in the United States (Number and Street) (Apt. Number) Results (Granted or Denied - attach all documentation) 3951 DWIGGINS ST. N/A (Town or City) (State/Country) (ZIP Code) 12. Date of Last Entry into the U.S. (Month/Day/Year) LOS ANGELES, CA/USA 90063 09-18-83 4. Country of Citizenship/Nationality 13. Place of Last Entry into the U.S. EL SALVADOR CALEXICO 5. Place of Birth (Town or City) (State/ Province) (Country) 14. Manner of Last Entry (Visitor, Student, etc.) BARRIO SANTA LUCIA, SANTA ANA, EL SALVADOR WITHOUT INSEPCTION 6. Date of Birth (Month/Day/Year) 7. Sex 15. Current Immigration Status (Visitor, Student, etc.) 06-14-06 Male Female ILLEGAL STATUS 8. Marital Status Married Single 16. Go to the Eligibility Section on the reverse of this form and check the Widowed Divorced box which applies to you. In the space below, place the letter and 9. Social Security Number (Include all Numbers you have ever used) number of the box you selected from the reverse side: 572-91-4612 Eligibility under 8 CFR 274a.12 10. Alien Registration Number (A-Number) or I-94 Number (if any) NONE ( A ) ( 12 ) ( ) Complete the reverse of this form before signature. Your Certification: I certify, under penalty of perjury under the laws of the United States of America, that the foregoing is true and correct. Furthermore, I authorize the release of any information which the Immigration and Naturalization Service needs to determine eligibility for the benefit I am seeking. I have read the reverse of this form and have checked the appropriate block, which is identified in item #16, above. J Signature She doesn't read Telephone Number Date Churon (213) 263-3502 06-13-91 Signature of Person Preparing Form if Other Than Above: I declare that this document was prepared by me at the request of the applicant and is based on all information of which I have any knowledge. Print Name Address Signature PRIVATE IMMIGRATION AGENCY Lamen G Grooking QDE #00-903-05 6/19/91 Initial Receipt Resubmitted Relocated Completed Vor H Rec'd Sent Approved Denied Returned Form I-765 (Rev. 12/7/90) N Page 2"
}